,name,author,link,lyrics,chords
0,Penitentiary,Citizen Cope,https://tabs.ultimate-guitar.com/tab/citizen-cope/penitentiary-chords-4132006,"Well I'm waiting on the day
When the people walk free to see
When the penitentiary is on fire
When there's no need
For your mother or your brother
Or the one that comes before you whoa
Well I'm waiting on a time when the people walk free to see
From the penitentiary in our mind
For your father
Or the one that you've become
When the penitentiary is on fire
When the penitentiary is on fire
When the people walk free to see
The penitentiary is on fire
For your father
Or the one that you've become and
I'm waiting on a time when the people walk free to see
From the penitentiary in our mind
For your mother or your brother
Or the one that comes before you, yeah
When the penitentiary is on fire
When the penitentiary is on fire, yeah
When the penitentiary is on fire, whoa
When the penitentiary is on fire
","['Em', 'Bm', 'B7', 'Em', 'Em', 'Bm', 'B7', 'Em', 'Bm', 'B7', 'Em', 'Bm', 'B7', 'B7', 'Em', 'B7', 'Em', 'Bm', 'B7', 'Em', 'Bm', 'B7', 'Em', 'Bm', 'B7', 'Em', 'Bm', 'B7', 'Em', 'Bm', 'B7', 'Em', 'Bm', 'B7', 'Em', 'Bm', 'B7', 'Em', 'Bm', 'B7', 'Em', 'Bm']"
1,Dartagnans Theme,Citizen Cope,https://tabs.ultimate-guitar.com/tab/citizen-cope/dartagnans-theme-chords-878778,"I've been sinning
I've been livin'
I've been beaten
By Saturdays
On a diamond
I lay on a diamond
On a diamond
I lay awake
Good ol' D'Artagnan
He ain't got a thing on me
I've been minding
To my field of timing
Too bad your time in
It just never came
Well I don't know how else to say it
In a diffrent way
But why don't you just fade away
'Cause there's a battle going on
Down south of Babylon
So why don't you just fade away
I've been dealing
I've been healing
I've been dealing
A crooked game
Thieving pirates
I'm thieving pirates
Out of gold
That they stole from the queen
Stole from a man
Whose favorite hand
Is one that he will always land
Well I'm building 
Us a levee
By the Mississippi
For I'll die in an unmarked grave
","['C', 'F', 'G', 'C', 'G', 'C', 'F', 'G', 'C', 'G', 'F', 'G', 'C', 'G', 'C', 'F', 'G', 'C', 'C', 'F', 'G', 'C', 'C', 'F', 'G', 'C', 'G', 'C', 'F', 'G', 'C', 'G', 'C', 'F', 'G', 'C', 'G', 'C', 'F', 'G', 'C', 'G', 'C', 'F', 'G', 'C', 'G']"
2,King Of Sorrow,Sade,https://tabs.ultimate-guitar.com/tab/sade/king-of-sorrow-chords-133139,"Verse 1	I'm crying everyone's tears
and there inside our private war
I died the night before
And all of these remnants of joy and disaster
What am I suppose to do
Chorus		The DJ's playing the same song
I have so much to do I have to carry on
I wonder if this grief will ever let me go
I feel like I am the king of sorrow, yeah
The king of sorrow
","['Cm6', 'Cm', 'BbM7', 'G', 'EbM7', 'G', 'Cm6', 'Cm', 'BbM7', 'G', 'EbM7', 'G', 'Cm6', 'Cm', 'BbM7', 'G', 'EbM7', 'G', 'Cm6', 'Cm', 'BbM7', 'G', 'EbM7', 'G', 'AM7', 'Gm', 'Cm', 'AM7', 'EbM7', 'G', 'Gm', 'Cm', 'AM7', 'BbM7', 'G', 'EbM7', 'G', 'Cm', 'AM7', 'BbM7', 'G', 'EbM7', 'G', 'Cm', 'Cm6', 'Cm', 'BbM7', 'G', 'EbM7', 'G']"
3,Diary (ver 2),Alicia Keys,https://tabs.ultimate-guitar.com/tab/alicia-keys/diary-chords-3420398,"Lay your head on my pillow
Here you can be yourself
No one has to know what you are feeling
No one but me and you ooh
I won't tell    your  secrets
Your secrets    are safe with me
I will keep    your secrets
Just think of me as the pages in your diary
I feel   such a con_nection
Even when   you're far a_way
Oooo baby if   there's anything that you fear
CALL 4-8-9 46  0-8 and I'll be here
I won't tell    your  secrets
Your secrets    are safe with me
I will keep    your secrets
Just think of me as the pages in your diary
Only we know what is talked about baby boy
I don't know how you can be drivin me so crazy boy
Baby when your in town why don't you   come around boy
I'll be the loyalty you need you can trust me boy
I won't tell    your  secrets
Your secrets    are safe with me
I will keep    your secrets
Just think of me as the pages in your diary
Everybody say
Whoa (whoa)
Let me hear you say
Whoa (whoa)
Everybody say Whoa (whoa)
Now sing it
Whoa (whoa)
Lemme hear you say
I won't tell(I wont tell)
I won't tell(I wont tell)
I won't tell(I wont tell)
Your secrets, your secrets
break it down...
","['Em', 'D', 'Am', 'Em', 'D', 'Am', 'Em', 'D', 'Am', 'C', 'D', 'Em', 'D', 'Am', 'Em', 'D', 'Am', 'Em', 'D', 'Am', 'Em', 'D', 'Am', 'C', 'D', 'Em', 'D', 'Am', 'Em', 'D', 'Am', 'Em', 'D', 'Am', 'Em', 'D', 'Am', 'C', 'D', 'Em', 'D', 'Am', 'Em', 'D', 'Am', 'Em', 'D', 'Am', 'Em', 'D', 'Am', 'C', 'D', 'Em', 'D', 'Am', 'Em', 'D', 'Am', 'Em', 'D', 'Am', 'Em', 'D', 'Am', 'C', 'D', 'Em', 'D', 'Am', 'Em', 'D', 'Am', 'Em', 'D', 'Am', 'Em', 'D', 'Am', 'C', 'D', 'Em', 'D', 'Em', 'D', 'Em', 'D', 'Em', 'D', 'Am', 'D', 'Em', 'D', 'Em', 'D', 'Am', 'Am', 'Em']"
4,Karma,Alicia Keys,https://tabs.ultimate-guitar.com/tab/alicia-keys/karma-chords-3085202,"  Weren't you the one that said that you don't want me anymore
  And how you need your space and give the keys back to your door
  And how I cried and tried and tried to make you stay with me
  But still you said that love was gone and that I had to leave
Now you, talkin' 'bout a family
Now you, saying I complete your dream
Now you, saying I'm your everything
You're confusing me What you say to me
Don't play with me Don't play with me
'Cause what goes around, comes around, what goes up,
must come down Now who's crying, desiring to come back to me
What goes around, comes around, what goes up,
must come down Now who's crying, desiring to come back
  And when you came home, you'd always have some sorry excuse
  And explaining to me, like I'm just some kind of a fool
  I sacrificed the things I want just to do things for you
  But when it's time to do for me, you never come through
Now you, wanna be a part of me (Ayy)
Now you, have so much to say to me (Hey)
Now you, wanna make time for me
What you doin' to me? You're confusing me
Don't play with me Don't play with me
'Cause what goes around, comes around, what goes up,
must come down Now who's crying, desiring to come back to me
What goes around, comes around, what goes up,
must come down Now who's crying, desiring to come back
I remember when I was sittin' home alone
Waitin' for you Til three o'clock in the morn'
  Night after night Knowing something going on
  Wasn't home before me You was, you was gone
  Lord knows it wasn't easy, but believe me
  Never thought you'd be the one that would deceived me
  And never do what you was supposed to do
No need to approach me boo, 'cause I'm over you
'Cause what goes around, comes around, what goes up,
must come down Now who's crying, desiring to come back to me
What goes around, comes around, what goes up,
must come down Gotta stop tryin', to come back to me
What goes around, comes around, what goes up,
must come down, It's called Karma, baby and it goes around
What goes around, comes around, what goes up,
must come down Now who's crying, desiring to come back to me
","['Am', 'Am', 'Am', 'Am', 'Am', 'Am', 'E/A', 'Am', 'E/A', 'Am', 'Am', 'Am', 'Am', 'G', 'Am', 'G', 'Am', 'Am', 'G', 'Am', 'G', 'Am', 'Am', 'Am', 'Am', 'Am', 'Am', 'Am', 'E/A', 'Am', 'E/A', 'Am', 'Am', 'Am', 'Am', 'G', 'Am', 'G', 'Am', 'Am', 'G', 'Am', 'G', 'Am', 'Dm', 'Dm', 'Am7', 'Am7', 'Dm7', 'Dm7', 'E', 'E', 'Am', 'G', 'Am', 'G', 'Am', 'Am', 'G', 'Am', 'G', 'Am', 'Am', 'G', 'Am', 'G', 'Am', 'Am', 'G', 'Am', 'G', 'Am']"
5,If I Aint Got You (ver 6),Alicia Keys,https://tabs.ultimate-guitar.com/tab/alicia-keys/if-i-aint-got-you-chords-1106753,"Some people live for the fortune
Some people live just for the fame
Some people live for the power yeah
Some people live just to play the game
Some people think that the physical things
Define what's within
I've been there before
But that life's a bore
So full of the superficial
Some people want it all
But I don't want nothing at all
If it ain't you baby
If I ain't got you baby
Some people want diamond rings
Some just want everything
But everything means nothing
If I ain't got you
Some people search for a fountain
Promises forever young
Some people need three dozen roses
And that's the only way to prove you love them
Hand me the world on a silver plater
And what good would it be
No one to share
No one who truly cares fo me
Some people want it all
But I don't want nothing at all
If it ain't you baby
If I ain't got you baby
Some people want diamond rings
Some just want everything
But everything means nothing
If I ain't got you
","['G', 'Em', 'Am7', 'D7', 'G', 'E', 'Am', 'D', 'Gmaj7', 'Am', 'B#', 'Am', 'Gmaj7', 'Am', 'B#', 'Gmaj7', 'Am', 'B#', 'Am', 'Gmaj7', 'Am', 'B#', 'Cmaj7', 'B#', 'Am', 'Gmaj7', 'Cmaj7', 'B#', 'Am', 'Gmaj7', 'G', 'Em', 'Am7', 'D7', 'G', 'E', 'Am', 'D', 'Gmaj7', 'Am', 'B#', 'Am', 'Gmaj7', 'Am', 'B#', 'Gmaj7', 'Am', 'Gmaj7', 'Am', 'B#', 'Cmaj7', 'B#', 'Am', 'Gmaj7', 'Cmaj7', 'B#', 'Am', 'Gmaj7']"
6,If I Aint Got You (ver 8),Alicia Keys,https://tabs.ultimate-guitar.com/tab/alicia-keys/if-i-aint-got-you-chords-1726122," Some people live for the fortune
 Some people live just for the fame
 Some people live for the power yeah
 Some people live just to play the game
Some people think that the physical things
Define what's within
I've been there before
But that life's a bore
So full of the superficial
Some people want it all
But I don't want nothing at all
If it ain't you baby
If I ain't got you baby
Some people want diamond rings
Some just want everything
But everything means nothing 
If I ain't got you
 Some people search for a fountain
 Promises forever young
 Some people need three dozen roses
 And that's the only way to prove you love them
Hand me the world on a silver plater
And what good would it be
No one to share
No one who truly
Cares for me
Some people want it all
But I don't want nothing at all
If it ain't you baby
If I ain't got you baby
Some people want diamond rings
Some just want everything
But everything means nothing 
If I ain't got you
","['Bbmaj7', 'Gmaj7', 'Em', 'Am7', 'D7', 'Bbmaj7', 'Gmaj7', 'E7', 'Am7', 'D7', 'Gmaj7', 'Am7', 'Bm7', 'Am7', 'Gmaj7', 'Am7', 'Bm7', 'Cmaj7', 'Bm7', 'Am7', 'Gmaj7', 'Am7', 'Bm7', 'Am7', 'Gmaj7', 'Am7', 'Bm7', 'G', 'A', 'B', 'Cmaj7', 'Bm7', 'Am7', 'Gmaj7', 'Gmaj7', 'Am7', 'Cmaj7', 'Bm7', 'Bbm7', 'Am7', 'Gmaj7', 'Bbmaj7', 'Gmaj7', 'Em', 'Am7', 'D7', 'Bbmaj7', 'Gmaj7', 'E7', 'Am7', 'D7', 'Gmaj7', 'Am7', 'Bm7', 'Am7', 'Gmaj7', 'Am7', 'Bm7', 'Cmaj7', 'Bm7', 'Am7', 'Gmaj7', 'Am7', 'Bm7', 'Am7', 'Gmaj7', 'Am7', 'Bm7', 'G', 'A', 'B', 'Cmaj7', 'Bm7', 'Am7', 'Gmaj7', 'Gmaj7', 'Am7', 'Cmaj7', 'Bm7', 'Bbm7', 'Am7', 'Gmaj7']"
7,Fallin (ver 4),Alicia Keys,https://tabs.ultimate-guitar.com/tab/alicia-keys/fallin-chords-947046,"In and out of love
With you
Sometimes I love you
Sometimes you make me blue
Sometimes I feel good
At times I feel used
Lovin' you darlin'
Makes me so confused
I keep on falling
In and out of love
With you
I never loved someone
The way that I love you
Oh, oh, I never felt this way
How do you give me so much pleasure
And cause me so much pain
'Cause when I think
I've taken more than would a fool
I start fallin'
Back in love with you
I keep on falling
In and out of love
With you
I never loved someone
The way that I love you
I, I, I, I'm fallin'
I, I, I, I'm fallin'
","['Am', 'Dm', 'Am', 'Dm', 'Am', 'Dm', 'Am', 'Dm', 'Am', 'Dm', 'Am', 'Dm', 'Am', 'Dm', 'Am', 'Em', 'Am', 'Dm', 'Am', 'Em', 'Am', 'Dm', 'Am', 'Em', 'Am', 'Dm', 'Am', 'Dm', 'Am', 'Dm', 'Am', 'Dm', 'Am', 'Dm', 'Am', 'Dm', 'Am', 'Dm', 'Am', 'Em', 'Am', 'Dm', 'Am', 'Em', 'Am', 'Dm', 'Am', 'Em', 'Am', 'Dm', 'Am', 'Dm', 'Am', 'Dm', 'Am', 'Dm']"
8,You Dont Know My Name (ver 2),Alicia Keys,https://tabs.ultimate-guitar.com/tab/alicia-keys/you-dont-know-my-name-chords-2371779,"  Baby, baby, baby from the day I saw you I really, really wanted to
catch your eye    there's something special 'bout you I must really
like you 'Cause not a lot of guys are worth my time    uh baby, baby,
baby It's getting kinda crazy 'Cause you are taking over my   mind
and it feels like uh uh uh uh you don't know my name
I swear It feels like uh uh uh uh you don't know my name
(round and round and round we go) Will you ever know?
  Oh, baby, baby, baby I see us on our first date you doing everything
that makes me smile    and when we had our first kiss It happened on a
Thursday Oh, it set my soul on fire    uh baby, baby, baby I can't wait
for the first time, my imagination's running wild
and it feels like uh uh uh uh you don't know my name
And I swear It feels like uh uh uh uh you don't know my name
(round and round and round we go) Will you ever know?
I'm doing nothing I've never done for anyone's attention take notice of
 and you'll never know how good it feels to have all of my affection and you´ll
never get a chance to experience my loving 'Cause my loving feels like
and it feels like uh uh uh uh you don't know my name
And I swear It feels like uh uh uh uh you don't know my name
(round and round and round we go) Will you ever know?
and it feels like uh uh uh uh you don't know my name
And I swear It feels like uh uh uh uh you don't know my name
(round and round and round we go) Will you ever know?
","['Dmaj7', 'C#7', 'Dmaj7', 'C#7', 'Dmaj7', 'C#7', 'Amaj7', 'Dmaj7', 'C#7', 'Amaj7', 'Dmaj7', 'C#7', 'Dmaj7', 'C#7', 'Dmaj7', 'C#7', 'Dmaj7', 'C#7', 'Amaj7', 'Dmaj7', 'C#7', 'Amaj7', 'Dmaj7', 'C#7', 'Amaj7', 'Dmaj7', 'Amaj7', 'Dmaj7', 'E', 'Amaj7', 'Dmaj7', 'C#7', 'Amaj7', 'Dmaj7', 'C#7', 'Amaj7', 'Dmaj7', 'C#7', 'Amaj7', 'Dmaj7', 'C#7']"
9,With You (ver 2),Chris Brown,https://tabs.ultimate-guitar.com/tab/chris-brown/with-you-chords-611417,"I need you boo, (Ooh) 
I gotta see you boo (Hey) 
And the hearts all over the world tonight, 
Said the hearts all over the world tonight
I need you boo, (Ooh) 
I gotta see you boo (Hey) 
And the hearts all over the world tonight, 
Said the hearts all over the world tonight
Hey! Little mama, 
Hot... lil figure, 
And I'm so glad to be yours, 
You're a class all your own 
Ooh, little cutie 
I swear... the whole world stops 
And I'm so glad that you are mine 
You are one of a kind and... 
You mean to me 
What I mean to you and... 
Together baby, 
There is nothing we won't do 
Cos if I gotchu, 
I don't need money, 
I don't need cars, 
Girl, you're my all. 
Oh! 
No... one else would do, 
every kiss and every hug, 
You make me fall in love, 
I... know I can't be the only 
one, 
world tonight, 
feel... 
With you
With you
With you 
Girl... 
With you 
With you 
With you 
Oh Girl! 
Without you, there's no one left then, 
You're like Jordans on Saturday, 
I gotta have you and I cannot wait now, 
Hey! little shawty, 
You know... I care for you, 
You know... that I won't lie, 
To be your everything... yeah... 
Cuz if I got chu, 
I don't need money, 
I don't need cars, 
Girl, you're my all. 
Oh! 
No... one else would do, 
every kiss and every hug, 
You make me fall in love, 
I... know I can't be the only 
one, 
world tonight, 
feel... 
With you
With you
With you 
Girl... 
With you 
With you 
With you 
Yeah Heh... 
And I... 
Will never try to deny, 
Cuz you are my whole light, 
Cuz if you ever let me go, 
I would die... 
So I won't find, 
I don't need another woman, 
I just need your all and nothing, 
Cus' if I got that, 
Baby, you're the best part of my day 
I need you boo, 
I gotta see you boo 
And the hearts all over the world tonight, 
Said the hearts all over the world tonight 
They need their boo
They gotta see their boo
Said there's hearts all over the world tonight
Hearts all over the world tonight
Oh! 
No... one else would do, 
every kiss and every hug, 
You make me fall in love, 
I... know I can't be the only 
one, 
world tonight, 
feel... 
With you
With you
With you 
Girl... 
With you 
With you 
With you 
Ohh...
","['Cadd9', 'G', 'F', 'G', 'Cadd9', 'G', 'F', 'G', 'Cadd9', 'G', 'F', 'G', 'Cadd9', 'G', 'F', 'G', 'F', 'G', 'Cadd9', 'F', 'F', 'G', 'Cadd9', 'F', 'F', 'G', 'Cadd9', 'F', 'Cadd9', 'G', 'F', 'G', 'Cadd9', 'G', 'F', 'G', 'Cadd9', 'G', 'F', 'G', 'Cadd9', 'G', 'F', 'Cadd9', 'G', 'F', 'G', 'Cadd9', 'G', 'F', 'G', 'F', 'G', 'Cadd9', 'G', 'F', 'Cadd9', 'G', 'F', 'G', 'Cadd9', 'G', 'F', 'G', 'Cadd9', 'G', 'F', 'G', 'Cadd9', 'G', 'F', 'G', 'F', 'G', 'C', 'G', 'C', 'F', 'G', 'C', 'G', 'F', 'G', 'C', 'G', 'F', 'G', 'Cadd9', 'Cadd9', 'G', 'F', 'G', 'Cadd9', 'G', 'F', 'G', 'Cadd9', 'G', 'F', 'G', 'Cadd9', 'G', 'F', 'G', 'Cadd9', 'G', 'F', 'G', 'Cadd9', 'G', 'F', 'G']"
10,Take You Down,Chris Brown,https://tabs.ultimate-guitar.com/tab/chris-brown/take-you-down-chords-781049,"Here we are all alone in this room (oh)
And girl I know where to start and what we're gonna do (yeah)
I'll take my time we'll be all night girl
So get ready babe I got plans for me and you
It ain't my first time but babygirl we can pretend,
Hey let's bump and grind girl tonight we'll never end
","['Am', 'C', 'G', 'D', 'Am', 'C', 'G', 'D', 'Am', 'C', 'G', 'D', 'Am', 'C', 'G', 'D', 'Am', 'C', 'G', 'D']"
11,I Wanna Be,Chris Brown,https://tabs.ultimate-guitar.com/tab/chris-brown/i-wanna-be-chords-3725096,"   Look (Ooh)
I know we've been friends for a while now (Hey, hey)
But, I just feel like I can confess to you (Na-na-na-na-na, yeah)
It's gon' be hard but (Oh)
Alright, here it goes
Imagine that the pillow that you cried on was my chest
And the tissue that you wiped your face with was my hand
Girl, imagine if you needed advice about some other guy
I'm the one that comes to mind
Not tryna hear you tell nobody that I'm just a friend
Just tryna make sure I'm that body that you call your man
And any time you need a shoulder
It's yours, night or day, but what I'm tryna say is
I wanna be the last number you call late at night (Said I wanna be)
First one that you dial when you open your eyes
Wanna be the one you run to
Wanna be the one that ain't gon' hurt you
I wanna be, yeah, wanna be, yeah
Be the man making your girls jealous (Girl, I wanna be)
Be the guy shutting down all the fellas (Oh)
Whatever you need, girl, it's all on me
Your soldier, your friend or your lover (Oh), girl, I wanna be
Would it be cool, would you mind if I called you my boo?
What if the next whip you was pushing was the one I bought for you?
Can I be the one that meets your pops and take your mama shopping?
Be the only one they like
Wait, have you thought about it
Wait, really thought about it?
Maybe you should take some time
Call your girls and talk about it, yeah
'Cause I done already made up my mind (My mind)
Don't need no more time to know if I wanna be with you
I wanna be the last number you call late at night (Yeah, I wanna be, yeah)
First one that you dial when you open your eyes (Oh)
Wanna be the one you run to (Wanna be that)
Wanna be the one that ain't gon' hurt you (Wanna be that)
I wanna be, yeah, wanna be, yeah
Be the man making your girls jealous (I wanna)
Be the guy shutting down all the fellas (All the fellas, yeah)
Whatever you need (Whatever you need), girl, it's all on me
Your soldier, your friend or your lover (Hey), girl, I wanna be
Put me on your screen saver, all over your MySpace
And make me one of your top favorites, that's where I wanna be
The one you crying for, stand up for and fighting for
Wanna be your good, bad, love, hate, girl
Cross my heart, hope to die, on everything that's good
I'ma do you right, show you right, get this understood
Cross my heart, hope to die, on everything that's good
I'ma do you right, show you right, get this understood
I wanna be the last number you call late at night (Oh, oh)
First one that you dial when you open your eyes (When you open your eyes)
Wanna be the one you run to
Wanna be the one that ain't gon' hurt you (Oh)
I wanna be, yeah (I wanna be yours), wanna be, yeah
Be the man making your girls jealous (Jealous, yeah)
Be the guy shutting down all the fellas (Fellas)
Whatever you need (Oh), girl, it's all on me
Your soldier, your friend or your lover, girl, I wanna be
Oh, I wanna be yours
Girl, I wanna be yours
I wanna be yours
Be yours
I wanna be, be yours
I wanna be, be yours
","['Bm', 'G', 'Bm', 'D', 'Bm', 'G', 'Bm', 'G', 'Em', 'F#m', 'G', 'G', 'Bm', 'G', 'D', 'G', 'A', 'Em', 'G', 'Bm', 'G', 'Bm', 'G', 'Em', 'F#m', 'D', 'Bm', 'G', 'Bm', 'D', 'G', 'Bm', 'G', 'A', 'Bm', 'G', 'Bm', 'G', 'D', 'G', 'A', 'D', 'G', 'D', 'G', 'D', 'G', 'Em', 'D', 'D', 'G', 'D', 'G', 'Em', 'D', 'G', 'Bm', 'D', 'G', 'D', 'G', 'A', 'Bm', 'G', 'Bm', 'G', 'D', 'G', 'A', 'G', 'Bm', 'Em', 'F#m', 'Em', 'Bm', 'Em', 'F#', 'D', 'Em', 'D', 'E', 'Bm', 'D', 'E', 'Bm', 'G', 'Bm', 'G', 'D', 'G', 'A', 'F#m', 'Bm', 'G', 'Bm', 'F#m', 'G', 'D', 'G', 'A', 'F#m', 'Bm', 'G', 'Bm', 'G', 'D', 'G', 'A', 'Bm']"
12,So Cold (ver 2),Chris Brown,https://tabs.ultimate-guitar.com/tab/chris-brown/so-cold-chords-931553,"Now I want my baby back
It's so cold without her
Cold without her. She's gone
Now I'm alone, no one to hold on
Cause she was the only one
And I know I was dead wrong
But if you youuuu
If youuu
See her sooonn
Ask her will she forgive me
If you ever see her
If you ever meet her
If you ever get a chance to sit down, talk to her
Then tell her it's so cold
It's so cold, it's so cold
Here without her
And tell her I miss her. Tell her I need her
Tell her I want her
I really want her to come back home, back to keep me warm
Tell her I'm sorry, I'm really sorry
Can you forgive me? Please forgive me
And come back home, keep me safe and warm
","['G', 'D', 'Em', 'C', 'G', 'D', 'Em', 'C', 'G', 'D', 'Em', 'C', 'G', 'D', 'Em', 'C', 'G', 'D', 'Em', 'C', 'G', 'D', 'Em', 'C', 'G', 'D', 'Em', 'C']"
13,Atticus,Noisettes,https://tabs.ultimate-guitar.com/tab/noisettes/atticus-chords-962030,"to kill a mockingbird
is to silence the song
that seduces you
why?
'cause you need that desire in your heart to survive
and you need that burning fire in your soul to know
you're still alive
so catch me when I fall
or did I dive at your delight?
in my heart I can fly
and I cannot disguise my love
there is no time
and I wouldn't know how
constellations tonight
are so fiercesomely bright, my love
I have no fear
I am Atticus now
so why don't we fall into the waves?
can't you see how my heart yearns to misbehave?
so why don't we fall into the waves?
can't you see how my heart yearns to misbehave?
","['Abm', 'Db', 'Bbm', 'Gm', 'Abm', 'Bbm', 'Ebm', 'Abm', 'Bbm', 'Ebm', 'Fm', 'Gb', 'Abm', 'Bbm', 'Ebm', 'Fm', 'Gb', 'Ebm', 'Abm', 'Db', 'Gb', 'Fm', 'Ebm', 'B', 'Gb', 'Db', 'Ebm', 'Abm', 'Db', 'Gb', 'Fm', 'Ebm', 'B', 'Gb', 'Abm', 'Bbm', 'Ebm', 'Abm', 'Bbm', 'Ebm', 'Abm', 'Bbm', 'Ebm', 'Abm', 'Bbm', 'Ebm']"
14,24 Hours,Noisettes,https://tabs.ultimate-guitar.com/tab/noisettes/24-hours-chords-841961,"  I'm pulling my hair out
  I can't get to sleep
  The bed feels so empty
I can still smell you on me
A moment in space, the look on your face when I said ""hello""
  You stagger to mine, you're still on my mind; why do I feel so low?
  It could have been forever but we'll never know, 24 hours ago
  The night was all we had and then I had to go, 24 hours ago
We were lovers,   24 hours ago
  Where did the summer go?
  Everybody's fallen in love
  Hey, lover, I'm in limbo
I can still feel your touch
So look in my eyes and tell me you don't want to run away
I know I was bold, but life is too short to catch a heart so cold
  It could have been forever but we'll never know, 24 hours ago
  The night was all we had and then I had to go, 24 hours ago
We were lovers,   24 hours ago
How do we conceal that life is not what it should be?
Life is not what it seems
If you're fraying at the seams
Don't let your heart fraaaaaay
  24 hours ago
  The night was all we had and then I had to go, 24 hours ago
We were lovers,   24 hours ago
We were lovers,   24 hours ago
24 hours ago 
","['Ab', 'Fm', 'Ab', 'Fm', 'C#', 'Fm', 'C#', 'Bb', 'Ab', 'C#', 'Ab', 'C#', 'Eb', 'C#', 'Ab', 'Ab', 'Fm', 'Ab', 'Fm', 'C#', 'Fm', 'C#', 'Bb', 'Ab', 'C#', 'Ab', 'C#', 'Eb', 'C#', 'Ab', 'Cm', 'F', 'C#', 'Bb', 'Eb', 'Bb', 'Ab', 'C#', 'Ab', 'C#', 'Eb', 'C#', 'Ab', 'Eb', 'C#', 'Ab', 'Ab', 'Fm', 'Ab', 'Fm']"
15,Sometimes,Noisettes,https://tabs.ultimate-guitar.com/tab/noisettes/sometimes-chords-1150997,"I am an island underneath the setting sun
In an ocean that is churning
For all I know there might be nobody nearby
Still, the world, it keeps on turning
And when that sun goes down
It gets brighter in my heart somehow
I don't know why this is
But it's what I want to know
Sometimes we start over
And go solo
We're looking for
That summer home
Beside the sea
And for the future
This time onwards
In      the-
Sooooome
Oooooooh
Aaaaaaah
Oooooooh
In this song
","['Gm', 'D/A', 'Bb', 'Cm', 'Eb', 'Gm', 'D', 'D/A', 'Gm', 'D/A', 'Bb', 'Cm', 'Eb', 'Gm', 'D', 'D/A', 'Cm', 'Bb', 'Adim', 'Gm', 'Eb', 'Gm', 'D', 'D/A', 'Gm', 'Cm', 'Bb', 'Adim', 'Gm', 'Eb', 'Gm', 'D', 'Ab', 'Abm', 'Abm6', 'Eb', 'A7', 'Ab', 'Bb', 'Eb', 'Bb/D', 'Ab', 'Abm', 'Fm', 'Eb', 'Bb/D', 'Cm', 'Bb/D', 'Eb', 'D', 'Fm', 'Fm7', 'Eb', 'Fm7', 'D', 'Cm', 'Bb/D', 'Eb', 'D', 'Gm', 'D/A', 'Bb', 'Cm', 'Cm', 'Eb', 'Bb/F', 'Eb/G', 'D/A', 'Gm', 'D/A', 'Bb', 'Cm', 'Eb', 'Bb/D', 'Cm']"
