,name,author,link,lyrics,chords
16,Do You,Ne-Yo,https://tabs.ultimate-guitar.com/tab/ne-yo/do-you-chords-555809,"Maybe this decision was a mistake.
You probably don't care what I have to say.
But it's been heavy on my mind for months now.
Guess I'm trying to clear some mental space.
I would love to talk to you in person.
But I understand why that can't be.
I'll leave you alone for good I promise.
If you answer this one question for me.
I just won-der,
Do you e---ver,
Think of me,
Anymore, do you?
First off let me say congratulations.
Heard that you just had a baby girl.
If she looks anything like her mother,
She's the prettiest thing in the world.
Swear that I'm not tryin' to start no trouble.
Tell your fiance he can relax.
I'll leave you alone for good I promise,
There's a question I just gotta ask.
 I know what we have is dead and gone.
 Too many times I made you cry.
 And I don't mean to interrupt your life.
I just wonder do I ever cross your mind?
","['Am7', 'Em', 'Am7', 'Em', 'Am7', 'Em', 'Am', 'Em', 'Am7', 'Em', 'Am7', 'Em', 'Am7', 'Em', 'Am', 'Em', 'Am7', 'Em', 'Am7', 'Em', 'Am7', 'Em', 'Am', 'Em', 'Am7', 'Em', 'Am7', 'Em', 'Am7', 'Em', 'Am', 'Em', 'Am7', 'Em', 'Am7', 'Em', 'Am7', 'Em', 'Am', 'Em', 'Am7', 'Em', 'Am7', 'Em', 'Am7', 'Em', 'Am', 'Em']"
17,Im Outta Love (ver 2),Anastacia,https://tabs.ultimate-guitar.com/tab/anastacia/im-outta-love-chords-3902462,"Aah      aah, yeah, ooh ooh yeah, ah huh.
   Now baby come on,
don't claim that love you never let me feel.
I should have known 'cause you've brought nothing real.
Come on be a man about it, you won't die.
I ain't got no more tears to cry,
and I can't take this no more.
You know I gotta let it go and you know...
I'm outta love, set me free and let me out this misery.
Just show me the way to get my life again.
You can't handle me, Said I'm outta love can't you see,
baby, that you gotta set me free? I'm outta love. Yeah.
   Say how many times have I tried to turn this love around?
But every time you just let me down.
Come on be a man about it, you'll survive,
true that you can't work it out alright.
Tell me, yesterday did you know,
I'd be the one to let you go, and you know...
I'm outta love, set me free and let me out this misery.
Just show me the way to get my life again.
You can't handle me, Said I'm outta love can't you see,
baby, that you gotta set me free?
I'm outta,   let me get over you    the way you gotten over me too.
Seems like my time has come and now    I'm moving on,
and I'll be stronger.
Said I'm out my love, set me free and let me out this misery.
Just show me the way to get my life again, you can't handle me.
Said I'm out my love, can't you see, baby that you got set me free?
I'm outta love! Yeah!
I'm outta love, set me free and let me out this misery.
Just show me the way to get my life again.
You can't handle me, said Im outta love
set me free and let me out this misery (...) And so on (Fade out)
","['Bbm', 'F7', 'Ab', 'Eb', 'Bbm', 'F7', 'Ab', 'Eb', 'Bbm', 'F7', 'Ab', 'Eb', 'Bbm', 'F7/A', 'Ab', 'Eb', 'Bbm', 'F7', 'Gb', 'Ebm7', 'F7', 'Bbm', 'F7', 'Gb', 'F', 'F7', 'Bbm', 'F7', 'Ab', 'Eb', 'Bbm', 'F7', 'Ab', 'Eb', 'Bbm', 'F7', 'Gb', 'F', 'Bbm', 'Bbm', 'F7', 'Ab', 'Eb', 'Bbm', 'F7/A', 'Ab', 'Eb', 'Bbm', 'F7', 'Gb', 'Ebm7', 'F7', 'Bbm', 'F7', 'Gb', 'F', 'F7', 'Bbm', 'F7', 'Ab', 'Eb', 'Bbm', 'F7', 'Ab', 'Eb', 'Bbm', 'F7', 'Gb', 'F', 'Gbmaj7', 'F7', 'Ebm9', 'Faug/C', 'F7sus4', 'F7', 'Bbm', 'F7', 'Ab', 'Eb', 'Bbm', 'F7', 'Ab', 'Eb', 'Bbm', 'F7', 'Gb', 'F7', 'Bbm', 'Bbm', 'F7', 'Ab', 'Eb', 'Bbm', 'F7', 'Ab', 'Eb', 'Bbm', 'F7', 'Ab', 'Eb']"
18,Not That Kind,Anastacia,https://tabs.ultimate-guitar.com/tab/anastacia/not-that-kind-chords-18534,"Notes:   The chords repeat themselves through out the song...
","['F#', 'F7', 'E', 'F7']"
19,Avec Classe,Corneille,https://tabs.ultimate-guitar.com/tab/corneille/avec-classe-chords-3366149,"Excuse-moi, je sais que d'autres avant moi ont fait le test
Et qu'ils n'ont pas aidé mes plans mais je t'en prie reste
Laisse-moi t'ouvrir la porte
et prendre ta veste, assieds-toi, rien ne presse
Quand   je    te vois,
je le déduis de ton style : le flash laisse ton cœur froid
Et puis de toutes façons, tu sais du cash moi j'en ai pas
Mon angle est bien beaucoup plus subtil que ça,
prends ton temps écoute-moi
Quand je t'assure que
C'est avec classe,
que j'admire si tu permets, crois-moi
Car c'est ta classe,
qui m'attire et tu le sais, ce soir
C'est avec classe,
que je te désire mais dans l’respect en tout cas
C'est avec classe,
et ça marche à chaque fois
Quand  je  t'ai vue,
j'ai d'abord remarqué tes yeux avant tes fesses (naaan..)
Ok j'avoue, c'est pas vrai je le confesse
Mais je ne suis qu'un homme c'est normal faut pas qu’tu stresses
Mais le plus important
C'est  que  j'ai su,
reconnaître les mille et une choses qui te rendent complète
Ton charme commence où ton sex-appeal arrête
Tu souris, tu me parles, c'est assez pour perdre ma tête
Et c'est très sincèrement, que je te chante que
C'est avec classe,
que j'admire si tu le permets, crois-moi
Car c'est ta classe,
qui m'attire et tu le sais, ce soir
C'est avec classe,
que je te désire mais dans le respect en tout cas
C'est avec classe,
et ça marche à chaque fois
Je m'adresse à mes gars, on leur doit au moins ça
On a tous une sœur, et nos mères ont été jeunes une fois
Celui d'un autre avis que moi, c'est pas grave on t'en veut pas
C'est une nouvelle école qu'un jour tu rejoindras
C comme Corneille, C comme Classe
Toi-même tu sais, qui c'est
C'est, C comme Corneille, C comme Classe
Toi-même tu sais, toi-même tu sais
C'est avec classe,
que j'admire si tu le permets, crois-moi
Car c'est ta classe,
qui m'attire et tu le sais, ce soir
C'est avec classe,
que je te désire mais dans le respect en tout cas
C'est avec classe,
et ça marche à chaque fois
C comme Corneille, C comme Classe
Toi-même tu sais, qui c'est
C'est, C comme Corneille, C comme Classe
Toi-même tu sais, toi-même tu sais
","['Am7', 'Em', 'Bm7', 'Am7', 'Em', 'Bm7', 'Am7', 'Em', 'Bm7', 'C', 'G', 'D', 'Em', 'Bm7', 'Am7', 'Em', 'Bm7', 'Am7', 'Em', 'Bm7', 'Am7', 'Em', 'D', 'C', 'G', 'D', 'D', 'Am7', 'Em', 'Bm7', 'Am7', 'Em', 'D', 'Am7', 'Em', 'Bm7', 'C', 'G', 'D', 'Em', 'Bm7', 'Am7', 'Em', 'Bm7', 'Am7', 'Em', 'Bm7', 'Am7', 'Em', 'D', 'C', 'G', 'D', 'Em', 'Bm7', 'Am7', 'Em', 'Bm7', 'Am7', 'Em', 'Bm7', 'C', 'Em', 'D', 'C', 'G', 'D', 'Am7', 'Em', 'Bm7', 'Am7', 'Em', 'D', 'Am7', 'Em', 'Bm7', 'C', 'G', 'D', 'B7', 'Em', 'F', 'C', 'B7', 'Em', 'F', 'D', 'Am7', 'Em', 'Bm7', 'Am7', 'Em', 'Bm7', 'Am7', 'Em', 'Bm7', 'Am7', 'Em', 'D', 'Am7', 'Em', 'Bm7', 'C', 'G', 'D', 'Am7', 'Em', 'Bm7', 'Am7', 'Em', 'Bm7']"
20,Against All Odds (ver 2),Mariah Carey,https://tabs.ultimate-guitar.com/tab/mariah-carey/against-all-odds-chords-3416393,"How can I just let you walk away,
just let you leave without a trace?
When I stand here taking every breath with you, ooh ooh,
you're the only one who really knew me at all.
How can you just walk away from me,
when all I can do is watch you leave?
'Cause we've shared the laughter and the pain,
and even shared the tears.
You're the only one who really knew me at all.
So take a look at me now, 'cause there's just an empty space
and there's nothing left here to remind me,
just the memory of your face.
So take a look at me now, 'cause there's just an empty space,
and you coming back to me is against the odds,
and that's what I've got to face.
I wish I could just make you turn around,
turn around and see me cry.
There's so much I need to say to you, so many reasons why.
You're the only one who really knew me at all.
So take a look at me now, 'cause there's just an empty space
and there's nothing left here to remind me,
just the memory of your face.
So take a look at me now, still there's just an empty space,
but to wait for you is all I can do
and that's what I've got to face.
Take a good look at me now, 'cause I'll still be standing here.
And you coming back to me is against all odds,
that's the chance I've got to take, eh, yeah,      oh oh oh.
Take a look at me now.          Mmmh...
","['Am', 'Bm', 'C', 'Dm7', 'F6', 'G7', 'Em7', 'Am', 'Dm7', 'F', 'Gsus4', 'G', 'Am', 'Bm', 'C', 'Dm7', 'F6', 'G7', 'Em7', 'Am', 'Dm7', 'F', 'Gsus4', 'G', 'C', 'D7', 'Am', 'F', 'Dm7', 'Gsus4', 'G', 'C', 'D7', 'Am', 'F', 'Dm7', 'Gsus4', 'G', 'Am', 'Bm', 'C', 'Dm7', 'F6', 'G7', 'Em7', 'Am', 'Dm7', 'F', 'Gsus4', 'G', 'C', 'D7', 'Am', 'F', 'Dm7', 'Gsus4', 'G', 'C', 'D7', 'Am', 'F', 'Dm7', 'Gsus4', 'G', 'C', 'D7', 'Am', 'F', 'Dm7', 'Gsus4', 'G', 'Dm', 'G', 'Dm', 'G', 'Dm', 'Gsus4', 'G', 'F', 'G']"
21,Jenny From The Block,Jennifer Lopez,https://tabs.ultimate-guitar.com/tab/jennifer-lopez/jenny-from-the-block-chords-1977251,"          L O X
           J. Lo
We off the block this year
 Everybody mad at the rocks that I wear
I know where I'm goin' and I know where I'm from
You hear LOX in your ear
Yea, we're at the airport out decline from the block
Where everybody air-forced-out
With a new white Tee, you fresh
get the mansion, bring the homies with us
Don't be fooled by the rocks that I got
I'm still, I'm still Jenny from the block
Used to have a little, now I have a lot
No matter where I go, I know where I came from (from the Bronx!)
Don't be fooled by the rocks that I got
I'm still, I'm still Jenny from the block
Used to have a little, now I have a lot
No matter where I go, I know where I came from (from the Bronx!)
From In Living Color and movie scripts
To On the 6 to J. Lo to this headline clips
I stayed grounded as the amounts roll in
I'm real, I thought I told you
I really been on Oprah
That's just me
Nothin phony, don't hate on me
What you get is what you see
Don't be fooled by the rocks that I got
I'm still, I'm still Jenny from the block
Used to have a little, now I have a lot
No matter where I go, I know where I came from (from the Bronx!)
Don't be fooled by the rocks that I got
I'm still, I'm still Jenny from the block
Used to have a little, now I have a lot
No matter where I go, I know where I came from (from the Bronx!)
I'm down to earth like this
Rockin this business
 I'm in control and loving it
Rumors got me laughing, kid
Love my life and my public
Put God first
Then can't forget to stay real
To me it's like breathing
Don't be fooled by the rocks that I got
I'm still, I'm still Jenny from the block
Used to have a little, now I have a lot
No matter where I go, I know where I came from (from the Bronx!)
Don't be fooled by the rocks that I got
I'm still, I'm still Jenny from the block
Used to have a little, now I have a lot
No matter where I go, I know where I came from (from the Bronx!)
Don't be fooled by the rocks that I got
I'm still, I'm still Jenny from the block
Used to have a little, now I have a lot
No matter where I go, I know where I came from (from the Bronx!)
Don't be fooled by the rocks that I got
I'm still, I'm still Jenny from the block
Used to have a little, now I have a lot
No matter where I go, I know where I came from (from the Bronx!)
Don't be fooled by the rocks that I got
I'm still, I'm still Jenny from the block
Used to have a little, now I have a lot
No matter where I go, I know where I came from (from the Bronx!)
","['Dm7', 'F#m7', 'C#m7', 'Cm7', 'Dm7', 'F#m7', 'C#m7', 'Cm7', 'G#m', 'D#m7', 'Dm7', 'D#m7', 'G#m', 'D#m7', 'Dm7', 'D#m7', 'G#m', 'G#m', 'D#m7', 'Dm7', 'D#m7', 'G#m', 'D#m7', 'Dm7', 'D#m7', 'G#m', 'D#m7', 'Dm7', 'D#m7', 'G#m', 'D#m7', 'Dm7', 'D#m7', 'G#m', 'D#m7', 'Dm7', 'D#m7', 'G#m', 'D#m7', 'Dm7', 'D#m7', 'G#m', 'D#m7', 'Dm7', 'D#m7', 'G#m', 'D#m7', 'Dm7', 'D#m7', 'G#m', 'D#m7', 'Dm7', 'D#m7', 'G#m', 'D#m7', 'Dm7', 'D#m7', 'G#m', 'D#m7', 'Dm7', 'D#m7', 'G#m', 'D#m7', 'Dm7', 'D#m7', 'G#m', 'D#m7', 'Dm7', 'D#m7']"
22,My Hands,Leona Lewis,https://tabs.ultimate-guitar.com/tab/leona-lewis/my-hands-chords-903851,"I wake in the morning
Tired of sleeping
Get in the shower
And make my bed alone
I put on my makeup
Talking to the mirror
Ready for a new day
Without you
And I walk steady on my feet
I talk my voice obeys me
I go out at night
Sleep without the lights
And I do all of the things
I have to keeping you off my mind
But when I think I'll be alright
I am always wrong cause
My hands (Don't wanna start again)
My hands (No they don't wanna understand)
My hands
They just shake and try to break
My hands (They only agree to hold)
Your hands (And they don't wanna be without)
Your hands
And they will not let me go
No they will not let me go
I talk about you now
And go a day without crying
I go out with my friends now
I stay home all alone
I don't see you everywhere
I can say your name easily
I laugh a bit louder
Without you
And I see different shades now
And I'm almost never afraid now
But when I think I'll be okay
I am always wrong now
My hands (Don't wanna start again)
My hands (No they don't wanna understand)
My hands
They just shake and try to break
My hands (They only agree to hold)
Your hands (And they don't wanna be without)
Your hands
And they will not let me go
No they will not let me go
Sometimes I wake and see them reaching out for you
Quietly breaking whatever shields
I spent so long building up
I cannot fake, cos when they cry I'm unspoken
They miss holding my baby
My hands
No they don't wanna understand
They just shake and try to break
whatever peace I may find
My hands
Your hands (They don't want to be without)
Your hands
They will not let me go
No they will not let me go
My hands (They don't wanna start again)
My hands (No they don't wanna understand)
My hands
They just shake and try to break
whatever peace I may find
My hands (They only agree to hold)
Your hands (And they don't wanna be without)
Your hands
And they will not let me go
No they will not let me go
No they will not let me go
","['C', 'G/B', 'Am', 'F', 'C', 'G/B', 'Am', 'F', 'Am', 'F', 'C', 'G/B', 'Am', 'F', 'C', 'G/B', 'C', 'G', 'Am', 'F', 'C', 'G', 'Am', 'F', 'C', 'C', 'G/B', 'Am', 'F', 'C', 'G/B', 'Am', 'F', 'Am', 'F', 'C', 'G/B', 'C', 'G', 'Am', 'F', 'C', 'G', 'Am', 'F', 'G', 'G', 'Am', 'F', 'G', 'Am', 'F', 'G', 'Am', 'F', 'G', 'G', 'C', 'G', 'Am', 'F', 'C', 'C', 'G', 'Am', 'F', 'C', 'C', 'G', 'Am', 'F', 'C', 'C', 'G', 'Am', 'F', 'C', 'G/B', 'Am', 'F', 'C']"
23,Call Me When You Get This,Corinne Bailey Rae,https://tabs.ultimate-guitar.com/tab/corinne-bailey-rae/call-me-when-you-get-this-chords-1501329,"How does it  fe-el     be-ing in  these arms? 
      What's it really like       to be loved? 
I've been alone now,  how long? 
Have you ever lo-ved  the way that I have? 
And I have often wondered who,
Who could love you the way I do? 
Now I just want you to know, how I'm touched deep in my soul 
Just being with you,  Oooo, Ooo, Ooo. 
And I need you more each day, Baby if you're still awake, 
Call me when you get this.
I've got   all this   poe-try        now  I didn't know then 
           I kept inside
Guess I had  ne-ver   seen anything be -  au - ti - ful 
      Till I first saw  you   asleep at night. 
And I have often wondered who,
Who could love you the way I do? 
Now I just want you to know, how I'm touched deep in my soul 
Just being with you,  Oooo, Ooo, Ooo. 
And I need you more each day, Baby if you're still awake, 
Call me when you get this.
I just   wanted to know what   it    was like
      What's it really like           to be loved? 
These little volcanoes came as a surp - rise    to me. 
I never thought       I  could be this way. 
And I have been cautious and 
I've tried to keep to myself
But who could love you
The way I do? 
Now I just want you to know, how I'm touched deep in my soul 
Just being with you,  Oooo, Ooo, Ooo. 
And I need you more each day, Baby if you're still awake, 
Call me when you get this.
Now I just want you to know, how I'm touched deep in my soul 
Just being with you,  Oooo, Ooo, Ooo. 
And I need you more each day, baby if you're still awake, 
Call me when you get this.
","['Emaj7', 'Am9', 'Am7', 'C#m9', 'C#m7', 'E7', 'Amaj7', 'E/B', 'Bm11', 'F#m11', 'A/E', 'B/F#', 'Emaj7', 'Am9', 'Am7', 'C#m9', 'C#m7', 'E7', 'Amaj7', 'E/B', 'Bm11', 'F#m11', 'A/E', 'B/F#', 'C#m', 'Caug', 'C#m7', 'C#m6', 'F#m11', 'A/B', 'A/E', 'B/F#', 'F#m11', 'E', 'G#m7', 'Gm7', 'F#m11', 'A#m7', 'Amaj7', 'Emaj7', 'Am9', 'Am7', 'C#m9', 'C#m7', 'E7', 'Amaj7', 'E/B', 'Bm11', 'F#m11', 'A/E', 'B/F#', 'Emaj7', 'Am9', 'Am7', 'C#m9', 'C#m7', 'E7', 'Amaj7', 'E/B', 'Bm11', 'F#m11', 'A/E', 'B/F#', 'C#m', 'Caug', 'C#m7', 'C#m6', 'F#m11', 'A/B', 'A/E', 'B/F#', 'F#m11', 'E', 'G#m7', 'Gm7', 'F#m11', 'A#m7', 'Amaj7', 'Emaj7', 'Am9', 'Am7', 'C#m9', 'C#m7', 'E7', 'Amaj7', 'E/B', 'Bm11', 'F#m11', 'A/E', 'B/F#', 'Emaj7', 'Am9', 'Am7', 'C#m9', 'C#m7', 'E7', 'Amaj7', 'E/B', 'Bm11', 'F#m11', 'A/E', 'B/F#', 'C#m', 'Caug', 'C#m7', 'C#m6', 'F#m11', 'A/B', 'A/E', 'B/F#', 'F#m11', 'E', 'G#m7', 'Gm7', 'F#m11', 'A#m7', 'Amaj7', 'F#m11', 'E', 'G#m7', 'Gm7', 'F#m11', 'A#m7', 'Amaj7']"
24,Statue (ver 2),Lil Eddie,https://tabs.ultimate-guitar.com/tab/lil-eddie/statue-chords-1114279,"When the day is said and done,
In the middle of the night and you're fast asleep, my love.
Stay awake looking at your beauty,
Telling myself I'm the luckiest man alive.
Cause so many times I was certain you was gonna walk out of my life
Why you take such a hold of me girl,
When I'm still trying to get my act right.
What is the reason, when you really could have any man you want,
I don't see, what I have to offer.
I should've been a season, guess you could see I had potential.
Do you know you're my Miracle?
I'm like a statue, stuck staring right at you,
Got me frozen in my tracks so amazed how you take me back,
Each and everytime our love collapsed
Statue, stuck staring right at you,
So when I'm lost for words,
Everytime I disappoint you, It's just cause I can't believe,
That you're so beautiful 
Don't wanna lose you, no 
Ask myself why are you even with me,
After all the shit I put you through,
Why did you make It hard, It's like you're living and I make you,
But baby your love is so warm It makes my shield melt down,
And everytime were both at war, You make me come around
What is the reason, when you really could have any man you want,
I don't see, what I have to offer.
I should've been a season, guess you could see I had potential.
Do you know you're my Miracle?
I'm like a statue, stuck staring right at you,
Got me frozen in my tracks so amazed how you take me back,
Each and everytime our love collapsed
Statue, stuck staring right at you,
So when I'm lost for words,
Everytime I disappoint you, It's just cause I can't believe,
That you're so beautiful 
Don't wanna lose you, no 
That you're so beautiful 
Don't wanna lose you, never
   Every single day of my life I thank my lucky stars,
   God really had to spend extra time when he sculptured your heart
   Cause there's no explanation, can't solve the equation
It's like you love me more than I love myself.
I'm like a statue, stuck staring right at you,
Got me frozen in my tracks so amazed how you take me back,
Each and everytime our love collapsed
Statue, stuck staring right at you,
So when I'm lost for words,
Everytime I disappoint you, It's just cause I can't believe,
That you're so beautiful 
Don't wanna lose you, no 
That you're so beautiful 
Don't wanna lose you, never.....
When the day Is said and done,
And In the middle of the night you're fast asleep, my love
","['Gmaj', 'Em7', 'Cadd9', 'Dsus4', 'Gmaj', 'Em7', 'Cadd9', 'D', 'Am', 'Em7', 'Cadd9', 'D', 'Am', 'Em7', 'Cadd9', 'D', 'Gmaj', 'Em7', 'Cadd9', 'D', 'Gmaj', 'Em7', 'Cadd9', 'D', 'Cadd9', 'D', 'Cadd9', 'D', 'Gmaj', 'Em7', 'Cadd9', 'D', 'Gmaj', 'Em7', 'Cadd9', 'D', 'Am', 'Em7', 'Cadd9', 'D', 'Am', 'Em7', 'Cadd9', 'D', 'Gmaj', 'Em7', 'Cadd9', 'D', 'Gmaj', 'Em7', 'Cadd9', 'D', 'Cadd9', 'D', 'Cadd9', 'D', 'Cadd9', 'D', 'Cadd9', 'D', 'Am', 'Em', 'Cadd9', 'D', 'Am', 'Em', 'Cadd9', 'D', 'Gmaj', 'Em7', 'Cadd9', 'D', 'Gmaj', 'Em7', 'Cadd9', 'D', 'Cadd9', 'D', 'Cadd9', 'D', 'Cadd9', 'D', 'Cadd9', 'D', 'Gmaj', 'Em7', 'C', 'D']"
25,Love In This Club (ver 2),Usher,https://tabs.ultimate-guitar.com/tab/usher/love-in-this-club-chords-2755629,"  Gotta do it for the ladies, I gotta keep it hood. Where we at, Polo? (hey!)
           I see you Rock?  I'ma keep doin' right! 
  We just gettin' started.         Yeaaah man.
You say you're searchin' for somebody that'll take you out and do you riiiight.
Well, come here baby and let daddy show you what it feel liiike.
You know all you gotta do is tell me what you're sippin' ooon.
And I promise that I'm gonna keep it comin' all night looong.
Lookin' in your eyes, while you on the other side, 
And I think miss shorty I got a thing for you, yeah
Doin' it on purpose, wind it and workin' it.
   I-can-tell by-the-way you're lookin' at me, girl.
I wanna make lo-ove in this club (hey)    In this club (hey)      In this club (hey) 
Got some friends rollin' with you baby then that's cooool
You can leave 'em with my niggas, let them know that I got youuu
If you didn't know, you're the only thing that's on my miiiind
'Cause the way I'm starin' at you got me want to give it to you all niiiighht
Lookin' in your eyes, while you're on the other side,
I can't take it no more baby I'm comin' for you
You keep do-in' it on purpose, wind it and workin' it.
   If-we-close our eyes it-could-just-be me and you
I wanna make lo-ove in this club (hey)    In this club (hey)      In this club (hey) 
I wanna make lo-ove in this club (hey)    In this club (hey)      In this club (hey) 
   I'm what you want,   I'm what you need.
   He got to trap,    I'll set you free,
Sexually, mentally, physically, emotionally,
I'll be like your medicine, you'll take every dose of me.
It's goin' down on isle three I'll bag you like some groceries.
And err'time you think about it, you're gonna want some more of me.
'bout to hit the club, make a movie, yeah rated R.
Pull up like a trap star that's if you had you ever made
love to a thug in a club with his sights on,
87 jeans and a fresh pair of Nikes on?
On the couch, on the table, on the bar, on the floor
You might as well give me a kiss, if we keep touching like this
I know you're scared, baby-they-don't-know-what-we doin'.
Let's both get undressed right here, keep it up girl and I swear.
    I'm gonna give-it-to-you-non-stop, and I don't care who's
watching,  watching, watching, watching, watching
 oh, in this club, on the floor  baby, let's make love 
I wanna make lo-ove in this club (hey)    In this club (hey)
       In this club (hey)  
I wanna make lo-ove in this club (hey)    In this club (hey)
       In this club (hey)    In this club, yeah
","['C', 'Em', 'Am', 'F', 'C', 'Em', 'Am', 'F', 'C', 'Em', 'Am', 'C', 'G', 'Am', 'F', 'C', 'G', 'Am', 'F', 'C', 'G', 'Am', 'F', 'C', 'G', 'Am', 'F', 'C', 'Em', 'Am', 'F', 'C', 'Em', 'Am', 'C', 'Em', 'Am', 'F', 'C', 'Em', 'Am', 'F', 'C', 'Em', 'Am', 'F', 'C', 'Em', 'Am', 'F', 'C', 'Em', 'Am', 'F', 'C', 'Em', 'Am', 'F', 'C', 'Am', 'F', 'C', 'Em', 'Am', 'F', 'C', 'Em', 'Am', 'F', 'C', 'G', 'Am', 'F', 'C', 'Em', 'Am', 'F', 'C', 'Em', 'Am', 'F', 'C', 'G', 'Am', 'F', 'C', 'G', 'Am', 'F', 'C', 'C', 'Em', 'Am', 'F', 'C', 'Em', 'Am', 'F', 'C', 'Em', 'Am', 'F', 'C', 'Em', 'Am', 'F', 'C', 'Em', 'Am', 'F', 'C', 'Em', 'Am', 'F']"
26,Here I Stand,Usher,https://tabs.ultimate-guitar.com/tab/usher/here-i-stand-chords-684344,"     I’m hoping that this ain’t too hard to believe
     Cause baby, you’re the only one for me
     I know it gets hard when I’m moving in and outta state
     But I promise my heart for you I would save
","['C', 'Am7', 'Abmaj7', 'Dm7', 'C', 'Am7', 'Abmaj7', 'Dm7', 'Dm7', 'C', 'Am7', 'Abmaj7', 'Dm7']"
