,name,author,link,lyrics,chords
45,Junko Partner,Dr. John,https://tabs.ultimate-guitar.com/tab/dr-john/junko-partner-chords-781552,"Down the road, come Junko Partner; the boy was loaded, as can be.
Boy he was knock, knock, knocked out loaded.
You know he wobbled, all over the street.
Singing; six months, ain't no sentence, Lord, and one year, ain't no time.
They got boys, up on the Ponderosa; 'doing life, and ninty-nine.
If I had, if I had, if I had, a million dollars,
Just one million, to call my own.
I would buy me, the land around parish prison,
And I would grow me, a big mootie farm.
Down the road, down the road, down the road, yeah, here he comes; Mr Jones.
Well, give me whiskey, when I get a little frisky,
'Cos it's my good drink, when I get a little dry.
Give me to-bacco, when I get a little sickly,
But give me heroin before I die.
Down the road, down the road, down the road, down the road,
The boy was loaded, as can be.
Don't you know that he wobbled, yes, all over the street.
","['G', 'C7', 'G', 'G', 'D7', 'G', 'G', 'C7', 'G', 'G', 'D7', 'G', 'G', 'C7', 'G', 'G', 'D7', 'G', 'G', 'C', 'G', 'C7', 'G', 'G', 'D7', 'G', 'G', 'C7', 'G', 'D7', 'G']"
46,Ill Be There (ver 3),Michael Jackson,https://tabs.ultimate-guitar.com/tab/michael-jackson/ill-be-there-chords-1421786,"You and I must make a pact
We must bring salvation back,
Where there is love, I'll be there. (I'll be there)
I'll reach out my hand to you
I'll have faith in all you do.
Just call my name and I'll be there. (I'll be there)
I'll be there to comfort you,
Build my world of dreams around you,
I'm so glad that I found you.
I'll be there with a love that's strong,
I'll be your strength, 
I'll keep holdin' on. (holdin' on)
Let me fill your heart with joy and laughter,
Togetherness, girl, is all I'm after,
Whenever you need me, I'll be there. (I'll be there)
I'll be there to protect you, (yeah baby)
With unselfish love that respects you.
Just call my name, I'll be there. (I'll be there)
I'll be there to comfort you,
Build my world of dreams around you,
I'm so glad that I found you.
I'll be there with a love that's strong,
I'll be your strength, 
I'll keep holdin' on. 
If you should ever find someone new
I know he better be good to you
Cause if he doesn't 
Ill be there (ill be there)
Don't you know baby yeah yeah, I'll be there
I'll be there
Just call my name, I'll be there (I'll be there)
I'll be there, I'll be there,
Whenever you need me, I'll be there (I'll be there)
Don't you know baby, yeah yeah
I'll be there, I'll be there
Just call my name, I'll be there (I'll be there)  (To Fade)
","['D', 'A', 'Bm', 'Bm/A', 'F#m', 'G', 'G6', 'A', 'D', 'D', 'A', 'Bm', 'Bm/A', 'F#m', 'G', 'G6', 'A', 'D', 'F', 'C', 'G', 'D', 'F', 'C', 'G', 'D', 'D', 'A', 'Bm', 'Bm/A', 'F#m', 'G', 'G6', 'A', 'D', 'D', 'A', 'Bm', 'Bm/A', 'F#m', 'G', 'G6', 'A', 'D', 'F', 'C', 'G', 'D', 'F', 'C', 'G', 'D', 'D', 'A', 'Bm', 'Bm/A', 'F#m', 'G', 'G6', 'A', 'D', 'D', 'A', 'Bm', 'Bm/A', 'F#', 'G', 'G6', 'A', 'D', 'A', 'Bm', 'Bm/A', 'F#m', 'G', 'G6', 'A', 'D', 'D', 'A', 'Bm', 'Bm/A', 'F#m', 'G', 'G6', 'A', 'D']"
47,Ben (ver 3),Michael Jackson,https://tabs.ultimate-guitar.com/tab/michael-jackson/ben-chords-841771,"Ben the two of us need look no more
We both found what we were looking for
With a friend to call my own
I'll never be alone 
And you my friend will see
You've got a friend in me
Ben, you're always running here and there
You feel you're not wanted anywhere
If you ever look behind
And don't like what you find
There's something you should know 
You've got a place to go (you've got a place to go)
I used to say, I and me 
Now it's  us, now it's we
I used to say, I and me 
Now it's  us, now it's we
Ben, most people would turn you away
I don't listen to a word they say
They don't see you as I do
I wish they would try to
I'm sure they'd think again
If they had a friend like Ben    (a friend)
Like Ben    (Like Ben)
Like Ben
","['F', 'C7', 'F', 'C7', 'Fmaj7', 'Esus4', 'A/C#', 'D#7', 'D7', 'C#7', 'C7', 'F', 'Bb', 'F', 'Bb', 'F', 'C7', 'F', 'C7', 'Fmaj7', 'Esus4', 'A/C#', 'D#7', 'D7', 'C#7', 'C7', 'F', 'Bb', 'F', 'Bb', 'Gm', 'Fmaj7', 'Gm', 'Fmaj7', 'Gm', 'Fmaj7', 'Gm', 'Fmaj7', 'F', 'C7', 'F', 'C7', 'Fmaj7', 'Esus4', 'A/C#', 'D#7', 'D7', 'C#7', 'C7', 'F', 'Bb', 'F', 'Bb', 'F', 'Bb', 'F', 'Bb', 'F']"
48,One Day In Your Life (ver 3),Michael Jackson,https://tabs.ultimate-guitar.com/tab/michael-jackson/one-day-in-your-life-chords-1709196,"One day in your life     you'll remember a place,    someone touching your face.
 You'll come back and you'll look,      a-rou—nd    you.
 One day in your life,  you'll remember the love,  you fou-nd     here.
 You'll re-member me some-how,               though you don't need me now.
 I     will  stay in your heart,           and when things fall a-part,
 you'll re—-mem—ber, one day.
 One day in your life,    when you find that you're al—ways wait—ing,
 For the  love we used to share;         Just call my name,  and       I'll   be there.
 You'll re-member me some-how,             though you don't meet me now
 I  will  stay in your heart,   and when things fall a-part
You'll re—memb—er, one day.
 One day in your life,  when you find that you're always   lonely
 For  the  love we used to share,           Just call my name,         and     I'll   be there.
","['E', 'C#m7', 'D#m7', 'G#7', 'C#maj7', 'C#m', 'F#m7', 'B7sus4', 'B7', 'Emaj7', 'C#m7', 'D#m7', 'G#', 'C#m', 'B7sus4', 'Emaj7', 'Amaj7', 'Am7', 'F#m6', 'B7b9', 'Emaj7', 'C#m7', 'F#sus4', 'F#7', 'B7sus4', 'B7', 'Bb9', 'Emaj7', 'C#m7', 'D#m7', 'G#7', 'G#', 'C#m', 'B7sus4', 'Emaj7', 'Amaj7', 'D', 'B7sus4', 'B7', 'C#', 'C#m', 'B7sus4', 'Emaj7', 'Amaj7', 'Am7', 'F#m6', 'B7b9', 'Emaj7', 'C#m7', 'F#sus4', 'F#7', 'B7sus4', 'B7', 'Bb9', 'E', 'C#m7', 'D#m7', 'G#7', 'C#m', 'B7sus4', 'Emaj7', 'Amaj7', 'D', 'B7sus4', 'B7', 'Emaj7']"
49,If I Could Build My Whole World Around You,Marvin Gaye,https://tabs.ultimate-guitar.com/tab/marvin-gaye/if-i-could-build-my-whole-world-around-you-chords-3669683,"Oh, if I could build my whole world around you, darling
First I'd put heaven by your side
Pretty flowers would grow wherever you walk, honey
And over your head would be the bluest sky
Then I'd take every drop of rain
And wash all your troubles away
I'd have the whole world wrapped up in you darling
And that would be all right, oh yes it would
If I could build my whole world around you
I'd make your eyes the morning sun
I'd put so much love where there is sorrow
I'd put joy where there's never been none
Then I'd give my love to you
For you to keep for the rest of your life
Oh, and happiness would surely be ours
And that would be all right, oh yes it would
 Doo doo doo doo doo
Doo doo doo doo
Doo doo doo doo doo
Doo doo doo doo
Oh, If I could build my whole world around you
I'd give you the greatest gift any woman could possess
And I'd step into this world you've created
And give you true love and tenderness
And there'd be something new with every tomorrow
To make this world better as days go by
That is if I could build my whole world around you
If I could build my whole world around you
And that would be all right, oh yeah
If I could build my whole world around you
If I could build my whole world around ya
And that would be all right, oh yeah
If I could just build my world, baby
If I could build it, build it all around ya
And that would be all right, oh yeah
","['Db', 'Gb', 'Db', 'Gb', 'Db', 'Gb', 'Db', 'Ebm', 'Db', 'Gb', 'Db', 'Gb', 'Db', 'Gb', 'Db', 'Bbm', 'Fm', 'Bbm', 'Fm', 'Bbm', 'Ebm', 'Db', 'Ab', 'Db', 'Gb', 'Db', 'Gb', 'Db', 'Gb', 'Db', 'Gb', 'Db', 'Gb', 'Db', 'Gb', 'Db', 'Gb', 'Db', 'Gb', 'Db', 'Gb', 'Fm', 'Bbm', 'Fm', 'Bbm', 'Ebm', 'Fm', 'Ab', 'Db', 'Gb', 'Db', 'Gb', 'Db', 'Gb', 'Db', 'Gb', 'Db', 'Ebm', 'Fm7', 'Bb7', 'Eb', 'Ab', 'Eb', 'Ab', 'Eb', 'Ab', 'Eb', 'Ab', 'Eb', 'Ab', 'Eb', 'Ab', 'Eb', 'Ab', 'Eb', 'Ab', 'Gm', 'Cm', 'Gm', 'Cm', 'Fm', 'Gm', 'Bb', 'Fm', 'Gm', 'Bb', 'Eb', 'Ab', 'Eb', 'Fm', 'Gm', 'Bb', 'Fm', 'Gm', 'Bb7', 'Eb', 'Ab', 'Eb', 'Fm', 'Gm', 'Bb', 'Fm7', 'Gm', 'Bb', 'Eb']"
