,name,author,link,lyrics,chords
42,Im Yours (ver 3),Jason Mraz,https://tabs.ultimate-guitar.com/tab/jason-mraz/im-yours-chords-712142,"Well, you done done me and you bet I felt it
I tried to be chill but you're so hot that I melted
I fell right through the cracks,
Now I'm tryin' to get back
Before the cool done run out I'll be givin' it my bestest
And nothin's gonna stop me but divine intervention
I reckon it's again my turn
To win some or learn some
But I won't hesitate
No more, no more
It cannot wait, I'm yours
 Well, open up your mind and see like me
Open up your plans and damn you're free
Love love love love
Listen to the music of the moment people dance and sing
We're just one big family
And it's our godforsaken right to be loved loved loved loved loved
So, I won't hesitate
No more, no more,
It cannot wait I'm sure
There's no need to complicate our time is short
This is our fate, I'm yours
but do you, do you, do, do,
but do you want to come on?
Scooch on over closer, dear
And I will nibble your ear
A-soo da ba ba ba ba bum
Whoa oh, oh oh oh oh oh
Whoa oh oh oh oh, oh oh, oh oh oh oh oh
Uh-huh, mmhmmm
I've been spendin' way too long checkin' my tongue in the mirror
and bendin' over backwards just to try to see it clearer
But my breath fogged up the glass
And so I drew a new face and I laughed
I guess what I'd be sayin' is there ain't no better reason
To rid yourself of vanities and just go with the seasons
It's what we aim to do
Our name is our virtue
But I won't hesitate
No more, no more
It cannot wait, I'm yours
 Well, open up your mind and see like me
Open up your plans and damn you're free
I look into your heart and you will find that the sky is yours
So please don't, please don't, please don't,
There's no need to complicate,
Cause our time is short
This, this, this is our fate,
I'm yooooooours
Brr da ba mmm da ba bo mmm day
Na ch doo, doo ch doo, doo ch doo doo mmm doo doo
mmm mmm mmm mmm (Hey, hey) Oh, I'm yours, oh-oh, I'm yours
Oh-oh-oh-oh, whoa-oh-oh-oh
Baby, do you believe I'm yours?
You best believe, you best believe I'm yours, hmm
","['G', 'D', 'Em', 'C', 'G', 'D', 'Em', 'C', 'G', 'D', 'Em', 'C', 'G', 'D', 'Em', 'C', 'G', 'D', 'Em', 'C', 'A7', 'G', 'D', 'Em', 'C', 'G', 'D', 'Em', 'C', 'Em', 'D', 'C', 'A7', 'G', 'D', 'Em', 'D', 'C', 'A7', 'G', 'D', 'Em', 'C', 'G', 'D', 'Em', 'C', 'G', 'D', 'Em', 'C', 'G', 'D', 'Em', 'C', 'G', 'D', 'Em', 'C', 'A7', 'G', 'D', 'Em', 'C', 'G', 'D', 'Em', 'C']"
43,All These Things That Ive Done (ver 5),The Killers,https://tabs.ultimate-guitar.com/tab/the-killers/all-these-things-that-ive-done-chords-1106662,"When there's nowhere else to run
Is there room for one more son?
One more son?
If you can hold on,
If you can hold on, hold on.
I want to stand up, I want to let go
You know you know - no, you don't, you don't.
I want to shine on in the hearts of men.
Another head aches, another heart breaks.
I'm so much older than I can take.
And my affection, well it comes and goes.
Help me out, yeah
Oh don't you put me on the back burner,
You know you gotta help me out, yeah.
And when there's nowhere else to run
Is there room for one more son?
The cold-hearted boy I used to be.
Yeah, you know you gotta help me out, yeah
Oh don't you put me on the back burner
You know you gotta help me out, yeah
You're gonna bring yourself down, yeah
You're gonna bring yourself down, yeah
You're gonna bring yourself down.
I got soul, but I'm not a soldier
I got soul, but I'm not a soldier
I got soul, but I'm not a soldier (2x)
I got soul, but I'm not a soldier
I got soul, but I'm not a soldier
Yeah, you know you gotta help me out, yeah
Oh don't you put me on the back burner
You know you gotta help me out, yeah
You're gonna bring yourself down, yeah
Oh don't you put me on the back burner,
You're gonna bring yourself down
Over and in, last call for sin.
While everyone's lost, the battle is won
With all these things that I've done.
With all these things that I've done.
If you can hold on, if you can hold on...
","['E', 'E7', 'A', 'E', 'C#m', 'A', 'E', 'E', 'A', 'E', 'E', 'A', 'E', 'E', 'A', 'E', 'E', 'A', 'E', 'E', 'A', 'E', 'C#m', 'A', 'E', 'E', 'A', 'E', 'C#m', 'A', 'E', 'E', 'A', 'E', 'E', 'A', 'E', 'C#m', 'F#m', 'A', 'B', 'E', 'C#m', 'A', 'B', 'E']"
44,Breathe 2 Am,Anna Nalick,https://tabs.ultimate-guitar.com/tab/anna-nalick/breathe-2-am-chords-159089,"  2 AM and she calls me cause I'm still awake 
""Can you help me unravel my latest mistake 
I don't love him. Winter just wasn't my season.""
  Yeah, we walk through the doors - so accusing their eyes
Like they have any right at all to criticize
Hypocrites. You're all here for the very same reason.
Cause you can't jump the track 
We're like cars on a cable 
And life's like an hourglass glued to the table 
No one can find the rewind button, girl 
So cradle your head in your hands. 
And breathe, just breathe, whoa breathe just breathe
  In May he turned 21 on the base of Fort Bliss 
""Just a day,"" he said down to the flask in his fist
""Ain't been sober since maybe October of last year.""
  Here in town you can tell he's been down for a while 
But my God it's so beautiful when the boy smiles
Wanna hold him. Maybe I'll just sing about it 
Cause you can't jump the track 
We're like cars on a cable
And life's like an hourglass glued to the table 
No one can find the rewind button, boys 
So cradle your head in your hands.
And breathe, just breathe, whoa breathe just breathe
There's a light at each end of this tunnel 
You shout cause you're just as far in as you'll ever be out 
And these mistakes you've made, you'll just make them again 
If you only try turnin' around
  2 AM and I'm still awake writing a song
If I get it all down on paper it's no longer inside of me 
Threatenin' the life it belongs to.
  And I feel like I'm naked in front of the crowd
Cause these words are my diary screamin' out loud
And I know that you'll use them however you want to.
But you can't jump the track 
We're like cars on a cable
And life's like an hourglass glued to the table, 
No one can find the rewind button now 
Sing it if you understand...
And breathe, just breathe, whoa breathe just breathe
Whoa  breathe, just breathe, whoa breathe just breathe
","['A', 'G', 'D', 'A', 'A', 'G', 'D', 'A', 'Bm', 'D', 'A', 'E', 'Bm', 'D', 'A', 'E', 'G', 'D', 'A', 'G', 'D', 'A', 'A', 'G', 'D', 'A', 'A', 'G', 'D', 'A', 'Bm', 'D', 'A', 'E', 'Bm', 'D', 'A', 'E', 'G', 'D', 'A', 'G', 'D', 'A', 'Bm', 'D', 'A', 'E', 'Bm', 'D', 'A', 'E', 'A', 'G', 'D', 'A', 'A', 'G', 'D', 'A', 'Bm', 'D', 'A', 'E', 'Bm', 'D', 'A', 'E', 'G', 'D', 'A', 'G', 'D', 'A', 'G', 'D', 'A', 'G', 'D', 'A']"
45,Second Chance (ver 2),Shinedown,https://tabs.ultimate-guitar.com/tab/shinedown/second-chance-chords-806129,"my eyes are open wide
by the way
i made it through the day
I watch the world outside
by the way
I’m leaving out today
I just saw halley's comet she waved                  
why are you always running in place
even the man in the moon disappeared
somewhere in this stratosphere
tell my mother tell my father
I have done the best I can
to make them realize
this is my life
I hope they understand
I am not angry I am just saying
sometimes good bye is a second chance
please don't cry one tear for me
I'm not afraid of what I have to say
this is my one and only voice
so listen close it's only for today
I just saw halley's comet she waved                  
why are you always running in place
even the man in the moon disappeared
somewhere in this stratosphere
tell my mother tell my father
I have done the best I can
to make them realize
this is my life
I hope they understand
I am not angry I am just saying
sometimes good bye is a second chance
","['Am', 'C', 'F', 'F', 'Am', 'C', 'F', 'F', 'G', 'Am', 'F', 'C', 'G/B', 'G', 'Am', 'D', 'D', 'Am', 'C', 'D', 'F', 'Am', 'C', 'D', 'F', 'Am', 'C', 'D', 'F', 'Am', 'C', 'F', 'F', 'Am', 'C', 'F', 'F', 'G', 'Am', 'F', 'C', 'G/B', 'G', 'Am', 'D', 'D', 'Am', 'C', 'D', 'F', 'Am', 'C', 'D', 'F', 'Am', 'C', 'D', 'F']"
46,Hanggang Kailan,Orange and Lemons,https://tabs.ultimate-guitar.com/tab/orange-and-lemons/hanggang-kailan-chords-190069,"Labis na naiinip
Nayayamot sa bawat saglit
Kapag naaalala ka
Wala naman akong
magawa
Umuwi ka na baby
Hindi na ako sanay ng wala ka
Mahirap ang mag-isa
At sa gabi'y hinahanap-hanap
kita.
Hanggang kailan ako maghihintay
Na makasama ka muli
Sa buhay kong puno ng paghihirap
Na tanging ikaw lang ang
Pumapawi sa mga luha
At naglalagay ng ngiti
sa mga labi
'Di mapigilang mag-isip
Na baka sa tagal
Mahulog ang loob mo sa iba
Nakakabalisa, knock on wood
'Wag naman sana
Umuwi ka na baby
Hindi na ako sanay ng wala ka
Mahirap ang mag-isa
At sa gabi'y hinahanap-hanap
kita.
Hanggang kailan ako maghihintay
Na makasama ka muli
Sa buhay kong puno ng paghihirap
Na tanging ikaw lang ang
Pumapawi sa mga luha
At naglalagay ng ngiti
sa mga labi
Umuwi ka na baby...
Umuwi ka na baby...
Umuwi ka na baby...
Umuwi ka na baby...
Umuwi ka na baby...
Umuwi ka na baby...
","['Cmaj7', 'Cm', 'G', 'Cmaj7', 'Cm', 'G', 'G7', 'Cmaj7', 'Cm', 'G', 'Em', 'Cmaj7', 'Cm', 'Cmaj7', 'G', 'Cmaj7', 'G', 'Cmaj7', 'G', 'Cm', 'G', 'G7', 'Cmaj7', 'Cm', 'G', 'G7', 'Cmaj7', 'Cm', 'G', 'Cmaj7', 'Cm', 'G', 'Em', 'Cmaj7', 'Cm', 'Cmaj7', 'G', 'Cmaj7', 'G', 'Cmaj7', 'G', 'Cm', 'G', 'G7', 'Cmaj7', 'G', 'Cmaj7', 'G', 'Cmaj7', 'G', 'Cmaj7', 'G']"
47,Burning Pile,Mother Mother,https://tabs.ultimate-guitar.com/tab/mother-mother/burning-pile-chords-1033378,"All my style
All my guts, try to spill
All my money been a long time spent
On my saving philosophy
It goes, one in the bank, and the rest for me
It goes, all my troubles on a burning pile
All lit up and I start to smile
If I, catch fire then I change my aim
Throw my troubles at the pearly gates
Oh oh oh oh
Oh oh-oh, oh oh-uh
ohhh-oh
   uh ohhh-oh
My mama, lonely maid
My papa, renaissance man
Sailed away and he never came back again
All my troubles on a burning pile
All lit up and I start to smile
If I, catch fire then I change my aim
Throw my troubles at the pearly gates
Oh oh oh oh
Oh oh oh oh
All you woebegones be gone
I said all you troubles, you don't mean a thing
All my troubles on a burning pile
All lit up and I start to smile
If I, catch fire then I change my aim
Throw my troubles at the world again
It goes, all my troubles on a burning pile
All lit up and I start to smile
If I, catch fire then I'll take my turn
To burn and burn, and burn and burn
Bah, bup bup bah
Bah, bup bup bah
bup-bah bah bah, bah bah
","['Bb', 'Gm', 'Bb', 'Gm', 'Gm', 'F', 'E', 'Bb', 'F', 'E', 'Bb', 'F', 'E', 'Bb', 'Bb', 'Gm', 'Gm', 'Bb', 'Gm', 'Bb', 'Am', 'Gm', 'F', 'Bb', 'Am', 'Gm', 'Gb', 'F', 'E', 'Bb', 'F', 'E', 'Bb', 'F', 'E', 'Gm', 'C', 'F', 'Eb', 'D', 'Gm', 'C', 'F', 'E', 'Bb', 'F', 'E', 'Bb', 'G', 'Gb', 'F', 'E', 'Bb', 'F', 'E', 'Bb', 'G', 'Gb', 'F', 'E', 'Bb', 'F', 'E', 'Bb']"
48,Your Body Is A Wonderland (ver 2),John Mayer,https://tabs.ultimate-guitar.com/tab/john-mayer/your-body-is-a-wonderland-chords-379339,"We got the afternoon
You got this room for two
One thing I've left to do
Discover me
Discovering you
One mile to every inch of
Your skin like porcelain
One pair of candy lips and
Your bubblegum tongue
And if you want love
We'll make it
Swimming a deep sea
Of blankets
Take all your big plans
And break 'em
This is bound to be a while
Your body Is a wonderland
Your body is a wonder
(I'll use my hands)
Your body Is a wonderland   
Something 'bout the way your hair falls in your face
I love the shape you take when crawling towards the pillowcase
You tell me where to go and,though I might leave to find it
I'll never let your head hit the bed without my hand behind it
And if you want love
We'll make it
Swimming a deep sea
Of blankets
Take all your big plans
And break 'em
This is bound to be a while
Your body Is a wonderland
Your body is a wonder
(I'll use my hands)
Your body Is a wonderland  
     Damn baby, you frustrate me
    I know you're mine all mine all mine
Your body Is a wonderland
Your body is a wonder
(I'll use my hands)
Your body is a wonderland  
","['D', 'Asus4', 'G', 'Asus4', 'D', 'Asus4', 'G', 'Asus4', 'D', 'Asus4', 'G', 'Asus4', 'D', 'Asus4', 'G', 'Asus4', 'D', 'Asus4', 'G', 'Asus4', 'D', 'Asus4', 'G', 'Asus4', 'D', 'Asus4', 'G', 'Asus4', 'D', 'Asus4', 'G', 'Asus4', 'G', 'Asus4', 'G', 'Asus4', 'G', 'Asus4', 'Em', 'F#m', 'G', 'Asus4', 'D', 'Asus4', 'G', 'Asus4', 'D', 'Asus4', 'G', 'Asus4', 'D', 'Asus4', 'G', 'Asus4', 'D', 'Asus4', 'Gadd9', 'Asus4', 'D', 'Asus4', 'Gadd9', 'Asus4', 'D', 'Asus4', 'Gadd9', 'Asus4', 'D', 'Asus4', 'Gadd9', 'Asus4', 'G', 'Asus4', 'G', 'Asus4', 'G', 'Asus4', 'Em', 'F#m', 'G', 'Asus', 'D', 'Asus4', 'G', 'Asus4', 'D', 'Asus4', 'G', 'Asus4', 'D', 'Asus4', 'G', 'Asus4', 'Bm9', 'Bm9', 'Bm9', 'Bm9', 'Asus4', 'D', 'Asus4', 'G', 'Asus4', 'D', 'Asus4', 'G', 'Asus4', 'D', 'Asus4', 'G', 'Asus4']"
49,Shadow Of The Day (ver 4),Linkin Park,https://tabs.ultimate-guitar.com/tab/linkin-park/shadow-of-the-day-chords-657567,"I close both locks below the window
I close both blinds and turn away
Sometimes so-lutions aren't so simple
Sometimes good bye's the only way
And the sun        will set for you   
The sun       will set for you  
And the shadow of the day
Will embrace the world in grey
And the sun        will set for you   
In cards and flowers on your window
Your friends all plead for you to stay
Sometimes be-ginnings aren't so simple
Sometimes good bye's the only way
And the sun        will set for you   
The sun       will set for you  
And the shadow of the day
Will embrace the world in grey
And the sun        will set for you   
And the shadow of the day
Will embrace the world in grey
And the sun        will set for you   
And the shadow of the day
Will embrace the world in grey
And the sun        will set for you   
","['Am', 'G', 'F', 'Am', 'G', 'F', 'Am', 'G', 'F', 'Am', 'G', 'F', 'C', 'Dm', 'Am', 'F', 'C', 'Dm', 'Am', 'F', 'C', 'G', 'Am', 'F', 'C', 'Dm', 'Am', 'F', 'Am', 'G', 'F', 'Am', 'G', 'F', 'Am', 'G', 'F', 'Am', 'G', 'F', 'C', 'Dm', 'Am', 'F', 'C', 'Dm', 'Am', 'F', 'C', 'G', 'Am', 'F', 'C', 'Dm', 'Am', 'F', 'C', 'G', 'Am', 'F', 'C', 'Dm', 'Am', 'F', 'C', 'G', 'Am', 'F', 'C', 'Dm', 'Am', 'F', 'C']"
