,name,author,link,lyrics,chords
30,Fat Bottomed Girls,Queen,https://tabs.ultimate-guitar.com/tab/queen/fat-bottomed-girls-chords-146240,"Ah, you gonna take me home tonight
Ah, down beside that red fire light
Ah, you gonna let it all hang out
Fat bottomed girls, you make the rockin' world go round
                           Hey!
I was just a skinny lad, never knew no good from bad
But I knew life before I left my nursery  (Huh!)
Left alone with big fat Fanny, she was such a naughty nanny
Heap big woman, you made a bad boy out of me
 Hey hey!
I've been singing with my band, across the water, across the land
I've seen every blue eyed floozy on the way  (hey)
But their beauty and their style, went kind of smooth after a while
Take me to them dirty ladies every time, come on!
Ah, won't you take me home tonight?
Ah, down beside your red fire light
Ah, and you give it all you got
Fat bottomed girls, you make the rockin' world go round
Fat bottomed girls, you make the rockin' world go round
                Hey, listen here
Now I got mortgages and homes, I got stiffness in my bones
Ain't no beauty queens in this locality (I tell you)
Oh, but I still get my pleasure
Still got my greatest treasure
Heap big woman, you done made a big man of me   - Now get this...
Oh (I know) you gonna take me home tonight (Please)
Oh, down beside that red fire light
Oh, you gonna let it all hang out
Fat bottomed girls, you make the rockin' world go round, yeah
Fat bottomed girls, you make the rockin' world go round
w/ad lib vocals
","['D', 'C', 'G', 'D', 'C', 'A', 'D', 'G', 'D', 'A', 'D', 'D', 'D', 'D', 'D', 'D', 'D', 'D', 'D', 'D', 'A', 'D', 'G', 'D', 'A', 'D', 'G', 'F', 'D', 'D', 'D', 'D', 'D', 'D', 'D', 'D', 'D', 'D', 'D', 'D', 'A', 'D', 'G', 'D', 'A', 'D', 'D', 'C', 'G/B', 'D', 'C', 'A', 'D', 'G', 'D', 'A', 'D', 'D', 'A', 'D', 'G', 'G', 'D', 'D', 'A', 'A', 'G', 'D', 'A', 'D', 'G', 'D', 'A', 'D', 'D', 'C', 'G/B', 'D', 'C', 'A', 'D', 'G', 'D', 'A', 'D', 'G', 'D', 'A', 'D', 'D']"
31,Bennie And The Jets,Elton John,https://tabs.ultimate-guitar.com/tab/elton-john/bennie-and-the-jets-chords-474727,"Hey kids, shake it loose together,
the spolight´s hitting something
that´s been known to change the weather
We´ll kill the fatted calf tonight
so stick around,
you´re gonna hear electric music, solid walls of sound
Say, Candy and Ronnie, have you seen them yet
but they´re so spaced out, Bennie and the jets,
but they´re weird and they´re wonderful,
oh, Bennie she´s really keen
she´s got electric boots a mohair suit,
you know I read it in a magazine,
oh!           Bennie and the jets
Hey kids, plug into the faithless,
maybe they´re blinded
but Bennie makes them ageless
We shall survive, let us take ourselves along,
where we fight our parents out in the streets
to find who´s right and who´s wrong
Say, Candy and Ronnie, have you seen them yet
but they´re so spaced out, Bennie and the jets,
but they´re weird and they´re wonderful,
oh, Bennie she´s really keen
she´s got electric boots a mohair suit,
you know I read it in a magazine,
oh!           Bennie and the jets
Bennie  Bennie  Bennie  Bennie Bennie and the jets
","['Am7', 'D7', 'G', 'G#dim7', 'Am7', 'D', 'Em', 'Am', 'Bm', 'C', 'G', 'Am', 'C', 'G', 'Am', 'C', 'D', 'Em', 'Em7', 'C', 'Bb', 'D', 'G', 'G6', 'Gmaj7', 'Fmaj7', 'Gmaj7', 'Fmaj7', 'Gmaj7', 'Fmaj7', 'Gmaj7', 'Fmaj7', 'Am', 'Am7', 'D7', 'G', 'G#dim7', 'Am7', 'D', 'Em', 'Am', 'Bm', 'C', 'G', 'Am', 'C', 'G', 'Am', 'C', 'D', 'Em', 'Em7', 'C', 'Bb', 'D', 'G', 'G6', 'Gmaj7', 'Fmaj7', 'Gmaj7', 'Fmaj7', 'Gmaj7', 'Fmaj7', 'Gmaj7', 'Fmaj7', 'Am', 'G', 'Fmaj7', 'Gmaj7', 'Fmaj7', 'Gmaj7', 'Fmaj7', 'Gmaj7', 'Fmaj7', 'Am']"
32,Just What I Needed (ver 2),The Cars,https://tabs.ultimate-guitar.com/tab/the-cars/just-what-i-needed-chords-1146418,"  I don’t mind you coming here
  Wasting all my time
  ‘Cause when you’re standing oh so near
  I kind of lose my mind
  It’s not the perfume that you wear
  It’s not the ribbons in your hair
  I don’t mind you coming here
  And wasting all my time
  I don’t mind you hanging out
  And talking in your sleep
  It doesn’t matter where you’ve been
  As long as it was deep, yeah
  You always knew to wear it well    and
  You look so fancy I can tell
  I don’t mind you hanging out
  And talking in your sleep
            I guess you’re just what I needed
            I needed someone to feed
            I guess you’re just what I needed
            I needed someone to bleed  
  I don’t mind you coming here
  And wasting all my time, time
  ‘Cause when you’re standing oh so near
  I kind of lose my mind, yeah
  It’s not the perfume that you wear
  It’s not the ribbons in your hair
  I don’t mind you coming here
  And wasting all my time
            I guess you’re just what I needed
            I needed someone to feed
            I guess you’re just what I needed
            I needed someone to bleed   
            I guess you’re just what I needed
            I needed someone to feed
            I guess you’re just what I needed
            I needed someone to bleed  
                      You’re just what I needed
                      You’re just what I needed 
                      You’re just what I needed 
        Yeah, yeah, yeah, yeah
","['E', 'B', 'C#m', 'G#', 'E', 'B', 'C#m', 'G#', 'E', 'B', 'C#m', 'G#', 'E', 'B', 'G#', 'A', 'E', 'B', 'C#m', 'G#', 'E', 'B', 'C#m', 'G#', 'E', 'B', 'C#m', 'G#', 'E', 'B', 'G#', 'A', 'E', 'B', 'A', 'C#m', 'B', 'E', 'B', 'A', 'C#m', 'E', 'B', 'A', 'C#m', 'B', 'E', 'B', 'A', 'C#m', 'E', 'B', 'C#m', 'G#', 'E', 'B', 'C#m', 'G#', 'E', 'B', 'C#m', 'G#', 'E', 'B', 'G#', 'A', 'E', 'B', 'A', 'C#m', 'B', 'E', 'B', 'A', 'C#m', 'E', 'B', 'A', 'C#m', 'B', 'E', 'B', 'A', 'C#m', 'E', 'B', 'A', 'C#m', 'B', 'E', 'B', 'A', 'C#m', 'E', 'B', 'A', 'C#m', 'B', 'E', 'B', 'A', 'C#m', 'E', 'B', 'C#m', 'A', 'E', 'B', 'C#m', 'A', 'E', 'B', 'C#m', 'A', 'E', 'B', 'C#m', 'G#']"
33,Ventura Highway (ver 3),America,https://tabs.ultimate-guitar.com/tab/america/ventura-highway-chords-833253,"[Intro Riff + Strumming]    x2
Chewin' on a piece of grass walkin' down the road 
   tell   me,   how   long   you   gonna     stay here Joe? 
Some  people  say  this  town  don't  look   good in snow 
Ventura Highway, in the  sunshine 
Where the days are longer  The nights are stronger than moonshine 
   You're gonna go         I know  ooo-oh  ooo-o-ooo-oh  ooo-oh ooo-o-ooo-oh 
Cause the free wind is blowin' through your hair
And the day surrounds your daylight there
 Season's crying, no despair
Alligator, lizards in the air, in the air
[Intro Riff + Strumming]    x2
Wishin' on a fallin' star   Waitin' for the  early train 
Sorry   boy,   but   I've  been   hit   by   purple rain 
Aw,  come on  Joe,    you   can   always     change your name 
Ventura Highway, in the  sunshine 
Where the days are longer  The nights are stronger than moonshine 
   You're gonna go         I know  ooo-oh  ooo-o-ooo-oh  ooo-oh ooo-o-ooo-oh 
Cause the free wind is blowin' through your hair
And the day surrounds your daylight there
 Season's crying, no despair
Alligator, lizards in the air, in the air
[Intro Riff + Strumming]    x2  then Cmaj7 (Hold)
","['Fmaj7', 'Cmaj7', 'Fmaj7', 'Cmaj7', 'Fmaj7', 'Cmaj7', 'Fmaj7', 'Cmaj7', 'Fmaj7', 'Cmaj7', 'Fmaj7', 'Cmaj7', 'Fmaj7', 'Cmaj7', 'Em', 'Dm7', 'Em', 'Dm7', 'Em', 'Dm7', 'Em', 'Dm7', 'Em', 'Fmaj7', 'Cmaj7', 'Fmaj7', 'Fmaj7', 'Cmaj7', 'Fmaj7', 'Cmaj7', 'Fmaj7', 'Cmaj7', 'Fmaj7', 'Cmaj7', 'Fmaj7', 'Cmaj7', 'Fmaj7', 'Cmaj7', 'Dm7', 'Em', 'Dm7', 'Em', 'Dm7', 'Em', 'Dm7', 'Em', 'Fmaj7', 'Cmaj7', 'Fmaj7']"
34,Daniel (ver 3),Elton John,https://tabs.ultimate-guitar.com/tab/elton-john/daniel-chords-1087235,"Daniel is traveling tonight on a plane 
I can see the red tail lights heading for Spain 
Oh and I can see Daniel waving goodbye 
God it looks like Daniel, must be the clouds in my eyes 
They say Spain is pretty though I've never been 
Well Daniel says it's the best place that he's ever seen 
Oh and he should know, he's been there enough 
Lord I miss Daniel, oh I miss him so much oh oh oh
Daniel my brother you are older than me 
Do you still feel the pain of the scars that won't heal? 
Your eyes have died but you see more than I 
Daniel you're a star in the face of the sky 
Daniel my brother you are older than me 
Do you still feel the pain of the scars that won't heal? 
Your eyes have died but you see more than I 
Daniel you're a star in the face of the sky 
Daniel is traveling tonight on a plane 
I can see the red tail lights heading for Spain 
Oh and I can see Daniel waving goodbye 
God it looks like Daniel, must be the clouds in my eyes 
God it looks like Daniel, must be the clouds in my eyes 
","['C', 'Dm', 'G', 'E7', 'Am', 'F', 'G', 'Am', 'F', 'G7', 'F', 'C', 'C', 'Dm', 'G', 'E7', 'Am', 'F', 'G', 'Am', 'F', 'G7', 'F', 'C', 'F', 'C', 'F', 'C', 'Am', 'F', 'Fm', 'C', 'A7', 'Dm', 'G7', 'F', 'C', 'F', 'C', 'Am', 'F', 'Fm', 'C', 'A7', 'Dm', 'G7', 'C', 'Dm', 'G', 'E7', 'Am', 'F', 'G', 'Am', 'F', 'G7', 'F', 'C', 'G7', 'F', 'G7', 'F', 'C']"
35,Smoke On The Water,Deep Purple,https://tabs.ultimate-guitar.com/tab/deep-purple/smoke-on-the-water-chords-1007111,"We all came out to Montreux
On the Lake Geneva shoreline
To make records with a mobile
We didn't have much time
Frank Zappa and the Mothers
Were at the best place around
But some stupid with a flare gun
Burned the place to the ground
Smoke on the water,     fire in the sky
Smoke on the water...
They burned down the gambling house
It died with an awful sound
Funky Claude was running in and out
Pulling kids out the ground
When it all was over
We had to find another place
But Swiss time was running out
It seemed that we would lose the race
Smoke on the water,     fire in the sky
Smoke on the water...
We ended up at the Grand Hotel
It was empty cold and bare
But with the Rolling truck Stones thing just outside
Making our music there
With a few red lights and a few old beds
We make a place to sweat
No matter what we get out of this
I know, I know we'll never forget
Smoke on the water,     fire in the sky
Smoke on the water...
","['G5', 'G5', 'G5', 'F5', 'G5', 'G5', 'G5', 'G5', 'F5', 'G5', 'G5', 'G5', 'G5', 'F5', 'G5', 'G5', 'G5', 'G', 'F', 'G', 'C5', 'G#5', 'G5', 'G5', 'C5', 'G#5', 'G5', 'G5', 'G5', 'F5', 'G5', 'G5', 'G5', 'G5', 'F5', 'G5', 'G5', 'G5', 'F5', 'G5', 'G5', 'G5', 'G5', 'F5', 'G5', 'C5', 'G#5', 'G5', 'G5', 'C5', 'G#5', 'G5', 'G', 'G5', 'F5', 'G5', 'G5', 'G5', 'G5', 'F5', 'G5', 'G5', 'G5', 'G5', 'F5', 'G5', 'G5', 'G5', 'G5', 'F5', 'G5', 'C5', 'G#5', 'G5', 'G5', 'C5', 'G#5']"
36,Sweet Baby James,James Taylor,https://tabs.ultimate-guitar.com/tab/james-taylor/sweet-baby-james-chords-644843,"There is a young cowboy, he lives on the range
His horse and his cattle are his only companions
He works in the saddle and he sleeps in the canyons
Waiting for summer, his pastures to change
And as the moon rises he sits by his fire
Thinkin' about women and glasses of beer
Closing his eyes as the dogies retire
He sings out a song which is soft but it's clear
As if maybe someone could hear
Goodnight you moonlight ladies
Rock-a-bye sweet baby James
Deep greens and blues are the colors I choose
Won't you let me go down in my dreams
And rock-a-bye sweet baby James
Now the first of December was covered with snow
And so was the turnpike from Stockbridge to Boston
Lord, the Berkshires seemed dreamlike on account of that frosting
With ten miles behind me and ten thousand more to go
There's a song that they sing when they take to the highway
A song that they sing when they take to the sea
A song that they sing of their home in the sky
Maybe you can believe it if it helps you to sleep
But singing works just fine for me
Goodnight you moonlight ladies
Rock-a-bye sweet baby James
Deep greens and blues are the colors I choose
Won't you let me go down in my dreams
And rock-a-bye sweet baby James
","['D', 'A', 'G', 'F#m', 'Bm', 'G', 'D', 'F#m', 'Bm', 'G', 'D', 'F#m', 'G', 'D', 'A', 'Em', 'A', 'G', 'A', 'D', 'Bm', 'G', 'D', 'A', 'G', 'A', 'D', 'Bm', 'G', 'D', 'E', 'Bm7', 'E', 'A', 'D', 'G', 'A', 'D', 'Bm', 'G', 'D', 'Bm', 'G', 'D', 'D', 'Bm7', 'E', 'A', 'A', 'G', 'A', 'D', 'D', 'A', 'G', 'F#m', 'Bm', 'G', 'D', 'F#m', 'Bm', 'G', 'D', 'F#m', 'G', 'D', 'A', 'Em', 'A', 'G', 'A', 'D', 'Bm', 'G', 'D', 'A', 'G', 'A', 'D', 'Bm', 'G', 'D', 'E', 'A', 'E', 'A', 'A', 'D', 'G', 'A', 'D', 'Bm', 'G', 'D', 'Bm', 'G', 'D', 'D', 'Bm7', 'E', 'A', 'A', 'G', 'A', 'D']"
37,Maggie May (ver 5),Rod Stewart,https://tabs.ultimate-guitar.com/tab/rod-stewart/maggie-may-chords-1049572,"Wake up, Maggie, I think I got some-thing to say to you:
It's late September and I really should be back at school.
I know I keep you amused, but I feel I'm being used.
Oh, Maggie, I couldn't have tried any more.
You lured me away from home, just to save you from being alone.
You stole my heart and that's what really hurts.
The morning sun, when it's in your face really shows your age.
But that don't worry me none; in my eyes you're everything.
I laughed at all of your jokes, my love you didn't need to coax,
Oh, Maggie I couldn't have tried any more.
You lured me away from home, just to save you from being alone.
You stole my soul that's a pain I can do without.
All I need was a friend to lend a guiding hand.  
But you turned into a lover and Mother what a lover your wore me out.
All you did was wreck my bed, and in the morning kick me in the head,
Oh, Maggie I couldn't have tried any more.
You lured me away from home, just to save you from being alone.
You stole my heart I couldn't leave you if I tried.
I suppose I could collect my books and get back to school.
Or steal my daddy's cue and make a living out of playing pool.
Or find myself a rock and roll band that needs a helping hand,
Oh, Maggie, I wish I'd never seen your face.
You made a first class fool out of me, 
but I'm as blind as a fool can be.
You stole my heart, but I love you anyway.
","['A', 'G', 'D', 'A', 'G', 'D', 'G', 'D', 'G', 'A', 'Em', 'F#m', 'Em', 'Em', 'A', 'Em', 'A', 'Em', 'A', 'G', 'D', 'A', 'G', 'D', 'A', 'G', 'D', 'G', 'D', 'G', 'A', 'Em', 'F#m', 'Em', 'Em', 'A', 'Em', 'A', 'Em', 'A', 'G', 'D', 'A', 'G', 'D', 'A', 'G', 'D', 'G', 'D', 'G', 'A', 'Em', 'F#m', 'Em', 'Em', 'A', 'Em', 'A', 'Em', 'A', 'G', 'D', 'A', 'G', 'D', 'A', 'G', 'D', 'G', 'D', 'G', 'A', 'Em', 'F#m', 'Em', 'Em', 'A', 'Em', 'A', 'Em', 'A', 'G', 'D']"
38,Kodachrome (ver 4),Paul Simon,https://tabs.ultimate-guitar.com/tab/paul-simon/kodachrome-chords-1099242,"When I think back 
on all the crap I learned in high school 
It's a wonder 
I can think at all 
And though my lack of education 
hasn't hurt me none
I can read the writing on the wall 
Kodachrome 
You give us those nice bright colors 
You give us the greens of summers 
Makes you think all the world's a sunny day, oh yeah! 
I got a Nikon camera 
I love to take a photograph 
So Mama, don't take my Kodachrome away 
If you took all the girls I knew
when I was single 
And brought them all together for one night 
I know they'd never match 
my sweet imagination 
And everything looks worse in black and white 
Kodachrome 
You give us those nice bright colors 
You give us the greens of summers 
Makes you think all the world's a sunny day, oh yeah! 
I got a Nikon camera 
I love to take a photograph 
So Mama, don't take my Kodachrome away 
Mama, don't take my Kodachrome away 
Mama, don't take my Kodachrome away
Mama, don't take my Kodachrome away
Mama, don't take my Kodachrome 
Mama, don't take my Kodachrome 
Mama, don't take my Kodachrome (away) 
Mama, don't take my Kodachrome 
(Leave your boy so far from home) 
Mama, don't take my Kodachrome (away)
Mama, don't take my Kodachrome whewwwwww
Mama, don't take my Kodachrome (away)
","['D', 'D7', 'G', 'Em', 'A7', 'D', 'Em', 'A7', 'D', 'D7', 'G', 'Em', 'A', 'D', 'D7', 'G', 'B7', 'E', 'E7', 'Am', 'D', 'G', 'C', 'A', 'D', 'G', 'B7', 'E', 'E7', 'Am', 'D', 'G', 'C', 'A', 'D', 'G', 'G', 'Bm', 'Em', 'A', 'A7', 'D', 'D7', 'G', 'Em', 'A7', 'D', 'Em', 'A7', 'D', 'D7', 'G', 'Em', 'A', 'A7', 'D', 'D7', 'G', 'B7', 'E', 'E7', 'Am', 'D', 'G', 'C', 'A', 'D', 'G', 'B7', 'E', 'E7', 'Am', 'D', 'G', 'C', 'A', 'D', 'G', 'G', 'Bm', 'Em', 'G', 'Bm', 'Em', 'G', 'Bm', 'Em', 'G', 'Bm', 'Em', 'G', 'Bm', 'Em', 'G', 'Bm', 'Em', 'G', 'Bm', 'Em']"
39,A Pirate Looks At Forty (ver 2),Jimmy Buffett,https://tabs.ultimate-guitar.com/tab/jimmy-buffett/a-pirate-looks-at-forty-chords-966513,"   Mother, mother ocean, I have heard you call
Wanted to sail upon your waters since I was three feet tall
You've seen it all,        you've seen it all
   Watch the men who rode you, switch from sails to steam
And in your belly you hold the treasure that few have ever seen
Most of them dreams,       most of them dreams
Yes I am a pirate, two hundred years too late
The cannons don't thunder there's nothin' to plunder, I'm an over forty victim of fate
Arriving too late,       arriving too late
I've done a bit of smugglin' and I've run my share of grass
I made enough money to buy Miami but I pissed it away so fast
Never meant to last,       never meant to last
I have been drunk now for over two weeks
I passed out and I rallied and I sprung a few leaks
But I've got to stop wishin', got to go fishin' I'm down to rock bottom again
With just a few friends,       just a few friends
I go for younger women, lived with several awhile
And though I ran away, they'll come back one day, I still could manage a smile
It just takes awhile,       just takes awhile
   Mother, mother ocean, after all these years I've found
My occupational hazard being, my occupation’s just not around
I feel like I've drowned,     gonna head uptown
I feel like I've drowned
","['G', 'C', 'G', 'Am7', 'Bm7', 'Am7', 'G', 'G', 'C', 'G', 'Am7', 'Bm7', 'Am7', 'G', 'G', 'C', 'G', 'Am7', 'Bm7', 'Am7', 'G', 'G', 'C', 'G', 'Am7', 'Bm7', 'Am7', 'G', 'G', 'G', 'C', 'G', 'Am7', 'Bm7', 'Am7', 'G', 'G', 'C', 'G', 'Am7', 'Bm7', 'Am7', 'G', 'G', 'C', 'G', 'Am7', 'Bm7', 'Am7', 'G', 'Am7', 'Bm7', 'Am7', 'G']"
40,Our House (ver 4),"Crosby, Stills, Nash & Young",https://tabs.ultimate-guitar.com/tab/crosby-stills-nash-young/our-house-chords-1051275,"I'll light the fire
You place the flowers in the vase
That you bought today
Staring at the fire
For hours and hours
While I listen to you play your love songs
All night long for me
Only for me
Come to me now
And rest your head for just five minutes
Everything is done
Such a cozy room
The windows are illuminated
By the evening sunshine through them
Fiery gems for you
Only for you
Our house, is a very, very, very fine house
With two cats in the yard
Life used to be so hard
Now everything is easy 'cause of you    and I
La la la...
La la la...
Our house, is a very, very, very fine house
With two cats in the yard
Life used to be so hard
Now everything is easy 'cause of you
I'll light the fire
While you place the flowers in the vase
That you bought today
","['A', 'Amaj7', 'F#m', 'A', 'D', 'A', 'D', 'D', 'E', 'A', 'Amaj7', 'F#m', 'A', 'D', 'A', 'D', 'E', 'D', 'E', 'A', 'Amaj7', 'F#m', 'A', 'D', 'F', 'A', 'Amaj7', 'F#m', 'A', 'D', 'A', 'D', 'E', 'A', 'Amaj7', 'F#m', 'A', 'D', 'A', 'D', 'E', 'D', 'E', 'A', 'Amaj7', 'F#m', 'A', 'D', 'F', 'A', 'Amaj7', 'F#m', 'A', 'D', 'A', 'D', 'A', 'D', 'A', 'D', 'Bm', 'D', 'A', 'Amaj7', 'F#m', 'A', 'D', 'A', 'D', 'E', 'E7', 'A', 'Amaj7', 'F#m', 'A', 'D', 'F', 'A', 'Amaj7', 'F#m', 'A', 'D', 'A', 'D', 'A', 'D', 'A', 'D', 'Bm', 'D', 'A', 'Amaj7', 'F#m', 'A', 'D', 'F', 'A']"
41,Shelter From The Storm (ver 2),Bob Dylan,https://tabs.ultimate-guitar.com/tab/bob-dylan/shelter-from-the-storm-chords-697872,"'Twas in another lifetime   One of toil and blood
When blackness was a virtue   The road was full of mud
I came in from the wilderness   A creature void of form
Come in she said I'll give ya   Shelter from the storm
And if I pass this way again   You can rest assured
I'll always do my best for her   On that I give my word
In a world of steel-eyed death and men  Who are fighting to be warm
Come in she said I'll give ya   Shelter from the storm
Not a word was spoke between us   There was little risk involved
Everything up to that point   Had been left unresolved
Try imagining a place    Where it's always safe and warm
Come in she said I'll give ya   Shelter from the storm
I was burned out from exhaustion  Buried in the hail
Poisoned in the bushes   And blown out on the trail
Hunted like a crocodile    Ravaged in the corn
Come in she said I'll give ya   Shelter from the storm
Suddenly I turned around   And she was standing there
With silver bracelets on her wrists  And flowers in her hair
She walked up to me so gracefully  And took my crown of thorns
Come in she said I'll give ya   Shelter from the storm
Now there's a wall between us  somethin' there's been lost
I took too much for granted got my signals crossed
Just to think that it all began on a long forgotten morn
Come in she said  I'll give you shelter from the storm
Well the deputy walks on hard nails and the preacher rides a mount
But nothing really matters much it's doom alone that counts
And the one-eyed undertaker he blows a futile horn
Come in she said  I'll give you shelter from the storm
I've heard newborn babies wailin' like a mournin' dove
And old men with broken teeth stranded without love
Do I understand your question then is it hopeless and forlorn
Come in she said  I'll give you shelter from the storm
In a little hilltop village, they gambled for my clothes
I bargained for salvation and they gave me a lethal dose
I offered up my innocence and got repaid with scorn
Come in she said  I'll give you shelter from the storm
Well I'm livin' in a foreign country but I'm bound to cross the line
Beauty walks a razor's edge someday I'll make it mine
If I could only turn back the clock to when God and her were born
Come in she said  I'll give you shelter from the storm
","['E', 'B', 'A', 'E', 'B', 'A', 'E', 'B', 'A', 'E', 'B', 'A', 'E', 'E', 'B', 'A', 'E', 'B', 'A', 'E', 'B', 'A', 'E', 'B', 'A', 'E', 'E', 'B', 'A', 'E', 'B', 'A', 'E', 'B', 'A', 'E', 'B', 'A', 'E', 'E', 'B', 'A', 'E', 'B', 'A', 'E', 'B', 'A', 'E', 'B', 'A', 'E', 'E', 'B', 'A', 'E', 'B', 'A', 'E', 'B', 'A', 'E', 'B', 'A', 'E', 'E', 'B', 'A', 'E', 'B', 'A', 'E', 'B', 'A', 'E', 'B', 'A', 'E', 'E', 'B', 'A', 'E', 'B', 'A', 'E', 'B', 'A', 'E', 'B', 'A', 'E', 'E', 'B', 'A', 'E', 'B', 'A', 'E', 'B', 'A', 'E', 'B', 'A', 'E', 'E', 'B', 'A', 'E', 'B', 'A', 'E', 'B', 'A', 'E', 'B', 'A', 'E', 'E', 'B', 'A', 'E', 'B', 'A', 'E', 'B', 'A', 'E', 'B', 'A', 'E']"
42,Youre So Vain (ver 3),Carly Simon,https://tabs.ultimate-guitar.com/tab/carly-simon/youre-so-vain-chords-845483,"You walked into the party;
like you were walking on to a yacht
Your hat, strategically dipped below one eye;
your scarf it was apricot
You had one eye in the mirror as   you watched yourself gavotte
And all the girls dreamed that they’d be your partner, they'd be your partner and
You're so vain,
you prob'ly think this song is about you
You're so vain,
I’ll bet you think this song is about you, don't you, don't you
You had me several years ago;
when I was still quite naive
Well, you said that we make such a pretty pair 
and that you would never leave
But you gave away the things you loved and one of them was me
I had some dreams; they were clouds in my coffee, clouds in my coffee and
You're so vain,
you prob'ly think this song is about you
You're so vain,
I’ll bet you think this song is about you, don't you, don't you, don't you
I had some dreams; they were clouds in my coffee, clouds in my coffee and
You're so vain,
you prob'ly think this song is about you
You're so vain,
I’ll bet you think this song is about you, don't you, don't you
Well, I hear you went up to Saratoga and your horse naturally won
Then you flew your Lear jet up to Nova Scotia
To see the total eclipse of the sun
Well you're where you should be all the time
and when you're not you're with
Some under world spy, or the wife of a close friend, wife of a close friend and
You're so vain,
you prob'ly think this song is about you
You're so vain,
I’ll bet you think this song is about you, don't you, don't you, don't you now
You're so vain, you prob'ly think this song is about you
You're so vain, you prob'ly think this song is about you....
","['Am', 'F', 'Am', 'Am', 'F', 'Am', 'F', 'G', 'Em', 'Am', 'F', 'C', 'G', 'F', 'C', 'Dm', 'C', 'C', 'Am', 'F', 'G', 'Am', 'F', 'Am', 'Am', 'F', 'Am', 'F', 'G', 'Em', 'Am', 'F', 'C', 'G', 'F', 'C', 'Dm', 'C', 'C', 'Am', 'F', 'G', 'G', 'F', 'C', 'Dm', 'C', 'C', 'Am', 'F', 'G', 'Am', 'F', 'Am', 'Am', 'F', 'Am', 'F', 'G', 'Em', 'Am', 'F', 'C', 'G', 'F', 'C', 'Dm', 'C', 'C', 'Am', 'F', 'G', 'C', 'Dm', 'C', 'C', 'Dm', 'C']"
