,name,author,link,lyrics,chords
17,Rocket Man (ver 4),Elton John,https://tabs.ultimate-guitar.com/tab/elton-john/rocket-man-chords-733830," She packed my bags last night pre-flight
 Zero hour, nine A.M.
 And I'm gonna be hi-i-igh ... as a kite by then
 I miss the earth so much, I miss my wife
   It's lonely out in space
 On such a ti-i-imeless flight
 And I think it's gonna be a long long time
 Til touchdown brings me 'round again to find
 I'm not the man they think I am at home
 Oh no, no, no, I'm a rocket man
Rocket man, burnin' out his fuse up here alone
 And I think it's gonna be a long long time
 Til touchdown brings me 'round again to find
 I'm not the man they think I am at home
 Oh no, no, no, I'm a rocket man
Rocket man, burnin' out his fuse up here alone
 Mars ain't the kinda place to raise your kids
  In fact it's cold as hell
 And there's no one there to-o-o raise them ... if you did
 And all this science, I don't understand
 It's just my job five days a week
A rocket ma-a-a-an,    rocket man
 And I think it's gonna be a long long time
 Til touchdown brings me 'round again to find
 I'm not the man they think I am at home
 Oh no, no, no, I'm a rocket man
Rocket man, burnin' out his fuse up here alone
 And I think it's gonna be a long long time
 Til touchdown brings me 'round again to find
 I'm not the man they think I am at home
 Oh no, no, no, I'm a rocket man
Rocket man, burnin' out his fuse up here alone
   And I think it's gonna be a long long time
   And I think it's gonna be a long long time
","['Em7', 'A', 'A', 'Asus4', 'Em7', 'A', 'A', 'G/B', 'C', 'G/B', 'Am', 'C/G', 'D/F#', 'Dsus2', 'D', 'Em7', 'A', 'Asus4', 'Em7', 'Asus4', 'G/B', 'C', 'G/B', 'Am', 'C/G', 'D/F#', 'D/A', 'D', 'C/D', 'G', 'C', 'C', 'G', 'G', 'C', 'C', 'G/B', 'A', 'Asus4', 'A', 'C', 'G', 'Gsus4', 'G', 'C', 'G', 'C', 'C', 'G', 'G', 'C', 'C', 'G/B', 'A', 'Asus4', 'C', 'G', 'Gsus4', 'G', 'C', 'Cadd9', 'Em7', 'A', 'Asus2', 'Em7', 'A', 'A', 'G/B', 'C', 'G/B', 'Am', 'C/G', 'D/F#', 'D/A', 'D', 'Em7', 'A', 'Em7', 'A', 'A7sus4', 'C', 'G/B', 'Am', 'C/G', 'D/F#', 'D/A', 'D', 'C/D', 'G', 'C', 'C', 'G', 'G', 'C', 'C', 'G/B', 'A', 'Asus4', 'A', 'C', 'G', 'Gsus4', 'G', 'C', 'G', 'C', 'C', 'G', 'G', 'C', 'C', 'G/B', 'A', 'Asus4', 'C', 'G', 'Gsus4', 'G', 'C', 'G', 'C', 'G']"
18,Dreams (ver 3),Fleetwood Mac,https://tabs.ultimate-guitar.com/tab/fleetwood-mac/dreams-chords-827737,"Now here you go again you say you want your freedom
well who am I to keep you down
It's only right that you should play the way you feel it
But listen carefully to the sound of your loneliness 
Like a heartbeat drives you mad
In the stillness of remembering
what you had
and what you lost
what you had
and what you lost
Thunder only happens when it's raining
Players only love you when they're playing
women they will come and they will go
when the rain washes you clean you'll know
Now here i go again i see the crystal vision
i keep my visions to myself
it's only me who wants to wrap around your dreams
and have you any dreams you'd like to sell dreams of loneliness
Like a heartbeat drives you mad
In the stillness of remembering
what you had
and what you lost
what you had
and what you lost
Thunder only happens when it's raining
Players only love you when they're playing
women they will come and they will go
when the rain washes you clean you'll know
","['Am', 'G', 'F', 'Am', 'G', 'F', 'Am', 'G', 'F', 'G', 'Am', 'G', 'F', 'G', 'F', 'G', 'F', 'G', 'F', 'G', 'F', 'G', 'F', 'G', 'F', 'G', 'Am', 'G', 'F', 'Am', 'G', 'F', 'Am', 'G', 'F', 'Am', 'G', 'F', 'Am', 'G', 'F', 'Am', 'G', 'F', 'Am', 'G', 'F', 'G', 'Am', 'G', 'F', 'G', 'F', 'G', 'F', 'G', 'F', 'G', 'F', 'G', 'F', 'G', 'F', 'G', 'Am', 'G', 'F', 'Am', 'G', 'F', 'Am', 'G', 'F', 'Am', 'G', 'F']"
19,Rhiannon,Fleetwood Mac,https://tabs.ultimate-guitar.com/tab/fleetwood-mac/rhiannon-chords-42801,"Rhiannon rings like a bell through the night.
And wouldn't you love to love her
Takes to the sky like a bird in flight
And who will be her lover
All your life you've never seen a woman taken by the wind
Would you stay if she promised you heaven
Will you ever win
She is like a cat in the dark
And then she is the darkness
She rules her life like a fine skylark
And when the sky is starless
All your life you've never seen a woman taken by the wind
Would you stay if she promised you heaven
Will you ever win
Will you ever win
Rhi - an          non
Rhi - an          non
Taken by, Taken by the sky   - - - - - - 
Taken by, Taken by the sky   - - - - - -    - - - - - - 
Dreams unwind, loves a state of mind
","['Am', 'F', 'Am', 'F', 'C', 'F', 'C', 'F', 'Am', 'F', 'Am', 'F', 'C', 'F', 'C', 'F', 'F', 'Am', 'F', 'Am', 'F', 'Am', 'F', 'Am', 'F', 'Am', 'F', 'Am', 'F']"
20,Rich Girl (ver 2),Hall & Oates,https://tabs.ultimate-guitar.com/tab/hall-oates/rich-girl-chords-1234917,"You're a rich girl and you've gone too far
'Cause you know it don't matter anyway
You can rely on the old man's money
You can rely on the old man's money
It's a bitch girl but it's gone too far
'Cause you know it don't matter anyway
  Say money but it won't get you too far,
Get you too far  | just keep picking the 3rd fret on the D string for 2 measures here |
And don't you  know,   don't you know           | I showed you up top.  If that way is too hard,
That it's wrong to take what he's givin' you    | get away with playing a Dm7 there instead but H&O 
So   far  gone,    on your own
You can get along if you try to be strong
But you'll never be strong
You're a rich girl and you've gone too far
'Cause you know it don't matter anyway
You can rely on the old man's money
You can rely on the old man's money
It's a bitch girl but it's gone too far
'Cause you know it don't matter anyway
  Say money but it won't get you too far,
Get you too far
High  and  dry,    out of the rain
It's so easy to hurt others when you can't feel pain
And don't you  know    that a love can't grow
'Cause there's too much to give, 'cause you'd rather live
For the thrill of it all        oh
You're a rich girl and you've gone too far
'Cause you know it don't matter anyway
You can rely on the old man's money
You can rely on the old man's money
It's a bitch girl but it's gone too far
'Cause you know it don't matter anyway
  Say money but it won't get you too far,
  Say money but it won't get you too far,
  Say money but it won't get you too far,
And you say you can rely on the old man's money
You can rely on the old man's money
You're a rich girl   a rich girl
ahh      you're a rich rich girl
  Say money but it won't get you too far,
  Say money but it won't get you too far,
  Say money but it won't get you too far,
Get you too far
","['F', 'Am7', 'Dm7', 'F/C', 'Bb', 'F/A', 'Gm7', 'Bb/C', 'F', 'Am7', 'Dm7', 'F/C', 'Bb', 'F/A', 'Gm7', 'Gm7', 'Am7', 'Bbmaj7', 'Gm7', 'F/C', 'Gm7', 'Am7', 'Dm7', 'Gm7', 'Am7', 'Bbmaj7', 'Gm7', 'Gm7', 'Dm7', 'Gm7', 'Bb/C', 'F', 'Am7', 'Dm7', 'F/C', 'Bb', 'F/A', 'Gm7', 'Bb/C', 'F', 'Am7', 'Dm7', 'F/C', 'Bb', 'F/A', 'Gm7', 'Gm7', 'Am7', 'Bbmaj7', 'Gm7', 'F/C', 'Gm7', 'Am7', 'Dm7', 'Gm7', 'Am7', 'Bbmaj7', 'Gm7', 'Gm7', 'Dm7', 'Gm7', 'Bb/C', 'F', 'Am7', 'Dm7', 'F/C', 'Bb', 'F/A', 'Gm7', 'Bb/C', 'F', 'Am7', 'Dm7', 'F/C', 'Bb', 'F/A', 'Bb', 'Dm7', 'F/C', 'Bb', 'F/A', 'Bb', 'F/A', 'Gm7', 'Bb/C', 'F', 'Am7', 'Dm7', 'F/C', 'Bb', 'F/A', 'Bb', 'Dm7', 'F/C', 'Bb', 'F/A', 'Gm7', 'F']"
21,Listen To The Music (ver 4),The Doobie Brothers,https://tabs.ultimate-guitar.com/tab/the-doobie-brothers/listen-to-the-music-chords-268316," /  /  /  /  /  /  /  /  /  /  /  /  /  /  /  /
 /  /  /  /  /  /  /  /  /  /  /  /  /  /  /  /
Don’t you feel it growin’, day by day
People gettin’ ready for the news
Some are happy, some are sad
Oh, we got to let the music
  /  /  /  /  /  /  /  /
What the people need
Is a way to make ’em smile
It ain’t so hard to do if you know how
Gotta get a message
Get it on through
Oh now mama, don’t you ask me why
Whoa oh whoaaa listen to the music
Whoa oh whoaaa listen to the music
Whoa oh whoaaa listen to the music
All the tiiii- i-i- iiime
 /  /  /  /  /  /  /  /  /  /  /  /  /  /  /  /  
Well I know, you know better
Everything I say
Meet me in the country for a day
We’ll be happy
And we’ll da-a-ance
Oh, we’re gonna dance our blues
  /  /  /  /  /  /  /  /
And if I’m feelin’ good to you
And you’re feelin’ good to me
There ain’t nothin’ we can’t do or say
Feelin’ good, feeling fine
Oh, baby, let the music play
Whoa oh whoaaa listen to the music
Whoa oh whoaaa listen to the music
Whoa oh whoaaa listen to the music
All the tiiii- i-i- iiime
  Like a lazy flowing river
    Surrounding castles in the sky
  And the crowd is growing bigger
List’nin’ for the happy sounds
And I got to let them fly
Whoa oh whoaaa listen to the music
Whoa oh whoaaa listen to the music
Whoa oh whoaaa listen to the music
All the tiiii- i-i- iiime
Whoa oh whoaaa listen to the music
Whoa oh whoaaa listen to the music
Whoa oh whoaaa listen to the music
All the tiiii- i-i- iiime
Whoa oh whoaaa listen to the music
Whoa oh whoaaa listen to the music
Whoa oh whoaaa listen to the music
All the tiiii- i-i- iiime
","['E', 'A', 'E', 'A', 'E', 'A', 'E', 'A', 'E', 'A', 'E', 'C#m', 'B', 'A', 'A', 'E', 'A', 'E', 'A', 'E', 'C#m', 'B', 'A', 'E', 'C#m7', 'A', 'C#m7', 'A', 'C#m7', 'A', 'F#7', 'A', 'E', 'A', 'E', 'A', 'E', 'A', 'E', 'C#m', 'B', 'A', 'A', 'E', 'A', 'E', 'A', 'E', 'C#m', 'B', 'A', 'A', 'E', 'C#m7', 'A', 'C#m7', 'A', 'C#m7', 'A', 'F#7', 'A', 'E', 'D/E', 'A/E', 'E', 'E', 'D/E', 'A', 'A', 'C#m7', 'A', 'C#m7', 'A', 'C#m7', 'A', 'F#7', 'A', 'C#m7', 'A', 'C#m7', 'A', 'C#m7', 'A', 'F#7', 'A', 'C#m7', 'A', 'C#m7', 'A', 'C#m7', 'A', 'F#7', 'A']"
22,Youve Got A Friend,Carole King,https://tabs.ultimate-guitar.com/tab/carole-king/youve-got-a-friend-chords-463673,"When you're down and troubled and you need some love and care
And nothing, nothing is going right.
Close your eyes and think of me and soon I will be there
To brighten up even your darkest nights
You just call out my name and you know wherever I am,
I'll come running to see you again
Winter spring summer or fall, all you have to do is call
And I'll be there    
You've got a friend
If the sky above you, grows dark and full of clouds,
And that ol' north wind, begins to blow.
Keep your head together and call my name out loud,
soon, you'll hear me knocking at your door.
You just call out my name and you know wherever I am,
I'll come running, running, yeah yeah, to see you again
Winter spring summer or fall, all you have to do is call
and I'll be there, yes, I will.
Now ain't it good to know that you've got a friend
When people can be so cold.
They'll hurt you, yes and desert you, and take your soul if you let them.
Oh, but don't you let them.
You just call out my name and you know wherever I am,
I'll come running, running, yeah yeah, to see you again
Winter spring summer or fall, all you have to do is call
and I'll be there, yes, I will.
You've got a friend,   you've got a friend.
Ain't it good to know, you've got a friend.
Ain't it good to know, ain't it good to know
Ain't it good to know, you've got a friend
Oh yeah now, oh you've got a friend, yeah, baby.
You've got a friend, oh, yeah.
Now you've got a friend.
","['Em', 'B7', 'Em', 'B7', 'Em', 'Am7', 'D7sus4', 'G', 'G', 'F#m', 'B7', 'Em', 'B7', 'Em', 'Am7', 'Bm7', 'D7sus4', 'G', 'Gmaj7', 'C', 'Am', 'G', 'D7sus4', 'G', 'Gmaj7', 'C', 'Em', 'G/D', 'C', 'Bm7', 'Am7', 'D7sus4', 'G', 'C', 'G', 'F#m', 'B7', 'Em', 'B7', 'Em', 'B7', 'Em', 'Am', 'D7sus4', 'G', 'G', 'F#m', 'B7', 'Em', 'B7', 'Em', 'Am7', 'Bm7', 'D7sus4', 'D7', 'D7sus2', 'D7', 'G', 'Gmaj7', 'C', 'G', 'D7sus4', 'G', 'Gmaj7', 'C', 'Em', 'G/D', 'C', 'Bm7', 'Am7', 'D7sus4', 'F', 'C', 'G', 'Gmaj7', 'C', 'F7', 'Em', 'A7', 'D7sus4', 'D7', 'G', 'Gmaj7', 'C', 'G', 'D7sus4', 'G', 'Gmaj7', 'C', 'Em', 'G/D', 'C', 'Bm7', 'Am7', 'D7sus4', 'G', 'C', 'G', 'C/G', 'G', 'C/G', 'G', 'C/G', 'G', 'C', 'G', 'C', 'G', 'C', 'G']"
23,Best Of My Love,Eagles,https://tabs.ultimate-guitar.com/tab/eagles/best-of-my-love-chords-14281,"Every night, I'm lying in bed, holding you close in my dreams
Thinking about all the things that we said, and coming apart at the seams
We try to talk it over, but the words come out too rough
I know you were trying to give me the best of your love
Beautiful faces, and loud empty places, look at the way that we live
Wasting our time on cheap talk and wine, left us so little to give
That same old crowd was like a cold dark cloud that we could never rise above
But here in my heart, I give you the best of my love
Oh-oh-oh ohhhh, sweet darlin', you get the best of my love
Oh-oh-oh ohhhh, sweet darlin', you get the best of my love
I'm going back in time and it's a sweet dream
It was a quiet night and I would be all right if I could go on sleeping
But every morning I wake up and worry, what's gonna happen today?
You see it your way, and I see it mine, but we both see it slipping away
You know we always had each other baby, I guess that wasn't enough; o-o-ohh
But here in my heart, I give you the best of my love
Oh-oh-oh ohhhh, sweet darlin', you get the best of my love
Oh-oh-oh ohhhh, sweet darlin', you get the best of my love
","['C', 'Dm', 'C', 'Dm', 'Em', 'Dm', 'Em', 'F/G', 'C', 'Dm', 'C', 'G7', 'C', 'Dm', 'C', 'Dm', 'Em', 'Dm', 'Em', 'F/G', 'C', 'Dm', 'C', 'G7', 'C', 'Dm', 'Cmaj7/G', 'Dm', 'Fm7', 'C', 'Fm7', 'Dm', 'G7', 'C', 'Dm', 'C', 'Dm', 'Em', 'Dm', 'Em', 'Dm', 'G7', 'C', 'Dm', 'C', 'G', 'C', 'Dm', 'Cmaj7/G', 'Dm']"
24,Walking On The Moon,The Police,https://tabs.ultimate-guitar.com/tab/the-police/walking-on-the-moon-chords-1173255,"Giant steps are what you take
Walking on the moon
I hope my legs don't break
Walking on the moon
We could walk forever
Walking on the moon
We could live together
Walking on, walking on the moon
Walking back from your house
Walking on the moon
Walking back from your house
Walking on the moon
Feet they hardly touch the ground
Walking on the moon
My feet don't hardly make no sound
Walking on, walking on the moon
Some    may say
I'm wishing my days away
No way
And if it's the price I pay
Some say
Tomorrow's another day
You stay
I may as well play
Giant steps are what you take
Walking on the moon
I hope my legs don't break
Walking on the moon
We could walk forever
Walking on the moon
We could live together
Walking on, walking on the moon
Some    may say
I'm wishing my days away
No way
And if it's the price I pay
Some say
Tomorrow's another day
You stay
I may as well play
Keep it up, keep it up
Keep it up, keep it up
Keep it up, keep it up
Keep it up, keep it up
","['Dm7', 'Bb', 'C', 'Dm7', 'Bb', 'C', 'Dm7', 'Bb', 'C', 'Dm7', 'Bb', 'C', 'Dm7', 'Bb', 'C', 'Dm7', 'Bb', 'C', 'Dm7', 'Bb', 'C', 'Dm7', 'Bb', 'C', 'Dm7', 'Bb', 'F', 'C', 'Gm', 'Bb', 'F', 'C', 'Gm', 'Bb', 'F', 'C', 'Gm', 'Bb', 'F', 'C', 'Dm7', 'Bb', 'C', 'Dm7', 'Bb', 'C', 'Dm7', 'Bb', 'C', 'Dm7', 'Bb', 'C', 'Dm7', 'Bb', 'F', 'C', 'Gm', 'Bb', 'F', 'C', 'Gm', 'Bb', 'F', 'C', 'Gm', 'Bb', 'F', 'C', 'Dm7', 'Bb', 'C', 'Dm7', 'Bb', 'C', 'Dm7', 'Bb', 'C', 'Dm7', 'Bb', 'C']"
25,Hotel California (ver 2),Eagles,https://tabs.ultimate-guitar.com/tab/eagles/hotel-california-chords-520827,"On a dark desert highway, cool wind in my hair
Warm smell of colitas rising up through the air
Up ahead in the distance, I saw a shimmering light
My head grew heavy and my sight grew dim; I had to stop for the night.
There she stood in the doorway; I heard the mission bell
And I was thinking to myself, ""This could be Heaven or this could be Hell""
Then she lit up a candle and she showed me the way
There were voices down the corridor I thought I heard them say...
Welcome to the Hotel California...
Such a lovely place, (such a lovely place) such a lovely face...
Plenty of room at the Hotel California...
Any time of year, (any time of year) you can find it here...
Her mind is Tiffany-twisted, she got the Mercedes Bends
She got a lot of pretty, pretty boys, that she calls friends
How they dance in the courtyard, sweet summer sweat
Some dance to remember, some dance to forget
So I called up the Captain, ""Please bring me my wine""
He said, ""We haven't had that spirit here since nineteen sixty nine""
And still those voices are calling from far away,
Wake you up in the middle of the night just to hear them say...
Welcome to the Hotel California...
Such a lovely place, (such a lovely place) such a lovely face...
They livin' it up at the Hotel California...
What a nice surprise, (what a nice surprise) bring your alibis...
Mirrors on the ceiling, the pink champagne on ice
And she said ""We are all just prisoners here, of our own device""
And in the master's chambers, they gathered for the feast
They stab it with their steely knives, but they just can't kill the beast
Last thing I remember, I was running for the door
I had to find the passage back to place I was before
""Relax"" said the night man, ""We are programmed to receive.
You can check out any time you like, but you can never leave"".
","['Bm', 'F#7', 'A', 'E7', 'G', 'D', 'Em', 'F#7', 'Bm', 'F#7', 'A', 'E7', 'G', 'D', 'Em', 'F#7', 'G', 'D', 'F#7', 'Bm', 'G', 'D', 'Em', 'F#7', 'Bm', 'F#7', 'A', 'E7', 'G', 'D', 'Em', 'F#7', 'Bm', 'F#7', 'A', 'E7', 'G', 'D', 'Em', 'F#7', 'G', 'D', 'F#7', 'Bm', 'F#7', 'G', 'D', 'Em', 'F#7', 'Bm', 'F#7', 'A', 'E7', 'G', 'D', 'Em', 'F#7', 'Bm', 'F#7', 'A', 'E7', 'G', 'D', 'Em', 'F#7']"
26,Ooh La La (ver 3),Faces,https://tabs.ultimate-guitar.com/tab/faces/ooh-la-la-chords-1410484,"Poor old Granddad  I laughed at all his words
I thought he was a bitter man   He spoke of women's ways
They'll trap you, then they use you  Be-fore you even know
For love is blind and you're far too kind   Don't ever let it show
I wish that I knew what I know now   When I was younger
I wish that I knew what I know now   When I was stronger.
The Can Can's such a pretty show   They'll steal your heart away
But backstage, back on earth again   The dressing rooms are grey
They come on strong and it ain't too long   Before they make you feel a man
But love is blind and you soon will find   You're just a boy again
I wish that I knew what I know now   When I was younger
I wish that I knew what I know now   When I was stronger.
When you want her lips, you get a cheek   Makes you wonder where you are
If you want some more and she's fast asleep   Leaves you twinkling with the stars.
Poor young grandson, there's nothing I can say
You'll have to learn, just like me  And that's the hardest way
Ooh la la
Ooh la la, la la, yeah
I wish that I knew what I know now   When I was younger
I wish that I knew what I know now   When I was stronger.
","['G', 'Am7', 'G', 'Am7', 'G', 'Am7', 'G', 'Am7', 'G', 'Am7', 'C', 'G', 'Am7', 'C', 'G', 'Am7', 'G', 'Am7', 'G', 'Am7', 'G', 'Am7', 'G', 'Am7', 'C', 'G', 'Am7', 'C', 'G', 'Am7', 'G', 'Am7', 'G', 'Am7', 'G', 'Am7', 'G', 'Am7', 'C', 'G', 'Am7', 'C', 'G', 'Am7', 'C']"
27,Crazy Little Thing Called Love (ver 3),Queen,https://tabs.ultimate-guitar.com/tab/queen/crazy-little-thing-called-love-chords-974560,"This thing called love, I just can't handle it.
This thing called love, I must get round to it.
I ain't ready.
Crazy little thing called love.
This thing (this thing) called love (called love)
it cries (like a baby) in a cradle all night.
It swings, it jives, it shakes all over like a 
jelly fish.
I kinda like it..crazy little thing called love.
There goes my baby..she knows how to Rock n' Roll.
She drives me crazy..she gives me hot and cold fever..
then she leaves me in a cool, cool sweat.
I gotta be cool, relax, get hip, get on my tracks.
Take a back seat, hitch-hike, and take a long ride 
on my motor bike..
Until I'm ready..crazy little thing called love.
I gotta be cool, relax, get hip, get on my tracks.
Take a back seat, hitch-hike, and take a long ride 
on my motor bike..
Until I'm ready..crazy little thing called love.
This thing called love, I just can't handle it.
This thing called love, I must get round to it.
I ain't ready.
Crazy little thing called love.
Crazy little thing called love. (x6) (Fade.)
","['D', 'G', 'C', 'G', 'D', 'G', 'C', 'G', 'D', 'Bb', 'C', 'D', 'D', 'G', 'C', 'G', 'D', 'G', 'C', 'G', 'D', 'Bb', 'C', 'D', 'G', 'C', 'G', 'Bb', 'E', 'A', 'F', 'E', 'A', 'D', 'G', 'C', 'G', 'D', 'G', 'C', 'G', 'D', 'Bb', 'C', 'D', 'D', 'G', 'C', 'G', 'D', 'G', 'C', 'G', 'D', 'Bb', 'C', 'D', 'D', 'G', 'C', 'G', 'D', 'G', 'C', 'G', 'D', 'Bb', 'C', 'D', 'Bb', 'C', 'D']"
28,Piano Man,Billy Joel,https://tabs.ultimate-guitar.com/tab/billy-joel/piano-man-chords-10768,"It's nine o'clock on a Saturday   The   regular crowd shuffles in
There's an old man    sitting next to me   making love to his tonic and gin
He says son can you play me a memory   I'm   not really sure how it goes
But it's sad and it's sweet and I knew it complete when I wore a younger man's clothes
Da da da     de de Da               dada          dede da          da da
Sing us a song you're the piano man          Sing us a song        tonight
Well, we're all in the mood for a melody         and you've got us feeling alright
Now John at the bar is a friend of mine,  he gets me my drinks for free
And he's quick with a joke and a light of your smoke but there's some place that he'd rather be
              He says Bill I believe this is killing me as the smile ran away from his face
Well I'm sure that I could be a movie star if I could get out of this place
Da da da     de de Da               dada          dede da          da da
Now Paul is a real estate novelist who never had time for a wife
And he's talking with Davy who's still in the navy and probably will be for life
And the waitress is practising politics as the businessmen slowly gets stoned
Yes, they're sharing a drink they call loneliness but it's better than drinking alone
 Sing us a song you're the piano man                 Sing us a song        tonight
  Well, we're all in the mood for a melody         and you've got us feeling alright
It's a pretty good crowd for a Saturday and the manager gives me a smile
Cause he knows that it's me they've been coming to see, to forget about life for a while
And the piano sounds like a carnival and the microphone smells like a beer
And they sit at the bar and put bread in my jar and say man what are you doing here?
Da da da     de de Da               dada          dede da          da da
            Sing us a song you're the piano man          Sing us a song        tonight
  Well, we're all in the mood for a melody         and you've got us feeling alright
","['C', 'C/B', 'Am', 'C/G', 'F', 'C/E', 'D7', 'G', 'C', 'C/B', 'Am', 'C/G', 'F', 'G11', 'C', 'C', 'C/B', 'Am', 'C/G', 'F', 'C/E', 'D7', 'G', 'C', 'Em/B', 'Am', 'C/G', 'F', 'G11', 'C', 'Am', 'Am/G', 'D7/F#', 'F', 'Am', 'Am/G', 'D7/F#', 'D7', 'G', 'G/F', 'C', 'Em/B', 'Am', 'C/G', 'F', 'C/E', 'D7', 'G', 'C', 'Em/B', 'Am', 'C/G', 'F', 'G11', 'C', 'C', 'Em/B', 'Am', 'C/G', 'F', 'C/E', 'D7', 'G', 'C', 'Em/B', 'Am', 'C/G', 'F', 'G11', 'C', 'C', 'F/C', 'Cmaj7', 'G11', 'C', 'Em/B', 'Am', 'C/G', 'F', 'C/E', 'D7', 'C', 'Em/B', 'Am', 'C/G', 'F', 'G11', 'C', 'Am', 'Am/G', 'D7/F#', 'F', 'Am', 'Am/G', 'D7/F#', 'D7', 'G', 'G/F', 'G', 'C', 'Em/B', 'Am', 'C/G', 'F', 'C/E', 'D7', 'G', 'C', 'Em/B', 'Am', 'C/G', 'F', 'G11', 'C', 'C', 'F/C', 'Cmaj7', 'G11', 'C', 'Em/B', 'Am', 'C/G', 'F', 'C/E', 'D7', 'G', 'C', 'Em/B', 'Am', 'C/G', 'F', 'G11', 'C', 'C', 'Em/B', 'Am', 'C/G', 'F', 'C/E', 'D7', 'G', 'C', 'Em/B', 'Am', 'C/G', 'F', 'G11', 'C', 'G11', 'C', 'C/B', 'Am', 'C/G', 'F', 'C/E', 'D7', 'G', 'C', 'C/B', 'Am', 'C/G', 'F', 'G11', 'C', 'C', 'F/C', 'Cmaj7', 'G11', 'C', 'C/B', 'Am', 'C/G', 'F', 'C/E', 'D7', 'C', 'C/B', 'Am', 'C/G', 'F', 'G11', 'C', 'Am', 'Am/G', 'D7/F#', 'F', 'Am', 'Am/G', 'D7/F#', 'D7', 'G', 'G/F', 'C/E', 'G/D', 'C/E', 'G7/D', 'C', 'C/B', 'Am', 'C/G', 'F', 'C/E', 'D7', 'G', 'C', 'C/B', 'Am', 'C/G', 'F', 'G11', 'C']"
29,More Than A Feeling (ver 3),Boston,https://tabs.ultimate-guitar.com/tab/boston/more-than-a-feeling-chords-1050593,"I looked out this morning and the sun was gone
Turned on some music to start my day
I lost myself in a familiar song
I closed my eyes and I slipped away
It's more than a feeling, more than a feeling
when I hear that old song, they used to play (more than a feeling)
I begin dreaming (more than a feeling)
till I see Marianne walk away
 I see my Marianne walkin' away
So many people have come and gone
Their faces fade as the years go by
Yet I still recall as I wander on
As clear as the sun in the summer sky
It's more than a feeling, more than a feeling
when I hear that old song, they used to play (more than a feeling)
I begin dreaming (more than a feeling)
till I see Marianne walk away
 I see my Marianne walkin' away
When I'm tired and thinking cold
I hide in my music, forget the day
And dream of a girl, I used to know
I closed my eyes and she slipped away
she slipped away
It's more than a feeling, more than a feeling
when I hear that old song they used to play (more than a feeling)
I begin dreaming (more than a feeling)
till I see Marianne walk away
","['D', 'Dsus4', 'C', 'G', 'D', 'Dsus4', 'C', 'G', 'D', 'Dsus4', 'C', 'G', 'D', 'Dsus4', 'Am', 'Dsus4', 'D', 'G', 'C', 'Em', 'D', 'G', 'C', 'Em', 'D', 'G', 'C', 'Em', 'D', 'G', 'C', 'Eb', 'Em', 'A', 'Asus4', 'G', 'D', 'Dsus4', 'C', 'G', 'D', 'Dsus4', 'C', 'G', 'D', 'Dsus4', 'C', 'G', 'D', 'Dsus4', 'Am', 'Dsus4', 'D', 'G', 'C', 'Em', 'D', 'G', 'C', 'Em', 'D', 'G', 'C', 'Em', 'D', 'G', 'C', 'Eb', 'Em', 'A', 'Asus4', 'Bm', 'A', 'G', 'D/F#', 'Asus4', 'A', 'D', 'Dsus4', 'C', 'G', 'D', 'Dsus4', 'C', 'G', 'D', 'Dsus4', 'C', 'G', 'D', 'Dsus4', 'Am', 'D', 'Am', 'Dsus4', 'D', 'G', 'C', 'Em', 'D', 'G', 'C', 'Em', 'D', 'G', 'C', 'Em', 'D', 'G', 'C', 'G']"
