,name,author,link,lyrics,chords
0,Make You Feel My Love (ver 4),Bob Dylan,https://tabs.ultimate-guitar.com/tab/bob-dylan/make-you-feel-my-love-chords-1189445,"When the rain is blowing in your face
And the whole world is on your case
I could offer you a warm embrace
To make you feel my love
When evening shadows and the stars appear
And there is no one there to dry your tears
I could hold you for a million years
To make you feel my love
I know you haven't made your mind up yet
But I would never do you wrong
I've known it from the moment that we met
No doubt in my mind where you belong
I'd go hungry, I'd go black and blue
I'd go crawling down the avenue
No there's nothing that I wouldn't do
To make you feel my love
The storms are raging on the rollin' sea
And on the highway of regret
The winds of change are blowing wild and free
You ain't seen nothing like me yet
I could make you happy, make your dreams come true
Nothing that I wouldn't do
Go to the ends of the earth for you
To make you feel my love
                                  (Fade)
","['C', 'G', 'Bb', 'F', 'Fm', 'C', 'D9', 'G7', 'C', 'C', 'G', 'Bb', 'F', 'Fm', 'C', 'D9', 'G7', 'C', 'F', 'C', 'E7', 'F', 'C', 'F', 'C', 'D9', 'G', 'C', 'G', 'Bb', 'F', 'Fm', 'C', 'D9', 'G7', 'C', 'F', 'C', 'E7', 'F', 'C', 'F', 'C', 'D9', 'G7', 'C', 'G', 'Bb', 'F', 'Fm', 'C', 'D9', 'G7', 'C', 'C', 'G', 'Bb', 'F', 'Fm', 'C', 'D9', 'G7', 'C']"
1,I Saw The Light,Todd Rundgren,https://tabs.ultimate-guitar.com/tab/todd-rundgren/i-saw-the-light-chords-538783," It was late last night
 I was feeling something wasn't right
 There was not another soul in sight
 Only you, only you
 So we walked along,
 though I knew that there was something wrong
 And the feeling hit me oh so strong about you
 Then you gazed up at me and the answer was plain to see
 'Cause I saw the light 
 In your eyes 
 in your eyes
 Though we had our fling
 I just ne__ver would suspect a thing
 'Til that little bell began to ring in my head, in my head
 But I tried to run, 
 though I knew it wouldn't help me none
 'Cause I couldn't ever love no one, or so I said
 But my feelings for you were just something I never knew
 'Til I saw the light 
 In your eyes 
 In your eyes
 But I love you best
 It's not something that I say in jest
 'Cause you're different girl from all the rest, in my eyes
 And I ran out before but I won't do it anymore
 Can't you see the light 
In my eyes           (x4)  
","['Dm7', 'G', 'Dm7', 'G', 'Dm7', 'G', 'Cmaj7', 'C7', 'Dm7', 'G', 'Dm7', 'G', 'Dm7', 'G', 'Cmaj7', 'C7', 'Fmaj7', 'Em7', 'Am', 'D7', 'Dm7', 'G', 'Cmaj7', 'Dm7', 'Cmaj7', 'Dm7', 'Dm7', 'G', 'Dm7', 'G', 'Dm7', 'G', 'Cmaj7', 'C7', 'Dm7', 'G', 'Dm7', 'G', 'Dm7', 'G', 'Cmaj7', 'C7', 'Fmaj7', 'Em7', 'Am', 'D7', 'Dm7', 'G', 'Cmaj7', 'Dm7', 'Cmaj7', 'Dm7', 'Dm7', 'G', 'Dm7', 'G', 'Dm7', 'G', 'Cmaj7', 'C7', 'Fmaj7', 'Em7', 'Am', 'D7', 'Dm7', 'G', 'Cmaj7', 'Dm7']"
2,Ill Have To Say I Love You In A Song (ver 2),Jim Croce,https://tabs.ultimate-guitar.com/tab/jim-croce/ill-have-to-say-i-love-you-in-a-song-chords-1047560,"Well, I know it's kind of late, I hope I didn't wake you.
But what I got to say can't wait, I knew you'd understand.
Every time I tried to tell you, the words just came out wrong.
So, I'll have to say I love you, in a song.
Yeah, I know it's kind of strange, but every time I'm near you..
I just run out of things to say..I knew you'd understand.
Cause every time I tried to tell you, the words just came out wrong.
So, I'll have to say I love you, in a song.
Every time the time was right, all the words just came out wrong.
So, I'll have to say I love you, in a song.
Yeah, I know it's kind of late, I hope I didn't wake you.
But there's something that I just got to say, I knew you'd understand.
Cause every time I tried to tell you, the words just came out wrong.
So, I'll have to say I love you, in a song.
","['Amaj7', 'C#m', 'Bm', 'E', 'Amaj7', 'C#m', 'Bm', 'E', 'D', 'G#7', 'C#7', 'F#m', 'D', 'A', 'E', 'D', 'A', 'Amaj7', 'C#m', 'Bm', 'E', 'Amaj7', 'C#m', 'Bm', 'E', 'D', 'G#7', 'C#7', 'F#m', 'D', 'A', 'E', 'D', 'A', 'D', 'G#7', 'C#7', 'F#m', 'D', 'Amaj7', 'E', 'D', 'A', 'Amaj7', 'C#m', 'Bm', 'E', 'Amaj7', 'C#m', 'Bm', 'E', 'D', 'G#7', 'C#7', 'F#m', 'D', 'Amaj7', 'E', 'D', 'A']"
3,Vienna (ver 2),Billy Joel,https://tabs.ultimate-guitar.com/tab/billy-joel/vienna-chords-813584,"Slow down you crazy child
You're so ambitious for a juvenile
But then if you're so smart tell me why
Are you still so afraid?
Where's the fire, what's the hurry about?
You better cool it off before you burn it out
You got so much to do and only
So many hours in a day
But you know that when the truth is told
That you can get what you want
Or you can just get old
You're gonna kick off before you even get halfway through, Oh oh
When will you realise...Vienna waits for you
Slow down you're doing fine
You can't be everything you want to be before your time
Although it's so romantic on the borderline tonight, tonight
Too bad but it's the life you lead
You're so ahead of yourself that you forgot what you need
Though you can see when you're wrong
You know you can't always see when you're right, you're right
You got your passion you got your pride
But don't you know that only fools are satisfied?
Dream on but don't imagine they'll all come true, Oh oh
When will you realise...Vienna waits for you
Slow down you crazy child
Take the phone off the hook and disappear for a while
It's alright you can afford to lose a day or two, Oh oh
When will you realise...Vienna waits for you
And you know that when the truth is told
That you can get what you want
Or you can just get old
You're gonna kick off before you even get halfway through, Oh oh
Why don't you realise...Vienna waits for you
When will you realise...Vienna waits for you
","['Am', 'C', 'G', 'Bb', 'F', 'C', 'D', 'E7', 'Am', 'C', 'G', 'Bb', 'F', 'C', 'D', 'E', 'F', 'G', 'C', 'C/B', 'Am', 'G', 'F', 'Bm7', 'E', 'Am', 'D', 'G#7', 'G', 'C', 'Am', 'C', 'G', 'Bb', 'F', 'C', 'D', 'E7', 'Am', 'C', 'G', 'Bb', 'F', 'C', 'D', 'E', 'F', 'G', 'C', 'C/B', 'Am', 'G', 'F', 'Bm7', 'E', 'Am', 'D', 'G#7', 'G', 'C', 'F', 'G', 'C', 'C/B', 'Am', 'G', 'F', 'Bm7', 'E', 'Am', 'D', 'G#7', 'G', 'C', 'F', 'G', 'C', 'C/B', 'Am', 'G', 'F', 'Bm7', 'E', 'Am', 'D', 'G#7', 'G', 'C', 'A7', 'D', 'G', 'C']"
4,Right Down The Line (ver 2),Gerry Rafferty,https://tabs.ultimate-guitar.com/tab/gerry-rafferty/right-down-the-line-chords-1208429,"      You know I need your love   You've got that hold over me
       Long as I got your love   You know that I'll never leave
   When I wanted you to share my life I had no doubt in my mind
And it's been you Woman Right down the line
  I know how much I lean on you        Only you can see
   The changes that I've been through   Have left a mark on me
 You've been as constant as a northern star  The brightest light that shines
And it's been you Woman Right down the line
   I just want to say this is my way
Of telling you everything I could never Say before
   Yeah this is my way
Of telling you that every day I'm loving you so much more...
  'Cause you believed in me    Through my darkest night
  Put something better inside of me    You brought me into the light
  Threw away all those crazy dreams    I put them all behind
And it was you Woman Right down the line
   I just want to say this is my way
Of telling you everything I could never Say before
   Yeah this is my way
Of telling you that every day I'm loving you so much more...
  If I should doubt myself    If I'm losing ground
  I won't turn to someone else   They'd only let me down
  When I wanted you to share my life   I had no doubt in my mind
And it's been you Woman Right down the line
Oooh  ooohhh..Woooh... etc.
","['Dm', 'C', 'Am', 'F', 'Dm', 'C', 'Am', 'F', 'Dm', 'C', 'Am', 'F', 'C', 'G', 'Am', 'C/G', 'F', 'Dm', 'C', 'Am', 'F', 'Dm', 'C', 'Am', 'F', 'Dm', 'C', 'Am', 'F', 'C', 'G', 'Am', 'C/G', 'F', 'D', 'Bm', 'G', 'E/G#', 'A', 'F', 'Dm', 'Bm', 'G', 'E/G#', 'A', 'F', 'Dm', 'Dm', 'C', 'Am', 'F', 'Dm', 'C', 'Am', 'F', 'Dm', 'C', 'Am', 'F', 'C', 'G', 'Am', 'C/G', 'F', 'D', 'Bm', 'G', 'E/G#', 'A', 'F', 'Dm', 'Bm', 'G', 'E/G#', 'A', 'F', 'Dm', 'Dm', 'C', 'Am', 'F', 'Dm', 'C', 'Am', 'F', 'Dm', 'C', 'Am', 'F', 'C', 'G', 'Am', 'C/G', 'F', 'D', 'Bm', 'G', 'E/G#', 'A', 'F', 'Dm', 'Bm', 'G', 'E/G#', 'A', 'F', 'Dm']"
5,Dust In The Wind,Kansas,https://tabs.ultimate-guitar.com/tab/kansas/dust-in-the-wind-chords-50293,"I close my   eyes
only for a moment
and the moment's gone
all my   dreams
pass before my eyes a curiosity
     dust in the wind
all we are is dust in the wind
Same old   song
just a drop of water
in the endless sea
all we   do
crumbles to the ground
though we refuse to see
     dust in the wind
all we are is dust in the wind
Now,  don't hang on
nothing last forever
but the earth and sky
it slips a   way
And all your money
won't another minute buy
     dust in the wind
all we are is dust in the wind
     dust in the wind
everything is dust in the wind
","['C', 'G/B', 'Am', 'G', 'Dm7', 'Am', 'G/B', 'C', 'G/B', 'Am', 'G', 'Dm7', 'Am', 'D/F#', 'G', 'Am', 'Am/G', 'D/F#', 'G', 'Am', 'G/B', 'C', 'G/B', 'Am', 'G', 'Dm7', 'Am', 'G/B', 'C', 'G/B', 'Am', 'G', 'Dm7', 'Am', 'D/F#', 'G', 'Am', 'Am/G', 'D/F#', 'G', 'Am', 'G', 'Dm7', 'G/B', 'C', 'G/B', 'Am', 'G', 'Dm7', 'Am', 'G/B', 'C', 'G/B', 'Am', 'G', 'Dm7', 'Am', 'D/F#', 'G', 'Am', 'Am/G', 'D/F#', 'G', 'Am', 'Am/G', 'D/F#', 'G', 'Am', 'Am/G', 'D/F#', 'G', 'Am']"
6,Love Grows Where My Rosemary Goes,Edison Lighthouse,https://tabs.ultimate-guitar.com/tab/edison-lighthouse/love-grows-where-my-rosemary-goes-chords-67686,"(6 measures)
She ain't got no money
Her clothes are kind of funny
Her hair is kind of wild and free
Oh, but love grows where my Rosemary goes
And nobody knows like me
She talks kind of lazy
And people say she's crazy
And her life's a mystery
Oh, but love grows where my Rosemary goes
And nobody knows like me
There's somethin' about her hand holdin' mine
It's a feelin' that's fine
And I just gotta say, hey
She's really got a magical spell
And it's workin' so well
That I can't get away
I'm a lucky fella
And I just gotta tell her
That I love her endlessly
Because love grows where my Rosemary goes
And nobody knows like me
There's somethin' about her hand holdin' mine
It's a feelin' that's fine
And I just gotta say, hey
She's really got a magical spell
And it's workin' so well
That I can't get away   (Key Change)
I'm a lucky fella
And I just gotta tell her
That I love her endlessly
Because love grows where my Rosemary goes
And nobody knows like me
Love grows where my Rosemary goes
And nobody knows like me
Love grows where my Rosemary goes
And nobody knows like me
Love grows where my Rosemary goes
And nobody knows like me
","['A', 'A', 'A', 'D', 'A', 'C#m', 'F#m', 'A', 'D', 'E7', 'A', 'A', 'D', 'A', 'C#m', 'F#m', 'A', 'D', 'E7', 'A', 'D', 'E', 'A', 'F#m', 'Bm', 'E', 'A', 'D', 'E', 'A', 'F#m', 'B', 'E7', 'A', 'A', 'D', 'A', 'C#m', 'F#m', 'A', 'D', 'E7', 'A', 'D', 'E', 'A', 'F#m', 'Bm', 'E', 'A', 'D', 'E', 'A', 'F#m', 'B', 'E7', 'F7', 'Bb', 'Bb', 'Eb', 'Bb', 'Dm', 'Gm', 'Bb', 'Eb', 'F7', 'Bb', 'Dm', 'Gm', 'Bb', 'Eb', 'F7', 'Bb', 'Bb', 'Dm', 'Gm', 'Bb', 'Eb', 'F7', 'Bb', 'Bb', 'Dm', 'Gm', 'Bb', 'Eb', 'F7', 'Bb']"
7,Pigs On The Wing Part 1,Pink Floyd,https://tabs.ultimate-guitar.com/tab/pink-floyd/pigs-on-the-wing-part-1-chords-79214,"If you didn't care
what happened to me
And I didn't care
For you
We would zig-zag our way
Through the boredom and pain
 Occasionally   glancing   up  through  the rain
     Wondering      which of the buggers to blame
 And watching          for pigs on the wing
","['G', 'C', 'Cadd4', 'C', 'G', 'Csus2', 'G', 'C', 'Cadd4', 'C', 'G', 'Csus2', 'G', 'A', 'G', 'A', 'G', 'A7', 'G', 'C', 'D', 'G', 'Am', 'F', 'Am', 'F', 'C', 'C/B', 'Am', 'D', 'Dsus4', 'D', 'G']"
8,Lookin Out My Back Door,Creedence Clearwater Revival,https://tabs.ultimate-guitar.com/tab/creedence-clearwater-revival/lookin-out-my-back-door-chords-15890,"Just got home from Illinois, lock the front door, oh boy
Got to sit down, take a rest on the porch
Imagination sets in, pretty soon I'm singing
Doo, doo, doo, lookin' out my back door
There's a giant doing cartwheels, a statue wearing high heels
Look at all the happy creatures dancing on the lawn
Dinosaur victrola listening to Buck Owens
Doo, doo, doo, lookin' out my back door
Tambourines and elephants are playing in the band
Won't you take a ride on the flyin' spoon  Doo, doo doo
Wondrous apparition provided by magician
Doo, doo, doo, lookin' out my back door
Tambourines and elephants are playing in the band
Won't you take a ride on the flyin' spoon, doo, doo, doo
Bother me tomorrow, today I'll find no sorrow
Doo, Doo, Doo, lookin' out my back door
Forward troubles Illinois, lock the front door, oh boy
Look at all the happy creatures dancing on the lawn
Bother me tomorrow, today I'll find no sorrow
Doo, doo, doo, lookin' out my back door
","['G', 'Em', 'C', 'G', 'D', 'G', 'Em', 'C', 'G', 'D', 'G', 'G', 'Em', 'C', 'G', 'D', 'G', 'Em', 'C', 'G', 'D', 'G', 'D', 'C', 'G', 'Em', 'D', 'G', 'Em', 'C', 'G', 'D', 'G', 'D', 'C', 'G', 'Em', 'D', 'G', 'Em', 'C', 'G', 'D', 'G', 'A', 'F#m', 'D', 'A', 'E', 'A', 'F#m', 'D', 'A', 'E', 'A']"
9,Tuesdays Gone,Lynyrd Skynyrd,https://tabs.ultimate-guitar.com/tab/lynyrd-skynyrd/tuesdays-gone-chords-493878,"Train roll on, on down the line,
Won't you please take me far away?
Now I feel the wind blow outside my door, means I'm
leaving my woman behind.
Tuesday's gone with the wind.
My baby's gone with the wind.
And I don't know, oh where I'm going.
I just want to be left alone.
Well, when this train ends I'll try again, Lord I'm
I'm leaving my woman at home.
Tuesday's gone with the wind.
Tuesday's gone with the wind.
Tuesday's gone with the wind.
My baby's gone with the wind,
Train roll on many miles from my home, see I'm 
I'm riding my blues away.
Tuesday, you see, she had to be free, Lord but 
But somehow I've got to carry on, oh yeah.
Tuesday's gone with the wind.
Tuesday's gone with the wind.
Tuesday's gone with the wind.
My baby's gone with the wind.
","['A', 'E', 'F#m', 'D', 'A', 'E', 'D', 'A', 'E', 'F#m', 'D', 'A', 'E', 'D', 'A', 'G', 'D', 'A', 'E', 'D', 'A', 'E', 'F#m', 'D', 'A', 'E', 'D', 'A', 'E', 'F#m', 'D', 'A', 'E', 'D', 'A', 'G', 'D', 'A', 'G', 'D', 'A', 'G', 'D', 'A', 'E', 'D', 'A', 'E', 'F#m', 'D', 'A', 'E', 'D', 'A', 'E', 'F#m', 'D', 'A', 'E', 'D', 'A', 'G', 'D', 'A', 'G', 'D', 'A', 'G', 'D', 'A', 'E', 'D']"
10,Dont Let Me Down (ver 4),The Beatles,https://tabs.ultimate-guitar.com/tab/the-beatles/dont-let-me-down-chords-1044470,"Don't let me down       Don't let me down
Don't let me down       Don't let me down
Nobody ever loved me like she do me oo she do me yes she does
And if somebody ever really loved me oo she loved me, yes she does
Don't let me down       Don't let me down
Don't let me down       Don't let me down
I'm in love for the first time, don't you know it's gonna last.
It's a love that lasts forever, it's a love that had no past
Don't let me down       Don't let me down
Don't let me down       Don't let me down
And from the first time that she really done me oo she done me,she done me good
I guess nobody ever really done me, like she done me, she does me good
Don't let me down       Don't let me down
Don't let me down       Don't let me down
","['E', 'F#m', 'F#m7', 'Amaj7', 'E', 'Esus4', 'E', 'E', 'F#m', 'F#m7', 'Amaj7', 'E', 'Esus4', 'E', 'E', 'F#m7', 'F#m', 'E', 'Esus4', 'E', 'E', 'F#m7', 'F#m', 'E', 'Esus4', 'E', 'E', 'F#m', 'F#m7', 'Amaj7', 'E', 'Esus4', 'E', 'E', 'F#m', 'F#m7', 'Amaj7', 'E', 'Esus4', 'E', 'E', 'B', 'B7', 'E', 'E', 'F#m', 'F#m7', 'Amaj7', 'E', 'Esus4', 'E', 'E', 'F#m', 'F#m7', 'Amaj7', 'E', 'Esus4', 'E', 'E', 'F#m7', 'F#m', 'E', 'Esus4', 'E', 'E', 'F#m7', 'F#m', 'E', 'Esus4', 'E', 'E', 'F#m', 'F#m7', 'Amaj7', 'E', 'Esus4', 'E', 'E', 'F#m', 'F#m7', 'Amaj7', 'E', 'Esus4', 'E']"
11,I Shall Be Released,Bob Dylan,https://tabs.ultimate-guitar.com/tab/bob-dylan/i-shall-be-released-chords-14873," They say everything can be replaced
 Yet every distance is not near
 So I remember every face
 Of every man who put me here.
 I see my light come shining
 From the west unto the east.
  Any day now,
  Any day now,
  I shall be released
 They say every man needs protection.
 They say that every man must fall.
 Yet I swear I see my reflection,
 Someplace so high above this wall.
 I see my light come shining
 From the west unto the east.
  Any day now,
  Any day now,
  I shall be released
 Well yonder stands a man in this lonely crowd,
 A man who swears he's not to blame.
 All day long I hear him cry out so loud,
 Calling out that he's been framed.
 I see my light come shining
 From the west unto the east.
  Any day now,
  Any day now,
  I shall be released
","['A', 'Bm', 'C#m', 'D', 'E', 'A', 'A', 'Bm', 'C#m', 'D', 'E', 'A', 'A', 'Bm', 'C#m', 'D', 'E', 'A', 'A', 'Bm', 'C#m', 'D', 'A', 'A', 'Bm', 'C#m', 'D', 'E', 'A', 'A', 'Bm', 'C#m', 'D', 'E', 'A', 'A', 'Bm', 'C#m', 'D', 'E', 'A', 'A', 'Bm', 'C#m', 'D', 'A', 'A', 'Bm', 'C#m', 'D', 'E', 'A', 'A', 'Bm', 'C#m', 'D', 'E', 'A', 'A', 'Bm', 'C#m', 'D', 'E', 'A', 'A', 'Bm', 'C#m', 'D', 'A']"
12,Baby I Love Your Way,Peter Frampton,https://tabs.ultimate-guitar.com/tab/peter-frampton/baby-i-love-your-way-chords-68704," Shadows Grow So Long Before My Eyes, And They're Moving, Across The Page
 Suddenly The Day Turns Into Night, Far Away, From The City
 But Don't, Hesitate, Cause Your Love, Won't Wait
            Ooh, Baby I Love Your Way
            Wanna Tell You I Love Your Way
            Wanna Be With You Night And Day
 Moon Appears To Shine, And Light The Sky, With The Help, Of Some Firefly
 Wonder How They Have, The Power To Shine, Shine, Shine
 I Can See Them, Under The Pine
 But Don't, Hesitate, Cause Your Love, Won't Wait
            Ooh, Baby I Love Your Way
            Wanna Tell You I Love Your Way
            Wanna Be With You Night And Day
 I Can See The Sunset In Your Eyes, Brown And Grey, And Blue Besides
 Clouds Are Stalking Islands In The Sun, I Wish I Could Buy One, Out Of Season
 But Don't, Hesitate, Cause Your Love, Won't Wait
            Ooh, Baby I Love Your Way
            Wanna Tell You I Love Your Way
            Wanna Be With You Night And Day
            Ooh, Baby I Love Your Way
","['G', 'D/F#', 'Em', 'C', 'F9', 'G', 'D/F#', 'Em', 'C', 'F9', 'Bm7', 'E7', 'Am', 'D7', 'G', 'D', 'Am', 'C', 'G', 'D', 'Am', 'C', 'G', 'D', 'Am', 'C', 'G', 'D/F#', 'Em', 'C', 'F9', 'G', 'D/F#', 'Em', 'C', 'F', 'Bm7', 'E7', 'Am', 'D7', 'G', 'D', 'Am', 'C', 'G', 'D', 'Am', 'C', 'G', 'D', 'Am', 'C', 'G', 'D/F#', 'Em', 'C', 'F9', 'G', 'D/F#', 'Em', 'C', 'F9', 'Bm7', 'E7', 'Am', 'D7', 'G', 'D', 'Am', 'C', 'G', 'D', 'Am', 'C', 'G', 'D', 'Am', 'C', 'G', 'D', 'Am', 'C']"
13,Black Magic Woman,Santana,https://tabs.ultimate-guitar.com/tab/santana/black-magic-woman-chords-1086950,"I got a black magic woman, I got a black magic woman
I got a black magic woman got me so blind I can't see
That she's a black magic woman she's tryin' to make a devil out of me
Don't turn your back on me baby, Don't turn your back on me baby
Yes, don't turn your back on me baby, stop messin' around with your tricks
Don't turn your back on me baby you just might pick up my magic sticks
Got your spell on me baby, got your spell on me baby
Got your spell on me baby turnin' my heart into stone
I need you so bad magic woman I can't leave you alone
","['Dm7', 'Am7', 'Dm7', 'Gm', 'Dm7', 'A7', 'Dm', 'Dm7', 'Am7', 'Dm7', 'Gm', 'Dm7', 'A7', 'Dm', 'Dm7', 'Am7', 'Dm7', 'Gm', 'Dm7', 'A7', 'Dm']"
14,Carry On Wayward Son,Kansas,https://tabs.ultimate-guitar.com/tab/kansas/carry-on-wayward-son-chords-72959,"Once I rose above the noise and confusion
Just to get a glimpse beyond this illusion
I was soaring ever higher
But I flew too high
Though my eyes could see I still was a blind man
Though my mind could think I still was a mad man
I hear the voices when I'm dreaming
I can hear them say
Carry on my wayward son
There'll be peace when you are done
Lay your weary head to rest
Masquerading as a man with a reason
My charade is the event of the season
And if I claim to be a wise man
It surely means that I don't know
On a stormy sea of moving emotion
Tossed about, I'm like a ship on the ocean
I set a course for winds of fortune
But I hear the voices say
Carry on my wayward son
There'll be peace when you are done
Lay your weary head to rest
   Carry on
You will always remember
   Carry on
Nothing equals the splendor
Now your life's no longer empty
Surely Heaven waits for you
Carry on my wayward son
There'll be peace when you are done
Lay your weary head to rest
Don't you cry {vocal echo: Don't you cry} no more
","['Em', 'D', 'C', 'D', 'Em', 'D', 'C', 'D', 'Am', 'G', 'F', 'F', 'G', 'Am', 'G', 'D', 'Em', 'D', 'C', 'D', 'Em', 'D', 'C', 'D', 'Am', 'G', 'F', 'F', 'G', 'Am', 'G', 'D', 'Em', 'G', 'D', 'C', 'Em', 'G', 'D', 'Em', 'G', 'D', 'C', 'Em', 'D', 'C', 'D', 'Em', 'D', 'C', 'D', 'Am', 'G', 'F', 'F', 'G', 'Am', 'G', 'D', 'Em', 'D', 'C', 'D', 'Em', 'D', 'C', 'D', 'Am', 'G', 'F', 'F', 'G', 'Am', 'G', 'D', 'Em', 'G', 'D', 'C', 'Em', 'G', 'D', 'Em', 'G', 'D', 'C', 'Em', 'D', 'C', 'Em', 'D', 'C', 'Am', 'G', 'F', 'Am', 'G', 'D', 'Em', 'G', 'D', 'C', 'Em', 'G', 'D', 'Em', 'G', 'D', 'C', 'Bm7']"
15,Brain Damage,Pink Floyd,https://tabs.ultimate-guitar.com/tab/pink-floyd/brain-damage-chords-43464,"  The lunatic is on the grass.
  The lunatic is on the grass.
  Remembering games and daisy chains and laughs.
Got to keep the loonies on the path.
  The lunatic is in the hall.
  The lunatics are in my hall.
  The paper holds their folded faces to the floor
And every day the paper boy brings more.
  And if the dam breaks open many years too soon
And if there is no room upon the hill
  And if your head explodes with dark forebodings too
I'll see you on the dark side of the moon.
  The lunatic is in my head.    (laughter)
  The lunatic is in my head
  You raise the blade, you make the change
  You re-arrange me 'till I'm sane.
  You lock the door
And throw away the key
There's someone in my head but it's not me.
  And if the cloud bursts, thunder in your ear
  You shout and no one seems to hear.
And if the band you're in starts playing different tunes
I'll see you on the dark side of the moon.
","['D', 'G7/D', 'D', 'G7/D', 'D', 'E/D', 'A7', 'D', 'Dsus2', 'D', 'G7/D', 'D', 'G7/D', 'D', 'E/D', 'A7', 'D', 'Dsus2', 'D7', 'D9', 'G', 'A', 'C', 'G', 'G', 'A7', 'C', 'G', 'Bm7', 'Em7', 'A', 'A7', 'D', 'G7/D', 'D', 'G7/D', 'D', 'E/D', 'A7', 'D', 'Dsus2', 'D', 'E/D', 'A7', 'D', 'Dsus2', 'D7', 'D9', 'G', 'A', 'C', 'G', 'A', 'A7', 'A', 'C', 'G', 'Bm7', 'Em', 'A7']"
16,The Only Living Boy In New York (ver 2),Simon & Garfunkel,https://tabs.ultimate-guitar.com/tab/simon-garfunkel/the-only-living-boy-in-new-york-chords-471042,"Tom, get your plane right on time
I know your part'll go fine
Fly down to Mexico
Do-n-da-da-n-da-da-n-da-da and here I am
The only living boy in New York
I get the news I need on the weather report
Oh, I can gather all the news I need on the weather report
Hey, I've got nothing to do to - day but smile
Do-n-da-da-n-da-n-da-da-n here I am
The only living boy in New York
Half of the time we're gone, but we don't know
Where, and we don't know where
Here I am
Half of the time we're gone, but we don't know
where, and we don't know where
Tom, get your plane right on time
I know that you've been eager to fly now
Hey, let your honesty shine, shine, shine now,
Do-n-da-da-n-da-da-n-do like it shines on me
The only living boy in New York
The only living boy in New York
Here I am
Here I am
","['G', 'C', 'G', 'C', 'G', 'C', 'C/B', 'Am', 'Am/G', 'D/F#', 'C', 'G', 'C', 'G', 'C', 'G', 'C', 'G', 'C', 'C/B', 'Am', 'Am/G', 'D/F#', 'C', 'G', 'C', 'Am', 'D7/F#', 'G', 'C', 'C', 'G', 'C', 'Am', 'D7/F#', 'G', 'C', 'G', 'C', 'G', 'C', 'G', 'C', 'C/B', 'Am', 'Am/G', 'D/F#', 'Cmaj7', 'G', 'C', 'G', 'C', 'C', 'G', 'C', 'C', 'G', 'C']"
