,name,author,link,lyrics,chords
32,Shes A Rainbow,The Rolling Stones,https://tabs.ultimate-guitar.com/tab/the-rolling-stones/shes-a-rainbow-chords-81120,"     She comes in colors ev'rywhere
She combs her hair
She's like a rainbow
Coming, colors in the air
Oh, everywhere
She comes in colors
     She comes in colors ev'rywhere
She combs her hair
She's like a rainbow
Coming, colors in the air
Oh, everywhere
She comes in colors          
Have you seen her dressed in blue?
Have you seen a lady fairer?
She comes in colors ev'rywhere
She combs her hair
She's like a rainbow
Coming, colors in the air
Oh, everywhere
She comes in colors
Have you seen her all in gold?
Have you seen a lady fairer?
She comes in colors ev'rywhere
She combs her hair
She's like a rainbow
Coming, colors in the air
Oh, everywhere
She comes in colors      
She's like a rainbow
Coming, colors in the air
Oh, everywhere
She comes in colors
","['F', 'Bb', 'Eb', 'Bb', 'Bb7', 'Bb', 'Eb', 'Bb', 'F', 'Bb', 'F', 'Bb', 'Eb', 'Bb', 'Bb7', 'Bb', 'Eb', 'Bb', 'F', 'Bb', 'F', 'Bb', 'Eb', 'Bb', 'Bb7', 'Bb', 'Eb', 'Bb', 'F', 'Bb', 'F', 'Bb', 'Eb', 'Bb', 'Bb7', 'Bb', 'Eb', 'Bb', 'F', 'Bb', 'Bb7', 'Bb', 'Eb', 'Bb', 'F', 'Bb']"
33,Ill Be Your Mirror,The Velvet Underground,https://tabs.ultimate-guitar.com/tab/the-velvet-underground/ill-be-your-mirror-chords-639,"I'll be your mirror, reflect what you are in case you don't know
I'll be the wind, the rain and the sunset, the light on your door to show that you're home
When you think the night has seen your mind
That inside you are twisted and unkind
Let me stand to show that you are blind
Please put down your hands cause I see yoooooou
I find it hard to believe you don't know the beauty that you are
But if you don't let me be your eyes, a hand in your darkness, so you won't be afraid
When you think the night has seen your mind
That inside you are twisted and unkind
Let me stand to show that you are blind
Please put down your hands 'cause I see you
I'll be your mirror x4
","['A', 'D', 'G', 'A', 'D', 'G', 'A', 'D', 'G', 'A', 'D', 'G', 'A', 'D', 'G', 'A', 'D', 'Em', 'G', 'A', 'A', 'D', 'G', 'A', 'D', 'G', 'A', 'D', 'G', 'A', 'D', 'G', 'A', 'D', 'G', 'A', 'D', 'Em', 'G', 'D', 'G']"
34,White Room (ver 3),Cream,https://tabs.ultimate-guitar.com/tab/cream/white-room-chords-980040,"Aaah, aaah, aaah, aaah....Aaah, aaah, aaah, aaah, aaah.
In a white room, with black curtains, near the station.
Black roof country, no gold pavements, tired starlings.
Silver horses, run down moonbeams, in your dark eyes.
Dawnlight smiles, on your leaving, my contentment.
I'll wait in this place, where the sun never shines.
Wait in this place where the shadows run from themselves.
You said no strings, could secure you, at the station.
Platform ticket, restless diesels, goodbye windows.
I walked into, such a sad time, at the station.
As I walked out, felt my own need, just beginning.
I'll wait in the queue when the trains come back.
I'll wait for you, where the shadows run from themselves.
Aaah, aaah, aaah, aaah....Aaah, aaah, aaah, aaah, aaah.
At the party, she was kindness, in the hard crowd.
Consolation, from the old wound, now forgotten.
Yellow tigers, crouched in jungles, in her dark eyes.
She's just dressing, goodbye windows, tired starlings.
I'll sleep in this place, with the lonely crowd..
lie in the dark where the shadows run from themselves. 
Aaah, aaah, aaah, aaah....Aaah, aaah, aaah, aaah, aaah. 
","['Gm', 'F', 'Dm', 'C', 'Gm', 'F', 'Dm', 'C', 'Am', 'Am', 'Dm', 'F', 'G', 'Bb', 'C', 'Dm', 'F', 'G', 'Bb', 'Dm', 'F', 'G', 'Bb', 'C', 'Dm', 'F', 'G', 'Bb', 'Dm', 'F', 'G', 'Bb', 'C', 'Dm', 'F', 'G', 'Bb', 'Dm', 'F', 'G', 'Bb', 'C', 'Dm', 'F', 'G', 'Bb', 'C', 'G', 'Bb', 'A', 'C', 'G', 'Bb', 'C', 'D', 'Dm', 'F', 'G', 'Bb', 'C', 'Dm', 'F', 'G', 'Bb', 'Dm', 'F', 'G', 'Bb', 'C', 'Dm', 'F', 'G', 'Bb', 'Dm', 'F', 'G', 'Bb', 'C', 'Dm', 'F', 'G', 'Bb', 'Dm', 'F', 'G', 'Bb', 'C', 'Dm', 'F', 'G', 'Bb', 'C', 'G', 'Bb', 'A', 'C', 'G', 'Bb', 'C', 'D', 'Gm', 'F', 'Dm', 'C', 'Gm', 'F', 'Dm', 'C', 'Am', 'Dm', 'F', 'G', 'Bb', 'C', 'Dm', 'F', 'G', 'Bb', 'Dm', 'F', 'G', 'Bb', 'C', 'Dm', 'F', 'G', 'Bb', 'Dm', 'F', 'G', 'Bb', 'C', 'Dm', 'F', 'G', 'Bb', 'Dm', 'F', 'G', 'Bb', 'C', 'Dm', 'F', 'G', 'Bb', 'C', 'G', 'Bb', 'A', 'C', 'G', 'Bb', 'C', 'D', 'Gm', 'F', 'Dm', 'C', 'Gm', 'F', 'Dm', 'C', 'Am']"
35,Season Of The Witch (ver 2),Donovan,https://tabs.ultimate-guitar.com/tab/donovan/season-of-the-witch-chords-1052070,"When I look out my window,
many sights to see.
And when I look in my window,
so many different people to be.
That it's strange.
So strange.
You got to pick up every stitch. X3
MmmHmmm
Must be the season of the witch,
must be the season of the witch, yeah,
must be the season of the witch.
When I look over my shoulder,
what do you think I see?
Some other cat lookin' over his shoulder at me.
And he’s strange,
sure is strange
You got to pick up every stitch.
You got to pick up every stitch, yeah.
Beatniks are out to make it rich
Oh no...
Must be the season of the witch,
must be the season of the witch, yeah
must be the season of the witch.
You got to pick up every stitch,
the rabbits running in the ditch.
Beatnicks are out to make it rich.
Oh no
Must be the season of the witch,
must be the season of the witch,
must be the season of the witch.
         When I go
When I look out my window,
what do you think I see?
And when I look in my window,
so many different people to be.
It's strange,
sure is strange.
You got to pick up every stitch,
you got to pick up every stitch
two rabbits running in the ditch.
Oh no
Must be the season of the witch,
must be the season of the witch, yeah,
must be the season of the witch.
          when I go       When I go
","['A7', 'D7', 'A7', 'D7', 'A7', 'D7', 'A7', 'D7', 'A7', 'D7', 'A7', 'D7', 'A7', 'D7', 'A7', 'D7', 'D7', 'E7', 'A', 'D7', 'E7', 'A', 'D7', 'E7', 'A7', 'A7', 'D7', 'A7', 'D7', 'A7', 'D7', 'A7', 'D7', 'A7', 'D7', 'A7', 'D7', 'A7', 'D7', 'A7', 'D7', 'A7', 'D7', 'A7', 'D7', 'D7', 'E7', 'A', 'D7', 'E7', 'A', 'D7', 'E7', 'A7', 'A7', 'D7', 'A7', 'D7', 'A7', 'D7', 'A7', 'D7', 'D7', 'E7', 'A', 'D7', 'E7', 'A', 'D7', 'E7', 'A7', 'A7', 'D7', 'A7', 'D7', 'A7', 'D7', 'A7', 'D7', 'A7', 'D7', 'A7', 'D7', 'A7', 'D7', 'A7', 'D7', 'A7', 'D7', 'A7', 'D7', 'A7', 'D7', 'A7', 'D7', 'A7', 'D7', 'D7', 'E7', 'A', 'D7', 'E7', 'A', 'D7', 'E7', 'A7', 'A7', 'D7', 'A7', 'D7', 'A7', 'D7', 'A7']"
36,Love Minus Zero - No Limit,Bob Dylan,https://tabs.ultimate-guitar.com/tab/bob-dylan/love-minus-zero-no-limit-chords-851194,"My love she speaks like silence,
Without ideals or violence,
She doesn't have to say she's faithful,
Yet she's true, like ice, like fire.
People carry roses,
Make promises by the hours,
My love she laughs like the flowers,
Valentines can't buy her.
In the dime stores and bus stations,
People talk of situations,
Read books, repeat quotations,
Draw conclusions on the wall.
Some speak of the future,
My love she speaks softly,
She knows there's no success like failure
And that failure's no success at all.
The cloak and dagger dangles,
Madams light the candles.
In ceremonies of the horsemen,
Even the pawn must hold a grudge.
Statues made of match sticks,
Crumble into one another,
My love winks, she does not bother,
She knows too much to argue or to judge.
The bridge at midnight trembles,
The country doctor rambles,
Bankers' nieces seek perfection,
Expecting all the gifts that wise men bring.
The wind howls like a hammer,
The night blows cold and rainy,
My love she's like some raven
At my window with a broken wing.
","['C', 'G', 'F', 'C', 'G', 'F', 'C', 'Dm', 'F', 'G7', 'C', 'G', 'F', 'C', 'G', 'F', 'C', 'F', 'G7', 'C', 'C', 'G', 'F', 'C', 'G', 'F', 'C', 'Dm', 'F', 'G7', 'C', 'G', 'F', 'C', 'G', 'F', 'C', 'F', 'G7', 'C', 'C', 'G', 'F', 'C', 'G', 'F', 'C', 'Dm', 'F', 'G7', 'C', 'G', 'F', 'C', 'G', 'F', 'C', 'F', 'G7', 'C', 'C', 'G', 'F', 'C', 'G', 'F', 'C', 'Dm', 'F', 'G7', 'C', 'G', 'F', 'C', 'G', 'F', 'C', 'F', 'G7', 'C']"
37,Cant Find My Way Home (ver 6),Blind Faith,https://tabs.ultimate-guitar.com/tab/blind-faith/cant-find-my-way-home-chords-1475023,"Come down off your throne and leave your body alone
  Somebody must change
You are the reason I've been waiting so long
  Somebody holds the key
But I'm near the end and I just ain't got the time
  And I'm wasted and I can't find my   way home
Come down on your own and leave your body alone
  Somebody must change
 You are the reason I've been waiting all these years
  Somebody holds the key
But I'm near the end and I just ain't got the time
Oh, oh, oh, and I'm wasted and I can't find my   way home
  Oooh, oooh, oooh       But I can't find my way home
  Oooh, oooh, oooh       But I can't find my way home
  Oooh, oooh, oooh       But I can't find my way home
  Oooh, oooh, oooh       But I can't find my way home
Still I can't find my way home
And I ain't done nothing wrong
But I can't find my way home
","['Cadd9', 'G/B', 'Gm/Bb', 'D/A', 'F', 'G', 'D', 'Cadd9', 'G/B', 'Gm/Bb', 'D/A', 'F', 'G', 'D', 'G/B', 'A7sus4', 'A7', 'D', 'Em', 'G', 'D/F#', 'Em', 'D', 'Cadd9', 'G/B', 'Gm/Bb', 'D/A', 'F', 'G', 'D', 'Cadd9', 'G/B', 'Gm/Bb', 'D/A', 'F', 'G', 'D', 'G/B', 'A7sus4', 'A7', 'D', 'Em', 'G', 'D/F#', 'Em', 'D', 'Cadd9', 'G/B', 'Gm/Bb', 'D/A', 'F', 'G', 'D', 'Cadd9', 'G/B', 'Gm/Bb', 'D/A', 'F', 'G', 'D', 'Cadd9', 'G/B', 'Gm/Bb', 'D/A', 'F', 'G', 'D', 'Cadd9', 'G/B', 'Gm/Bb', 'D/A', 'F', 'G', 'D', 'F', 'G', 'D', 'F', 'G', 'D', 'F', 'G', 'D']"
38,All Ive Got To Do (ver 4),The Beatles,https://tabs.ultimate-guitar.com/tab/the-beatles/all-ive-got-to-do-chords-1089328,"Whenever I want you around yeh
All I´ve gotta do
Is call you on the phone and you'll come running home 
Yeh that's all I gotta do
And when I, I wanna kiss you yeh 
All I´ve gotta do
Is whisper in your ear the words you want to hear 
and I'll be kissing you 
And the same goes for me whenever you want me at all 
I'll be here, yes, I will whenever you call 
You just gotta call on me, yeh 
you just gotta call on me 
And when I, I wanna kiss you, yeh 
All I´ve gotta do
Is call you on the phone and you'll come running home 
yeh, that's all I gotta do 
And the same goes for me whenever you want me at all 
I'll be here, yes, I will whenever you call 
You just gotta call on me, yeh 
you just gotta call on me 
oh, you just gotta call on me   3x
Hm-mmmmmmmmmmmmmmmmmmmm
","['E', 'C#m', 'E', 'C#m', 'F#m', 'Am', 'E', 'E', 'C#m', 'E', 'C#m', 'F#m', 'Am', 'E', 'E', 'A', 'C#m', 'A', 'E', 'A', 'E', 'E', 'C#m', 'E', 'C#m', 'F#m', 'Am', 'E', 'A', 'C#m', 'A', 'E', 'A', 'E', 'A', 'E', 'C#m', 'E']"
39,Norwegian Wood,The Beatles,https://tabs.ultimate-guitar.com/tab/the-beatles/norwegian-wood-chords-744331,"I once had a girl, or should I say
she once had me.
She showed me her room, isn't it good?
Norwegian wood.
She asked me to stay and told me to sit anywhere,
So, I looked around and I noticed there wasn't
a chair.
I sat on a rug, biding my time,
drinking her wine.
We talked until two, and then she said,
It's time for bed.
She told me she worked in the morning and started
to laugh.
I told her I didn't, and crawled off to sleep in
the bath.
And when I awoke, I was alone, this bird has flown.
So, I lit a fire, isn't it good, Norwegian wood.
","['E', 'B', 'E', 'A', 'E', 'E', 'D', 'E', 'Em', 'A', 'Em', 'B', 'Em', 'F#m', 'B', 'E', 'D', 'E', 'E', 'B', 'E', 'D', 'E', 'Em', 'A', 'A7', 'Em', 'B', 'A', 'Em', 'F#m', 'B', 'E', 'D', 'E']"
40,Good Times Bad Times (ver 2),Led Zeppelin,https://tabs.ultimate-guitar.com/tab/led-zeppelin/good-times-bad-times-chords-1495630,"    In the days of my youth,
    I was told what it means to be a man.
    Now I've reached that age,
    I've tried to do all those things the best I can.
    No matter how I try, I find my way into the same old jam.
Good times, bad times, you know I had my share,
when my woman left home for a brown-eyed man,
well, I still don't seem to care.
    Sixteen: I fell in love with a girl as sweet as could be,
Good times, bad times, you know I had my share,
when my woman left home for a brown-eyed man,
well, I still don't seem to care.
Good times, bad times, you know I had my share,
when my woman left home for a brown-eyed man,
well, I still don't seem to care.
    Oh, I know what it means to be alone,
    I sure do wish I was at home.
    I don't care what the neighbors say,
    I'm gonna love you each and every day.
    You can feel the beat within my heart.
    realize, sweet babe, we ain't ever gonna part....
","['E', 'D', 'A', 'E', 'D', 'A', 'E', 'D', 'A', 'E', 'D', 'A', 'E', 'D', 'A', 'E', 'D', 'A', 'A', 'G', 'A', 'G', 'B7', 'E', 'B7', 'F#', 'B', 'A', 'B', 'A', 'C#7', 'F#', 'C#7', 'A', 'G', 'A', 'G', 'B7', 'E', 'B7', 'E', 'D', 'A', 'E', 'D', 'A', 'E', 'D', 'A', 'E', 'D', 'A', 'E', 'D', 'A', 'E', 'D', 'A', 'E', 'D', 'A']"
41,Julia (ver 4),The Beatles,https://tabs.ultimate-guitar.com/tab/the-beatles/julia-chords-1089762,"Half of what I say is meaningless
But I say it just to reach you, 
Julia
Julia, Julia,  ocean child, calls me
So I sing a song of love, Julia
Julia, seashell eyes, windy smile, calls me
So I sing a song of love, Jul ia
Her hair of floating sky is shimmering, glimmering,
In the sun
Julia, Julia,   morning moon, touch me
So I sing a song of love, Jul ia
When I cannot sing my heart
I can only speak my mind, Julia
Julia, sleeping sand, silent cloud, touch me
So I sing a song of love, Julia
Hum hum hum...calls me
So I sing a song of love, Julia  Julia   Julia
","['C', 'Am7', 'Em', 'G', 'C', 'Am7', 'Em', 'G', 'C', 'Am', 'Gm', 'Gm9', 'A', 'F', 'Fm', 'C', 'Am7', 'Em', 'C', 'C', 'Am7', 'Gm', 'Gm9', 'A', 'F', 'Fm', 'C', 'Am', 'Em', 'G', 'C', 'Bm', 'C', 'Am7', 'Em7', 'Em', 'C', 'Am7', 'Gm', 'Gm9', 'A', 'F', 'Fm', 'C', 'Am7', 'Em', 'G', 'C', 'C', 'Am7', 'Em', 'G', 'C', 'Am7', 'Em', 'G', 'C', 'Am7', 'Gm', 'Gm9', 'A', 'F', 'Fm', 'C', 'Am7', 'Em', 'C', 'A', 'F', 'Fm', 'C', 'Am7', 'G', 'C', 'G', 'C', 'Em', 'G', 'Cmaj7']"
42,A Hard Days Night (ver 3),The Beatles,https://tabs.ultimate-guitar.com/tab/the-beatles/a-hard-days-night-chords-555383,"(break)
It's been a hard day's night
and I've been working like a dog.
It's been a hard day's night
I should be sleeping like a log.
But when I get home to you
I find the things that you do
Will make me feel alright.
You know I work all day
To get you money to buy you things
And it's worth it just to hear you say
You're gonna give me everything
So why on earth should I moan
'cause when I get you alone
you know I'll feel O.K.
When I'm home
Everything seems to be alright
When I'm home
Feeling you holding me tight, tight yeah!!
It's been a hard day's night
and I've been working like a dog.
It's been a hard day's night
I should be sleeping like a log.
But when I get home to you
I find the things that you do
Will make me feel alright. AHHHHH!!!!
So why on earth should I moan
'cause when I get you alone
you know I'll feel O.K.
When I'm home
Everything seems to be alright
When I'm home
Feeling you holding me tight, tight yeah!!
It's been a hard day's night
and I've been working like a dog.
It's been a hard day's night
I should be sleeping like a log.
But when I get home to you
I find the things that you do
Will make me feel alright
 You know I feel alright
 You know I feel alright.    (fade)
","['G7sus4', 'G', 'C', 'G', 'G', 'F', 'G', 'G', 'C', 'G', 'G', 'F', 'G', 'C', 'D', 'G', 'C', 'G', 'G', 'C', 'G', 'G', 'F', 'G', 'G', 'C', 'G', 'G', 'F', 'G', 'C', 'D', 'D', 'G', 'C', 'G', 'Bm', 'Em', 'Bm', 'G', 'Em', 'C', 'D', 'G', 'C', 'G', 'G', 'F', 'G', 'G', 'C', 'G', 'G', 'F', 'G', 'C', 'D', 'G', 'C', 'G', 'C', 'D', 'G', 'C', 'G', 'Bm', 'Em', 'Bm', 'G', 'Em', 'C', 'D', 'G', 'C', 'G', 'G', 'F', 'G', 'G', 'C', 'G', 'G', 'F', 'G', 'C', 'D', 'G', 'C', 'G', 'C', 'G', 'C', 'G', 'C', 'G', 'C', 'Dsus4', 'Dm7', 'Dsus4', 'Dm7', 'Dsus4', 'Dm7']"
43,Got To Get You Into My Life (ver 3),The Beatles,https://tabs.ultimate-guitar.com/tab/the-beatles/got-to-get-you-into-my-life-chords-1061713,"I was alone I took a ride I didn't know what I would find there
Another road where maybe I can see another kind of mind there
Ooh, then I suddenly see you
Ooh, did I tell you I need you
Every single day of my life
You didn't run you didn't lie you know I wanted just to hold you
And had you gone you'd knew in time we meet again for I'd had told you
Ooh you were meant to be near me
Ooh, and I want you hear me
Say we'll be together every day
Got to get you into my life
What can I do? What can I be when I'm with you I wanna stay there
If I'm true I'll never leave and if I do I know the way there
Ooh then I suddenly see you
Ooh did I tell you I need you
Every single day of my life
Got to get you into my life
Got to get you into my life
I was alone, I took a ride, 
Another road where maybe I could see another kind of mind there
Then suddenly I see you,
Did I tell you I need you . . .
","['G', 'F', 'G', 'F', 'Bm', 'D', 'Bm', 'D', 'C', 'Am', 'D', 'G', 'G', 'F', 'G', 'F', 'Bm', 'D', 'Bm', 'D', 'C', 'Am', 'D', 'G', 'G', 'G', 'C', 'F', 'G', 'G', 'F', 'G', 'F', 'Bm', 'D', 'Bm', 'D', 'C', 'Am', 'D', 'G', 'G', 'G', 'C', 'F', 'G', 'G', 'G', 'C', 'F', 'G', 'G', 'F', 'G', 'F', 'G']"
44,All Along The Watchtower,Bob Dylan,https://tabs.ultimate-guitar.com/tab/bob-dylan/all-along-the-watchtower-chords-152504,"""There must be some way out of here,"" said the joker to the thief,
""There's too much confusion, I can't get no relief.
Businessmen, they drink my wine, plowmen dig my earth,
None of them along the line know what any of it is worth.""
""No reason to get excited,"" the thief, he kindly spoke,
""There are many here among us who feel that life is but a joke.
But you and I, we've been through that, and this is not our fate,
So let us not talk falsely now, the hour is getting late.""
All along the watchtower, princes kept the view
While all the women came and went, barefoot servants, too.
Outside in the distance a wildcat did growl,
Two riders were approaching, the wind began to howl.
","['C#m', 'B', 'A', 'B', 'C#m', 'B', 'A', 'B', 'C#m', 'B', 'A', 'B', 'C#m', 'B', 'A', 'B', 'C#m', 'B', 'A', 'B', 'C#m', 'B', 'A', 'B', 'C#m', 'B', 'A', 'B', 'C#m', 'B', 'A', 'B', 'C#m', 'B', 'A', 'B', 'C#m', 'B', 'A', 'B', 'C#m', 'B', 'A', 'B', 'C#m', 'B', 'A', 'B', 'C#m', 'B', 'A', 'B', 'C#m', 'B', 'A', 'B', 'C#m', 'B', 'A', 'B', 'C#m', 'B', 'A', 'B', 'C#m', 'B', 'A', 'B', 'C#m', 'B', 'A', 'B', 'C#m', 'B', 'A', 'B', 'C#m', 'B', 'A', 'B', 'C#m', 'B', 'A', 'B', 'C#m', 'B', 'A', 'B', 'C#m', 'B', 'A', 'B', 'C#m', 'B', 'A', 'B']"
45,Old Friends,Simon & Garfunkel,https://tabs.ultimate-guitar.com/tab/simon-garfunkel/old-friends-chords-83961,"Old   friends. Old   friends.
Sat on their park bench like bookends.
A newspaper blown through the grass falls on the round toes
of the high shoes of the old   friends.
Old   friends. Winter companions, the old   men.
Lost in their overcoats waiting for the sunset.
The sounds of the city, shifting through trees
settle like dust on the shoulders of the old friends.
Can you imagine us years from today, sharing a park bench quietly?
How terribly strange to be seventy.
Old   friends. Memory brushes the same  years.
Silently sharing the same fears.
Time it was and what a time it was, it was a ...
A time of innocence, a time of confidences
Long ago it must be, I have a photograph
Preserve your memories,
they're all that's left you.
","['Fmaj7', 'Cmaj7', 'Fmaj7', 'Cmaj7', 'Dm/F', 'G7', 'C', 'Am', 'G', 'Am', 'Am/G', 'Fmaj7', 'Cmaj7', 'Fmaj7', 'Cmaj7', 'Dm/F', 'G7', 'Fmaj7', 'Em7', 'Dm/F', 'G7', 'C', 'Am', 'G', 'Am', 'G', 'F', 'Dm9', 'Am', 'Dm/F', 'G7', 'Cmaj7', 'F6', 'Fm6', 'Cmaj7', 'Dm/F', 'G7', 'Asus4', 'Fmaj7', 'Cmaj7', 'Dm/F', 'G7', 'Fmaj7', 'Em7', 'G', 'C', 'Am', 'Dm/F', 'Cmaj7', 'F', 'Cmaj7', 'Dm/F', 'C', 'F', 'C']"
46,The End (ver 2),The Doors,https://tabs.ultimate-guitar.com/tab/the-doors/the-end-chords-1053887,"This is the end
Beautiful friend
My only friend, the end
Of our elaborate plans, the end
Of everything that stands, the end
No safety or surprise, the end
I’ll never look into your  eyes...again
Can you picture what will be
So limitless and free
Desperately in need...of some...strangers hand
In a...desperate land
Lost in a romance...wilderness of pain
And all the children are insane
All the children are insane
Waiting for the summer rain, yeah
There’s danger on the edge of town
The west is the best
The blue bus is calling us
The blue bus is calling us
Driver, where you’ve taken us
C’mon baby, take a chance with us
And meet me at the back of the blue bus
Doing a blue rock
On a blue bus
Doing a blue rock
C’mon, yeah
This is the end
Beautiful friend
My only friend, the end
It hurts to set you free
But you’ll never follow me
The end of laughter and soft lies
The end of nights we tried to die
This is the end
","['D', 'C', 'D', 'C', 'D', 'C', 'G', 'D', 'C', 'G', 'D', 'C', 'G', 'D', 'C', 'G', 'D', 'C', 'D', 'G7', 'D', 'C', 'D', 'G', 'D', 'C', 'D', 'D', 'C', 'D', 'C', 'D', 'C', 'D', 'C', 'D', 'D', 'D', 'D', 'C', 'D', 'D', 'C', 'D', 'D', 'C', 'D', 'D', 'C', 'D', 'C', 'D', 'C', 'D', 'C', 'D', 'C', 'D', 'D', 'C', 'D', 'C', 'D', 'C', 'G', 'D', 'C', 'D', 'C', 'D', 'C', 'G', 'D', 'C', 'G', 'D']"
47,Femme Fatale,The Velvet Underground,https://tabs.ultimate-guitar.com/tab/the-velvet-underground/femme-fatale-chords-635,"Here she comes
You better watch your step
She's gonna break your heart in two, yes it's true
It's not hard to realize
Just look into her false colored eyes
She'll bring you up just to put you down, what a clown
Cos everybody knows                  (she's a femme fatale)
The things she does to please        (she's a femme fatale)
She's just a little tease            (she's a femme fatale)
Just see the way she walks and hear the way she talks
You're written in her book
Number 47 have a look
She's going to smile just to make you frown, what a clown
Little boy, she's from the street
Before you start you're already beat
She's going to play you for a fool, it's true
Cos everybody knows                  (she's a femme fatale)
The things she does to please        (she's a femme fatale)
She's just a little tease            (she's a femme fatale)
Just see the way she walks and hear the way she talks
","['Cmaj7', 'Fmaj9', 'Cmaj7', 'Fmaj9', 'Cmaj7', 'F', 'Dm', 'G', 'Cmaj7', 'Fmaj9', 'Cmaj7', 'Fmaj9', 'Cmaj7', 'F', 'Dm', 'G', 'C', 'F', 'C', 'F', 'C', 'F', 'Dm', 'Bb', 'G', 'Cmaj7', 'Fmaj9', 'Cmaj7', 'Fmaj9', 'Cmaj7', 'F', 'Dm', 'G', 'Cmaj7', 'Fmaj9', 'Cmaj7', 'Fmaj9', 'Cmaj7', 'F', 'Dm', 'G', 'C', 'F', 'C', 'F', 'C', 'F', 'Dm', 'Bb', 'G']"
48,Surfin Usa (ver 2),The Beach Boys,https://tabs.ultimate-guitar.com/tab/the-beach-boys/surfin-usa-chords-1053572,"If everybody had an ocean
Across the U.S.A.
Then everybody'd be surfin'
Like California
You'd seem 'em wearing their baggies
Huarachi sandals too
A bushy bushy blonde hairdo
Surfin' U.S.A.
You'd catch 'em surfin' at Del Mar
Ventura County line
Santa Cruz and Trestles
Australia's Narrabeen
All over Manhattan
And down Doheny Way
Everybody's gone surfin'
Surfin' U.S.A.
We'll all be planning out a route
We're gonna take real soon
We're waxing down our surfboards
We can't wait for June
We'll all be gone for the summer
We're on safari to stay
Tell the teacher we're surfin'
Surfin' U.S.A.
Haggerties and Swamies
Pacific Palisades
San Onofre and Sunset
Redondo Beach L.A.
All over La Jolla
At Waimea Bay
Everybody's gone surfin'
Surfin' U.S.A.
Everybody's gone surfin'
Surfin U.S.A
","['C', 'G7', 'C', 'G7', 'C', 'F', 'C', 'G7', 'F', 'C', 'C', 'G7', 'C', 'G7', 'C', 'F', 'C', 'G7', 'F', 'C', 'C', 'G7', 'C', 'G7', 'C', 'F', 'C', 'G7', 'F', 'C', 'C', 'G7', 'C', 'G7', 'C', 'F', 'C', 'G7', 'F', 'C', 'C', 'G7', 'F', 'C']"
49,Love Is All Around,The Troggs,https://tabs.ultimate-guitar.com/tab/the-troggs/love-is-all-around-chords-1049273,"I feel it in my fingers,
I feel it in my toes
Love is all around me,
and so the feeling grows
It's written on the wind,
It's everywhere I go
So if you really love me,
come on and let it show
You know I love you,
I always will
My mind's made up,
by the way that I feel
There's no beginning,
there'll be no end
Cause on my love,
you can depend
I see your face before me,
as I lay on my bed
I kind a get to thinking,
of all the things you said
You gave your promise to me,
and I gave mine to you
I need someone beside me,
in everything I do
You know I love you,
I always will
My mind's made up,
by the way that I feel
There's no beginning,
there'll be no end
Cause on my love,
you can depend
It's written on the wind,
it s everywhere I go
So if you really love me,
come on and let it show
come on and let it show
come on and let it show
come on and let it show
come on and let it show . . .
","['D', 'Em', 'G', 'A', 'D', 'Em', 'G', 'A', 'D', 'Em', 'G', 'A', 'D', 'Em', 'G', 'A', 'D', 'Em', 'G', 'A', 'D', 'Em', 'G', 'A', 'D', 'Em', 'G', 'A', 'D', 'Em', 'G', 'A', 'G', 'Em', 'G', 'D', 'G', 'Em', 'Em', 'A', 'D', 'Em', 'G', 'A', 'D', 'Em', 'G', 'A', 'D', 'Em', 'G', 'A', 'D', 'Em', 'G', 'A', 'D', 'Em', 'G', 'A', 'D', 'Em', 'G', 'A', 'D', 'Em', 'G', 'A', 'D', 'Em', 'G', 'A', 'G', 'Em', 'G', 'D', 'G', 'Em', 'Em', 'A', 'D', 'Em', 'G', 'A', 'D', 'Em', 'G', 'A', 'D', 'Em', 'G', 'A', 'D', 'Em', 'G', 'A', 'D', 'Em', 'G', 'A', 'D', 'Em', 'G', 'A', 'D', 'Em', 'G', 'A', 'D', 'Em', 'G']"
