,name,author,link,lyrics,chords
0,Carry That Weight,The Beatles,https://tabs.ultimate-guitar.com/tab/the-beatles/carry-that-weight-chords-17234,"Boy, you're gonna carry that weight
Carry that weight a long time.
Boy, you're gonna carry that weight
Carry that weight a long time.
(instrumental)
(instrumental)
  I never give you my pil -  low
 I only send you my in -  vitations
 And in the middle of the cele - brations
I break down
Boy, you're gonna carry that weight
Carry that weight a long time.
Boy, you're gonna carry that weight            2/4
Carry that weight a long time.
","['C', 'G', 'G', 'C', 'C', 'G', 'G', 'G7', 'C', 'G/B', 'Am7', 'D7sus4', 'Dm7', 'G7', 'Csus4', 'C', 'Fmaj7', 'Bm7b5', 'E7', 'Am', 'Am7', 'D7sus4', 'Dm7', 'G7', 'Csus4', 'C', 'Fmaj7', 'Bm7b5', 'E7', 'Am7', 'G', 'C', 'G', 'C', 'G', 'G', 'C', 'C', 'G', 'G', 'C', 'G/B', 'A', 'C', 'G/B', 'A']"
1,Strawberry Fields Forever (ver 9),The Beatles,https://tabs.ultimate-guitar.com/tab/the-beatles/strawberry-fields-forever-chords-1693071,"Let me take you down, cos I'm going to Strawberry Fields
Nothing is real and nothing to get hung about
Strawberry Fields forever
Living is easy with eyes closed
Misunderstanding all you see
It's getting hard to be someone but it all works out
It doesn't matter much to me
Let me take you down, cos I'm going to Strawberry Fields
Nothing is real and nothing to get hung about
Strawberry Fields forever
No one I think is in my tree
I mean it must be high or low
That is you can't you know tune in but it's all right
That is I think it's not too bad
Let me take you down, cos I'm going to Strawberry Fields
Nothing is real and nothing to get hung about
Strawberry Fields forever
Always, no sometimes, think it's me
But you know I know when it's a dream
I think I know I mean a ""Yes"" but it's all wrong
That is I think I disagree
Let me take you down, cos I'm going to Strawberry Fields
Nothing is real and nothing to get hung about
Strawberry Fields forever
Strawberry Fields forever
Strawberry Fields forever
","['G', 'Dm', 'Dm7', 'E7', 'C', 'E7', 'C', 'G', 'D', 'Dmaj7', 'D7', 'D7sus2', 'D7', 'Em', 'Em7', 'C', 'C', 'D7', 'G', 'Em', 'C', 'D7', 'C', 'G', 'G', 'Dm', 'Dm7', 'E7', 'C', 'E7', 'C', 'G', 'D', 'Dmaj7', 'D7', 'D7sus2', 'D7', 'Em', 'Em7', 'C', 'C', 'D7', 'G', 'Em', 'C', 'D7', 'C', 'G', 'G', 'Dm', 'Dm7', 'E7', 'C', 'E7', 'C', 'G', 'D', 'Dmaj7', 'D7', 'D7sus2', 'D7', 'Em', 'Em7', 'C', 'C', 'D7', 'G', 'Em', 'C', 'D7', 'C', 'G', 'G', 'Dm', 'Dm7', 'E7', 'C', 'E7', 'C', 'G', 'Em', 'C', 'G', 'C', 'D7', 'C', 'G']"
2,Vivre Pour Le Meilleur,Johnny Hallyday,https://tabs.ultimate-guitar.com/tab/johnny-hallyday/vivre-pour-le-meilleur-chords-2500911,"Des gens qui cherchent la lumière
En pleine nuit
Des gens qui courent après l'amour
Et qui le fuient
Des bras qui se lèvent pour un Dieu
Qu'ils ne voient pas
Moi, j'ai ta chair contre ma chair
En ça je crois
Vivre pour le meilleur
Se vouloir pour tout se donner
Plus riche de ne rien garder
Que l'amour
Des hommes qui n'ont que l'illusion
D'attendre un signe
Des femmes qui pleurent leurs enfants
Et restent dignes
Moi, tu me rends plus fort chaque jour
Sans Dieu ni loi
Et quand nos corps se font l'amour
Je sais pourquoi
Vivre pour le meilleur
Se vouloir pour tout se donner
Plus riche de ne rien garder
Que l'amour
Oui, vivre pour vivre libre
Aimer tout ceux qu'on peut aimer
Encore et toujours ne vouloir
Que l'amour, que l'amour
Vivre pour le meilleur
Se vouloir pour tout se donner
Plus riche de ne rien garder
Que l'amour, que l'amour
Oui, vivre pour vivre libre
Aimer tout ceux qu'on peut aimer
Encore et toujours ne vouloir
Que l'amour, que l'amour
","['Am', 'F', 'Am', 'F', 'C', 'F', 'C', 'E', 'E7', 'A', 'Dm', 'G', 'C', 'F', 'Dm', 'E', 'E7', 'Am', 'F', 'Am', 'F', 'C', 'F', 'C', 'E', 'E7', 'A', 'Dm', 'G', 'C', 'F', 'Dm', 'E', 'E7', 'A', 'Dm', 'G', 'C', 'F', 'Dm', 'E', 'E7', 'A', 'Dm', 'G', 'C', 'F', 'Dm', 'E', 'E7', 'A', 'Dm', 'G', 'C', 'F', 'Dm', 'E', 'E7']"
3,Something,The Beatles,https://tabs.ultimate-guitar.com/tab/the-beatles/something-chords-17436,"Something in the way she moves
Attracts me like no other lover
Something in the way she woos me
I don't want to leave her now
You know I believe and how
Somewhere in her smile she knows
That I don't need no other lover
Something in her style that shows me
I don't want to leave her now
You know I believe and how
You're asking me will my love grow
I don't know, I don't know
You stick around now it may show
I don't know, I don't know
Something in the way she knows
And all I have to do is think of her
Something in the things she shows me
I don't want to leave her now
You know I believe and how
","['A', 'Amaj7', 'A7', 'D', 'B7', 'E', 'F#m', 'F#mmaj7', 'F#m7', 'B', 'D', 'C', 'E', 'A', 'Amaj7', 'A7', 'D', 'B', 'E', 'F#m', 'F#mmaj7', 'F#m7', 'B', 'D', 'C', 'E', 'F#', 'F#', 'F#maj7', 'F#7', 'B', 'E', 'F#', 'F#', 'F#maj7', 'F#7', 'B', 'E', 'A', 'A', 'Amaj7', 'A7', 'D', 'B', 'E', 'F#m', 'F#mmaj7', 'F#m7', 'B', 'D', 'C', 'E', 'F#']"
4,Twist And Shout,The Beatles,https://tabs.ultimate-guitar.com/tab/the-beatles/twist-and-shout-chords-122350,"Well shake it up baby, now  (shake it up baby) 
Twist and shout  (twist and shout) 
C'mon, c'mon, c'mon, c'mon baby, now  (c'mon, baby)
C'mon and work it on out  (work it on out - ooooh)
Well, work it on out  (work it on out) 
You know you look so good  (look so good) 
You know you got me goin' now  (got me goin')  
Just like you knew you would  (like I knew you would - ooooh) 
Well shake it up baby, now  (shake it up baby)
Twist and shout  (twist and shout) 
C'mon, c'mon, c'mon, c'mon baby, now  (c'mon, baby) 
C'mon and work it on out  (work it on out - ooooh) 
You know you twist you little girl  (twist little girl) 
You know you twist so fine  (twist so fine) 
C'mon and twist a little closer, now  (twist a little closer) 
And let me know that you're mine  (let me know you're mine - ooooh) 
Aah, aah, aah, aah
Aaaah, yeah
Shake it up Baby, now  (shake it up baby) 
Twist and shout  (twist and shout) 
C'mon, c'mon, c'mon, c'mon baby, now  (c'mon, baby) 
C'mon and work it on out  (work it on out- ooooh) 
You know you twist you little girl  (twist little girl) 
You know you twist so fine  (twist so fine) 
C'mon and twist a little closer, now  (twist a little closer) 
And let me know that you're mine  (let me know you're mine- ooooh) 
Well shake it, shake it, shake it baby, now  (shake it up baby)    
Well shake it, shake it, shake it baby, now  (shake it up baby)    
Well shake it, shake it, shake it baby, now  (shake it up baby)    
Aah, aah, aah, aah                             x-5-4-5-5(5)
  1 + 2 + 3 + 4 +  1 + 2 + 3 + 4 +        1 + 2 + 3 + 4 +  1 + 2 + 3 + 4 +
  *     *     *
  1 + 2 + 3 + 4 +  1 + 2 + 3 + 4 +  1 + 2 + 3 + 4 +  1 + 2 + 3 + 4 +
  1 + 2 + 3 + 4 +  1 + 2 + 3 + 4 +  1 + 2 + 3 + 4 +  1 + 2 + 3 + 4 +
","['D', 'G', 'A', 'D', 'G', 'A', 'D', 'G', 'A', 'D', 'G', 'A', 'D', 'G', 'A', 'D', 'G', 'A', 'D', 'G', 'A', 'D', 'G', 'A', 'D', 'G', 'A', 'D', 'G', 'A', 'D', 'G', 'A', 'D', 'G', 'A', 'D', 'G', 'A', 'D', 'G', 'A', 'D', 'G', 'A', 'D', 'G', 'A', 'A', 'A7', 'D', 'G', 'A', 'D', 'G', 'A', 'D', 'G', 'A', 'D', 'G', 'A', 'D', 'G', 'A', 'D', 'G', 'A', 'D', 'G', 'A', 'D', 'G', 'A', 'D', 'G', 'A', 'D', 'G', 'A', 'D', 'G', 'A', 'A', 'A7', 'A5', 'A5', 'A#5', 'B5', 'C5', 'C#5', 'D5', 'D9', 'D', 'G', 'A', 'A7', 'D', 'G', 'A', 'A7', 'A', 'D', 'G', 'A', 'D', 'G', 'A', 'D', 'G', 'A', 'D', 'G', 'A']"
5,Youve Got To Hide Your Love Away (ver 7),The Beatles,https://tabs.ultimate-guitar.com/tab/the-beatles/youve-got-to-hide-your-love-away-chords-1089352,"Here I stand, with head in hand, turn my face to the wall.
If she's gone, I can't go on, feeling two foot small.
Everywhere, people stare, each and every day
I can see, them laugh at me, and I hear them say
Hey, you've got to hide your love away
Hey, you've got to hide your love away
How can I, even try, I can never win.
Hearing them, seeing them, in the state I'm in.
How could she, say to me, ""Love will find a way""?
Gather 'round, all you clowns, let me hear you say
Hey, you've got to hide your love away
Hey, you've got to hide your love away
","['G', 'D', 'F', 'G', 'C', 'F', 'C', 'G', 'D', 'F', 'G', 'C', 'F', 'C', 'D', 'G', 'D', 'F', 'G', 'C', 'F', 'C', 'G', 'D', 'F', 'G', 'C', 'F', 'C', 'D', 'G', 'C', 'Dsus4', 'D', 'Dsus2', 'D', 'G', 'C', 'Dsus4', 'D', 'Dsus2', 'D', 'G', 'D', 'F', 'G', 'C', 'F', 'C', 'G', 'D', 'F', 'G', 'C', 'F', 'C', 'D', 'G', 'D', 'F', 'G', 'C', 'F', 'C', 'G', 'D', 'F', 'G', 'C', 'F', 'C', 'D', 'D/C', 'D/B', 'G', 'C', 'Dsus4', 'D', 'Dsus2', 'D', 'G', 'C', 'Dsus4', 'D', 'Dsus2', 'D']"
6,The Crystal Ship,The Doors,https://tabs.ultimate-guitar.com/tab/the-doors/the-crystal-ship-chords-1053687,"Before you slip into unconsciousness, 
I'd like to have another kiss
Another flashing chance at   bliss,
another kiss, another kiss 
The days are bright, and filled with pain, 
enclose me in your gentle rain 
The time you ran was too     insane, 
we'll meet again, we'll meet again 
Oh, tell me where your freedom lies, 
the streets are fields that never die 
Deliver me from reasons  why, 
you'd rather cry, I'd rather fly 
The crystal ship is being filled 
A thousand girls, a thousand thrills
A million ways to spend your  time
When we get back, I'll drop a line 
","['Em', 'Bm', 'Am', 'Em', 'E', 'Em', 'A', 'B', 'A', 'E', 'D', 'E', 'D', 'E', 'Em', 'Bm', 'Am', 'Em', 'E', 'Em', 'A', 'B', 'A', 'E', 'D', 'E', 'D', 'E', 'Em', 'Bm', 'Am', 'Em', 'E', 'Em', 'A', 'B', 'A', 'E', 'D', 'E', 'D', 'E', 'Em', 'Bm', 'Am', 'Em', 'E', 'Em', 'A', 'B', 'A', 'E', 'D', 'E', 'D', 'E']"
7,Love In Vain,The Rolling Stones,https://tabs.ultimate-guitar.com/tab/the-rolling-stones/love-in-vain-chords-373532,"Well I followed her to the station
     with a suitcase in my hand
Yeah I followed her to the station
      with a suitcase in my hand
  Well it's hard to tell, it's hard to tell
    when all your love's in vain
When the train come in the station
     I looked her in the eye
Well the train come in the station
      and I looked her in the eye
  Whoa I felt so sad so lonesome
    that I could not help  but cry
When the train left the station
     it had two lights on behind
Yeah, when the train left the station
     it had two lights on behind
  Whoa the blue light was my baby
    and the red light was my mind
All my love's in vain
Ooo                         hey hey
Ooo
All my love's in vain
","['G', 'G7', 'C', 'D7/F#', 'G', 'D', 'D/F#', 'Em7', 'C', 'G7', 'D', 'G', 'G7', 'C', 'D7/F#', 'G', 'D', 'D/F#', 'Em7', 'C', 'G7', 'D', 'G', 'G7', 'C', 'D7/F#', 'G', 'D', 'D/F#', 'Em7', 'C', 'G7', 'D', 'G', 'G7', 'C', 'D7/F#', 'D', 'D/F#', 'Em7', 'C', 'G7', 'D']"
8,You Cant Always Get What You Want,The Rolling Stones,https://tabs.ultimate-guitar.com/tab/the-rolling-stones/you-cant-always-get-what-you-want-chords-4019,"I saw her today at the reception,
a glass of wine in her hand
I knew she was gonna meet her connection,
at her feet was a footloose man
You can't always get what you want
You can't always get what you want
You can't always get what you want
but if you try sometimes, you might find, you get what you need
I went down to the demonstration,
to get my fair share of abuse
Singing, ""we're gonna vent our frustration,
if we don't we're gonna blow a 50 amp fuse""
You can't always get what you want
You can't always get what you want
You can't always get what you want
but if you try sometimes, you might find, you get what you need
I went down to the Chelsea Drug Store,
to get your prescription filled
I was standing in line with Mr. Jimmy
and man did he look pretty ill
We decided we would have a soda,
my favorite flavour: cherry red
I sung my song to Mr. Jimmy,
and he said one word to me and that was ""dead""
You can't always get what you want
You can't always get what you want
You can't always get what you want
but if you try sometimes, you might find, you get what you need
You can't always get what you want
You can't always get what you want
You can't always get what you want
but if you try sometimes, you might find, you get what you need
I saw her today at the reception,
in her glass was a bleeding man
She was practiced at the art of deception,
I could tell by her bloodstained hands
You can't always get what you want
You can't always get what you want
You can't always get what you want
but if you try sometimes, you might find, you get what you need
You can't always get what you want
You can't always get what you want
You can't always get what you want
but if you try sometimes, you might find, you get what you need
","['G', 'Gadd9', 'G', 'C', 'G', 'Gadd9', 'G', 'C', 'G', 'Gadd9', 'G', 'C', 'G', 'Gadd9', 'G', 'C', 'G', 'Gadd9', 'G', 'C', 'G', 'Gadd9', 'G', 'C', 'G', 'Gadd9', 'G', 'C', 'A', 'C', 'G', 'G', 'Gadd9', 'G', 'C', 'G', 'Gadd9', 'G', 'C', 'G', 'Gadd9', 'G', 'C', 'G', 'Gadd9', 'G', 'C', 'G', 'Gadd9', 'G', 'C', 'G', 'Gadd9', 'G', 'C', 'G', 'Gadd9', 'G', 'C', 'A', 'C', 'G', 'G', 'Gadd9', 'G', 'C', 'G', 'Gadd9', 'G', 'C', 'G', 'Gadd9', 'G', 'C', 'G', 'Gadd9', 'G', 'C', 'G', 'Gadd9', 'G', 'C', 'G', 'Gadd9', 'G', 'C', 'G', 'Gadd9', 'G', 'C', 'G', 'Gadd9', 'G', 'C', 'G', 'Gadd9', 'G', 'C', 'G', 'Gadd9', 'G', 'C', 'G', 'Gadd9', 'G', 'C', 'A', 'C', 'G', 'G', 'Gadd9', 'G', 'C', 'G', 'Gadd9', 'G', 'C', 'G', 'Gadd9', 'G', 'C', 'A', 'C', 'G', 'G', 'Gadd9', 'G', 'C', 'G', 'Gadd9', 'G', 'C', 'G', 'Gadd9', 'G', 'C', 'G', 'Gadd9', 'G', 'C', 'G', 'Gadd9', 'G', 'C', 'G', 'Gadd9', 'G', 'C', 'G', 'Gadd9', 'G', 'C', 'A', 'C', 'G', 'G', 'Gadd9', 'G', 'C', 'G', 'Gadd9', 'G', 'C', 'G', 'Gadd9', 'G', 'C', 'A', 'C', 'G']"
9,Sugar Mountain (ver 3),Neil Young,https://tabs.ultimate-guitar.com/tab/neil-young/sugar-mountain-chords-1088575,"Oh, to live on Sugar Mountain,
with the barkers and the colored balloons
You can't be twenty on Sugar Mountain,
though you're thinking that you're leaving there too soon;
you're leaving there too soon.
It's so noisy at the fair, 
but all your friends are there
And the candy floss you had,
and your mother and your dad.
Oh, to live on Sugar Mountain,
with the barkers and the colored balloons
You can't be twenty on Sugar Mountain,
though you're thinking that you're leaving there too soon;
you're leaving there too soon.
There's a girl just down the aisle,
oh, to turn and see her smile.
You can hear the words she wrote,
as you read the hidden note.
Oh, to live on Sugar Mountain
with the barkers and the colored balloons
You can't be twenty on Sugar Mountain,
though you're thinking that you're leaving there too soon;
you're leaving there too soon.
Now you're underneath the stairs, 
and you're giving back some glares
To the people who you met,
and it's your first cigarette.
Oh, to live on Sugar Mountain,
with the barkers and the colored balloons
You can't be twenty on Sugar Mountain,
though you're thinking that you're leaving there too soon;
you're leaving there too soon.
Now you say you're leaving home,
'cause you want to be alone.
Ain't it funny how you feel,
when you're finding out it's real?
Oh, to live on Sugar Mountain,
with the barkers and the colored balloons
You can't be twenty on Sugar Mountain,
though you're thinking that you're leaving there too soon;
you're leaving there too soon.
Oh, to live on Sugar Mountain,
with the barkers and the colored balloons
You can't be twenty on Sugar Mountain,
though you're thinking that you're leaving there too soon
","['G', 'F', 'G', 'F', 'G', 'F', 'Dm', 'G', 'Dm', 'G', 'G', 'F', 'G', 'F', 'G', 'G', 'F', 'G', 'F', 'G', 'F', 'Dm', 'G', 'Dm', 'G', 'G', 'F', 'G', 'F', 'G', 'G', 'F', 'G', 'F', 'G', 'F', 'Dm', 'G', 'Dm', 'G', 'G', 'F', 'G', 'F', 'G', 'G', 'F', 'G', 'F', 'G', 'F', 'Dm', 'G', 'Dm', 'G', 'G', 'F', 'G', 'F', 'G', 'G', 'F', 'G', 'F', 'G', 'F', 'Dm', 'G', 'Dm', 'G', 'G', 'F', 'G', 'F', 'G', 'F', 'Dm', 'G']"
10,The Wanderer,Dion,https://tabs.ultimate-guitar.com/tab/dion/the-wanderer-chords-67096,"I kiss 'em and I love 'em 'cause to me they're all the same
I hug 'em and I squeeze 'em, they don't even know my name
They call me the Wanderer, yeah, Wanderer
I roam round and round and round and round
There's Flo on my left and there's Mary on my right
And Janie is the girl that I'll be with tonight
And when she asks me which one I love the best
I tear open my shirt and show Rosie on my chest
'Cause I'm the Wanderer, yeah, Wanderer
I roam round and round and round and round
Well, I roam from town to town
With my 2 fists of iron but I'm goin' nowhere
I'm the type of guy that likes to roam around
I'm never in one place; I roam from town to town
And when I find myself a-fallin' for some girl
I hop right into that car of mine and drive around the world
'Cause I'm the Wanderer, yeah, Wanderer
I roam round and round and round and round
I'm the type of guy that likes to roam around
I'm never in one place; I roam from town to town
And when I find myself a-fallin' for some girl
I hop right into that car of mine and drive around the world
'Cause I'm the Wanderer, yeah, Wanderer
I roam round and round and round and round
","['G', 'D', 'A', 'G', 'D', 'D', 'D', 'G', 'D', 'A', 'G', 'D', 'A', 'B7', 'E7', 'D', 'D', 'G', 'D', 'A', 'G', 'D', 'A', 'D', 'D', 'G', 'D', 'A', 'G', 'D']"
11,Touch Me,The Doors,https://tabs.ultimate-guitar.com/tab/the-doors/touch-me-chords-15050,"        1 times: Am7 -stop-
        Touch me babe,
        Can't you see that I am not afraid.
        What was that promise that you made?
        Why won't you tell me what she said?
        What was that promise that she made?
        Now I'm gonna love you
        till the heaven stops the rain.
        I'm gonna love  you
        till the stars fall from the sky
        for you and I.
        1 times: Am7 -stop-
        Touch me babe,
        Can't you see that I am not afraid.
        What was that promise that you made?
        Why won't you tell me what she said?
        What was that promise that she made?
        Now I'm gonna love you
        till the heaven stops the rain.
        I'm gonna love  you
        till the stars fall from the sky
        for you and I.
        I'm gonna love you
        till the heaven stops the rain.
        I'm gonna love  you
        till the stars fall from the sky
        for you and I.
","['Am7', 'Am7', 'Am7', 'G7', 'Am7', 'Am7', 'G7', 'Am7', 'Bm7', 'G', 'Bm', 'C', 'Eb', 'Bb', 'Dm', 'Eb', 'Gb', 'Db', 'Gb', 'Fm', 'Gb', 'Ab', 'Db', 'Gb', 'Fm', 'Gb', 'Ab', 'Gb', 'Db', 'Am7', 'Am7', 'Am7', 'G7', 'Am7', 'Am7', 'G7', 'Am7', 'Bm7', 'G', 'Bm', 'C', 'Eb', 'Bb', 'Dm', 'Eb', 'Gb', 'Db', 'Gb', 'Fm', 'Gb', 'Ab', 'Db', 'Gb', 'Fm', 'Gb', 'Ab', 'Gb', 'Db', 'Gb', 'Fm', 'Gb', 'Ab', 'Db', 'Gb', 'Fm', 'Gb', 'Ab', 'Gb', 'Db']"
12,You Really Got Me,The Kinks,https://tabs.ultimate-guitar.com/tab/the-kinks/you-really-got-me-chords-1056474,"Girl, you really got me goin' 
Yeah, you really got me now 
Oh, yeah, you really got me now 
You Really Got Me 
You Really Got Me 
You Really Got Me 
See, don't ever set me free 
Yeah, you really got me now 
Oh, yeah, you really got me now 
You Really Got Me 
You Really Got Me 
You Really Got Me 
See, don't ever set me free 
Yeah, you really got me now 
Oh, yeah, you really got me now 
You Really Got Me 
You Really Got Me 
You Really Got Me 
","['G', 'A', 'D', 'C', 'D', 'D', 'C', 'D', 'C', 'D', 'D', 'C', 'D', 'C', 'D', 'D', 'C', 'D', 'G', 'A', 'D', 'C', 'D', 'D', 'C', 'D', 'C', 'D', 'D', 'C', 'D', 'C', 'D', 'D', 'C', 'D', 'G', 'A', 'D', 'C', 'D', 'D', 'C', 'D', 'C', 'D', 'D', 'C', 'D', 'C', 'D', 'D', 'C', 'D']"
13,I Shall Be Released (ver 3),The Band,https://tabs.ultimate-guitar.com/tab/the-band/i-shall-be-released-chords-1047049,"They say everything can be replaced  
They say every distance is not near 
So I remember every face  
Of every man who put me here
I see my light come shining 
From the west down to the east  
Any day now, any day now 
I   shall be released 
They say every man needs protection 
They say that every man must fall 
Yet I swear I see my reflection 
Somewhere so high above this wall 
I see my light come shining 
From the west down to the east  
Any day now, any day now 
I   shall be released 
Now yonder stands a man in this lonely crowd  
A man who swears he's not to blame  
All day long I hear him shouting so loud  
Just crying out that he was framed
I see my light come shining 
From the west down to the east  
Any day now, any day now 
I   shall be released 
Any day now, any day now 
I   shall be released 
","['E', 'F#m', 'G#m', 'A', 'E', 'F#m', 'G#m', 'A', 'E', 'B7', 'E', 'F#m', 'G#m', 'A', 'E', 'F#m', 'G#m', 'A', 'E', 'E', 'F#m', 'G#m', 'A', 'E', 'F#m', 'G#m', 'A', 'E', 'B7', 'E', 'F#m', 'G#m', 'A', 'E', 'F#m', 'G#m', 'A', 'E', 'E', 'F#m', 'G#m', 'A', 'E', 'F#m', 'G#m', 'A', 'E', 'B7', 'E', 'F#m', 'G#m', 'A', 'E', 'F#m', 'G#m', 'A', 'E', 'F#m', 'G#m', 'A', 'E']"
14,Suite Judy Blue Eyes (ver 3),"Crosby, Stills & Nash",https://tabs.ultimate-guitar.com/tab/crosby-stills-nash/suite-judy-blue-eyes-chords-1053535,"It's getting to the point
Where I'm no fun anymore
I am sorry
Sometimes it hurts so badly
I must cry out loud
I am lonely
I am yours, you are mine
You are what you are
And you make it hard.
Remember what we've said and done and felt
About each other
Oh babe, have mercy
Don't let the past remind us of what we are not now
I am not dreaming.
I am yours, you are mine
You are what you are
You make it hard.
Tearing yourself, away from me now
You are free, and I am crying
This does not mean, I don't love you
I do, that's forever, 
Yes and for always
I am yours, you are mine
You are what you are
You make it hard.
Something inside is telling me that
I've got your secret.
Are you still listening?
Fear is the lock, and laughter the key to your heart
And I love you
I am yours, you are mine, you are what you are
You make it hard
And you make it hard x3
And you make it hard
Friday evening, Sunday in the afternoon
What have you got to lose?
Tuesday morning, please be gone I'm tired of you.
What have you got to lose?
Can I tell it like it is? (Help me I'm suffering)
Listen to me baby. 
It's my heart that's a suffering (Help me I'm dying)
It's a dying, that's what I have to lose
I've got an answer
I'm going to fly away
What have I got to lose?
Will you come see me Thursdays and Saturdays?
What have you got to lose?
Chestnut brown canary
Ruby throated sparrow
Sing the song, don't be long
Thrill me to the marrow.
Voices of the angels, ring around the moonlight
Asking me, said she so free
How can you catch the sparrow?
Lacy, lilting, leery, losing love, lamenting
Change my life, make it right
Be my lady.
Do do do do  do..do..do..do do 16x
","['D', 'C', 'G', 'D', 'A7', 'G', 'G7', 'D', 'C', 'G', 'D', 'A7', 'G', 'G7', 'D', 'A7', 'G', 'G7', 'D', 'G', 'D', 'C', 'G', 'D', 'A7', 'G', 'G7', 'D', 'C', 'G', 'D', 'A7', 'G', 'G7', 'D', 'A7', 'G', 'G7', 'D', 'G', 'D', 'C', 'G', 'D', 'A7', 'G', 'G7', 'D', 'C', 'G', 'D', 'A7', 'G', 'G7', 'D', 'A7', 'G', 'G7', 'D', 'G', 'D', 'C', 'G', 'D', 'A7', 'G', 'G7', 'D', 'C', 'G', 'D', 'A7', 'G', 'G7', 'D', 'A7', 'G', 'G7', 'D', 'G', 'G', 'D', 'G', 'D', 'G', 'D', 'G', 'G7', 'G', 'D', 'G', 'G7', 'G', 'D', 'C', 'G', 'C', 'G', 'D', 'D', 'G', 'G7', 'G', 'D', 'G', 'G7', 'G', 'D', 'C', 'D', 'C', 'D', 'C', 'Am', 'C', 'Am', 'C', 'D', 'C', 'D', 'C', 'D', 'C', 'Am', 'C', 'Am', 'C', 'D', 'C', 'D', 'C', 'D', 'C', 'Am', 'C', 'Am', 'C', 'D', 'G', 'Am', 'Em', 'C', 'D']"
15,Bus Stop,The Hollies,https://tabs.ultimate-guitar.com/tab/the-hollies/bus-stop-chords-647739,"Bus stop, wet day, she's there, I say, please share my
umbrell...A.
Bus stop, bus goes, she stays, love grows, under my
umbrella.
All that summer we enjoyed it, wind and rain and shine.
That um..brella, we em..ployed it, by August, she was mine.
Every morning I would see her waiting at the stop..
sometimes she'd shopped and she would show me what she'd
bought.
Other people stared as if we were both quite insane,
someday my name and hers are going to be the same.
That's the way the whole thing started, silly but it's
true.
Thinking of a sweet romance beginning in a queue.
Came the sun the ice was melting, no more sheltering now.
Nice to think that that umbrella led me to a vow.
Every morning I would see her waiting at the stop..
sometimes she'd shopped and she would show me what she'd
bought.
Other people stared as if we were both quite insane,
someday my name and hers are going to be the same.
Bus stop, wet day, she's there, I say, please share my
umbrell...A.
Bus stop, bus goes, she stays, love grows, under my
umbrella.
All that summer we enjoyed it, wind and rain and shine.
That um..brella, we em..ployed it, by August, she was mine.
","['Am', 'G', 'Am', 'G', 'Am', 'G', 'Am', 'G', 'Am', 'G', 'Am', 'G', 'Am', 'G', 'Am', 'C', 'G', 'Am', 'Dm', 'Em', 'Am', 'G', 'Am', 'G', 'Am', 'G', 'Am', 'C', 'B7', 'Em', 'C', 'Am', 'B7', 'Em', 'D', 'C', 'B', 'C', 'B7', 'Em', 'D', 'C', 'Am', 'B7', 'Em', 'Am', 'G', 'Am', 'G', 'Am', 'G', 'Am', 'G', 'Am', 'G', 'Am', 'G', 'Am', 'G', 'Am', 'C', 'G', 'Am', 'Dm', 'Em', 'Am', 'G', 'Am', 'G', 'Am', 'G', 'Am', 'C', 'B7', 'Em', 'C', 'Am', 'B7', 'Em', 'D', 'C', 'B', 'C', 'B7', 'Em', 'D', 'C', 'Am', 'B7', 'Em', 'Am', 'G', 'Am', 'G', 'Am', 'G', 'Am', 'G', 'Am', 'G', 'Am', 'G', 'Am', 'G', 'Am', 'C', 'G', 'Am', 'Dm', 'Em', 'Am', 'G', 'Am', 'G', 'Am', 'G', 'Am']"
