,name,author,link,lyrics,chords
16,Shes Leaving Home,The Beatles,https://tabs.ultimate-guitar.com/tab/the-beatles/shes-leaving-home-chords-17357,"Wednesday morning at five o'clock as the day begins 
Silently closing her bedroom door
Leaving the note that she hoped would say more
She goes downstairs to the kitchen clutching a handkerchief
Quietly turning the backdoor key
Stepping outside she is free
She (We gave her most of our lives.)
Is leaving  (Sacrificed most of our lives.)
Home  (We gave her everything money could                   ^ ^ ^ 
She's leaving home after living alone for so many years
Father snores as his wife gets into her dressing gown,
Picks up the letter that's lying there.
Standing alone at the top of the stairs,
She breaks down and cries to her husband ""Daddy our baby's gone!""
Why would she treat us so thoughtlessly?
How could she do this to me?
She (We never thought of ourselves.)
Is leaving  (Never a thought for ourselves.)
Home  (We struggled hard all our lives to get               ^ ^ ^ 
She's leaving home after living alone for so many years
Friday morning at nine o'clock she is far away
Waiting to keep the appointment she made
Meeting a man from the motor trade
She  (What did we do that was wrong?)
Is having  (We didn't know it was wrong.)
Fun  (Fun is the one thing that money can't 
Something inside that was always denied for so many years
She's leaving home (bye bye)
","['E', 'Bm', 'F#m', 'C#m', 'F#7', 'F#m7/B', 'B9', 'F#m7/B', 'B9', 'E', 'Bm', 'F#m', 'C#m', 'F#7', 'F#m7/B', 'B9', 'F#m7/B', 'B9', 'E', 'E', 'E', 'Bm6', 'C#m', 'F#7', 'C#m', 'F#7', 'E', 'Bm', 'F#m', 'C#m', 'F#7', 'F#m7/B', 'B9', 'F#m7/B', 'B9', 'E', 'Bm', 'F#m', 'C#m', 'F#7', 'F#m7/B', 'B9', 'F#m7/B', 'B9', 'E', 'E', 'E', 'Bm6', 'C#m', 'F#7', 'C#m', 'F#7', 'E', 'Bm', 'F#m', 'C#m', 'F#7', 'F#m7/B', 'B9', 'F#m7/B', 'B9', 'E', 'E', 'E', 'Bm6', 'C#m', 'F#7', 'C#m', 'F#7', 'C#m7', 'F#', 'A', 'E']"
17,Yellow Submarine (ver 2),The Beatles,https://tabs.ultimate-guitar.com/tab/the-beatles/yellow-submarine-chords-1089343,"In the town where I was born
Lived a man who sailed to sea
And he told us of his life
In the land of submarines
So we sailed up to the sun
Till we found the sea of green
And we lived beneath the waves
In our yellow submarine
We all live in a yellow submarine
Yellow submarine, yellow submarine
We all live in a yellow submarine 
Yellow submarine, yellow submarine
And our friends are all on board
Many more of them live next door
And the band begins to play 
We all live in a yellow submarine
Yellow submarine, yellow submarine
We all live in a yellow submarine 
Yellow submarine, yellow submarine
As we live a life of ease
Everyone of us has all we need
Sky of blue and sea of green
In our yellow submarine 
We all live in a yellow submarine
Yellow submarine, yellow submarine
We all live in a yellow submarine 
Yellow submarine, yellow submarine 2x
","['G', 'D', 'C', 'G', 'Em', 'Am', 'C', 'D', 'G', 'D', 'C', 'G', 'Em', 'Am', 'C', 'D', 'G', 'D', 'C', 'G', 'Em', 'Am', 'C', 'D', 'G', 'D', 'C', 'G', 'Em', 'Am', 'C', 'D', 'G', 'D', 'G', 'G', 'D', 'G', 'G', 'D', 'C', 'G', 'Em', 'Am', 'C', 'D', 'G', 'D', 'C', 'G', 'G', 'D', 'G', 'G', 'D', 'G', 'G', 'D', 'C', 'G', 'Em', 'Am', 'C', 'D', 'G', 'D', 'C', 'G', 'Em', 'Am', 'C', 'D', 'G', 'D', 'G', 'G', 'D', 'G']"
18,Candy Says,The Velvet Underground,https://tabs.ultimate-guitar.com/tab/the-velvet-underground/candy-says-chords-631," Candy says, I've come to hate my body,
 and all that it requires, in this world.
 Candy says, I'd like to know completely,
 what other souls discreetly, talk about.
 I'm gonna watch the blue birds fly,
 over my shoulder.
 I'm gonna watch them pass me by,
maybe when I'm older.
 What do you think I'd see,
if I could walk away from me?    (4 beat pause)
 Candy says, I hate the quiet places,
 that cause the smallest taste, of what will be.
 Candy says, I hate the big decisions,
 that cause endless revisions, in my mind.
 I'm gonna watch the blue birds fly,
 over my shoulder.
 I'm gonna watch them pass me by,
maybe when I'm older.
 What do you think I'd see,
if I could walk away from me?    (4 beat pause)
..........Doo, Doo, Whaa.........
Doo.......Doo, Doo, Whaa......... (x4)
Doo...
","['D', 'F#m', 'F', 'B', 'Em', 'A', 'D', 'A', 'D', 'F#m', 'F', 'B', 'Em', 'A', 'D', 'A', 'D', 'G', 'E', 'A', 'D', 'G', 'E', 'A', 'C', 'G', 'A', 'C', 'D', 'F#m', 'F', 'B', 'Em', 'A', 'D', 'A', 'D', 'F#m', 'F', 'B', 'Em', 'A', 'D', 'D', 'G', 'E', 'A', 'D', 'G', 'E', 'A', 'C', 'G', 'A', 'C', 'D', 'G', 'D', 'G', 'D']"
19,America (ver 2),Simon & Garfunkel,https://tabs.ultimate-guitar.com/tab/simon-garfunkel/america-chords-464768,"Ooh ooh ooh  a ooh a ooh, ooh ooh ooh  a ooh a ooh
Let us be lovers, we'll marry our fortunes together
I've got some real-estate here in my bag
So we bought a pack of cigarettes, and Mrs. Wagner pies
And walked off to look for America
Cathy I said as we boarded the Greyhound in Pittsburg
Michigan seems like a dream to me now
It took me four days to hitch-hike from Saginaw
And I've come to look for America
Laughing on the bus, playing games with the faces
She said the man in the gabardine suit was a spy
I said be careful his bowtie is really a camera
Toss me a cigarette I think there's one in my raincoat
We smoked the last one an hour ago
So I looked at the scenery,  she read her magazine
And the moon rose over an open field
Cathy I'm lost, I said, though I knew she was sleeping
I'm empty and aching and I don't know why
Counting the cars on the New Jersey Turnpike
They've all come to look for America
They've all come to look for America
They've all come to look for America
Do do do do-da-do, do do do do-da-do (repeat and fade)
","['C', 'C/B', 'Am', 'C/G', 'F', 'C', 'C/B', 'Am', 'C/G', 'F', 'C', 'C/B', 'Am', 'C/G', 'F', 'C', 'C/B', 'Am', 'Am7', 'Em7', 'A7', 'Em7', 'A7', 'Em7', 'D', 'C', 'G', 'C', 'C/B', 'Am', 'F', 'C', 'C/B', 'Am', 'C/G', 'F', 'C', 'C/B', 'Am', 'Am7', 'G', 'Em7', 'D', 'G', 'D', 'Cmaj7', 'C', 'Bbmaj7', 'Bb', 'C', 'Bbmaj7', 'C', 'C/B', 'Am', 'C/G', 'F', 'Fmaj7', 'C', 'C/B', 'Am', 'C/G', 'Am6', 'Fmaj7', 'C', 'C/B', 'Am', 'C/G', 'F', 'C', 'C/B', 'Am', 'Am7', 'Em7', 'A7', 'Em7', 'A7', 'Em7', 'D', 'C', 'G', 'C', 'C/B', 'Am', 'C/G', 'F', 'C', 'C/B', 'Am', 'C/G', 'F', 'C', 'C/B', 'Am', 'Am7', 'G', 'D', 'G', 'D', 'Cmaj7', 'D', 'G', 'D', 'Cmaj7', 'D', 'G', 'D', 'Cmaj7', 'C', 'C', 'C/B', 'Am', 'C/G', 'Dm', 'F', 'G', 'G7']"
20,Up On Cripple Creek (ver 3),The Band,https://tabs.ultimate-guitar.com/tab/the-band/up-on-cripple-creek-chords-1055475,"When I get off of this mountain, you know where I want to go?
Straight down the Mississippi river, to the Gulf of Mexico
To Lake Charles, Louisiana, little Bessie, girl that I once knew
She told me just to come on by, if there's anything she could do
Up on Cripple Creek she sends me
If I spring a leak she mends me
I don't have to speak, she defends me
A drunkard's dream if I ever did see one
Good luck had just stung me, to the race track I did go
She bet on one horse to win and I bet on another to show
The odds were in my favor, I had 'em five to one
When that nag to win came around the track, sure enough we had won
Up on Cripple Creek she sends me
If I spring a leak she mends me
I don't have to speak, she defends me
A drunkard's dream if I ever did see one
I took up all of my winnings, and I gave my little Bessie half
And she tore it up and threw it in my face, just for a laugh
Now there's one thing in the whole wide world, I sure do like to see
That's how that little sweet thing of mine, dips her doughnut in my tea
Up on Cripple Creek she sends me
If I spring a leak she mends me
I don't have to speak, she defends me
A drunkard's dream if I ever did see one
Now me and my mate were back at the shack, we had Spike Jones on the box
She said, ""I can't take the way he sings, but I love to hear him talk""
Now that just gave my heart a throb, to the bottom of my feet
And I swore as I took another pull, my Bessie can t be beat 
Up on Cripple Creek she sends me
If I spring a leak she mends me
I don't have to speak, she defends me
A drunkard's dream if I ever did see one
Now there's a flood out in California and up north it's freezing cold
And this living off the road is getting pretty old
So I guess I'll call up my big mama, tell her I'll be rolling in
But you know, deep down, I'm kind of tempted 
To go and see my Bessie again.
Up on Cripple Creek she sends me
If I spring a leak she mends me
I don't have to speak, she defends me
A drunkard's dream if I ever did see one
","['A', 'D', 'A', 'D', 'E', 'A', 'D', 'A', 'D', 'E', 'A', 'D', 'E', 'F#m', 'G', 'A', 'D', 'A', 'D', 'E', 'A', 'D', 'A', 'D', 'E', 'A', 'D', 'E', 'F#m', 'G', 'A', 'D', 'A', 'D', 'E', 'A', 'D', 'A', 'D', 'E', 'A', 'D', 'E', 'F#m', 'G', 'A', 'D', 'A', 'D', 'E', 'A', 'D', 'A', 'D', 'E', 'A', 'D', 'E', 'F#m', 'G', 'A', 'D', 'A', 'D', 'E', 'A', 'D', 'A', 'D', 'E', 'A', 'D', 'E', 'F#m', 'G']"
21,A Well Respected Man,The Kinks,https://tabs.ultimate-guitar.com/tab/the-kinks/a-well-respected-man-chords-10199,"Cos he gets up in the morning and he goes to work at nine
And he comes back home at five thirty, gets the same train every time
Cos his world is built on punctuality, it never fails
Cos he's oh so good, and he's oh so fine
And he's oh so healthy in his body and his mind
He's a well respected man about town
Doing the best things so conservatively
And his mother goes to meetings while his father pulls the maid
And she stirs the tea with councillors while discussing foreign trade
And she passes looks as well as bills at every suave young man ...
Cos he's oh so good, and he's oh so fine
And he's oh so healthy in his body and his mind
He's a well respected man about town
Doing the best things so conservatively
And he likes his own backyard and he likes his fags the best
Cos he's better than the rest and his arm sweat smells the best
And he hopes to grab his father's loot when Pater passes on ...
Cos he's oh so good, and he's oh so fine
And he's oh so healthy in his body and his mind
He's a well respected man about town
Doing the best things so conservatively
And he plays the stocks and shares and he goes to a regatta
He adores the girl next door cos he's dying to get at her
But his mother knows the best about the matrimonial stakes ...
Cos he's oh so good, and he's oh so fine
And he's oh so healthy in his body and his mind
He's a well respected man about town
Doing the best things so conservatively
","['C', 'C/B', 'Am', 'C', 'C/B', 'Am', 'C', 'C/B', 'Am', 'C', 'C/B', 'Am', 'C', 'C/B', 'Am', 'C', 'C/B', 'Am', 'C', 'C/B', 'Am', 'C', 'C/B', 'Am', 'C', 'C/B', 'Am', 'C', 'C/B', 'Am', 'F', 'Em', 'F', 'D', 'G', 'G/C', 'G', 'C', 'C/B', 'Am', 'C', 'C/B', 'Am', 'C', 'C/B', 'Am', 'C', 'C/B', 'Am', 'C', 'C/B', 'Am', 'C', 'C/B', 'Am', 'C', 'C/B', 'Am', 'C', 'C/B', 'Am', 'C', 'C/B', 'Am', 'C', 'C/B', 'Am', 'F', 'Em', 'F', 'D', 'G', 'G/C', 'G', 'C', 'C/B', 'Am', 'C', 'C/B', 'Am', 'C', 'C/B', 'Am', 'C', 'C/B', 'Am', 'C', 'C/B', 'Am', 'C', 'C/B', 'Am', 'C', 'C/B', 'Am', 'C', 'C/B', 'Am', 'C', 'C/B', 'Am', 'C', 'C/B', 'Am', 'F', 'Em', 'F', 'D', 'G', 'G/C', 'G', 'C', 'C/B', 'Am', 'C', 'C/B', 'Am', 'C', 'C/B', 'Am', 'C', 'C/B', 'Am', 'C', 'C/B', 'Am', 'C', 'C/B', 'Am', 'C', 'C/B', 'Am', 'C', 'C/B', 'Am', 'C', 'C/B', 'Am', 'C', 'C/B', 'Am', 'F', 'Em', 'F', 'D', 'G', 'G/C', 'G']"
22,To Love Somebody (ver 5),Bee Gees,https://tabs.ultimate-guitar.com/tab/bee-gees/to-love-somebody-chords-2437013," There’s a light
 a certain kind of light
 that never shone on me,
 I want my life to be
 lived with you,
 lived with you.
 There’s a way
 everybody say
 to do each and every little thing
 but what does it bring
 if I ain’t got you,
 ain’t got.
Baby you don’t know what it's like
baby you don’t know what it's like
to love somebody,
to love somebody
the way I love you.
 In my brain
 I see your face again
 I know my frame of mind
 you ain’t got to be so blind
 and I’m blind,
 so, so so blind.
 I’m a man,
 can’t you see what I am?
 I live and breathe for you
 but what good does it do
 if I ain’t got you,
 ain’t got.
Baby, you don’t know what it's like,
baby, you don’t know what it's like
to love somebody,
to love somebody
the way I love you.
Oooooooh
you don’t know what it's like,
baby, you don’t know what it's like
to love somebody...
to love somebody...
the way I love you.
No no no no no no no
you don’t know what it's like,
baby, you don’t know what it's like
to love somebody...
","['G', 'Am', 'C', 'G', 'F', 'G', 'D', 'C', 'G', 'Am', 'C', 'G', 'F', 'G', 'D', 'C', 'G', 'D', 'C', 'G', 'D', 'C', 'G', 'G', 'Am', 'C', 'G', 'F', 'G', 'D', 'C', 'G', 'Am', 'C', 'G', 'F', 'G', 'D', 'C', 'G', 'D', 'C', 'G', 'D', 'C', 'G', 'D', 'G', 'D', 'C', 'G', 'D', 'C', 'G', 'D', 'G', 'D', 'C', 'G', 'D', 'G']"
23,Dream A Little Dream Of Me,The Mamas & The Papas,https://tabs.ultimate-guitar.com/tab/the-mamas-the-papas/dream-a-little-dream-of-me-chords-282391,"Stars shining bright above you 
Night breezes seem to whisper ""I love you"" 
Birds singing in the sycamore tree 
Dream a little dream of me 
Say ""Nightie-night"" and kiss me 
Just hold me tight and tell me you'll miss me 
While I'm alone and blue as can be 
Dream a little dream of me 
Stars fading but I linger on, dear 
Still craving your kiss 
I'm longing to linger till dawn, dear 
Just saying this 
Sweet dreams till sunbeams find you 
Sweet dreams that leave all worries behind you 
But in your dreams whatever they be 
Dream a little dream of me
","['C', 'B7', 'Am', 'E7', 'C', 'B7', 'A7', 'Dm', 'Fdim7', 'C', 'B7', 'Am', 'E7', 'C', 'B7', 'Am', 'E7', 'C', 'B7', 'A7', 'Dm', 'Fdim7', 'C', 'B7', 'Am', 'E7', 'A', 'F#m', 'Bm', 'E7', 'A', 'F#m', 'Bm', 'E7', 'A', 'F#m', 'Bm', 'E7', 'A', 'E7', 'C7', 'C', 'B7', 'Am', 'E7', 'C', 'B7', 'A7', 'Dm', 'Fdim7', 'C', 'B7', 'Am', 'E7']"
24,Im A Believer (ver 4),The Monkees,https://tabs.ultimate-guitar.com/tab/the-monkees/im-a-believer-chords-380449,"I thought love was only true in fairy tales.
Meant for someone else but not for me.
Love was out to get me
  That's the way it seemed.
  Disappointment haunted all my dreams.
Then I saw her face,
now I'm a believer
Not a trace
of doubt in my mind.
I'm in love,                    ooh
I'm a believer! I couldn't leave her if I tried.
I thought love was more or less a given thing,
Seems the more I gave, the less I got.
What's the use in tryin'?
 All you get is pain.
  When I needed sunshine I got rain.
Then I saw her face,
now I'm a believer
Not a trace
of doubt in my mind.
I'm in love,                    ooh
I'm a believer! I couldn't leave her if I tried.
Oh, love was out to get me
 Now that's the way it seemed.
  Disappointment haunted all my dreams.
Then I saw her face,
now I'm a believer
Not a trace
of doubt in my mind.
I'm in love,                    ooh
I'm a believer! I couldn't leave her if I tried.
Yes, I saw her face,
now I'm a believer
Not a trace
of doubt in my mind.
Said I'm a believer (yeah, yeah, yeah, yeah, yeah, yeahhhh)
I'm a believer
Said I'm a believer (I'm a believer)
Said I'm a believer (I'm a believer)
","['G', 'D', 'G', 'G', 'D', 'G', 'C', 'G', 'C', 'G', 'C', 'G', 'D', 'G', 'C', 'G', 'C', 'G', 'C', 'G', 'C', 'G', 'C', 'G', 'C', 'G', 'C', 'G', 'C', 'G', 'C', 'G', 'F', 'D', 'G', 'D', 'G', 'G', 'D', 'G', 'C', 'G', 'C', 'G', 'C', 'G', 'D', 'G', 'C', 'G', 'C', 'G', 'C', 'G', 'C', 'G', 'C', 'G', 'C', 'G', 'C', 'G', 'C', 'G', 'C', 'G', 'F', 'D', 'C', 'G', 'C', 'G', 'C', 'G', 'D', 'G', 'C', 'G', 'C', 'G', 'C', 'G', 'C', 'G', 'C', 'G', 'C', 'G', 'C', 'G', 'C', 'G', 'C', 'G', 'F', 'D', 'G', 'C', 'G', 'C', 'G', 'C', 'G', 'C', 'G', 'C', 'G', 'C', 'G', 'C', 'G', 'C', 'G', 'C', 'G', 'C', 'G', 'C', 'G', 'C', 'G', 'C', 'G', 'C', 'G', 'C', 'G']"
25,Honey Pie,The Beatles,https://tabs.ultimate-guitar.com/tab/the-beatles/honey-pie-chords-768560," She was a working girl
 North of England way
Now she's hit the big time
 In the U.S.A.
And if she could only hear me
This is what I'd say
Honey pie, you are making me crazy
I'm in love but I'm lazy
So won't you please come home
Oh honey pie, my position is tragic
Come and show me the magic
of your Hollywood song
You became a legend of the silver screen
And now the thought of meeting you
Makes me weak in the knee
Oh honey pie, you are driving me frantic
Sail across the Atlantic
To be where you belong, honey pie come back to me
I like it like that, ooh
    I like this kind of hot kind of music
Hot kind of music
Just play it to me
Play it to me Hollywood Blues
Will the wind that blew her boat
Across the sea
Kindly send her sailing back to me
Honey pie, you are making me crazy
I'm in love but I'm lazy
So won't you please come home
Come, come back to me honey pie
(scat vocals)
","['Em', 'A6', 'Am/D', 'Cm', 'G', 'Em', 'A6', 'Am/D', 'Cm', 'G', 'A7', 'D7', 'G', 'Eb7', 'E7', 'A7', 'D7', 'G', 'Eb7', 'D7', 'G', 'Eb7', 'E7', 'A7', 'D7', 'G', 'F#', 'F', 'Em', 'C#m7b5', 'G', 'G7', 'C', 'E7', 'Am', 'D7', 'G', 'Eb7', 'E7', 'A7', 'D7', 'G', 'Eb7', 'D7', 'Eb7', 'D7', 'G', 'Eb7', 'E7', 'A7', 'D7', 'G', 'F#', 'F', 'Em', 'C#m7b5', 'G', 'G7', 'C', 'E7', 'Am', 'D7', 'G', 'Eb7', 'E7', 'A7', 'D7', 'G', 'Eb7', 'D7', 'G', 'G', 'Eb7', 'E7', 'A7', 'D7', 'G', 'Eb7', 'D7', 'G']"
26,Dear Prudence (ver 2),The Beatles,https://tabs.ultimate-guitar.com/tab/the-beatles/dear-prudence-chords-1044378,"Dear Prudence             won't you come out to play
Dear Prudence             greet the brand new day
The sun is up, the sky is blue it's beautiful, and so are you 
Dear Prudence won't you come out to play         
Dear Prudence             open up your eyes
Dear Prudence             see the sunny skies
The wind is low, the birds will sing
That you are part of everything
Dear Prudence  won't you open up you eyes
Look around round round round round round round round
Look around round round round round round round round
Look around
Dear Prudence             let me see you smile
Dear Prudence             like a little child
The clouds will be a daisy chain
So let me see you smile again
Dear Prudence  won't you let me see you smile
","['D', 'D7', 'Gmaj7/D', 'D+', 'D', 'D7', 'Gmaj7/D', 'D+', 'D', 'D7', 'Gmaj7/D', 'D+', 'D', 'D7', 'Gmaj7/D', 'D+', 'D', 'D+', 'Gmaj7/D', 'Gm', 'D+', 'D', 'C', 'G', 'D', 'D7', 'Gmaj7/D', 'D+', 'D', 'D7', 'Gmaj7/D', 'D+', 'D', 'D7', 'Gmaj7/D', 'D+', 'D', 'D7', 'Gmaj7/D', 'D+', 'D', 'D7', 'Gmaj7/D', 'D+', 'D', 'D+', 'Gmaj7/D', 'Gm', 'D+', 'D', 'C', 'G', 'D', 'D', 'G/D', 'A/D', 'G/D', 'D', 'G/D', 'A/D', 'G/D', 'D', 'F', 'G', 'D', 'D', 'D7', 'Gmaj7/D', 'D+', 'D', 'D7', 'Gmaj7/D', 'D+', 'D', 'D7', 'Gmaj7/D', 'D+', 'D', 'D7', 'Gmaj7/D', 'D+', 'D', 'D+', 'Gmaj7/D', 'Gm', 'D+', 'D', 'C', 'G', 'D']"
27,Happiness Is A Warm Gun,The Beatles,https://tabs.ultimate-guitar.com/tab/the-beatles/happiness-is-a-warm-gun-chords-17264,"Am6    x-0-2-2-1-2
Em     0-2-2-0-0-0
She's not a girl   who misses much
 Du du du du du du       Oh yeah
 She's well acquainted with the touch of the velvet hand
like a lizard on a window pane
The man in the crowd with the multicoloured mirrors on his hobnail boots
Lying with his eyes while his hands are busy working overtime
 A soap impression of his wife which he ate and donated to the National Trust
I need a fix 'cause I'm goin' down, down to the bits that I left up town
I need a fix 'cause I'm goin' down
Mother Superior jump the gun,     Mother Superior jump the gun
Mother Superior jump the gun,     Mother Superior jump the gun
Mother Superior jump the gun,     Mother Superior jump the gun
  Happiness is a warm gun (happiness, bang bang shoot shoot)
  Happiness is a warm gun, mama (happiness, bang bang shoot shoot)
  When I hold you   in my arms (ooooh oh yea)
  And I feel my finger on your trigger (oooh oh yea)
  I know nobody can do me no harm, because (oooh oh yea)
Happiness is a warm gun mama (happiness, bang bang shoot shoot)
  Happiness is a warm gun yes it is (happiness, bang bang shoot shoot)
Happiness is a warm yes it is
Gun                  Don't you know that
Happiness is a warm gun mama, etc.
","['Am7', 'Am6', 'Emadd9', 'Em', 'Am7', 'Am6', 'Emadd9', 'Em', 'Dm', 'Am', 'Dm', 'Am', 'Dm', 'Am', 'Dm', 'Am', 'A7', 'C', 'A7', 'C', 'A7', 'G7', 'A7', 'C', 'A7', 'G7', 'A7', 'C', 'A7', 'G7', 'C', 'Am', 'F', 'G7', 'C', 'Am', 'F', 'G7', 'C', 'Am', 'F', 'G7', 'C', 'Am', 'F', 'G7', 'C', 'Am', 'F', 'G7', 'C', 'Am', 'F', 'G7', 'C', 'Am', 'F', 'G7', 'Fm', 'C', 'Am', 'F', 'G7', 'C', 'Am', 'F', 'G7']"
28,Play With Fire (ver 3),The Rolling Stones,https://tabs.ultimate-guitar.com/tab/the-rolling-stones/play-with-fire-chords-1051354,"Well, you've got your diamonds and you've got your pretty clothes
But don't play with me, cause you're playing with fire
Your mother she's an heiress, owns a block in Saint John's Wood
But don't play with me, cause you're playing with fire
Your old man took her diamonds and tiaras by the score
So don't play with me, cause you're playing with fire
Now you've got some diamonds and you will have some others
So don't play with me, cause you're playing with fire
So don't play with me, cause you're playing with fire
","['Em', 'G', 'D', 'G', 'C', 'Em', 'Em', 'G', 'D', 'G', 'C', 'Em', 'Em', 'G', 'D', 'G', 'C', 'Em', 'Em', 'G', 'D', 'G', 'C', 'Em', 'G', 'D', 'G', 'C', 'Em']"
29,Paperback Writer,The Beatles,https://tabs.ultimate-guitar.com/tab/the-beatles/paperback-writer-chords-349641," Dear Sir or Mad-am will you read my book?
 It took me years to write  will you take a look?
 It's based on a nov-el by a man named Lear
 and I need a job so I want to be a pa-per-back writ - er
 pa - per - back writ - er.
 It's the dir-ty sto-ry of a dirt-y man and his cling-ing wife
 does-n't un-der-stand. His son is work - ing for the dai-ly Mail
 It's a stead-y job but he wants to be a pa-per-back writ-er
 pa - per-back writ - er.
 It's a thousand pag-es give or take a few, I'll be writ-ing more
 in a week or two. I can make long-er if you like the style,
 I can change it round and I want to be a pa-per-back writ - er
 pa - per-back writ - er.
 If you real - ly like it you can have the rights,
 it could make a mil - lion for you o-ver-night.
 If you must re - turn it you can send it  here,
 But I need a break and I want to be a pa-per-back writ - er
 pa - per-back writ - er.
","['G7', 'G7', 'G7', 'G7', 'C', 'G7', 'G7', 'G7', 'G7', 'C', 'G7', 'G7', 'G7', 'G7', 'C', 'G7', 'G7', 'G7', 'G7', 'G7', 'C', 'G7']"
30,All My Loving (ver 2),The Beatles,https://tabs.ultimate-guitar.com/tab/the-beatles/all-my-loving-chords-1489130," Close your eyes and I'll kiss you
 tomorrow I'll miss you
 re-member I'll always be true
 And then while I'm a-way
 I'll write home every-day
 and I'll send all my loving to you
 I'll pre-tend that I'm kissing
 the lips I am missing 
 and hope that my dreams will come true
 and then while I'm a-way
 I'll write home every-day
 and I'll send all my loving to you
 All my loving  I will send to you
 All my loving  darling I'll be true 
(** = use hybrid-picking with a flat pick AND middle finger)
 Close your eyes and I'll kiss you
 tomorrow I'll miss you
 re-member I'll always be true
 And then while I'm a-way
 I'll write home every-day
 and I'll send all my loving to you
 All my loving  I will send to you
 All my loving  darling I'll be true
 All my loving 
 All my loving  ooohh  
 All my loving  
 I will send to you
 Bbaug xx4332  or 6x4331
","['F#m', 'B', 'E', 'C#m', 'A', 'F#m', 'D', 'B7', 'F#m', 'B', 'E', 'C#m', 'A', 'B', 'E', 'F#m', 'B', 'E', 'C#m', 'A', 'F#m', 'D', 'B7', 'F#m', 'B', 'E', 'C#m', 'A', 'B', 'E', 'C#m', 'Caug', 'E', 'C#m', 'Caug', 'E', 'A7', 'A7', 'E', 'E', 'F#m', 'B7', 'E', 'F#m', 'B', 'E', 'C#m', 'A', 'F#m', 'D', 'B7', 'F#m', 'B', 'E', 'C#m', 'A', 'B', 'E', 'C#m', 'Caug', 'E', 'C#m', 'Caug', 'E', 'C#m', 'E', 'C#m', 'E', 'Bm']"
31,Tell Me Why (ver 5),The Beatles,https://tabs.ultimate-guitar.com/tab/the-beatles/tell-me-why-chords-1053651,"Tell me why  you cried  and why you lied to me
Tell me why  you cried  and why you lied to me
Well I gave you everything I had, but you left me sitting on my own
Did you have to treat me oh so bad, all I do is hang my head and moan
Tell me why  you cried  and why you lied to me
Tell me why  you cried  and why you lied to me
If there's something I have said or done, Tell me what and I'll apolo-gize
If you don't really can't go on, Holding back these tears in my eyes
Tell me why  you cried  and why you lied to me
Tell me why  you cried  and why you lied to me
Well I' m  beg in on my bended knees, if you'll only listen to my pleas
Is there anything I can do   Cause I really can't stand it, I'm soo in love with you
Tell me why  you cried  and why you lied to me
Tell me why  you cried  and why you lied to me
","['A7', 'D', 'Bm', 'Em', 'A7', 'D', 'Em', 'A7', 'D', 'Bm', 'Em', 'A7', 'D', 'Em', 'A7', 'A7', 'D', 'Bm', 'Em', 'A7', 'D', 'Bm', 'Em', 'A7', 'A7', 'D', 'Bm', 'Em', 'A7', 'D', 'Em', 'A7', 'D', 'Bm', 'Em', 'A7', 'D', 'Em', 'A7', 'A7', 'D', 'Bm', 'Em', 'A7', 'D', 'Bm', 'Em', 'A7', 'A7', 'D', 'Bm', 'Em', 'A7', 'D', 'Em', 'A7', 'D', 'Bm', 'Em', 'A7', 'D', 'D7', 'D7', 'G7', 'A7', 'Bm', 'Em', 'A7', 'D', 'A7', 'D', 'Bm', 'Em', 'A7', 'D', 'Em', 'A7', 'D', 'Bm', 'Em', 'A7', 'D', 'Bm', 'Bb', 'A7', 'D']"
