,name,author,link,lyrics,chords
44,Dear God (ver 2),XTC,https://tabs.ultimate-guitar.com/tab/xtc/dear-god-chords-1941507,"||:  /  /  /  /  |  /  /  /  /  :||[x2]
      Dear God, hope you got the letter, and...
   ...I pray ...you can make it better down  ...here,
      I don't mean a big re - duction in the price of beer,
      But all the people that you made in your image,
See them starving on their feet,
'Cause they don't get enough to eat,
From   ...God---------------,
I can't believe in   ...you--------------------!
      Dear God, sorry to disturb you, but...
      I feel ...that I should be heard loud and   ...clear,
      We all need a big re - duction in amount of ...tears,
      And all the people that you made in your image,
See them fighting in the street,
'Cause they can't make opinions meet...
...About   ...God---------------,
I can't believe in  ...you--------------------!
      Did you make disease,
And the diamond blue----------?  | /  /  /__/   /__/  | 
      Did you make mankind, 
After we made you-------!   Mm---, mmm---, mm-------!
            And the devil  ...too--------------------?
|  /  /  /  / |  /  /  /  /  |  /  /  /  / |  /  /  /  / |
|  /  /  /  /  |  /  /  /  /  |
      Dear God, don't know if you've noticed, but...
   ...Your name ...is on a lot of quotes in this ...book,
      And us crazy humans wrote it, you should take a look,
      And all the people that you made in your image,
Still be - lieving that junk is true,
Well, I know it ain't, ...so do you,
Dear   ...God---------------,
I can't believe in...
I don't believe in...
I won't believe in heaven and hell,
No saints, no sinners, no devil as well,
No pearly gates, no thorny crown,
You're always letting us humans down,
The wars you bring, the babes you drown,
Those lost at sea and never found!
And it's the same the whole world 'round,
The hurt I see helps to compound...
...That Father, Son, and Holy Ghost...
...Is just somebody's unholy hoax,
And, if you're up there, you'd perceive...
...That my heart's here upon my sleeve,
If there's one thing I don't believe in...
 ...It's you-------------------------------------------,
Dear God!
","['Am', 'Fmaj7', 'Am/G', 'D9/F#', 'Am', 'Fmaj7', 'Am/G', 'D9/F#', 'C', 'C/G#', 'D7sus2', 'D9/F#', 'C', 'C/G#', 'D7sus2', 'D9/F#', 'D', 'D/C', 'Bb', 'E7', 'Am', 'Fmaj7', 'Am/G', 'D9/F#', 'Am', 'Fmaj7', 'Am/G', 'D9/F#', 'Am', 'Fmaj7', 'Am/G', 'D9/F#', 'C', 'C/G#', 'D7sus2', 'D9/F#', 'C', 'C/G#', 'D7sus2', 'D9/F#', 'D', 'D/C', 'Bb', 'E7', 'Am', 'Fmaj7', 'Am/G', 'D9/F#', 'Am', 'Fmaj7', 'Am/G', 'D9/F#', 'Fmaj7', 'C', 'C', 'C/B', 'C/A', 'C/G', 'C', 'C', 'C/B', 'C/A', 'C/G', 'Fmaj7', 'Em7', 'Em6', 'C/E', 'Cdim', 'E7', 'Am', 'Fmaj7', 'Am/G', 'D9/F#', 'Am', 'Fmaj7', 'Am/G', 'D9/F#', 'C', 'C/G#', 'D7sus2', 'D9/F#', 'C', 'C/G#', 'D7sus2', 'D9/F#', 'D', 'D/C', 'Bb', 'E7', 'Am', 'Fmaj7', 'Am/G', 'D9/F#', 'C', 'C/G#', 'D7sus2', 'D9/F#', 'C', 'C/G#', 'D7sus2', 'D9/F#', 'D', 'D/C', 'Bb', 'E7', 'Am', 'Fmaj7', 'Am/G', 'D9/F#', 'Am', 'Fmaj7', 'Am/G', 'D9/F#', 'Am', 'Fmaj7', 'Am/G', 'Dm', 'Bb', 'Dm', 'Bb', 'G7', 'Bb', 'Dm', 'Bb', 'G7', 'Bb', 'Dm', 'Bb', 'G7', 'A7', 'Dsus2', 'Dsus2/Bb', 'Dsus2/C', 'Dsus2/F', 'Dsus2/G', 'Dsus2/E', 'D']"
45,Flame Trees,Cold Chisel,https://tabs.ultimate-guitar.com/tab/cold-chisel/flame-trees-chords-65018,"The kids are driving and Saturday afternoon just passed me by
I'm just savouring familiar sights
We shared some history, this town and I
And I can't stop that long-forgotten feeling of her
In time to book a room and stay tonight
Number 1 is to find some friends and say ""you're doing well --
After all this time you boys look just the same""
Number 2 is the Happy Hour at one of two hotels
And settle in to play ""Do you remember so-and-so""
Number 3 is never say her name
And oh the flame trees'll blind a weary driver
And there's nothing that can set fire to this town
There's no change, there's no pace, everything within its place,
Just makes it harder to believe that she won't be around
Oh, who needs that sentimental bullshit anyway
It takes more than just a memory to make me cry
And I'm happy just to sit here at a table with old friends
And see which one of us can tell the biggest lies
And there's a girl, she's fallin' in love near where the pianola stands
With a young local factory auto worker - just holdin' hands
And I'm wondering if he'll go or if he'll stay
Do you remember, nothing stopped us on the field in our day
And oh the flame trees'll blind a weary driver
And there's nothing that can set fire to this town
There's no change, there's no pace, everything within its place,
Just makes it harder to believe that she won't be around
And oh the flame trees'll blind a weary driver
And there's nothing that can set fire to this town
There's no change, there's no pace, everything within its place,
Just makes it harder to believe that she won't be around
","['A', 'E', 'A', 'E', 'A', 'E', 'A', 'B', 'G#m', 'A', 'A', 'B', 'E', 'Esus4', 'E', 'A', 'E', 'A', 'E', 'A', 'E', 'A', 'B', 'G#m', 'A', 'A', 'B', 'E', 'Esus4', 'E', 'A', 'B', 'F#m', 'A', 'B', 'E', 'Esus4', 'E', 'A', 'B', 'C#m', 'E', 'A', 'B', 'E', 'Esus4', 'E', 'A', 'E', 'A', 'E', 'A', 'E', 'A', 'E', 'A', 'E', 'A', 'E', 'A', 'G#m', 'B', 'C', 'G', 'C', 'G', 'D', 'E', 'A', 'B', 'F#m', 'A', 'B', 'E', 'Esus4', 'E', 'A', 'B', 'C#m', 'E', 'A', 'B', 'E', 'Esus4', 'E', 'A', 'B', 'F#m', 'A', 'B', 'E', 'Esus4', 'E', 'A', 'B', 'C#m', 'E', 'A', 'B', 'E', 'Esus4', 'E']"
46,Create In Me A Clean Heart,Keith Green,https://tabs.ultimate-guitar.com/tab/keith-green/create-in-me-a-clean-heart-chords-1043432,"Create in me a clean heart oh God,
And renew a right spirit within me.
Create in me a clean heart oh God,
And renew a right spirit within me.
And cast me not away from Thy presence oh Lord,
And take not Thy Holy Spirit from me.
Restore unto me the joy of Thy salvation,
And renew a right spirit within me.
","['G', 'D', 'C7', 'G', 'C7', 'D', 'G', 'G', 'D', 'C7', 'G', 'C7', 'D', 'G', 'C', 'D', 'Em', 'G', 'C', 'D', 'Em', 'C', 'D', 'Em', 'D', 'G', 'C7', 'D', 'G']"
47,Je Te Donne (ver 2),Jean-Jacques Goldman,https://tabs.ultimate-guitar.com/tab/jean-jacques-goldman/je-te-donne-chords-1091053,"I can give you a voice, bred with rhythm and soul
The heart of a Welsh boy who's lost his home
Put it in harmony let the words ring
Carry your thoughts in the songs we sing
Je te donne mes notes, je te donne mes mots
Quand ta voix les emporte à ton propre tempo
Une épaule fragile et solide à la fois
Ce que j'imagine et ce que je crois
Je te donne toutes mes différences
Tous ces défauts qui sont autant de chances
On sera jamais des 'standards', des gens bien comme il faut
Je te donne ce que j'ai, ce que je vaux
I can give you the force
Of my ancestral pride
The will to go on when I'm hurt deep inside
whatever the feeling, whatever the way
It helps me go on from day to day
Je te donne nos doutes et notre indicible espoir
Les questions que les routes ont laissées dans l'histoire
Nos filles sont brunes et l'on parle un peu fort
Et l'humour et l'amour sont nos trésors
Je te donne toutes mes différences
Tous ces défauts qui sont autant de chances
On sera jamais des 'standards', des gens bien comme il faut
Je te donne ce que j'ai, ce que je vaux
Je te donne, donne, donne, ce que je suis
I can give you my voice, bred with rhythm and soul
Je te donne mes notes, je te donne ma voix
The songs that I love and the stories I've told
Ce que j'imagine et ce que je crois
I can make you feel good even when I'm down
Les raisons qui me portent et ce stupide espoir
My force is a platform that you can climb on
Une épaule fragile et forte à la fois
Je te donne,      houuu, je te donne
Tout ce que je vaux, ce que je suis, mes dons, mes défauts
Mes plus belles chances, mes différences
Je te donne
","['Em7', 'Cadd9', 'D4', 'G', 'Em7', 'Cadd9', 'D4', 'G', 'G', 'Cadd9', 'D4', 'Em7', 'Cadd9', 'G/B', 'Cadd9', 'D4', 'D', 'Em7', 'Cadd9', 'D4', 'G', 'Em7', 'Cadd9', 'D4', 'G', 'G', 'Cadd9', 'D', 'Em7', 'Cadd9', 'G/B', 'Cadd9', 'D4', 'D', 'C', 'D', 'G', 'C', 'G', 'C', 'D', 'Em', 'C', 'D', 'G', 'Am', 'C', 'G', 'C', 'D', 'Em7', 'Cadd9', 'D4', 'G', 'Em7', 'Cadd9', 'D4', 'G', 'G', 'Cadd9', 'D4', 'Em7', 'Cadd9', 'G', 'Cadd9', 'D4', 'Em7', 'Cadd9', 'D4', 'G', 'Em7', 'Cadd9', 'D4', 'G', 'G', 'Cadd9', 'D', 'Em7', 'Cadd9', 'G', 'Cadd9', 'D4', 'D', 'C', 'D', 'G', 'C', 'G', 'C', 'D', 'Em', 'C', 'D', 'G', 'Am', 'C', 'G', 'C', 'D', 'C', 'G', 'Am', 'G', 'C', 'D', 'E', 'Am', 'F', 'G', 'C', 'Am', 'F', 'G', 'C', 'C', 'F', 'G', 'Am', 'F', 'C', 'F', 'G', 'Am', 'F', 'G', 'C', 'Am', 'F', 'G', 'C', 'C', 'F', 'G', 'Am', 'F', 'C', 'F', 'G', 'C', 'F', 'G', 'Am', 'F', 'C', 'G', 'Am', 'F', 'C', 'G', 'Am', 'F', 'C', 'F', 'G', 'C', 'F', 'G', 'C']"
48,Amanda,Boston,https://tabs.ultimate-guitar.com/tab/boston/amanda-chords-61201,"Babe, tomorrow's so far away.
There's somethin' I just have to say.
I don't think I could hide
what I'm feelin' inside - another day
knowin' I love you.
And I, I'm gettin' too close again.
I don't wanna see it end.
If I could tell you tonight,
will you turn out the light - and walk away
knowin' I love you?
I'm gonna take you by surprise
and make you realize, Amanda.
I'm gonna tell you right away;
I can't wait another day, Amanda.
I'm gonna say it like a man
and make you understand, Amanda. (second time: Oh, girl.)
I love you. (not sung second time)
And, I feel like today's the day
I'm lookin' for the words to say.
Do you wanna be free?
Are you ready for me - to feel this way?
I don't wanna lose ya.
So, it may be too soon, I know.
The feelin' takes so long to grow.
If I tell you today
will you turn me away - and let me go?
I don't wanna lose you.
I'm gonna take you by surprise
and make you realize, Amanda.
I'm gonna tell you right away;
I can't wait another day, Amanda.
I'm gonna say it like a man
and make you understand, Amanda. (second time: Oh, girl.)
I love you.
You and I, I know that we can't wait.
And I swear, I swear it's not a lie, girl.
Tomorrow may be too late.
You, you and I, girl,
we can share a life together.
It's now or never,
and tomorrow may be too late.
Oh. Ooo Oh Ooo Oh.
And, feelin' the way I do,
I don't wanna wait my whole life through
to say  -  I'm in love with you.
","['G', 'C/G', 'G', 'Em', 'Bm', 'C', 'G/B', 'Am', 'Am/G', 'Dsus4', 'D', 'G', 'C/G', 'G', 'Em', 'Bm', 'C', 'G/B', 'Am', 'Am/G', 'D', 'C/D', 'G/D', 'D', 'Em', 'Am7', 'D', 'Dsus4', 'D', 'D(add9)', 'D', 'Em', 'Am7', 'D', 'Dsus4', 'D', 'D(add9)', 'D', 'Em', 'Am7', 'D', 'Csus2', 'G', 'C/G', 'G', 'Em', 'Bm', 'C', 'G/B', 'Am', 'Am/G', 'D', 'D7sus4', 'G', 'C/G', 'G', 'Em', 'Bm', 'C', 'G/B', 'Am', 'Am/G', 'D', 'Em', 'Am7', 'D', 'Dsus4', 'D', 'D(add9)', 'D', 'Em', 'Am7', 'D', 'Dsus4', 'D', 'D(add9)', 'D', 'Em', 'Am7', 'D', 'Csus2', 'E', 'Bm7', 'E', 'Bm7', 'C', 'D', 'G', 'D/F#', 'Em', 'Em/D', 'C', 'C/B', 'Am', 'Am/G', 'D', 'C/D', 'G/D', 'D', 'G', 'C/G', 'G', 'Em', 'Bm', 'Am', 'Am/G', 'D']"
49,So Far Away,Dire Straits,https://tabs.ultimate-guitar.com/tab/dire-straits/so-far-away-chords-15417,"        Here I am again in this mean old town, and you're so far away from me
        Now where are you when the sun goes down, and you're so far away from me
        So far away from me,  so far I just can't see
        So far away from me,  you're so far from me  (all right)
       I'm tired of bein' in love and bein' all alone, when you're so far away from me
        I'm tired of maki'n out on the telephone, 'cuz your so far away from me
        So far away from me,  so far I just can't see
        So far away from me,  you're so far from me  (all right)
        And I get so tired when I have to explain, you're so far away from me
        See you been in the sun and I been in the rain and you're so far away from me
        So far away from me,  so far I just can't see
        So far away from me,  you're so far from me  (take it out) 
       you´re so far away,     you´re so far away from me. 
","['E', 'B', 'E', 'E', 'B', 'E', 'A', 'C#m', 'B', 'E', 'A', 'C#m', 'B', 'A', 'E', 'B', 'A', 'E', 'E', 'B', 'E', 'E', 'B', 'E', 'A', 'C#m', 'B', 'E', 'A', 'C#m', 'B', 'A', 'E', 'B', 'A', 'E', 'B', 'A', 'E', 'E', 'B', 'E', 'E', 'B', 'E', 'A', 'C#m', 'B', 'E', 'A', 'C#m', 'B', 'A', 'E', 'B', 'A', 'E']"
