,name,author,link,lyrics,chords
14,New Years Day,U2,https://tabs.ultimate-guitar.com/tab/u2/new-years-day-chords-87434,"All is quiet on New Year's Day
A world in white, gets underway
I want to be with you, be with you night and day
Nothing changes on New Year's Day
On New Year's Day
I will be with you again
I will be with you again
Under a blood red sky
A crowd has gathered, black and white
Arms entwined, the chosen few
Newspaper say, says, say it's true, it's true
And we can break through
Though torn in two, we can be one
I, I will begin again
I, I will begin again, yeah
I will be with you again
I will be with you again
","['Am', 'C', 'Em', 'Am', 'C', 'Em', 'Am', 'C', 'Em', 'Am', 'C', 'Em', 'Am', 'Em', 'G', 'Am', 'G', 'F', 'Am', 'C', 'Em', 'Am', 'C', 'Em', 'Am', 'C', 'Em', 'Am', 'C', 'Em', 'Am', 'C', 'Em', 'G', 'Am', 'G', 'F', 'G', 'Am', 'G', 'F', 'Am', 'C', 'Em', 'Am', 'G', 'Am', 'G', 'F', 'Am', 'C', 'Em']"
15,Were Not Gonna Take It,Twisted Sister,https://tabs.ultimate-guitar.com/tab/twisted-sister/were-not-gonna-take-it-chords-1163174,"We're not gonna take it
No, we ain't gonna take it
We're not gonna take it anymore
  We've got the right to choose and
  There ain't no way we'll lose it
  This is our life, this is our song
  We'll fight a thousand legions
  Don't pick our destiny 'cause
  You don't know us, you don't belong
We're not gonna take it
No, we ain't gonna take it
We're not gonna take it anymore
  Oh you're so condescending
  Your gall is never ending
  We don't want nothin', not a thing from you
  Your life is trite and jaded
  Boring and confiscated
  If that's your best, your best won't do
  oh......oh...oh...........
  oh......oh...oh...........
we're right/yeah
we're free/yeah
we'll fight/yeah
you'll see/yeah
We're not gonna take it
No, we ain't gonna take it
We're not gonna take it anymore
We're not gonna take it
No, we ain't gonna take it
We're not gonna take it anymore
  oh......oh...oh...........
  oh......oh...oh...........
we're right/yeah
we're free/yeah
we'll fight/yeah
you'll see/yeah
We're not gonna take it anymore
We're not gonna take it
No, we ain't gonna take it
We're not gonna take it anymore
","['E', 'B', 'E', 'A', 'E', 'B', 'E', 'D#5', 'C#m7', 'B', 'E', 'B', 'E', 'A', 'E', 'B', 'E', 'B', 'E', 'B', 'E', 'A', 'E', 'B', 'E', 'B', 'E', 'B', 'E', 'A', 'E', 'B', 'E', 'D#5', 'C#m7', 'B', 'E', 'B', 'E', 'A', 'E', 'B', 'E', 'B', 'E', 'B', 'E', 'A', 'E', 'B', 'E', 'D#5', 'C#m7', 'B', 'D', 'C#m', 'Bm', 'D', 'C#m', 'Bm', 'E', 'F', 'F#', 'B', 'E', 'B', 'E', 'A', 'E', 'B', 'E', 'B', 'E', 'B', 'E', 'A', 'E', 'B', 'E', 'D#5', 'C#m7', 'B', 'D', 'C#m', 'Bm', 'D', 'C#m', 'Bm', 'E', 'F', 'F#', 'B', 'B', 'E', 'B', 'E', 'A', 'E', 'B', 'E', 'B']"
16,Every Woman In The World,Air Supply,https://tabs.ultimate-guitar.com/tab/air-supply/every-woman-in-the-world-chords-2848469,"Overnight scenes, dinner and wine, Saturday girls.
I was never in love, never had the time,
In my hustle and hurry world.
Laughing myself to sleep,
Waking up lonely,
I needed someone to hold me, oh.
It's such a crazy old town it can drag you down,
Till you run out of dreams.
So you party all night to the music and lights,
But you don't know what happiness means.
I was dancing in the dark with strangers,
No love around me,
When suddenly you found me, oh.
Girl, you're every woman in the world to me.
You're my fantasy, you're my reality.
Girl, you're every woman in the world to me.
You're everything I need, you're everything to me
Oh girl.
Everything good, everything fine,
That's what you are.
So put your hand in mine and together we'll climb,
As high as the highest star
I'm living a lifetime in every minute,
That we're together.
And I'll stay right here forever,   oh.
Girl, you're every woman in the world to me.
You're my fantasy, you're my reality.
Girl, you're every woman in the world to me.
You're everything I need, you're everything to me.
Oh girl.
Girl, you're every woman in the world to me.
You're my fantasy, you're my reality.
Girl, you're every woman in the world to me.
You're everything I need, you're everything to me. (repeat till fade)
","['A', 'D', 'A', 'D', 'Bm7', 'Bm7/E', 'C#m7', 'F#m7', 'Bm7', 'Bm7/A', 'D/E', 'A', 'D', 'A', 'D', 'Bm7', 'Bm7/E', 'C#m7', 'F#m7', 'Bm7', 'Bm7/A', 'E7/G#', 'E7', 'A', 'A/C#', 'D', 'Bm7', 'Bm7/E', 'A', 'A/C#', 'D', 'A/C#', 'Bm7', 'C#sus', 'C#', 'F#', 'B', 'F#', 'Db/F', 'Bb', 'Eb', 'Bb', 'Eb', 'Cm', 'Cm/F', 'Dm', 'Gm7', 'Cm7', 'Cm7/Bb', 'F7/A', 'F7', 'Bb', 'Bb/D', 'Eb', 'Cm7', 'Cm7/F', 'Bb', 'Bb/D', 'Eb', 'Cm7', 'Dsus', 'D', 'G', 'C', 'E/F#', 'B', 'B/D#', 'E', 'C#m7', 'C#m7/F#', 'B', 'B/D#', 'E', 'B/D#', 'C#m7', 'C#m7/F#']"
17,Thunder Road (ver 3),Bruce Springsteen,https://tabs.ultimate-guitar.com/tab/bruce-springsteen/thunder-road-chords-344758,"The screen door slams  Mary's dress waves       Like a vision she dances 
across the porch    As the radio plays    Roy Orbison singing for the lonely
Hey that's me and I want you only    Don't turn me home again  I just can't face 
myself alone again
Don't run back inside    darling you know just what I'm here for
So you're scared and you're thinking   That maybe we ain't that young anymore
Show a little faith, there's magic in the night
You ain't a beauty, but hey you're alright   Oh and that's alright with me
You can hide neath your covers  And study your pain  Make crosses from your lovers
Throw roses in the rain   Waste your summer praying in vain
For a saviour to rise from these streets   Well now I'm no hero
That's understood  All the redemption I can offer, girl Is beneath this dirty hood
 With a chance to make it good somehow  Hey what else can we do now
Except roll down the window   And let the wind blow back your hair
Well the night's busting open   These two lanes will take us anywhere
We got one last chance to make it real   To trade in these wings on some wheels
Climb in back   Heaven's waiting on down the tracks   
Oh oh come take my hand     Riding out tonight to case the promised land  
Oh oh Thunder Road, oh Thunder Road oh Thunder Road  
Lying out there like a killer in the sun      Hey I know it's late 
we can make it if we run   Oh Thunder Road, sit tight take hold   Thunder Road
Well I got this guitar    And I learned how to make it talk
And my car's out back    If you're ready to take that long walk
From your front porch to my front seat  The door's open but the ride it ain't free
And I know you're lonely   For words that I ain't spoken
But tonight we'll be free    All the promises'll be broken
There were ghosts in the eyes    Of all the boys you sent away
They haunt this dusty beach road  In the skeleton frames of burned out Chevrolets
They scream your name at night in the street Your graduation gown lies in rags at 
their feet        And in the lonely cool before dawn
You hear their engines roaring on   But when you get to the porch they're gone
On the wind, so Mary climb in    It's a town full of losers
And I'm pulling out of here to win.
","['F', 'Bb', 'F', 'F', 'C', 'Bb', 'C', 'F', 'Bb', 'F', 'C', 'F', 'Bb', 'F', 'C', 'Bb', 'C', 'F', 'Bb', 'F', 'C', 'F', 'Dm', 'F', 'Bb', 'F', 'Am', 'Bb', 'C7', 'F', 'Dm', 'F', 'Bb', 'F', 'Am', 'Bb', 'C7', 'F', 'Bb', 'F', 'C', 'Bb', 'C', 'F', 'Bb', 'F', 'C', 'F', 'Dm', 'F', 'Bb', 'F', 'Am', 'Bb', 'C7', 'F', 'Dm', 'F', 'Bb', 'F', 'Am', 'Bb', 'C7', 'F', 'Bb', 'C', 'F', 'Dm', 'Bb', 'C', 'Bb', 'C', 'Am', 'Dm', 'Bb', 'Bb/A', 'Gm7', 'Bb/F', 'C', 'F', 'Bb', 'F', 'C', 'Bb', 'C', 'F', 'Bb', 'Am', 'Bb', 'Gm', 'C', 'Bb', 'Gm', 'Bb', 'C', 'F', 'F']"
18,Should I Stay Or Should I Go,The Clash,https://tabs.ultimate-guitar.com/tab/the-clash/should-i-stay-or-should-i-go-chords-27335,"Darling you've got to let me know
Should I stay or should I go
If you say that you are mine
I'll be there til the end of time
So you've gotta let me know
Should I stay or should I go
Should I stay or should I go now?
Should I stay or should I go now?
If I go there will be trouble
And if I stay it will be double
So come on and let me know
Should I stay or should I go?
","['D', 'G', 'D', 'D', 'G', 'D', 'G', 'F', 'G', 'D', 'G', 'D', 'A', 'D', 'G', 'D', 'D', 'G', 'D', 'D', 'G', 'D', 'G', 'F', 'G', 'D', 'G', 'D', 'A', 'G', 'F', 'G']"
19,Maneater,Hall & Oates,https://tabs.ultimate-guitar.com/tab/hall-oates/maneater-chords-353751,"She'll only come out at night
The lean and hungry type
Nothing is new, I've seen her here before
Watching and waiting
Ooh, she's sittin' with you but her eyes are on the door
So many have paid to see
What you think you're getting for free
The woman is wild, a she-cat tamed by the purr of a Jaguar
Money's the matter
If you're in it for love, you ain't gonna get too far
(Oh-oh, here she comes) Watch out boy she'll chew you up
(Oh-oh, here she comes) She's a maneater
(Oh-oh, here she comes) Watch out boy she'll chew you up
(Oh-oh, here she comes) She's a maneater
I wouldn't if I were you
I know what she can do
She's deadly man, she could really rip your world apart
Mind over matter
Ooh, the beauty is there but a beast is in the heart
","['D', 'A', 'C', 'B', 'Em', 'A', 'Bm', 'D', 'A', 'C', 'B', 'Em', 'A', 'Bm', 'Bm', 'A', 'G', 'F#', 'Bm', 'A', 'Em', 'G', 'A', 'D', 'A', 'C', 'B', 'Em', 'A', 'Bm']"
20,Heaven (ver 3),Bryan Adams,https://tabs.ultimate-guitar.com/tab/bryan-adams/heaven-chords-158982," Oh, thinkin' about all our younger years, there was only you and me,
 we were young and wild and free. Now nothin' can take you away from me,
 we've been down that road before, but that's over now,
 you keep me comin' back for more.
 Baby you're all that I want, when you're lyin' here in my arms,
I'm findin' it hard to believe, we're in heaven.
And love is all that I need, and I found it here in your heart,
  It isn't too hard to see, we're in heaven.
 Baby you're all that I want, when you're lyin' here in my arms,
I'm findin' it hard to believe, we're in heaven.
And love is all that I need, and I found it here in your heart,
  It isn't too hard to see, we're in heaven.
 I've been waitin' for  so  long, for somethin' to arrive,
 For love to come along.        
Through the good times and the bad, Ya, I'll be standin' there by you.
","['G', 'Em', 'D', 'Am', 'Em', 'F', 'D', 'G', 'Em', 'D', 'Am', 'Em', 'F', 'D', 'C', 'D', 'Em', 'G', 'C', 'C', 'D', 'Em', 'D', 'C', 'D', 'Em', 'G', 'C', 'C', 'D', 'Em', 'D', 'C', 'D', 'Em', 'G', 'C', 'C', 'D', 'Em', 'D', 'C', 'D', 'Em', 'G', 'C', 'C', 'D', 'Em', 'D', 'Am', 'G', 'C', 'D', 'Em', 'Am', 'D', 'D', 'D', 'D', 'D', 'D', 'D']"
21,Please Please Please Let Me Get What I Want,The Smiths,https://tabs.ultimate-guitar.com/tab/the-smiths/please-please-please-let-me-get-what-i-want-chords-84209,"       Good times for a change.
See the luck I've had could make a good man turn bad.
So  please please please  let me   let me   let me....let me
get what I want this time.
      Haven't had a dream in a long time.
See the life I've had could make a good man bad.
So for once in my life let me   get what I want.
Lord knows it would be the first time.
Lord knows it would be the first time.
","['Dmaj7', 'A', 'D', 'A', 'F#m', 'G', 'A', 'Asus4', 'A', 'G', 'A', 'D', 'A', 'Gmaj7', 'A', 'Bm', 'Gmaj7', 'A', 'Dmaj7', 'A', 'D', 'A', 'F#m', 'G', 'A', 'Asus4', 'A', 'G', 'A', 'D', 'A', 'Gmaj7', 'A', 'Bm', 'Gmaj7', 'A', 'D', 'D7']"
22,Kids In America,Kim Wilde,https://tabs.ultimate-guitar.com/tab/kim-wilde/kids-in-america-chords-932973,"Looking out a dirty old window.
Down below the cars in the city go rushing by.
I sit here alone and I wonder why.
Friday night and everyone's moving.
Heading down,
I search for the beat in this dirty town.
Down town the young ones are going.
Down town the young ones are growing.
We're the kids in America.
We're the kids in America.
Everybody live for the music-go-round.
Bright lights, the music gets faster.
Look boy, don't check on your watch, not another glance.
I'm not leaving now, honey not a chance.
Hot-shot, give me no problems.
Much later baby you'll be saying never mind.
You know life is cruel, life is never kind.
Kind hearts don't make a new story.
Kind hearts don't grab any glory.
We're the kids in America.
We're the kids in America.
Everybody live for the music-go-round.
Come closer, honey that's better.
Feeling right.
Oh, don't try to stop baby, hold me tight.
Outside a new day is dawning.
Outside Suburbia's sprawling everywhere.
I don't want to go baby.
New York to East California.
There's a new wave coming I warn you.
We're the kids in America.
We're the kids in America.
Everybody live for the music-go-round.
We're the kids
We're the kids
We're the kids in America
We're the kids
We're the kids
We're the kids in America
We're the kids
We're the kids
We're the kids in America
We're the kids
We're the kids
We're the kids in America
","['B', 'A', 'G', 'A', 'E', 'B', 'A', 'G', 'A', 'E', 'E', 'F#', 'G', 'D', 'G', 'D', 'G', 'A', 'B', 'B', 'A', 'G', 'A', 'E', 'B', 'A', 'G', 'A', 'E', 'E', 'F#', 'G', 'D', 'G', 'D', 'G', 'A', 'B', 'B', 'A', 'G', 'A', 'E', 'B', 'A', 'G', 'A', 'E', 'F#', 'G', 'D', 'G', 'D', 'G', 'A', 'B', 'B', 'G', 'E', 'B', 'G', 'E', 'B', 'G', 'E', 'B', 'G', 'E']"
23,Pour Some Sugar On Me (ver 2),Def Leppard,https://tabs.ultimate-guitar.com/tab/def-leppard/pour-some-sugar-on-me-chords-1506911,"Demolition woman, can I be your man? (Your man)
Razzle 'n' a dazzle 'n' a flash a little light
C'mon,   take a bottle,   shake it up
   Break the bubble,   break it up
Pour some sugar on me, ooh, in the name of love
Pour some sugar on me, c'mon, fire me up
Pour your sugar on me, oh, I can't get enough
   I'm hot, sticky sweet, from my head to my feet, yeah
Sweet dream, saccharine, loosen up (Loosen up)
You gotta squeeze a little, squeeze a little, tease a little more
    Take a bottle,   shake it up
   Break the bubble,   break it up
Pour some sugar on me, ooh, in the name of love
Pour some sugar on me, c'mon, fire me up
Pour your sugar on me, oh, I can't get enough
   I'm hot, sticky sweet, from my head to my feet, yeah
Do you take sugar? One lump or two?
    Take a bottle,   shake it up
   Break the bubble,   break it up
Pour some sugar on me, ooh, in the name of love
Pour some sugar on me, c'mon, fire me up
Pour your sugar on me, oh, I can't get enough
Pour some sugar on me, ooh, in the name of love
Pour some sugar on me, (adlib)...
Pour your sugar on me, (adlib)...
Pour some sugar on me, yeah! Sugar me!
","['C#m', 'C#m', 'F#', 'C#m', 'B', 'F#', 'C#m', 'B', 'E', 'B', 'A', 'E', 'A', 'B', 'E', 'A', 'B', 'E', 'A', 'B', 'E', 'A', 'B', 'C#m', 'C#m', 'C#', 'F#', 'C#m', 'B', 'F#', 'C#m', 'B', 'E', 'B', 'A', 'E', 'A', 'B', 'E', 'A', 'B', 'E', 'A', 'B', 'E', 'A', 'B', 'C#m', 'E', 'F#', 'C#m', 'B', 'F#', 'C#m', 'B', 'E', 'B', 'A', 'E', 'A', 'B', 'E', 'A', 'B', 'E', 'A', 'B', 'E', 'A', 'B', 'E', 'A', 'B', 'E', 'A', 'B', 'E', 'A', 'B', 'E', 'A', 'B', 'E', 'A', 'B']"
24,Call Me (ver 2),Blondie,https://tabs.ultimate-guitar.com/tab/blondie/call-me-chords-1043971,"Color me your color, baby,
color me your car.
Color me your color, darling,
I know who you are.
Come up off your color chart;
I know where you're coming from.
Call me (call me) on the line,
call me, call me any, anytime.
Call me (call me) I'll arrive, 
you can call me any day or night.
Call me!
Cover me with kisses, baby,
cover me with love.
Roll me in designer sheets,
I'll never get enough.
Emotions come, I don't know why;
cover up love's alibi.
Call me (call me) on the line,
call me, call me any, anytime.
Call me (call me) I'll arrive, 
when you're ready we can share the wine.
Call me.
Ooh, he speaks the languages of love.
Ooh, amore, chiamami (chiamami).
Ooh, appelle-moi, mon cheri (appelle-moi).
Anytime, anyplace, anywhere, anyway!
Anytime, anyplace, anywhere, any day, anyway!
Call me (call me) in my life,
call me, call me any, anytime.
Call me (call me) I'll arrive,
call me, call me for some overtime.
Call me (call me) in my life,
call me, call me in a sweet design.
Call me, (call me) call me for your lover's lover's alibi.
Call me (call me) inner line,
call me, call me any anytime.
Call me.
Oh, call me, ooh ooh ah.
","['Dm', 'Bb', 'Dm', 'Bb', 'Gm', 'A', 'Gm', 'A', 'Dm', 'F', 'Gm', 'Bb', 'Dm', 'F', 'Gm', 'Bb', 'Dm', 'Dm', 'Bb', 'Dm', 'Bb', 'Gm', 'A', 'Gm', 'A', 'Dm', 'F', 'Gm', 'Bb', 'Dm', 'F', 'Gm', 'Bb', 'Dm', 'Em', 'Bm', 'Em', 'Bm', 'F', 'C', 'Dm', 'Bb', 'Gm', 'A', 'Dm', 'F', 'Gm', 'Bb', 'Dm', 'F', 'Gm', 'Bb', 'Dm', 'F', 'Gm', 'Bb', 'Dm', 'F', 'Gm', 'Bb', 'Dm', 'F', 'Gm', 'Bb', 'Dm', 'F', 'Gm', 'Bb']"
25,Love Me Like Theres No Tomorrow,Freddie Mercury,https://tabs.ultimate-guitar.com/tab/freddie-mercury/love-me-like-theres-no-tomorrow-chords-98413," You had to kill the conversation,
 you always had the upper hand,
 Got Caught In love and stepped in sinking sand,
 you had to go and ruin all our plans
 Packed your bags and you're leaving home,
got a one-way ticket and you're all set to go,
 but we only have one more day together, so...
Love me like there's no tomorrow,
Hold me in your arms tell me you mean it
This is our last goodbye and very soon it will be over,
but today just love me like there's no tomorrow
 I guess we drift alone in separate ways,
 I don't have all that far to go,
 God Knows I learnt to play the lonely man,
 I've never felt so low in all my life,
 we were born to be Just losers,
so I guess there's a limit on how far we go,
 but we only have one more day together, so...
Love me like there's no tomorrow,
Hold me in your arms tell me you mean it
This is our last goodbye and very soon it will be over,
but today just love me like there's no tomorrow
Tomorrow God knows just where I'll be,
Tomorrow who knows just what's in store for me
Anything could happen but we only have one more day together, yeah,
Just one more day forever,
Love me like there's no tomorrow,
Hold me in your arms tell me you mean it
This is our last goodbye and very soon it will be over,
but today just love me like there's no tomorrow
Love me like there's no tomorrow,
Hold me in your arms tell me you mean it
This is our last goodbye and very soon it will be over,
but today just love me like there's no tomorrow
","['Bm', 'Em', 'A', 'D', 'G', 'Dadd9', 'A', 'D', 'F#', 'Bm', 'D', 'A', 'C#m', 'F#', 'B', 'D#m', 'E', 'C#m', 'F#', 'B', 'D#m', 'E', 'C#m', 'C#m', 'F#', 'B', 'Bm', 'Em', 'A', 'D', 'G', 'Dadd9', 'A', 'D', 'F#', 'Bm', 'D', 'A', 'C#m', 'F#', 'B', 'D#m', 'E', 'C#m', 'F#', 'B', 'D#m', 'E', 'C#m', 'C#m', 'F#', 'B', 'D', 'A', 'D', 'A', 'Am', 'G', 'D', 'Dm', 'G', 'C', 'Em', 'F', 'Dm', 'G', 'C', 'Em', 'F', 'Dm', 'Dm', 'G', 'C', 'C', 'Em', 'F', 'Dm', 'G', 'C', 'Em', 'F', 'Dm', 'Dm', 'G', 'C']"
26,Irgendwann Bleib I Dann Dort (ver 2),STS,https://tabs.ultimate-guitar.com/tab/sts/irgendwann-bleib-i-dann-dort-chords-1469456,"Der letzte Sommer war sehr schön,        i bin in irgend einer Bucht g'legn.
Die Sunn wie Feuer auf der Haut,         du riachst des Wasser und nix is laut.
Irgendwo in Griechenland, jede Menge weißer Sand, auf mein Rücken nur dei Hand.
Nach zwei drei Wochen hab i's g'spürt,        i hab des Lebensgfühl dort inhaliert.
Die Gedanken drehn sich um,         was z'Haus wichtig war is jetz ganz dumm.
Du sitzt bei an Olivenbaum und du spielst die mit am Stan,
es is so anders als daham.
Und irgendwann bleib i dann dort, lass alles liegn und stehn,
geh von daheim für immer fort.
Darauf geb i dir mei Wort, wieviel Jahr a noch vergehn,
In unserer Hektomatikwelt           dreht sich alles nur um Macht und Geld.
Finanz und Banken steigen mir d'rauf,      die Rechnung die geht sowieso nie auf.
Und irgendwann fragst die wieso, quäl i mi do so schrecklich ab
und bin net längst schon weiß Gott wo.
Aber no is net so weit,        noch was zu tun befiehlt die Eitelkeit.
Doch bevor der Herzinfarkt         mi mit 40 in die Windeln prackt.
Lieg i scho irgendwo Am Strand, a Bottle Rotwein in der Hand
und steck die Füß in weißen Sand.
Und irgendwann bleib i dann dort, lass alles liegn und stehn,
geh von daheim für immer fort.
Darauf geb i dir mei Wort, wieviel Jahr a noch vergehn,
Und irgendwann bleib i dann dort, lass alles liegn und stehn,
geh von daheim für immer fort.
Darauf geb i dir mei Wort, wieviel Jahr a noch vergehn,
","['G', 'G', 'Am', 'G', 'Am', 'G', 'G', 'Am', 'G', 'Am', 'D', 'Am', 'D', 'C', 'G', 'G', 'G', 'G', 'Am', 'G', 'Am', 'G', 'G', 'Am', 'Am', 'G', 'Am', 'D', 'Am', 'D', 'C', 'G', 'G', 'G', 'G7', 'C', 'D', 'G', 'G11', 'G', 'G7', 'C', 'C', 'D', 'G', 'G', 'Am', 'G', 'Am', 'G', 'G', 'Am', 'G', 'Am', 'D', 'Am', 'D', 'C', 'G', 'G', 'G', 'G', 'Am', 'G', 'Am', 'G', 'G', 'Am', 'G', 'Am', 'D', 'Am', 'D', 'C', 'G', 'G', 'G', 'G7', 'C', 'D', 'G', 'G11', 'G', 'G7', 'C', 'C', 'D', 'G', 'G7', 'C', 'D', 'G', 'G11', 'G', 'G7', 'C', 'C', 'D']"
27,Just A Gigolo I Aint Got Nobody (ver 2),David Lee Roth,https://tabs.ultimate-guitar.com/tab/david-lee-roth/just-a-gigolo-i-aint-got-nobody-chords-1801056,"Just a gigolo, Everywhere I go, People know the part, I'm playing
Paid for every dance, Selling each romance, Ooh what they saying
There will come a day when youth will pass away, Then what will they say about me
When the end comes I know, They'll say just a gigolo,
As life goes on without me
Just a gigolo, Everywhere I go, People know the part, I'm playing
Paid for every dance, Selling each romance, Ooh what they saying
There will come a day when youth will pass away, Then what will they say about me
When the end comes I know, They'll say just a gigolo,
As life goes on without me
'Cause I aint got nobody, nobody cares for me, nobody nobody cares for me
I'm so sad and lonely, Sad and lonely sad and lonely
Won't some sweet mama, Come and take a chance with me
Get along with me babe, Been singin love songs, All of the time
Even only be, honey only, only be
Bop bozadee bozadee bop zitty bop
I aint got nobody, nobody cares for me, nobody nobody cares for me
Hummala bebhuhla zeebuhla boobuhla, Hummala bebhuhla zeebuhla bop
I aint got nobody, nobody cares for me, nobody nobody cares for me
I'm so sad and lonely, Sad and lonely sad and lonely
Won't some sweet mama, Come and take a chance with me
Get along with me babe, Been singin love songs, All of the time
Even only be, honey only, only be
Sweet love, go, darlin, mama, baby, sweet, got nobody
I love nobody, (nobody), nobody, (nobody), nobody, (nobody), nobody (nobody)
Nobody (Nobody) nobody cares for me.
","['G', 'Gmaj7', 'G6', 'Edim', 'Am', 'D7', 'D', 'G', 'F', 'E7', 'Am', 'Cm', 'G', 'E7', 'Am', 'D7', 'G', 'G', 'Gmaj7', 'G6', 'Edim', 'Am', 'D7', 'D', 'G', 'F', 'E7', 'Am', 'Cm', 'G', 'E7', 'Am', 'D7', 'G', 'D7', 'G', 'Gb', 'F', 'E', 'Am', 'D7', 'G', 'G', 'Gb', 'F', 'E', 'A7', 'D7', 'G', 'C', 'E7', 'A7', 'D7', 'G', 'Gb', 'F', 'E', 'Am', 'D7', 'G', 'D7', 'G', 'Gb', 'F', 'E', 'Am', 'D7', 'G', 'G', 'Gb', 'F', 'E', 'A7', 'D7', 'G', 'C', 'E7', 'Am', 'D7', 'G', 'Gb', 'F', 'E7', 'Am', 'D7', 'G', 'E7', 'Am', 'D7', 'G']"
28,To Her Door,Paul Kelly and the Coloured Girls,https://tabs.ultimate-guitar.com/tab/paul-kelly-and-the-coloured-girls/to-her-door-chords-1213187,"They got married early,  never had no money,
Then when he got laid off,  they really hit the skids,
He started up his drinking,  then they started fighting,
He took it pretty badly,  she took both the kids,
She said: ""I'm not standing by,  to watch you slowly die,
So watch me walking,  out the door,
Out the door,  out the door, 
She said ""Shove it, Jack, I'm walking out your fucking door""
She went to her brother's,  got a little bar work,
He went to the buttery,  he stayed about a year,
Then he wrote a letter,  he said I want to see you,
She thought he sounded better,  she sent him up the fare,
He was riding through the cane, in the pouring rain,
On Olympic,  to her door.
To her door,  to her door,  to her door.
He came in on a Sunday,  every muscle aching,
Walking in slow motion,  like he'd just been hit,
Did they have a future?  Would he know his children?
Could he make a picture  and get them all to fit?
He was shaking in his seat, riding through the streets,
In a silvertop,  to her,
Shaking in his seat, riding through the streets,
In a silvertop,  to her door.
To her door,  to her door,  to her door.
","['G', 'D', 'C', 'G', 'D', 'C', 'G', 'D', 'C', 'G', 'D', 'C', 'G', 'Em', 'D', 'C', 'D', 'C', 'D', 'G', 'D', 'C', 'G', 'D', 'C', 'G', 'D', 'C', 'G', 'D', 'C', 'G', 'D', 'C', 'G', 'D', 'C', 'G', 'Em', 'D', 'C', 'D', 'C', 'D', 'G', 'D', 'C', 'G', 'D', 'C', 'G', 'G', 'D', 'C', 'G', 'D', 'C', 'G', 'D', 'C', 'G', 'D', 'C', 'G', 'Em', 'D', 'C', 'D', 'C', 'D', 'Em', 'D', 'C', 'D', 'C', 'D', 'G', 'D', 'C', 'G', 'D', 'C', 'G']"
29,Hickory Wind (ver 2),Gram Parsons,https://tabs.ultimate-guitar.com/tab/gram-parsons/hickory-wind-chords-1421592," In South Carolina
 There are many tall pines
I remember the oak tree
 That we used to climb
But now when I'm lonesome,
 I always pretend
That I'm getting the feel
 Of hickory wind
 I've started out younger
 Had most everything
All the riches and pleasures,
 What else can life bring?
But it makes me feel better
 Each time it begins
Callin' me home,
 Hickory wind
 It's a hard way to find out
 That trouble is real
In a far away city,
 With a far away feel
But it makes me feel better
 Each time it begins
Callin' me home,
 Hickory wind
Keeps callin' me home,
 Hickory wind
","['G', 'D', 'C', 'G', 'D', 'C', 'D', 'D7', 'C', 'D', 'G', 'C', 'D', 'G', 'C', 'G', 'G', 'D', 'C', 'G', 'D', 'C', 'D', 'D7', 'C', 'D', 'G', 'C', 'D', 'G', 'C', 'G', 'G', 'D', 'C', 'G', 'D', 'C', 'D', 'D7', 'C', 'D', 'G', 'C', 'D', 'G', 'C', 'G', 'C', 'D', 'G', 'C', 'G']"
