,name,author,link,lyrics,chords
30,Maailma On Kaunis,Irwin Goodman,https://tabs.ultimate-guitar.com/tab/irwin-goodman/maailma-on-kaunis-chords-950621,"Maailma on kaunis ja hyva elää sille
Jolla on aikaa ja tilaa unelmille
Ja mielen vapaus ja mielen vapaus
On vapautta kuunnella metsän huminoita
Kun aamuinen aurinko kuultaa kallioita
Ja elää elämäänsä ja elää elämäänsä
On vapautta valvoa kesaisia oita
Ja katsella hiljaisen haavan värinöitä
Ja elää elämäänsä ja elää elämäänsä
Maailma on kaunis ja hyva elaa sille
Jolla on aikaa ja tilaa unelmille
Ja mielen vapaus ja mielen vapaus
On vapautta istua iltaa yksinansa
Ja tuntea, tutkia omaa sisintänsä
Ja elää elämäänsä ja elää elämäänsä
On vapautta vaistota viesti suuremmasta
Ja olla kuin kaikua aina jatkuvasta
Ja elää elämäänsä ja elää elämäänsä
Maailma on kaunis ja hyva elää sille
Jolla on aikaa ja tilaa unelmille
Ja mielen vapaus ja mielen vapaus
","['Em', 'Am', 'H', 'Em', 'Em', 'Am', 'H', 'Em', 'Am', 'C', 'H', 'Em', 'H', 'Em', 'Am', 'H', 'Em', 'H', 'Em', 'H', 'Em', 'H', 'Em', 'Am', 'H', 'Em', 'H', 'Em', 'H', 'Em', 'Em', 'Am', 'H', 'Em', 'Em', 'Am', 'H', 'Em', 'Am', 'C', 'H', 'Em', 'H', 'Em', 'Am', 'H', 'Em', 'H', 'Em', 'H', 'Em', 'H', 'Em', 'Am', 'H', 'Em', 'H', 'Em', 'H', 'Em', 'Em', 'Am', 'H', 'Em', 'Em', 'Am', 'H', 'Em', 'Am', 'C', 'H', 'Em']"
31,This Charming Man (ver 5),The Smiths,https://tabs.ultimate-guitar.com/tab/the-smiths/this-charming-man-chords-1715414,"Punctured bicycle
on a hill side desolate,
will nature make a man of me yet?
when this charming car
this charming man
why pamper life’s complexity
on the passenger seat
I would go out tonight
but I haven’t got a stitch to wear
this man said it’s gruesome
that someone so handsome should care
Ah!    a jumped up pantry boy
who never knew his place
he said return the rings
he knows so much a-bout these things
he knows so much a-bout these things
I would go out tonight
but I haven’t got a stitch to wear
this man said it’s gruesome
that someone so handsome should care
La la la la la la la this charming man
La la la la la la la this charming man
Ah!    a jumped up pantry boy
who never knew his place
he said return the rings
he knows so much a-bout these things
he knows so much a-bout these things
he knows so much a-bout these things
","['Asus2', 'C', 'C/B', 'G', 'Asus2', 'C', 'C/B', 'G', 'Asus2', 'C', 'C/B', 'G', 'Asus2', 'C', 'C/B', 'G', 'Asus2', 'C', 'C/B', 'G', 'Asus2', 'C', 'C/B', 'C', 'D', 'Em', 'Asus2', 'C', 'D', 'Em', 'C', 'D', 'Em', 'Asus2', 'C', 'D', 'Em', 'G', 'Asus2', 'C', 'C/B', 'G', 'Asus2', 'C', 'C/B', 'G', 'Asus2', 'C', 'C/B', 'G', 'Asus2', 'C', 'C/B', 'C', 'D', 'Em', 'Asus2', 'C', 'D', 'Em', 'C', 'D', 'Em', 'Asus2', 'C', 'D', 'Em', 'C', 'D', 'Em', 'Asus2', 'C', 'D', 'Em']"
32,Hells Bells,AC/DC,https://tabs.ultimate-guitar.com/tab/acdc/hells-bells-chords-2245939,"I'm a rolling thunder, pouring rain
I'm coming on like a hurricane
My lightning's flashing across the sky
You're only young, but you're gonna die
I won't take no prisoners, won't spare no lives
Nobody's putting up a fight
I got my bell, I'm gonna take you to hell
I'm gonna get you, Satan get you
Hell's bells
Yeah, hell's bells
You got me ringing
Hell's bells
Hell's bells
I'll give you black sensations up and down your spine
If you're into evil, you're a friend of mine
See my white light flashing as I split the night
'Cause if good's on the left, then I'm sticking to the right
I won't take no prisoners, won't spare no lives
Nobody's putting up a fight
I got my bell, I'm gonna take you to hell
I'm gonna get you, Satan get you
Hell's bells
Yeah, hell's bells
You got me ringing
Hell's bells
Hell's bells
Hell's bells, satan's comin' to you
Hell's bells, he's ringing them now
Those hell's bells, the temperature's high
Hell's bells, across the sky
Hell's bells, they're taking you down
Hell's bells, they're dragging you under
Hell's bells, gonna split the night
Hell's bells, there's no way to fight, yeah
","['Am', 'D', 'C', 'G/B', 'Am', 'D', 'C', 'G/B', 'Am', 'D', 'C', 'G/B', 'Am', 'D', 'C', 'G/B', 'D', 'C', 'G', 'D', 'C', 'G', 'E', 'D', 'A', 'E', 'Am', 'D', 'C', 'D', 'Am', 'C', 'B', 'Am', 'Am', 'G', 'D', 'C', 'B', 'Am', 'D', 'C', 'G/B', 'Am', 'D', 'C', 'G/B', 'Am', 'D', 'C', 'G/B', 'Am', 'D', 'C', 'G/B', 'D', 'C', 'G', 'D', 'C', 'G', 'E', 'D', 'A', 'E', 'Am', 'D', 'C', 'D', 'Am', 'D', 'C', 'D', 'C', 'B', 'Am', 'D', 'C', 'D', 'Am', 'G', 'D', 'C', 'B', 'Am', 'D', 'C', 'D', 'Am', 'D', 'C', 'D', 'C', 'B', 'Am', 'D', 'C', 'D', 'Am', 'D', 'C', 'D', 'C', 'B', 'Am', 'D', 'C', 'D', 'Am', 'D', 'C', 'D', 'C', 'B', 'Am', 'D', 'C', 'D', 'Am', 'D', 'C', 'D', 'C', 'B']"
33,When The Children Cry (ver 4),White Lion,https://tabs.ultimate-guitar.com/tab/white-lion/when-the-children-cry-chords-813010,"little child, dry your cryin eyes
how can I explain the fear you feel inside
because you were born into this evil world
where man is killing man and no one knows just why
what have we become just look what we have done
all that we’ve destroyed you must build again
when the children cry, let em know we tried
because when the children sing then the new world begins
little child you must show the way
To a better day for all the young
because you were born for all the world to see
that we all can live with love and peace
no more presidents and all the wars will end
one united world under god
when the children cry, let em know we tried
because when the children sing then the new world begins
what have we become just look what we have done
all that we’ve destroyed you must build again
no more presidents and all the wars will end
one united world under god
when the children cry, let em know we tried
when the children fight, let em know it ain’t right
when the children pray, let em know the way
because when the children sing, then the new world begins
","['G', 'D', 'Em', 'Bm', 'C', 'G', 'Em', 'D', 'G', 'D', 'Em', 'Bm', 'C', 'G', 'Em', 'D', 'C', 'Bm', 'Em', 'Bm', 'C', 'G', 'Em', 'D', 'Em', 'Bm', 'C', 'G', 'Em', 'Bm', 'C', 'D', 'G', 'D', 'Em', 'Bm', 'C', 'G', 'Em', 'D', 'G', 'D', 'Em', 'Bm', 'C', 'G', 'Em', 'D', 'C', 'Bm', 'Em', 'Bm', 'C', 'G', 'Em', 'D', 'Em', 'Bm', 'C', 'G', 'Em', 'Bm', 'C', 'D', 'C', 'Bm', 'Em', 'Bm', 'C', 'G', 'Em', 'D', 'C', 'Bm', 'Em', 'Bm', 'C', 'G', 'Em', 'D', 'Em', 'Bm', 'C', 'G', 'Em', 'Bm', 'C', 'D', 'Em', 'Bm', 'C', 'G', 'Em', 'Bm', 'C', 'D']"
34,Skandal Im Sperrbezirk,Spider Murphy Gang,https://tabs.ultimate-guitar.com/tab/spider-murphy-gang/skandal-im-sperrbezirk-chords-471626,"In München steht ein Hofbräuhaus doch Freudenhäuser müssen raus,
damit in dieser schönen Stadt das Laster keine Chance hat!
Doch jeder ist gut informiert, weil Rosie täglich inseriert
und wenn dich deine Frau nicht liebt wie gut, dass es die Rosi gibt!
Und draußen vor der großen Stadt stehen die Nutten sich die Füße platt!
Skandal (Skandal) im Sperrbezirk Skandal (Skandal) im Sperrbezirk
Skandal,   Skandal um Rosie!
Ja Rosie hat ein Telefon auch ich hab' ihre Nummer schon.
Unter 32-16-8 herrscht Konjunktur die ganze Nacht.
Und draußen im Hotel d'Amour langweilen sich die Damen nur,
weil jeder den die Sehnsucht quält ganz einfach Rosies Nummer wählt.
Und draußen vor der großen Stadt stehen die Nutten sich die Füße platt!
Skandal (Skandal) im Sperrbezirk Skandal (Skandal) im Sperrbezirk
Skandal,   Skandal um Rosie!
Ja Rosie hat ein Telefon auch ich hab' ihre Nummer schon.
Unter 32-16-8 herrscht Konjunktur die ganze Nacht.
Und draußen im Hotel d'Amour langweilen sich die Damen nur,
weil jeder den die Sehnsucht quält ganz einfach Rosies Nummer wählt.
Und draußen vor der großen Stadt stehen die Nutten sich die Füße platt!
Skandal (Skandal) im Sperrbezirk Skandal (Skandal) im Sperrbezirk
Skandal,   Skandal um Rosie!
Skandal ! (Moral !) Skandal ! (Moral !)
Skandal ! (Moral !) Skandal ! (Moral !)
Skandal ! (Moral !) Skandal ! (Moral !)
Skandal ! (Moral !) Skandal ! (Moral !)
Skandal ! (Moral !) Skandal ! (Moral !)
Skandal ! (Moral !) Skandal ! (Moral !)
Skandal ! (Moral !) Skandal ! (Moral !)
Skandal ! (Moral !)
Skandal um Rosie !
","['A', 'G', 'D', 'E', 'A', 'G', 'D', 'E7#9', 'A', 'C', 'Bm', 'E', 'A', 'C', 'Bm', 'E', 'A', 'A', 'G', 'D', 'E', 'A', 'G', 'D', 'E7#9', 'A', 'C', 'Bm', 'E', 'A', 'C', 'Bm', 'E', 'A', 'A', 'G', 'D', 'E', 'A', 'G', 'D', 'E7#9', 'A', 'C', 'Bm', 'E', 'A', 'C', 'Bm', 'E', 'A', 'A', 'C', 'D', 'E', 'A', 'C', 'D', 'E', 'A', 'C', 'D', 'E', 'A', 'C', 'D', 'E', 'A']"
35,Pride In The Name Of Love (ver 2),U2,https://tabs.ultimate-guitar.com/tab/u2/pride-in-the-name-of-love-chords-102363,"One man come in the name of love,
One man come and go.
One man come he to justify,
One man to overthrow,
In the name of love,
What more in the name of love?
In the name of love,
What more in the name of love?
One man crawled on a barbed wire fence,
One man he resist.
One man washed on an empty beach.
One man betrayed with a kiss.
In the name of love,
What more in the name of love?
In the name of love,
What more in the name of love?
Nobody like you  
Nobody like you 
Ooo-oo-oo-oo
Ooo-oo-oo-oo
Ooo-oo-oo-oo
Ooo-oooo
Early morning, April 4.
A shot rings out in the Memphis sky.
Free at last, they took your life,
They could not take your pride.
In the name of love,
What more in the name of love?
In the name of love,
What more in the name of love?
In the name of love,
What more in the name of love?
In the name of love,
What more in the name of love?
","['B', 'E', 'A', 'F#m', 'B', 'E', 'A', 'F#m', 'B', 'E', 'A', 'F#m', 'B', 'E', 'A', 'F#m', 'B', 'E', 'A', 'F#m', 'B', 'E', 'A', 'F#m', 'B', 'E', 'A', 'F#m', 'B', 'E', 'A', 'F#m', 'B', 'D', 'E', 'E', 'B', 'D', 'E', 'E', 'B', 'E', 'A', 'F#m', 'B', 'E', 'A', 'F#m', 'B', 'E', 'A', 'F#m', 'B', 'E', 'A', 'F#m', 'B', 'E', 'A', 'F#m', 'B', 'E', 'A', 'F#m', 'B', 'E', 'A', 'F#m']"
36,What It Takes,Aerosmith,https://tabs.ultimate-guitar.com/tab/aerosmith/what-it-takes-chords-18827,"There goes my old girlfriend, there's another diamond ring.
And, uh, all those late night promises I guess they don't mean a thing.
So baby what's the story? Did you find another man ?
Is it easy to sleep in the bed that we made?
  When you don't look back I guess the feeling starts to fade away.
I used to feel your fire but now it's cold inside.
  And you're back on the street like you didn't miss a beat, yeah.
  Tell me what it takes to let you go.
  Tell me how's the pain supposed to go.
  Tell me how it is  that you can sleep, in the night
Without thinking you lost ev'rything that was good in your
life to the toss of the dice?,  Tell me what it takes to let you go,  yeah.
Girl before I met you I was F.I.N.E, fine
But your love made me a prisoner, yeah my heart's been doing time.
You spent me up like money then you hung me out to dry.
It was easy to keep all your lies in disguise,
'Cause you had me in deep with the devil in your eyes.
  Tell me what it takes to let you go.
  Tell me how's the pain supposed to go.
  Tell me how it is  that you can sleep, in the night
Without thinking you lost ev'rything that was good in your
life to the toss of the dice?,  Tell me what it takes to let you go... Guitar!
  Tell me that you're happy that you're on your own. Yeah, yeah
Yeah, tell me that is better when you're all alone.
Tell me that your body doesn't miss my touch.
Tell me that my loving didn't mean that much.
Tell me you ain't dying when you're crying for me.
 Tell me what it takes to let you . . .
Tell me who's to blame for thinking twice.    No, no no no.
 'Cause I don't wanna burn in paradise.    Oh
 Let go, let go, let go  I don't wanna burn in paradise.
Let it go, let it go, let it go . . .      (one million times, fading)
","['G', 'D', 'Em', 'D', 'C', 'G', 'D', 'Em', 'D', 'C', 'D', 'G', 'Em', 'D', 'C', 'Bb', 'F', 'Bb', 'F', 'Bb', 'A', 'Dm', 'Dm/C', 'Dm/B', 'Bb', 'Db', 'F', 'G', 'D', 'Em', 'D', 'C', 'G', 'D', 'Em', 'D', 'C', 'D', 'Bb', 'F', 'Bb', 'F', 'Bb', 'A', 'Dm', 'Dm/C', 'Dm/B', 'Bb', 'Db', 'F', 'C', 'G', 'Bb', 'F', 'Fm', 'Eb', 'Db', 'Ab', 'C', 'Bb', 'Bb', 'Db', 'F', 'E7', 'Bb', 'Db', 'F', 'Dm', 'Bb', 'F', 'Dm', 'Bb', 'F']"
37,Walk Of Life (ver 4),Dire Straits,https://tabs.ultimate-guitar.com/tab/dire-straits/walk-of-life-chords-1055528,"Here comes Johnny singing oldies, goldies
He got the action, he got the motion;
Oh yeah, the boy can play
Dedication, devotion;
turning all the night time into the day
He do the song about the sweet lovin' woman
He do the song about the knife
He do the walk, he do the walk of life
Yeah, he do the walk of life
    Woo hoo 
Here comes Johnny gonna tell you the story;
He got the action, he got the motion;
Oh yeah, the boy can play
Dedication, devotion;
turning all the night time into the day
He do the song about the sweet lovin' woman
He do the song about the knife
He do the walk, he do the walk of life
Yeah, he do the walk of life
    Woo hoo hoo 
Here comes Johnny singing oldies, goldies
He got the action, he got the motion;
Oh yeah, the boy can play
Dedication, devotion;
turning all the night time into the day
And after all the violence and double talk
There's just a song in all the trouble and the strife
You do the walk, yeh, you do the walk of life;
you do the walk of life
    Woo hoo 
","['E', 'A', 'E', 'A', 'E', 'B', 'E', 'A', 'E', 'B', 'A', 'B', 'E', 'E', 'A', 'B', 'A', 'B', 'E', 'A', 'E', 'A', 'E', 'E', 'B', 'E', 'A', 'E', 'B', 'A', 'B', 'E', 'E', 'A', 'B', 'A', 'B', 'E', 'A', 'E', 'A', 'E', 'E', 'B', 'E', 'A', 'E', 'B', 'A', 'B', 'E', 'E', 'A', 'B', 'A', 'B']"
38,Im On Fire,Bruce Springsteen,https://tabs.ultimate-guitar.com/tab/bruce-springsteen/im-on-fire-chords-31297,"Hey little girl is your daddy home
Did he go away and leave you all alone
I got a bad desire      Ohhhhhhhhh, I'm on fire      
Tell me now baby is he good to you
Can he do to you the things that I do
I can take you higher   Ohhhhhhhhhh, I'm on fire
Sometimes it's like someone took a knife baby edgy and dull and cut a
six-inch valley through the middle of my soul
At night I wake up with the sheets soaking wet and a
Only you     can cool my desire      Ohhhhhhhhh, I'm on fire 
Ohhhhhhhhh, I'm on fire 
Ohhhhhhhhh, I'm on fire 
","['E', 'A', 'C#m7', 'A', 'B', 'E', 'E', 'A', 'C#m7', 'A', 'B', 'E', 'A', 'E', 'C#m7', 'E', 'A', 'C#m7', 'A', 'B', 'E', 'A', 'B', 'E', 'A', 'B', 'E']"
39,Burning Down The House,Talking Heads,https://tabs.ultimate-guitar.com/tab/talking-heads/burning-down-the-house-chords-210881,"        V        V         V        V      V
  Watch out        you might get what you're after
  Cool babies     strange but not a stranger
           I'm an ordinary guy
Burning down the house
  Hold tight         wait till the party's over
  Hold tight        We're in for nasty weather
     There has got to be a way
Burning down the house
  All wet       hey you might need a raincoat
  Shakedown    dreams walking in broad daylight
Three hundred sixty five degrees
Burning down the house
Burning down the house
  My house       S'out of the ordinary
  That's might     Don't want to hurt nobody
Some things sure can sweep me off my feet
Burning down the house
","['G', 'G', 'F', 'F', 'A7', 'G', 'G', 'F', 'G', 'G', 'G', 'F', 'G', 'G', 'F', 'G', 'A7', 'F', 'G', 'G', 'F', 'G', 'G', 'G', 'F', 'G', 'G', 'F', 'G', 'A7', 'F', 'G', 'G', 'F', 'G', 'G', 'G', 'F', 'G', 'G', 'F', 'G', 'A7', 'F', 'A7', 'F', 'G', 'G', 'F', 'G', 'G', 'G', 'F', 'G', 'G', 'F', 'G', 'A7', 'F']"
40,Dancing With Myself (ver 4),Billy Idol,https://tabs.ultimate-guitar.com/tab/billy-idol/dancing-with-myself-chords-1017238,"On the floors of Tokyo
Or down in London town to go, go
With the record selection and the mirror's reflection
I'm a dancing with myself
When there's no-one else in sight
In the crowded lonely night
Well I wait so long for my love vibration
And I'm dancing with myself
Oh-oh dancing with myself
Oh-oh dancing with myself
When there's nothing to lose and there's nothing to prove
And I'm dancing with myself, oh oh oh
If I looked all over the world
And at every type of girl
But your empty eyes seem to pass me by
Leave me dancing with myself
So let's sink another drink
'Cause it'll give me time to think
If I had the chance I'd ask the world to dance
And not be dancing with myself
Oh-oh dancing with myself
Oh-oh dancing with myself
When there's nothing to lose, and there's nothing to prove
When I'm dancing with myself, oh oh oh-oh
Oh oh oh-oh, oh
Oh oh oh-ohhh
Oh oh oh-ohhhh    aaahh
Well, If I looked all over the world
And at every type of girl
But your empty eyes seem to pass me by
Leave me dancing with myself
So let's sink another drink
'Cause it'll give me time to think
If I had the chance I'd ask the world to dance
And not be dancing with myself
Oh-oh dancing with myself
Oh-oh dancing with myself
If I had the chance I'd ask the world to dance
If I had the chance I'd ask the world to dance
If I had the chance I'd ask the world to dance....
Oh oh oh-oh
Oh oh oh-oh
Oh oh oh-oh
Oh oh oh-oh
Oh oh, Dancing with myself, 
Oh oh, Dancing with myself, 
Oh oh, Dancing with myself, 
Oh oh, Dancing with myself, oh oh 
Oh oh oh-oh
Oh oh oh-oh
Oh oh oh-oh
Well, If I looked all over the world
And at every type of girl
But your empty eyes seem to pass me by
Leave me dancing with myself
So let's sink another drink
'Cause it'll give me time to think
If I had the chance I'd ask the world to dance
And not be dancing with myself
Oh-oh dancing with myself
Oh-oh dancing with myself
If I had the chance I'd ask the world to dance
If I had the chance I'd ask the world to dance
If I had the chance I'd ask the world to dance....
Oh oh oh-oh
Oh oh oh-oh
Oh oh oh-oh
Oh oh oh-oh
Oh oh    Dancing with myself          (Oh..., well it's all)
Oh oh    Dancing with myself          (wet, and I'll sweat, and I'll
Oh oh    Dancing with myself          (sweat, sweat, sweat, sweat,)
Oh oh    Dancing with myself          (sweat, sweat, sweat, sweat,)
Oh oh    Dancing with myself          (sweat, sweat, sweat, sweat,)
Oh oh    Dancing with myself          (sweat, sweat, sweat-sweat-sweat-aahh)
Oh oh    Dancing with myself
Oh oh    Dancing with myself....
","['E', 'A', 'B', 'A', 'E', 'A', 'B', 'A', 'E', 'A', 'B', 'A', 'E', 'E', 'A', 'B', 'A', 'E', 'A', 'B', 'A', 'E', 'A', 'B', 'A', 'E', 'A', 'E', 'B', 'E', 'A', 'B', 'A', 'E', 'A', 'B', 'A', 'E', 'A', 'B', 'B', 'B', 'E', 'A', 'E', 'A', 'E', 'A', 'E', 'A', 'A', 'E', 'A', 'E', 'A', 'B', 'A', 'E', 'A', 'B', 'A', 'E', 'A', 'B', 'B', 'B', 'E', 'A', 'E', 'A', 'E', 'A', 'E', 'A', 'E', 'A', 'E', 'A']"
41,Your Love (ver 3),The Outfield,https://tabs.ultimate-guitar.com/tab/the-outfield/your-love-chords-826593,"[Bridge] F G (Or you can use an Eb major instead of the G)
Josie's on a vacation far away
Come around and talk it over
So many things that I wanna say
You know I like my girls a little bit older
I just wanna use your love tonight
I don't wanna lose your love tonight
I ain't got many friends left to talk to
No-one's around when I'm in trouble
You know I'd do anything for you
Stay the night - we'll keep it under cover
I just wanna use your love tonight
I don't wanna lose your love tonight
Try to stop my hands from shakin'
Somethin' in my mind's not makin' sense
It's been a while since we've been all alone
I can't hide the way I'm feelin'
As you leave me please would you close the door
and don't forget what I told you
Just 'cause you're right - that don't mean I'm wrong
Another shoulder to cry upon
I just wanna use your love tonight
I don't wanna lose your love tonight
I just wanna use your love tonight
I don't wanna lose your love tonight
Lose your love
Lose your love
Lose your love
","['F', 'Am', 'G', 'C', 'Am', 'G', 'G', 'C', 'Am', 'G', 'G', 'F', 'Am', 'G', 'Am', 'F', 'G', 'C', 'Am', 'G', 'G', 'C', 'Am', 'G', 'G', 'F', 'Am', 'G', 'Am', 'F', 'G', 'F', 'G', 'F', 'G', 'F', 'G', 'F', 'G', 'C', 'Am', 'G', 'G', 'C', 'Am', 'G', 'G', 'F', 'Am', 'G', 'Am', 'F', 'C', 'F', 'Am', 'G', 'Am', 'F', 'G', 'Am', 'F', 'G', 'Am', 'F', 'G', 'Am', 'F', 'G']"
42,Fürstenfeld (ver 2),STS,https://tabs.ultimate-guitar.com/tab/1514538,"Langsam find der Dag sei End und die Nacht beginnt,
in der Kaertnerstrossen do singt aner ""Blowing in the wind"".
Hot a greanes Reckerl o, steht do ganz valuan,
Und der Steffel der schaut obi, auf den armen Steirer Buam.
Er hot wolln sei Glick probiern, in der grossen fremden Stod,
hod glaubt sei Musik bringt eam aufs Rennbahn-Express-Titelblatt.
Aus der Traum, zerplatzt wie Seifenblasen, nix is blim,
Ois wie a poar Schilling, in seim Gitarrenkoffer drin.
Wochenlang steh i scho do, Wochenlang plag i mi a,
I spui mir die Finger wund und sing so goar do kummt di Sunn.
Doch es is zum narrisch wern, kana wui mi singan hearn.
Langsam kriag i wirkli gnua, i frog mi was i da dua.
Do geht den ganzen Dog da Wind, nix als Baustellen, dass ka Mensch was find,
Die Burnheidln san ein Graus und im Kaffeehaus brennst di aus
I wui wieder ham, fuehl mi da so alan,
Brauch ka grosse Woed, i wui ham nach Fürstenfeld.
In der Zeitung do homs geschriem, do gibt's a Szene, do muast hin.
Was de woin, des  solln se schreim, mir kann die Szene gstoihn bleim.
Do geh  i gestern ins U4, fangt a Dirndl an zum ren mit mir,
Schwoarze Lippen gruene Hoar, da kannst ja Angst kriagn, wirklich war.
I wui wieder ham, fuehl mi da so alan,
Brauch ka grosse Woed, i wui ham nach Fürstenfeld.
Niemois spui i mer in Wien, Wien hot mi goarnet verdient,
I spui hechstens no in Graz, Sinablkirchen und Stinatz.
I brauch koan Guertel, brauch koan Ring, i wui z'ruck hintern Semmering.
I brauch nur des bissel Geld, fuer die Foart nach Fürstenfeld.
I wui wieder ham, i fuehl mi da so alan,
Brauch ka grosse Woed, i wui ham nach Fürstenfeld.
I wui wieder ham, i fuehl mi da so alan,
Brauch ka grosse Woed, i wui ham nach Fürstenfeld.
I wui wieder ham, fuehl mi da so alan,
Brauch ka grosse Woed, i wui ham nach Fürstenfeld.
","['G', 'D', 'C', 'G', 'Em', 'Bm', 'C', 'D', 'G', 'D', 'C', 'G', 'Em', 'Bm', 'C', 'D', 'G', 'G', 'D', 'C', 'G', 'Em', 'Bm', 'C', 'D', 'G', 'D', 'C', 'G', 'Em', 'Bm', 'C', 'D', 'G', 'D', 'C', 'G', 'D', 'C', 'G', 'D', 'C', 'G', 'C', 'D', 'G', 'D', 'C', 'G', 'D', 'C', 'G', 'D', 'C', 'G', 'C', 'D', 'G', 'D', 'C', 'G', 'D', 'C', 'G', 'D', 'C', 'G', 'C', 'D', 'G', 'D', 'G', 'D', 'G', 'D', 'G', 'C', 'D', 'G', 'D', 'C', 'G', 'D', 'C', 'G', 'D', 'C', 'G', 'C', 'D', 'G', 'D', 'C', 'G', 'D', 'C', 'G', 'D', 'C', 'G', 'C', 'D', 'G', 'D', 'G', 'D', 'G', 'D', 'G', 'C', 'D', 'G', 'D', 'C', 'G', 'D', 'C', 'G', 'D', 'C', 'G', 'C', 'D', 'G', 'D', 'C', 'G', 'D', 'C', 'G', 'D', 'C', 'G', 'C', 'D', 'G', 'D', 'G', 'D', 'G', 'D', 'G', 'C', 'D', 'G', 'D', 'G', 'D', 'G', 'D', 'G', 'C', 'D', 'G', 'D', 'G', 'D', 'G', 'D', 'G', 'C', 'D', 'G']"
43,Shine On You Crazy Diamond,Pink Floyd,https://tabs.ultimate-guitar.com/tab/pink-floyd/shine-on-you-crazy-diamond-chords-2478706,"[Part I Guitar Solo (blues-minor G)]
[Part II Syd's Guitar Riff (starts with notes: Bb F G E)]
[Part II Guitar Solo (natural minor G)]
[Part III Flute-Solo (Minimoog)]
[Part III Guitar-Solo]
Remember when you were young,   You shone like the sun.
Shine on you crazy        diamond.
Now there's a look in your eyes,     Like black holes in the sky.
Shine on you crazy        diamond.
You were caught in the crossfire of childhood and stardom,  
Blown on the steel breeze.
Come on you target for faraway laughter,
Come on you stranger, you legend, you martyr, and shine!
You reached for the secret too soon,    You cried for the moon.
Shine on you cra-       -zy  diamond.
Threatened by shadows at night,   And exposed in the light.
Shine on you crazy          diamond.
Well you wore out your welcome, with random precision,  
Rode on the steel breeze.
Come on you raver, you seer of visions,
Come on you painter, you piper, you prisoner and shine!
Nobody knows where you are,    How near or how far.
Shine on you cra-       -zy  diamond.
Pile on many more layers,     And I'll be joining you there.
Shine on you cra-       -zy  diamond.
And we'll bask in the shadow of yesterday's triumph, 
Sail on the steel breeze.
Come on you boy child, you winner and loser,
Come on you miner for truth and delusion and shine!
","['Gm', 'Gm', 'Gm', 'Gm6', 'Gm', 'Gm/F#', 'Gm/F', 'Gm/E', 'Eb', 'D', 'Ebdim', 'D', 'Gm', 'Cm', 'Gm', 'D7', 'Gm', 'Gb', 'Bb', 'Eb', 'Eb/D', 'Cm', 'Eb/Bb', 'F/A', 'F', 'F#dim7', 'Gm', 'Gb', 'Bb', 'Eb', 'Eb/D', 'Cm', 'Eb/Bb', 'F/A', 'F', 'Gm', 'Gm/F#', 'Gm7/F', 'Edim7', 'Eb', 'Edim7', 'Bb/F', 'Dm/F', 'D7/F#', 'Gm', 'Gm', 'Gb', 'Bb', 'Eb', 'Eb/D', 'Cm', 'Eb/Bb', 'F/A', 'F', 'Gm', 'Gb', 'Bb', 'Eb', 'Eb/D', 'Cm', 'Eb/Bb', 'F/A', 'F', 'Gm', 'Gm/F#', 'Gm7/F', 'Edim7', 'Eb', 'Edim7', 'Bb/F', 'Dm/F', 'D7/F#', 'Gm', 'Gm', 'Gb', 'Bb', 'Eb', 'Eb/D', 'Cm', 'Eb/Bb', 'F/A', 'F', 'Gm', 'Gb', 'Bb', 'Eb', 'Eb/D', 'Cm', 'Eb/Bb', 'F/A', 'F', 'Gm', 'Gm/F#', 'Gm7/F', 'Edim7', 'Eb', 'Edim7', 'Bb/F', 'Dm/F', 'D7/F#', 'Gm']"
