,name,author,link,lyrics,chords
16,Reno,Doug Supernaw,https://tabs.ultimate-guitar.com/tab/doug-supernaw/reno-chords-2731956,"Couldn't roll me a seven if they gave me loaded dice
I couldn't draw a hand if I sat here all night
Scared money bad whiskey there ain't no way to win
This ain't the first time, it's the way it's always been
You know the ladies a lot like Reno
She ain't got a heart and she don't care when you're down
Just like the lights of a casino
She'll pull you in and play with you awhile
But there ain't no way to win I know she's a lot like Reno
They're both out to break you, take everything you got
When you finally win the hand there ain't nothin' in the pot
A gamble that I'm takin' but either one i choose
Lady or Reno either way I lose
You know the ladies a lot like Reno
She ain't got a heart and she don't care when you're down
Just like the lights of a casino
She'll pull you in and play with you awhile
But there ain't no way to win I know she's a lot like Reno
Couldn't roll me a seven if they gave me loaded dice
","['G', 'D', 'C', 'G', 'D', 'C', 'G', 'D', 'C', 'G', 'D', 'C', 'G', 'C', 'D', 'G', 'C', 'D', 'G', 'C', 'D', 'C', 'D', 'Am', 'C', 'D', 'G', 'G', 'D', 'C', 'G', 'D', 'C', 'G', 'D', 'C', 'G', 'D', 'C', 'G', 'C', 'D', 'G', 'C', 'D', 'G', 'C', 'D', 'C', 'D', 'Am', 'C', 'D', 'G', 'G', 'D', 'C']"
17,Just Call Me Lonesome,Radney Foster,https://tabs.ultimate-guitar.com/tab/radney-foster/just-call-me-lonesome-chords-68634,"Just call me lonesome, heartbroke and then some
Cause I ain't got no one, since youv'e been gone
You called me baby, now I've got a new name
Don't need my old one, call me lonesome from now on
You used to call me, your one and only
But now you only call me someone you once knew
You were my angel, before some stranger
Stole your heart and stole my world when he stole you
Just call me lonesome, heartbroke and then some
Cause I ain't got no one, since youv'e been gone
You called me baby, now I've got a new name
Don't need my old one, call me lonesome from now on
I see you with him, and fall apart again
Remembering when I was the only man you needed
We said forever, we'd be together
He came between us and now forever lies in pieces
Just call me lonesome, heartbroke and then some
Cause I ain't got no one, since youv'e been gone
You called me baby, now I've got a new name
Don't need my old one, call me lonesome from now on
I don't need my old one, call me lonesome from now on
","['A', 'E', 'B7', 'E', 'A', 'E', 'B7', 'A', 'E', 'B7', 'E', 'A', 'B7', 'E', 'A', 'B7', 'E', 'A', 'E', 'B7', 'E', 'A', 'E', 'B7', 'A', 'E', 'B7', 'E', 'A', 'B7', 'E', 'A', 'B7', 'E', 'A', 'E', 'B7', 'E', 'A', 'E', 'B7', 'A', 'E', 'B7', 'E']"
18,Shut Up And Drive (ver 2),Chely Wright,https://tabs.ultimate-guitar.com/tab/chely-wright/shut-up-and-drive-chords-3110699,"Shut up and drive, you don't know what you're talking about
He's not the one, you ought to know that by now
You've got one of those hearts that keeps changing your mind
Your heart has a way of making you stay so shut up and drive
Don't look in the mirror, he might have that look in his eyes
The one that's so strong, it strangles your will to survive
He's mastered the art, of looking sincere
His eyes have a way of making you stay
Don't look in the mirror
I'm the voice you never listen to
And I had to break your heart to make you see
That he's the one who will be missing you
And you only miss the man that you wanted him to be
Turn the radio on to drown out the sound of goodbye
Blink back the tears show me you've still got your pride
Just get yourself lost in a sad country song
Those guys that they play know just what to say
Turn the radio on
I'm the voice you never listen to
And I had to break your heart to make you see
That he's the one who will be missing you
And you only miss the man that you wanted him to be
Shut up and drive  Don't look in the mirror
Turn the radio on, get outta here
Shut up and drive mmmmm  mmmm  ooooh
Shut up and drive ooooh  oooh  oooohh
Shut up and drive
","['G', 'Am', 'D', 'G', 'G', 'C', 'G', 'D', 'G', 'G', 'Am', 'D', 'G', 'G', 'C', 'G', 'D', 'G', 'C', 'G', 'Am', 'D', 'G', 'C', 'G', 'Am', 'D', 'G', 'Am', 'D', 'G', 'G', 'C', 'G', 'D', 'G', 'C', 'G', 'Am', 'D', 'G', 'C', 'G', 'Am', 'D', 'G', 'Am', 'D', 'G', 'G', 'Am', 'D', 'G', 'G', 'Am', 'D', 'G', 'G', 'Am', 'D', 'G']"
19,When The Thought Of You Catches Up With Me,David Ball,https://tabs.ultimate-guitar.com/tab/david-ball/when-the-thought-of-you-catches-up-with-me-chords-1204168,"It can happen any moment, without reason or rhyme
It might be right around the corner  
Or it'll come up from behind
A picture that I thought would fade
But I still clearly see  
When the thought of you catches up with me
It can happen on a Sunday drive 
Sky above the shade of blue
Headin' down some lonesome highway 
then you come into view
Mile after mile goes by
But you're all I see  
When the thought of you catches up with me
When the thought of you comes to mind
It'll carry me away to a better place in time
It can happen in the dead of night
Or any day of the week
Sometimes you'll come find me 
when I'm in bed a sleep
And I'll have that dream about you
And I sure love what I see  
When the thought of you catches up with me
When the thought of you catches up with me
When the thought of you catches up with me
","['C', 'D', 'G', 'C', 'D', 'G', 'G', 'C', 'D', 'G', 'D', 'Em', 'C', 'G', 'Bm', 'C', 'D', 'G', 'C', 'D', 'G', 'G', 'C', 'D', 'G', 'C', 'D', 'G', 'D', 'Em', 'C', 'G', 'Bm', 'C', 'D', 'G', 'C', 'D', 'G', 'Bm', 'A', 'D', 'C', 'D', 'G', 'C', 'D', 'G', 'G', 'C', 'D', 'G', 'D', 'Em', 'C', 'G', 'Bm', 'C', 'D', 'G', 'G', 'Bm', 'C', 'D', 'G', 'G', 'Bm', 'C', 'D', 'G']"
20,Mixed Up Shook Up Girl,Willy DeVille,https://tabs.ultimate-guitar.com/tab/willy-deville/mixed-up-shook-up-girl-chords-1400604,"Candle lit, and my eyes are slits, jumpin' now, paper clip
Make a move, sail a ship, tap it in, tap it in, ruby lips
She's a mixed up, shook up girl,
Got me so strung out I don't know what to do.
She's a mixed up, mixed up, shook up girl.
Take a breath, in the night.
Hurry over, she said, but there was no one in sight
Now break away, is in her eyes.
You know that little girl, she cut me deep, inside out.
She's a mixed up, shook up girl,
Got me so strung out I don't know what to do.
She's a mixed up, mixed up, shook up girl.
Hey, you, I remember, 
All the empty streets, fill me now,
And though you're gone away, I know not forever.
Why don't you just come over here and tell me, baby, is it over now?
She's a mixed up, shook up girl,
Got me so strung out I don't know what to do.
She's a mixed up, mixed up, shook up girl. (repeat)
She's a mixed up, shook up girl,    she's a mixed up, shook up girl.
She's a mixed up, shook up girl... She's a mixed up, shook up girl...
And she got me so strung out... She's a mixed up, shook up girl...
","['E', 'A', 'E', 'A', 'E', 'A', 'E', 'A', 'A', 'E', 'B', 'E', 'A', 'B', 'E', 'E', 'A', 'E', 'A', 'E', 'A', 'E', 'A', 'A', 'E', 'B', 'E', 'A', 'B', 'E', 'G', 'C', 'G', 'C', 'G', 'C', 'G', 'C', 'C', 'G', 'D', 'G', 'C', 'D', 'G', 'C', 'G', 'C', 'G', 'C', 'G', 'C', 'G', 'G', 'G', 'C', 'G']"
21,Lost Love (ver 2),Golden Smog,https://tabs.ultimate-guitar.com/tab/golden-smog/lost-love-chords-1778852,"AaddF x03220
Lost love in the desert
Lost love on the sea
You can put it behind you
But it's still beyond me
'Cause hearts break in the summer
Will they meet in the spring
Broken hearts all around me
But I don't feel a thing
Lost love on the highway
Lost love on the phone
Lost love with a suitcase
Heading back home
Where hearts break in the summer
And they meet in the spring
Mines still wrapped inside me
But I don't feel a thing
You're my lost love, I can't see
That you're coming back for me
You're the travel I can't find
And it's only a matter of time
Should have taken it all so hard
And my lost love
My lost love
My lost love
","['D/F#', 'D', 'Dsus2', 'D', 'Dsus2', 'D', 'G', 'A', 'Asus2', 'A', 'Em', 'Em7', 'Em', 'A', 'Asus2', 'D', 'Dsus2', 'D', 'Dsus2', 'D', 'G', 'A', 'Asus2', 'A', 'Em', 'Em7', 'Em', 'D', 'Dsus2', 'D', 'D', 'Dsus2', 'D', 'Dsus2', 'D', 'G', 'A', 'Asus2', 'A', 'Em', 'Em7', 'Em', 'A', 'Asus2', 'D', 'Dsus2', 'D', 'Dsus2', 'D', 'G', 'A', 'Asus2', 'A', 'Em', 'Em7', 'Em', 'D', 'D7', 'Bm', 'D', 'Bm', 'A', 'G', 'D/F#', 'Em', 'D', 'Dsus2', 'D', 'G', 'D', 'Dsus2', 'D', 'G', 'D', 'Dsus2', 'D', 'G']"
22,A Legend In My Time,Ronnie Milsap,https://tabs.ultimate-guitar.com/tab/ronnie-milsap/a-legend-in-my-time-chords-1752012,"If heartaches brought fame, in love's crazy game,
I’d be a legend in my time.
If they gave gold statuettes, for tears and regrets,
I’d be a legend in my time.
But they don’t give awards, and there’s no praise or fame,
For a heart that’s been broken, over love that’s in vain.
If loneliness meant world acclaim,
Everyone would know my name.
I’d be a legend in my time.
(You’d be a legend in your time)  (Backing vocals)
But they don’t, they don’t give awards, and there’s no praise or fame,
For a heart that’s been broken, over love that’s in vain.
If loneliness meant world acclaim,
Everyone would know my name.
I’d be a legend in my time.
I’d be a legend in  my time.
","['C', 'Dm', 'G7', 'C', 'F', 'G7', 'C', 'G7', 'C', 'Dm', 'G7', 'C', 'F', 'G7', 'C', 'D', 'E7', 'Fdim7', 'A', 'A7', 'D', 'D6', 'Dm', 'G7', 'C', 'F', 'G7', 'C', 'C7', 'F', 'G7', 'C', 'F', 'G7', 'C', 'C7', 'E7', 'Fdim7', 'A', 'A7', 'D', 'D6', 'Dm', 'G7', 'Db', 'Gb', 'Ab7', 'Db', 'Db7', 'Gb', 'Ab7', 'Bbm', 'Db7', 'Db7', 'Gb', 'Ab7', 'Fm', 'Db', 'B6', 'Gb', 'Ebm', 'Db']"
23,Beyond The Sunset,Slim Whitman,https://tabs.ultimate-guitar.com/tab/slim-whitman/beyond-the-sunset-chords-1785771,"Beyond the sun-set O blissful morning
When with our Savior Heaven's just begun
Earth's toiling end-ed  O glorious dawning
Beyond the sun-set when day is done
Beyond the sun-set no clouds will gather
No storms will threaten no fears annoy
O day of glad-ness O day unending
Beyond the sun-set eternal joy
Beyond the sun-set a hand will guide me
To God the Father whom I adore
His glorious pres-ence His words of welcome
Will be my port-ion on that fair shore
Beyond the sun-set O glad reunion
With our dear loved ones who've gone before
In that fair home-land we'll know no parting
Beyond the sun-set forever more
Beyond the sun-set forever more 
","['C', 'F', 'C', 'G7', 'C', 'F', 'C', 'F', 'C', 'G7', 'C', 'F', 'C', 'G7', 'C', 'F', 'C', 'F', 'C', 'G7', 'C', 'F', 'C', 'G7', 'C', 'F', 'C', 'F', 'C', 'G7', 'C', 'F', 'C', 'G7', 'C', 'F', 'C', 'F', 'C', 'G7', 'C', 'F', 'C', 'G7', 'C']"
24,Since I Fell For You,Glen Campbell,https://tabs.ultimate-guitar.com/tab/glen-campbell/since-i-fell-for-you-chords-1811740,"   When you just give love
And never get love
You better let love depart
   I know it's so   and yet I know 
I can't get you outta my heart...
You...       made me leave my happy home.......
   You took my love and now you're gone
Since I fell... for you
Love......     brings such misery and pain....
I know I'll never be the same
   Since I fell.. for you
Well It's too bad   And It's too sad
But I'm in love with you
You love me  then you snub me
But what can I do
I'm still in love with you
Well I....        I guess I'll never see the light.......
I get the blues most every night
Since I fell    for you....
Since I fell    for you....
","['F#', 'C#', 'D#m', 'G#m', 'C#7', 'F#', 'D#m7', 'G#m7', 'C#', 'C#7', 'F#7', 'B', 'D#m', 'C#m7', 'E', 'G#m', 'F#', 'F#m7', 'C#', 'G#m', 'C#7', 'F#', 'D#m', 'G#m', 'C#', 'C#7', 'F#', 'Bbm', 'D#m', 'C#', 'C#7', 'F#7', 'B', 'Bm', 'Bbm', 'G#m', 'C#', 'F#', 'Bbm', 'G#m', 'D#m', 'C#', 'C#7', 'F#', 'C#', 'D#m', 'G#m', 'C#', 'C#7', 'F#', 'D#m', 'G#m', 'C#m', 'C#m7', 'B', 'Bm', 'Bbm', 'D#m', 'G#m', 'C#', 'F#', 'B', 'F#', 'F#7', 'B', 'E', 'Bbm', 'G#m', 'F#', 'F#7', 'B', 'F#', 'E', 'F#', 'D#m', 'G#m', 'C#', 'F#', 'C#', 'D#m', 'G#m', 'C#', 'C#7', 'F#', 'Bbm', 'D#m', 'G#m', 'E', 'F#', 'B', 'Bm', 'Bbm', 'D#m', 'G#m', 'C#', 'D#m', 'F#7', 'B', 'G#m', 'C#', 'F#', 'Bb7', 'Amaj7', 'F#']"
25,Freight Train Blues,Hank Williams,https://tabs.ultimate-guitar.com/tab/hank-williams/freight-train-blues-chords-2295847,"I was born in Dixie in a boomer's shack,
Just a little old shanty by a railroad track,
and a freight train whistle taught me how to cry.
I've got the freight train blues, Lordy, Lordy, Lordy,
Got 'em in the bottom of my ramblin' shoes,
And when that whistle blows, I've gotta go,
Oh! Lordy! guess I'm never gonna lose,
The mean old freight train blues.
Now my Pappy was a fireman and my Mammy dear,
Was the only daughter of an en-gin- eer,
Now it's a shame the way she keeps a good man broke.
I've got the freight train blues, Lordy, Lordy, Lordy,
Got 'em in the bottom of my ramblin' shoes,
And when the whistle blows, I've gotta go,
Oh! Lordy! guess I'm never gonna lose,
The mean old freight train blues.
","['C', 'G7', 'C', 'G7', 'C', 'C', 'D7', 'G7', 'C', 'C7', 'F', 'C', 'A7', 'D7', 'G7', 'C', 'C', 'G7', 'C', 'G7', 'C', 'C', 'D7', 'G7', 'C', 'C7', 'F', 'C', 'A7', 'D7', 'G7', 'C']"
26,Arms Length Away,Sammy Kershaw,https://tabs.ultimate-guitar.com/tab/sammy-kershaw/arms-length-away-chords-2340321,"How long have we been
the very best of friends
I've always heard you say
I could tell you anything
Oh the times I made you laugh
the times I dried your tears
Through the good and bad
I've always been right here
An arms length away, right in front of your face
This close to your lips, right at your fingertips
That one true love you're dreaming of
Darling what would you say
If I told you it's an arms length away
For so long I've longed to hold you
oh the nights I almost told you
I stopped myself, afraid
of just what you might say
And the love that you have searched for
that seems so out of reach
Have you ever stopped
to think it might be me
An arms length away, right in front of your face
This close to your lips, right at your fingertips
That one true love you're dreaming of
Darling what would you say
If I told you it's an arms length away
That one true love you're dreaming of
Darling what would you say
If I told you it's an arms length away
","['Bb', 'F', 'Bb', 'C', 'F', 'Gm', 'Gdim', 'F', 'Dm', 'Gm', 'Bb', 'C', 'Bb', 'F', 'Gm', 'C', 'F', 'Am', 'Dm', 'Gm', 'C', 'Bb', 'Gm', 'Bb', 'F', 'Bb', 'F', 'Bb', 'C', 'F', 'Gm', 'Gdim', 'F', 'Dm', 'Gm', 'C', 'Bb', 'F', 'Gm', 'C', 'F', 'Am', 'Dm', 'Gm', 'C', 'Bb', 'Gm', 'Bb', 'F', 'Am', 'Dm', 'Gm', 'C', 'Bb', 'Gm', 'Bb', 'F']"
27,Nashville Blues,Cory Morrow,https://tabs.ultimate-guitar.com/tab/cory-morrow/nashville-blues-chords-2444803,"Late one morning I just packed my things
Burned all my bills and I hopped a plane
I told the cops and the bankers goodbye
They said ""Don't let us catch you, cause you owe us your life""
Well, the plane was headed east and so I was
Bound for Tennessee to outrun the fuzz
They found me in a day or two
Now I'm flat busted in jail, fightin' the Nashville blues
I like George Jones, Willie and Waylon
I think Kris and Merle are songwrittin' saviors
And Townes Van Zant, he died too soon
But now he’s up there with Hank and they’re both fightin’ the Nashville blues
Well the songwritin's left up to old hillbillies
Hippies and rednecks and girls like Miss Emmylou
I'm too young to have a point of view
But I just want to be a part of fightin' the Nashville blues
Fightin' the Nashville blues it ain't fun, no
It takes a toll upon your mind
But all the great ones they been there too
And they're all fightin' the Nashville blues
Well, I moved back to Austin to try to make a livin
But it ain't been so easy with those hill country women
And I'm stuck inside of this 8x12 room
And my throat's a scratchin' from the cigaretts and booze
And my face is wrinklin' and my mind's a strayin'
And I get on my knees and I get to prayin'
But my hands are worn like the soles of my shoes
And the Lord only knows I'm just fightin' the Nashville blues
I like Johnny Cash, Willie and Waylon
I think Kris and Merle are songwritin' saviors
Old Keith Whitley, he died too soon
Bun now he's up there with Hank
And there both fightin' the Nashville blues
","['G', 'Am', 'D', 'G', 'Am', 'D', 'G', 'Am', 'C', 'D', 'G', 'Am', 'C', 'D', 'G', 'Am', 'D', 'G', 'Am', 'D', 'G', 'Am', 'C', 'D', 'G', 'Am', 'C', 'D', 'G', 'G', 'Am', 'D', 'G', 'Am', 'D', 'G', 'Am', 'C', 'D', 'G', 'Am', 'C', 'D', 'G', 'G', 'Am', 'D', 'G', 'Am', 'D', 'G', 'Am', 'C', 'D', 'G', 'Am', 'C', 'D', 'G', 'C', 'D', 'G', 'G', 'C', 'C', 'G', 'D', 'C', 'G', 'G', 'Am', 'D', 'G', 'Am', 'D', 'G', 'Am', 'C', 'D', 'G', 'Am', 'C', 'D', 'G', 'Am', 'D', 'G', 'Am', 'D', 'G', 'Am', 'C', 'D', 'G', 'Am', 'C', 'D', 'G', 'G', 'Am', 'D', 'G', 'Am', 'D', 'G', 'Am', 'C', 'D', 'G', 'Am', 'C', 'D', 'G']"
28,There Is A Reason,Alison Krauss & Union Station,https://tabs.ultimate-guitar.com/tab/alison-krauss-union-station/there-is-a-reason-chords-1679589,"I've seen hard times and I've been told
There isn't any wonder that I fall
Why do we suffer crossing off the years
There must be a reason for it all
I've trusted in you Jesus to save me from my sins
Heaven is a place I call my home
But I keep on gettin caught up in this world I'm livin' in
And Your voice, it sometimes fades before I know
Hurtin' brings my heart to you, cryin with my need
Depending on Your love to carry me
The love that shed his blood for all the world to see
This must be the reason for it all
Hurtin' brings my heart to you, A fortress in the storm
When what I wrap my heart around is gone
I give my heart so easily to the ruler of this world
When the one who loves me most will give me all
In all the things that cause me pain, you give me eyes to see    
I do believe, but help my unbelief
I've seen hard times, and I've been told
There is a reason for it all
","['G', 'Dsus2', 'C(add9)', 'Dsus2', 'G', 'Am', 'G/B', 'C', 'Dsus', 'G', 'Dsus', 'G', 'Dsus2', 'C(add9)', 'Dsus2', 'G', 'C', 'G/B', 'Am', 'G', 'D/A', 'G', 'Dsus2', 'C(add9)', 'Dsus2', 'G', 'Am', 'G/B', 'C', 'Dsus2', 'G', 'Dsus2', 'C(add9)', 'Dsus2', 'G', 'C', 'G/B', 'Am', 'G', 'Em', 'C', 'Dsus2', 'G', 'G/F#', 'Em', 'A7', 'Am7', 'Dsus2', 'G', 'Dsus2', 'C(add9)', 'Dsus2', 'Em7', 'C', 'G/B', 'Am', 'G', 'Em', 'C', 'Dsus2', 'G', 'G/F#', 'Em', 'A7', 'Am7', 'Dsus2', 'G', 'Dsus2', 'C(add9)', 'Dsus2', 'Em7', 'C', 'G/B', 'Am', 'G', 'Em', 'C', 'Dsus2', 'G', 'G/F#', 'Em', 'A7', 'Am7', 'Dsus2', 'G', 'Dsus2', 'C(add9)', 'Dsus2', 'Em7', 'Am7', 'G/B', 'C', 'G']"
29,High On A Mountain Top,Marty Stuart,https://tabs.ultimate-guitar.com/tab/marty-stuart/high-on-a-mountain-top-chords-2578755,"As I look at the valley down below.
They are green just as far as I can see.
As my memories return, oh how my heart does yearn.
For you and the days that use to be.
High on a mountain top standin' all alone
Wonderin' where the years of my life have gone.
High on a mountain top wind blowin' free.
Thinkin' about the days that use to be.
Well I wonder if you ever think of me,
Or has time erased your memory
As I listen to the breeze whisper gently through the trees 
Well I wonder if you ever think of me.
High on a mountain top
Thinkin' about the days that use to be.
I wonder if you ever think of me.
","['E', 'D', 'E', 'E', 'D', 'E', 'E', 'D', 'E', 'A', 'E', 'B', 'E', 'E', 'D', 'E', 'A', 'E', 'B', 'E', 'E', 'D', 'E', 'A', 'E', 'B', 'E', 'E', 'D', 'E', 'E', 'D', 'E', 'E', 'D', 'E', 'A', 'E', 'B', 'E', 'E', 'D', 'E', 'A', 'E', 'B', 'E', 'E', 'B', 'E']"
30,I Never Knew Love,Doug Stone,https://tabs.ultimate-guitar.com/tab/doug-stone/i-never-knew-love-chords-2670678,"I never knew the power of a song
Till I heard the music playin’
The day momma passed on
Never knew what innocence was about
Till the first time I laid eyes on the face
Of a new born child
I never knew love no I mean real love
I never knew that kind of love
Till this moment with you
I never understood the meaning of home
Till I pulled into that old dirt drive
After being gone too long
I didn't know what serenity really was
Till I stopped one day to listen to
That river gently run
I never knew love no I mean real love
I never knew that kind of love
Till this moment with you
I've known the hunger before tonight for other loves
I felt the yearning I felt the fire
In their touch but this goes deeper
Than anything I've ever known
Beyond my heart clear down to my soul
I never knew what beauty could behold
Till you looked at me and I could see
Forever unfold oh you made me whole
I never knew love no I mean real love
I never knew that kind of love
Till this moment with you
Till I was loved by you
","['G', 'D7', 'Em', 'G', 'C', 'D7', 'C', 'G', 'C', 'G', 'D7', 'Em', 'G', 'C', 'D7', 'C', 'G', 'D7', 'Em', 'C', 'G', 'C', 'G', 'D7', 'Em', 'A7', 'D7', 'C', 'G', 'D7', 'Em', 'G', 'C', 'D7', 'C', 'G', 'C', 'G', 'D7', 'Em', 'G', 'C', 'D7', 'C', 'G', 'D7', 'Em', 'C', 'G', 'C', 'G', 'D7', 'Em', 'A7', 'D7', 'C', 'G', 'C', 'D7', 'G', 'C', 'D7', 'Em', 'G', 'Am', 'G', 'C', 'D7', 'Bm', 'Em', 'G', 'A7', 'Am', 'G', 'C', 'D7', 'G', 'D7', 'Em', 'G', 'C', 'D7', 'C', 'G', 'C', 'G', 'D7', 'Em', 'C', 'G', 'C', 'G', 'D7', 'Em', 'A7', 'D7', 'C', 'G', 'Am', 'D7', 'C', 'G']"
31,Great American Cowboy,Sons of the San Joaquin,https://tabs.ultimate-guitar.com/tab/sons-of-the-san-joaquin/great-american-cowboy-chords-2884892,"Well, he's up at the crack of dawn, puttin' those big boots on
Pullin' those calves in the snow has left him tired
There's tension in the air as he thinks of the eritters out there
The grazin's gone and the winter has hit 'em hard!
Cowboy, great American Cowboy -
Big high boots, Stetson hat, and a leather vest
Cowboy, Great American Cowboy -
With a horse and a rope and a gun, he tamed the West!
Well, he's up at the crack of dawn, puttin' those woolies on
The wind's so cold the chills are runnin' down his back
The cattle range is froze, and every little dogie knows
He's an angel of mercy mounted on a horse's back
Cowboy, great American Cowboy -
Big high boots, Stetson hat, and a leather vest
Cowboy, Great American Cowboy -
With a horse and a rope and a gun, he tamed the West!
Well, he's up at the crack of dawn, cinchin' that saddle on
Stormin' hard and things are lookin'g mighty grim
There's a long ride ahead that day choppin' ice and a-feedin' hay
'Cause he knows every critter's life depends on him!
Cowboy, great American Cowboy -
Big high boots, Stetson hat, and a leather vest
Cowboy, Great American Cowboy -
With a horse and a rope and a gun, he tamed the West!
Well, he's up at the crack of dawn, puttin' that bacon on
Winter is past and the skies are clear and blue
There's springtime everywhere, and the dogies are a-frolikin' there
And he's thankin' the Lord once more for a-seein' 'em through
Cowboy, great American Cowboy -
Big high boots, Stetson hat, and a leather vest
Cowboy, Great American Cowboy -
With a horse and a rope and a gun, he tamed the West!
Well he's up at the crack of dawn puttin' that Stetson on
Headin' for the ""Daddy Of 'Em All"" to celebrate
Well, he busts out of that chute, ridin' that wild galoot
Smilin' and a-rolin' his own as he counts to eight!
Cowboy, great American Cowboy -
Big high boots, Stetson hat, and a leather vest
Cowboy, Great American Cowboy -
With a horse and a rope and a gun, he tamed the West!
With a horse and a rope and a gun, he tamed the West!
With a horse and a rope and a gun, he tamed the West!
","['Em', 'D', 'Em', 'D', 'Em', 'D', 'Em', 'B', 'G', 'Em', 'Am', 'B', 'G', 'Em', 'Am', 'B', 'Em', 'Em', 'D', 'Em', 'D', 'Em', 'D', 'Em', 'B', 'G', 'Em', 'Am', 'B', 'G', 'Em', 'Am', 'B', 'Em', 'Em', 'D', 'Em', 'D', 'Em', 'D', 'Em', 'B', 'G', 'Em', 'Am', 'B', 'G', 'Em', 'Am', 'B', 'Em', 'Em', 'D', 'Em', 'D', 'Em', 'D', 'Em', 'B', 'G', 'Em', 'Am', 'B', 'G', 'Em', 'Am', 'B', 'Em', 'Em', 'D', 'Em', 'D', 'Em', 'D', 'Em', 'B', 'G', 'Em', 'Am', 'B', 'G', 'Em', 'Am', 'B', 'Em', 'Am', 'B', 'Em', 'Am', 'B', 'Em']"
32,Thank You Lord,Larry Sparks,https://tabs.ultimate-guitar.com/tab/larry-sparks/thank-you-lord-chords-3492071,"Thank you Lord, praise your name,
For the breath that I breathe,
Thank you Lord, for every blessing I receive
Please keep me humble, and to work for thee,
Thank you Lord, for saving me
I needed you so bad,
You saved my soul and I'm so glad,
Please use me Lord that's my plea.
Let the light shine in me,
so the whole world may see,
Thank you Lord, for saving me.
I've been mocked when I pray,
I don't care what people say,
Thank you Lord, you've been so good to me
Please keep me humble, and Lord send me,
Thank you Lord for saving me.
I needed you so bad,
You saved my soul and I'm so glad,
Please use me Lord that's my plea.
Let the light shine in me,
so the whole world may see,
Thank you Lord, for saving me.
Thank you Lord, for saving me.
","['G', 'G', 'D', 'G', 'G7', 'C', 'G', 'D', 'G', 'G7', 'C', 'G', 'A', 'D', 'G', 'G', 'D', 'G', 'G', 'G', 'D', 'G', 'G7', 'C', 'G', 'D', 'G', 'G7', 'C', 'G', 'A', 'D', 'G', 'G', 'D', 'G', 'D', 'C', 'G']"
33,Ive Seen All This World I Care To See,Willie Nelson,https://tabs.ultimate-guitar.com/tab/willie-nelson/ive-seen-all-this-world-i-care-to-see-chords-4135588,"I close my eyes and watch the darkness
Withdraw to my world of make believe
This world is filled with so much sorrow
And I've seen all this world I care to see
I watch as castles fall around me
From crumbled ruins of my own
This world is filled with much unhappiness
So many people so alone
Seeds that thrive in loveless gardens
The fruits of such will bitter be
Fields of hate and greed surround me
And I've seen all this world I care to see
","['Am', 'E7', 'Am', 'E7', 'Am', 'Am', 'E7', 'Am', 'E7', 'Am', 'Em', 'Am', 'A7', 'E7', 'Am', 'E7', 'Am', 'Em', 'Am']"
