,name,author,link,lyrics,chords
36,Poor Boy,Steve Earle,https://tabs.ultimate-guitar.com/tab/steve-earle/poor-boy-chords-3388259,"I was born on the other side of town
Everybody over here just put me down
I never thought about it much
Till the first time I saw you
Uh oh, what's a poor boy gonna do
It's bad enough to love you from afar
Me down here and you up where you are
If you hadn't given me that look
That's all it took it's true
Uh oh, what's a poor boy gonna do
Baby what's a poor boy got, not a heck of a lot
Just a heart that's true
One thing he sure don't need is
A heart that bleeds and these lovesick blues
I know a poor boy can't go far
Baby, maybe someday drive your car
I can look in my rear view, into those eyes of blue
Uh oh what's a poor boy gonna do
Baby what's a poor boy got, not a heck of a lot
Just a heart that's true
One thing he sure don't need is
A heart that bleeds and these lovesick blues
I know a poor boy can't go far
Baby, maybe someday drive your car
And I can look in my rear view, into those eyes of blue
Uh oh what's a poor boy gonna do
Uh oh what's a poor boy gonna do
","['E', 'B', 'E', 'B', 'E', 'A', 'E', 'B', 'E', 'E', 'B', 'E', 'E', 'B', 'E', 'B', 'E', 'A', 'E', 'B', 'E', 'E', 'B', 'E', 'A', 'E', 'B', 'E', 'A', 'E', 'F#', 'B', 'E', 'B', 'E', 'B', 'E', 'A', 'E', 'B', 'E', 'E', 'B', 'E', 'A', 'E', 'B', 'E', 'A', 'E', 'F#', 'B', 'E', 'B', 'E', 'B', 'E', 'A', 'E', 'B', 'E', 'E', 'B', 'E', 'E', 'B', 'E', 'E7']"
37,Valentines Day,Steve Earle,https://tabs.ultimate-guitar.com/tab/steve-earle/valentines-day-chords-509320,"I come to you with empty hands
I guess I just forgot again
I only got my love to send
On Valentine's Day
I ain't got a card to sign
Roses have been hard to find
I only hope that you'll be mine
On Valentine's Day
I know that I swore that I wouldn't forget
I wrote it all down, I lost it I guess
There's so much I want to say
But all the words just slip away
The way you love me every day
Is Valentine's Day
If I could I would deliver to you
Diamonds and gold, it's the least I can do
So if you'll take my IOU
I could make it up to you
Until then I hope my heart will do
For Valentine's Day
For Valentine's Day
","['A', 'C#', 'D', 'A', 'Dm', 'A', 'E7', 'G#', 'A', 'E7', 'G#', 'A', 'C#', 'D', 'A', 'Dm', 'A', 'F#m', 'D', 'E7', 'G#', 'A', 'D', 'A/C#', 'E7', 'G#', 'A', 'D', 'A', 'C#', 'F#m', 'E7', 'G#', 'A', 'C#', 'D', 'A', 'Dm', 'A', 'F#m', 'D', 'E7', 'G#', 'A', 'D', 'A/C#', 'E7', 'G#', 'A', 'D', 'A', 'C#', 'F#m', 'E7', 'G#', 'A', 'C#', 'D', 'A', 'Dm', 'A', 'F#m', 'D', 'C#', 'F#m', 'E', 'D', 'E7', 'G#', 'A']"
38,Man Of My Word (ver 2),Collin Raye,https://tabs.ultimate-guitar.com/tab/collin-raye/man-of-my-word-chords-2455810,"I'm a man of my word. . . I mean what I say
My pledge is my bond. . . That's just my way
When you've made a promise. . . To someone who's gone
Well, that's when forever. . . Seems a little too long
I'm a man of my word. . . And I made you a vow
I swore that I'd love you. . . And I can't change that now
They tell me I'm free. . . To find someone new
I just don't have the heart. . . Cause I gave mine to you
I said my love. . . Would last for all time
And no one would take your place
Well, if that promise. . . Was the last sound you heard
Well, you know I kept it. . . I'm a man of my word
I'm a man of my word. . . And its cost me so dear
These words are a prison. . . With-out you here
And I’ll go to my grave. . . This torch held high
But just once I wish. . . I’d told you a lie
I said my love. . . Would last for all time
And no one would take your place
Well, if that promise. . . Was the last sound you heard
Well, you know I kept it. . . I'm a man of my word
Yes, I'll always love you. . . I'm a man of my word
","['C', 'C', 'G', 'C', 'F', 'C', 'C', 'G', 'C', 'C', 'G', 'Am', 'F', 'C', 'G', 'C', 'C', 'C', 'G', 'C', 'F', 'C', 'C', 'G', 'C', 'C', 'G', 'Am', 'F', 'C', 'G', 'C', 'G', 'G', 'F', 'C', 'C', 'C', 'G', 'G', 'F', 'C', 'C', 'F', 'F', 'C', 'G', 'C', 'C', 'C', 'G', 'C', 'F', 'C', 'C', 'G', 'C', 'C', 'G', 'Am', 'F', 'C', 'G', 'C', 'G', 'G', 'F', 'C', 'C', 'C', 'G', 'G', 'F', 'C', 'C', 'F', 'F', 'C', 'G', 'Am', 'G', 'F', 'C', 'G', 'C']"
39,O Little Town Of Bethlehem,Garth Brooks,https://tabs.ultimate-guitar.com/tab/garth-brooks/o-little-town-of-bethlehem-chords-1689806,"O little town of Bethlehem
How still we see thee lie
Above thy deep and dreamless sleep
The silent stars go by
Yet in thy dark streets shineth
The everlasting Light
The hopes and fears of all the years
Are met in thee tonight
Oh holy child of Bethlehem
Descend to us we pray
Cast out our sins and enter in
Be born to us today
Oh morning stars together
Proclaim the holy birth
And praises sing to God the King
And Peace to men on earth.
","['D', 'G', 'Em', 'D', 'A7', 'D', 'D/C', 'B7', 'Em', 'D', 'A7', 'D', 'Em', 'Fdim7', 'F#7', 'Bm', 'G6', 'F#7', 'D', 'Dmin', 'D7', 'G', 'Em', 'D/A', 'A7', 'D', 'D', 'G', 'Em', 'D', 'A7', 'D', 'D/C', 'B7', 'Em', 'D', 'A7', 'D', 'Em', 'Fdim7', 'F#7', 'Bm', 'G6', 'F#7', 'D', 'Dmin', 'D7', 'G', 'Em', 'D/A', 'A7', 'D']"
40,Angel Of No Mercy,Collin Raye,https://tabs.ultimate-guitar.com/tab/collin-raye/angel-of-no-mercy-chords-2333987,"Heaven knows where I'd be now
If you had not found me
On that road that takes a man
To places he's not meant to be.
I wasn't ready for the touch
That turned my life a round
Now I'm helpless in your hands
It's love that ties me down.
Angel of no mercy
Girl you take my breath away
And it feels so good it hurts me
To think that you might fly away
Can't you see that I've surr endered
You stole this old heart bl ind
You're an angel of no mercy
But I don't mind
Ain't it strange how love can take
A heart that's hard as steel
Hold it tightly in the fire
And teach that cold heart how to feel.
Touch me now, I'm still not sure
You're truly flesh and bone
Heaven knows you can't be from
This world that I live on.
Can't you see that I've surr endered
You stole this old heart bl ind
You're an angel of no mercy
But I don't mind
","['D', 'A', 'D', 'G', 'A', 'D', 'G', 'A', 'D', 'G', 'Em7', 'G', 'A', 'D', 'A', 'D', 'G', 'A', 'D', 'G', 'A', 'D', 'G', 'Em7', 'A', 'D', 'A', 'D', 'D/A', 'D', 'D7', 'G', 'D', 'D/A', 'D', 'A7', 'D', 'D/A', 'D', 'D7', 'G', 'Em7', 'D', 'A7', 'D', 'D', 'A', 'D', 'G', 'A', 'D', 'G', 'A', 'D', 'G', 'Em7', 'G', 'A', 'D', 'A', 'D', 'G', 'A', 'D', 'G', 'A', 'D', 'G', 'Em7', 'A', 'D', 'A', 'D', 'D/A', 'D', 'D7', 'G', 'Em7', 'D', 'A7', 'G', 'D']"
41,More Money Tonight,Violent Femmes,https://tabs.ultimate-guitar.com/tab/violent-femmes/more-money-tonight-chords-1728935,"I always felt that I was different
Sometimes in school people pick on me
In the gym locker room or in the hallway
Cruel things people do and say
Wait a minute, wait a minute
I'll make more money tonight than you ever dreamed of you
Thought I was strange well just look at me now
If you are lucky, I'll play in your city and
You can come see me if you got the
Somebody stole all my clothes that I like to wear
But I'm so rich and famous baby what do I care?
Wait a minute, wait a minute 
I'll make more money tonight than you ever dreamed of you
Thought I was strange well just look at me now
If you are lucky, I'll play in your city and
You can come see me if you got the
I'll make more money tonight than you ever dreamed of you
Thought I was strange, well, just look at me now
If you are lucky, I'll play in your city and
You can come see me
If you got the money
If you got the money
If you got the money
","['C', 'Em', 'C', 'Em', 'C', 'Em', 'C', 'D', 'Em', 'C', 'Em', 'C', 'C', 'D', 'C', 'D', 'C', 'D', 'Em', 'C', 'Em', 'C', 'D', 'Em', 'C', 'Em', 'C', 'C', 'D', 'C', 'D', 'C', 'D', 'Em', 'C', 'Em', 'C', 'C', 'D', 'C', 'D', 'C', 'D', 'C', 'D', 'C', 'D', 'C', 'D']"
42,The Box,Randy Travis,https://tabs.ultimate-guitar.com/tab/randy-travis/the-box-chords-3483779,"On the top shelf in the closet,
In the workshop where he spent his extra time
Was a dusty wooden box that I had never noticed till that night
And we set on the table and carefully, we opened up the top
And stared into the memory
Daddy kept inside the box
There was a letter from mamma, when she went out to Reno
To help her sister out in 62
And a flower from Hawaii, when they went on vacation
It was the first time that my Daddy ever flew
And the pocket knife I gave to him on Fathers day
Years ago, I thought it had been lost
We all thought his heart was made from solid rock
But that was long before we found the box
I guess we always knew it but “I love you” was hard for him to say
Some men show it easy and some just never seem to find the way
But that night I began to see the softer side of someone I had lost
I saw the love he kept inside the first time we opened up the box
There was a picture that was taken, when he and Mom were dating
Standing by his 1944,
And the faded leather Bible, he got when he was baptised
I guess no one understood him like the Lord
And the poem that he had written, about his wife and children
The tender words he spoke were quite a shock
We all thought his heart was made of solid rock
But that was long before we found the box
We all thought his heart was made of solid rock
Yes that was long before we found the box
","['A', 'D', 'E7', 'A', 'D', 'E7', 'A', 'D', 'A', 'E7', 'A', 'D', 'A', 'E7', 'A', 'D', 'A', 'E7', 'A', 'D', 'E7', 'A', 'A', 'D', 'A', 'D', 'E7', 'A', 'D', 'A', 'E7', 'A', 'D', 'A', 'E7', 'A', 'D', 'A', 'E7', 'A', 'E7', 'A', 'D', 'E7', 'A']"
43,Oscar The Angel,Randy Travis,https://tabs.ultimate-guitar.com/tab/randy-travis/oscar-the-angel-chords-2333109,"Oscar was an angel and he used to walk the streets
Shoutin' out some prophecy to everyone he'd meet
He was a local fixture; like a cop out on a beat
Folks said he'd been shell-shocked long a- -go
And more than that, no one seemed to know
Oscar was a walker, at least four miles twice a day
The entire length of main street he'd be shoutin' all the way
And I had no idea, where he'd heard the things he'd say
But he was not your normal voice of doom
It was a happy song, sung slightly out of tune
And he'd say, ""Everyone will die and go to
heaven.
And we will all be angels some day-aa-aa.
And what you are in this world don't count for nothin'.
'Cause we are only children, we're just lost along the way.
But we will all be angels some day""
Well I worked at the Rialto; I sold tickets at the door
And Oscar he'd come by most ev'ry- -day 'bout half past four
And he'd pay to see some movie that he'd seen ten times before
But mostly we'd just let him in for free
And he'd watch five minutes then he'd come and talk to me
Well it's going on ten years now since I left my home town
And I went back last summer; for a week I hung a- -round
I looked out for Oscar; he was nowhere to be found
Someone said they finally had to com- -mit him and he died
Before they had time to for- -get him
Now I'm not about to argue, Oscar's train had jumped the tracks
But I'll bet my last dollar on a plain and simple fact
Oscar never said a word about me behind my back
And the way the I was raised to under- -stand
Well, that bone, makes him the better man
Ya, we will all be angels some- -day
","['A', 'D', 'A', 'G', 'E', 'A', 'D', 'A', 'E', 'D', 'F#m', 'E', 'A', 'D', 'A', 'G', 'E', 'A', 'D', 'A', 'E', 'D', 'F#m', 'E', 'D', 'E', 'A', 'D', 'E', 'D', 'E', 'A', 'D', 'A', 'G', 'E', 'D', 'E', 'D', 'A', 'D', 'A', 'G', 'E', 'A', 'D', 'A', 'E', 'D', 'F#m', 'E', 'A', 'D', 'A', 'G', 'E', 'A', 'D', 'A', 'E', 'D', 'F#m', 'E', 'A', 'D', 'A', 'G', 'E', 'A', 'D', 'A', 'E', 'D', 'F#m', 'E', 'E', 'A']"
44,No News,Lonestar,https://tabs.ultimate-guitar.com/tab/lonestar/no-news-chords-199447,"She said ""It's just a woman thing"" and pulled out of the drive.
I said not to worry, I'm an understandin' guy.
I've heard that when you love someone, you've gotta let em go.
She hollered: ""When I find myself you'll be the first to know.""
Ooo-ooo-hoo-oo,  No news!   
I've learned to do the laundry, feed the cat, and clean the house.
I promised to be patient while she worked her problems out.
When she packed her bags, her destination wasn't clear;
But I sensed that her intentions were honest and sincere.
Ooo-ooo-hoo-oo,  No news! 
She could telephone, tell a friend,
Tell a lie about where she's been.
Send a pigeon, send a fax; write it on a post-it pad.
Send a signal up in smoke, tap it out in Morse Code.
I prefer a bad excuse, to no news!
Her mama's been a little vague as to her whereabouts.
Her sister says ""I'm certain your romance has headed south.""
I don't have a single doubt that she's still in love;
My level of anxiety is just a product of...
Ooo-ooo-hoo-oo,  No news!  
She could telephone, tell a friend,
Tell a lie about where she's been.
Send a pigeon, send a fax; write it on a post-it pad.
Send a signal up in smoke, tap it out in Morse Code.
I prefer a bad excuse
She missed her bus, missed her plane;
Surely this can be explained.
Lost her car at the mall;  got locked in a bathroom stall.
Playing guitar with The Band;  on the road with Pearl Jam.
Buried with The Grateful Dead;  came back as a Parrot Head.
Got derailed, got de-iced;  offered as a sacri-fice.
FBI, CIA;   If they've seen her they ain't saying
No newwwws!                     Still no news!          Oh-oh!  
","['A', 'A', 'A', 'A', 'D', 'D', 'A', 'A', 'G', 'E', 'A', 'E', 'A', 'A', 'A', 'A', 'D', 'D', 'A', 'A', 'G', 'E', 'A', 'A', 'A', 'G', 'D/F#', 'F', 'A', 'G', 'D/F#', 'F', 'A', 'G', 'D/F#', 'F', 'E', 'E', 'A', 'A', 'A', 'A', 'A', 'A', 'D', 'D', 'A', 'A', 'G', 'E', 'A', 'A', 'A', 'G', 'D/F#', 'F', 'A', 'G', 'D/F#', 'F', 'A', 'G', 'D/F#', 'F', 'E', 'E', 'A', 'G', 'D/F#', 'F', 'A', 'G', 'D/F#', 'F', 'A', 'G', 'D/F#', 'F', 'A', 'G', 'D/F#', 'F', 'A', 'G', 'D/F#', 'F', 'A', 'G', 'D/F#', 'F', 'A', 'G', 'D/F#', 'F', 'A', 'G', 'D/F#', 'F', 'A', 'G', 'D/F#', 'F', 'A', 'G', 'D/F#', 'F', 'A', 'G', 'D/F#', 'F']"
45,Bears,Lyle Lovett,https://tabs.ultimate-guitar.com/tab/lyle-lovett/bears-chords-962744,"(repeat)
","['F', 'C', 'G']"
46,Step Inside This House (ver 2),Lyle Lovett,https://tabs.ultimate-guitar.com/tab/lyle-lovett/step-inside-this-house-chords-3252446,"That picture hanging on the wall
Was painted by a friend
He gave it to me all down and out, when he owed me ten
It doesn't look like much I guess
But it's all that's left of him
And it sure is nice from right over here,
when the light's a little dim
Step inside this house girl
And I'll sing for you a song
I'll tell you bout just where I've been
it shouldn't take too long
I'll show you all the things that I own
My treasures you might say
It couldn't be more than ten dollars worth
they brighten up my day
This book of poems was given me
By a girl I used to know
I guess I read it front to back
Fifty times or so
It's all about the good life
And stayin' at ease with the world
It's funny how I love that book
And I never loved that girl
Step inside this house girl
And I'll sing for you a song
I'll tell you bout just where I've been
it shouldn't take too long
I'll show you all the things that I own
My treasures you might say
It couldn't be more than ten dollars worth
they brighten up my day
Now you hold this piece of glass
Up to the light that's shinin' through the door
It's a prism glass I found it on the road
Can't you see that tiny rainbow
It's not really a prism I guess
Its just kind of broke a funny way
I was on my way through Houston
And I was headed for L.A.
Step inside this house girl
And I'll sing for you a song
I'll tell you bout just where I've been
it shouldn't take too long
I'll show you all the things that I own
My treasures you might say
It couldn't be more than ten dollars worth
they brighten up my day
This guitar was given me
By old man Thomas Gray
It's not too much to look at
But I play it every day
It's been across this country
Four or five times I guess
Between me and old man Tom
It never got much rest
Step inside this house girl
And I'll sing for you a song
I'll tell you bout just where I've been
it shouldn't take too long
I'll show you all the things that I own
My treasures you might say
It couldn't be more than ten dollars worth
they brighten up my day
Well that's just about all I own
All I care to I guess
Except this pair of boots maybe
And that funny yellow vest
And that leather jacket and that leather bag
And that hat hangin' on the wall
Just so it's not too much to carry babe
Could I see you again next Fall
Step inside this house girl
And I'll sing for you a song
I'll tell you bout just where I've been
it shouldn't take too long
I'll show you all the things that I own
My treasures you might say
It couldn't be more than ten dollars worth
they brighten up my day
","['G', 'C', 'G', 'Bm', 'C', 'D', 'G', 'C', 'G', 'Bm', 'C', 'D', 'C', 'G', 'Bm', 'C', 'D', 'C', 'G', 'Bm', 'C', 'D', 'G', 'C', 'G', 'Bm', 'C', 'D', 'G', 'C', 'G', 'Bm', 'C', 'D', 'C', 'G', 'Bm', 'C', 'D', 'C', 'G', 'Bm', 'C', 'D', 'G', 'C', 'G', 'Bm', 'C', 'D', 'G', 'C', 'G', 'Bm', 'C', 'D', 'C', 'G', 'Bm', 'C', 'D', 'C', 'G', 'Bm', 'C', 'D', 'G', 'C', 'G', 'Bm', 'C', 'D', 'G', 'C', 'G', 'Bm', 'C', 'D', 'C', 'G', 'Bm', 'C', 'D', 'C', 'G', 'Bm', 'C', 'D', 'G', 'C', 'G', 'Bm', 'C', 'D', 'G', 'C', 'G', 'Bm', 'C', 'D', 'C', 'G', 'Bm', 'C', 'D', 'C', 'G', 'Bm', 'C', 'D']"
47,Please Remember Me,Tim McGraw,https://tabs.ultimate-guitar.com/tab/tim-mcgraw/please-remember-me-chords-269196,"*************************************************
A (C)new wind is gonna find your (G)sail
Please remember me
","['Am', 'G', 'F', 'C', 'E7', 'Am', 'G', 'F', 'C', 'Am']"
