,name,author,link,lyrics,chords
17,That Lonesome Song (ver 2),Jamey Johnson,https://tabs.ultimate-guitar.com/tab/jamey-johnson/that-lonesome-song-chords-2455942,"That mornin' sun made it's way
Through the windshield of my Chevrolet
Whiskey eyes and ashtray breath
On a chert rock gravel road
What the hell did I do last night?
That's the story of my life
Like tryin' to remember words
To a song nobody wrote
And it's sad and it's long and can't nobody sing along
It's a southbound train, it's a whistle in the wind
Ain't no one there to care where I've been
I'm hummin' on that lonesome song again
I took a trip across the country from Montgomery
Discovered I'd been wrong for so long
I thought it was the fame and the glory and the money
But all I've got to show is a damn song
And it's sad and it's long, can't nobody sing along
It's a southbound train, it's a whistle in the wind
There's no one there to sing to in the end
I'm hummin' on that lonesome song again
And it's sad and it's long, can't nobody sing along
It's a southbound train, it's a whistle in the wind
There's no one there to care where I've been
I'm hummin' on that lonesome song again
The mornin' sun made it's way
Through the windshield of my Chevrolet
Whiskey eyes and ashtray breath
On a chert rock gravel road
","['D', 'C', 'G', 'C', 'G', 'Bb5', 'A', 'D', 'C', 'G', 'C', 'G', 'Bb5', 'A', 'A', 'G', 'D', 'A', 'Bb5', 'C5', 'D', 'Bb5', 'C5', 'D', 'Bb5', 'A', 'C', 'G', 'F', 'D', 'D', 'G', 'F', 'D', 'D', 'G', 'F', 'D', 'A', 'G', 'D', 'A', 'Bb5', 'C5', 'D', 'Bb5', 'C5', 'D', 'Bb5', 'A', 'C', 'G', 'F', 'D', 'A', 'G', 'D', 'A', 'Bb5', 'C5', 'D', 'Bb5', 'C5', 'D', 'Bb5', 'A', 'C', 'G', 'F', 'D', 'D', 'C', 'G', 'C', 'G', 'Bb5', 'D']"
18,I Dug Up A Diamond,Mark Knopfler,https://tabs.ultimate-guitar.com/tab/mark-knopfler/i-dug-up-a-diamond-chords-1974807,"I dug up a diamond
Rare and fine
I dug up a diamond
In a deep dark mine
If only I could cling to
My beautiful find
I dug up a diamond
In a deep dark mine
My gem is special
Beyond all worth
As strong as any metal
Or stone in the earth
Sharp as any razor
Or blade you can buy
Bright as any laser
Or any star in the sky
Maybe once in a lifetime
You'll hold one in your hand
Once in a lifetime
In this land
Where the journey ends
In a worthless claim
Time and again
In the mining game
I dug up a diamond
Rare and fine
I dug up a diamond
In a deep dark mine
Down in the darkness
In the dirt and the grime
I dug up a diamond
In a deep dark mine
","['Bm', 'D', 'A', 'Bm', 'A', 'Bm', 'D', 'A', 'Bm', 'A', 'Bm', 'D', 'A', 'Bm', 'A', 'Bm', 'D', 'A', 'Bm', 'A', 'Bm', 'D', 'G', 'D', 'A', 'Bm', 'D', 'G', 'D', 'A', 'Bm', 'D', 'A', 'Bm', 'A', 'Bm', 'D', 'A', 'Bm', 'A', 'Bm']"
19,Down To The River To Pray (ver 2),Alison Krauss,https://tabs.ultimate-guitar.com/tab/alison-krauss/down-to-the-river-to-pray-chords-2889116,"As I went down to the river to pray
Studying about that good old way
And who shall wear the star and crown
Good Lord  show me the way
O sisters let's go down
Lets go down  come on down
O sisters lets go down
Down in the river to pray
As I went down to the river to pray
Studying about that good old way
And who shall wear the robe and crown
Good Lord  show me the way
O brothers let's go down
Lets go down  come on down
O brothers lets go down
Down in the river to pray
As I went down to the river to pray
Studying about that good old way
And who shall wear the star and crown
Good Lord  show me the way
O fathers let's go down
Lets go down  come on down
O fathers lets go down
Down in the river to pray
As I went down to the river to pray
Studying about that good old way
Good Lord  show me the way
O mothers let's go down
Lets go down  come on down
O mothers lets go down
Down in the river to pray
As I went down to the river to pray
Studying about that good old way
Good Lord  show me the way
O sinners let's go down
Lets go down  come on down
O sinners lets go down
Down in the river to pray
As I went down to the river to pray
Studying about that good old way
Good Lord  show me the way
","['D', 'G', 'D', 'D', 'A7', 'G', 'D', 'A7', 'D', 'G', 'D', 'A7', 'D', 'G', 'D', 'D', 'G', 'D', 'D', 'A7', 'G', 'D', 'A7', 'D', 'G', 'D', 'A7', 'D', 'G', 'D', 'D', 'G', 'D', 'D', 'A7', 'G', 'D', 'A7', 'D', 'G', 'D', 'A7', 'D', 'G', 'D', 'D', 'G', 'D', 'A7', 'G', 'D', 'A7', 'D', 'G', 'D', 'A7', 'D', 'G', 'D', 'D', 'G', 'D', 'A7', 'G', 'D', 'A7', 'D', 'G', 'D', 'A7', 'D', 'G', 'D', 'D', 'G', 'D', 'A7', 'G', 'D']"
20,Crazy Eddies Last Hurrah,Reckless Kelly,https://tabs.ultimate-guitar.com/tab/reckless-kelly/crazy-eddies-last-hurrah-chords-440546,"Well, it sure didnt take to long
I woke up in the morning she was gone
And the note that she wrote didnt say dear john
It said goodbye fucker im gone
She was a homegrown mountain girl
Raised in a different world
I was a wanna be rocker She was more into Merle
Couldn't see it just wouldn't work
And now I'm double fisting long necks, grapefruit and Stoli
But I'm never getting over Joely
Well I poured myself in my car
I drove it on down to the bar
But they wouldn't let me in Cause I ain't a movie star
So I went to the Horse Shoe on Lamar
Well the bouncer threw me out too
And I didn't know what to do
So I picked up the phone And I called dear Sue
The cock blocker wouldn't let me through
And now I'm wishing for some drugs or a shrink to console me
But I'm never getting over Joely
Well I gathered up all my guns
And a pipe bomb just for fun
I drove to her house and parked out on the lawn
She's right I always was the crazy one.
Well her boyfriend was sure nice to me
Said ""calm down would you like a drink""
And I shot him full of holes From his nose to his knees
And I polished off her little sweet pea
And I'm crying on me knees feeling dirty and unholy
But I'm never getting over Joely
Now I'll probably get life and serve at least forty,
But I'm never getting over Joely
","['G', 'C', 'G', 'C', 'G', 'Em', 'C', 'G', 'C', 'G', 'D', 'G', 'G', 'C', 'G', 'C', 'G', 'Em', 'C', 'G', 'C', 'G', 'D', 'G', 'Em', 'C', 'G', 'C', 'G', 'D', 'G', 'G', 'G', 'C', 'G', 'G', 'C', 'G', 'Em', 'C', 'G', 'C', 'G', 'D', 'G', 'G', 'C', 'G', 'G', 'C', 'G', 'Em', 'C', 'G', 'C', 'G', 'D', 'G', 'Em', 'C', 'G', 'C', 'G', 'D', 'G', 'G', 'C', 'G', 'G', 'C', 'G', 'Em', 'C', 'G', 'G', 'G', 'D', 'G', 'G', 'C', 'G', 'G', 'C', 'G', 'Em', 'C', 'G', 'C', 'G', 'D', 'G', 'Em', 'C', 'G', 'C', 'G', 'D', 'G', 'Em', 'C', 'G', 'C', 'G', 'D', 'G']"
21,Crazy Eddies Last Hurrah (ver 2),Reckless Kelly,https://tabs.ultimate-guitar.com/tab/reckless-kelly/crazy-eddies-last-hurrah-chords-1099357,"Well it sure didnt take to long
I woke up one morning and she's gone
and the note that she wrote didnt say 'Dear John'
it said Goodbye F***er Im Gone
Now I'm double-fisting longnecks grapefruit and Stolie
But I'm never getting over Jolie.
","['G', 'C', 'G', 'G', 'C', 'G', 'Em', 'C', 'G', 'C', 'G', 'D', 'Em', 'C', 'G', 'C', 'G', 'D', 'G']"
22,I Told You So (ver 2),Carrie Underwood,https://tabs.ultimate-guitar.com/tab/carrie-underwood/i-told-you-so-chords-787333,"Suppose I called you up tonight,
And told you that I loved you,
And suppose I said ""I wanna come back home.""
And suppose I cried and said ""I think I finally learned my lesson
And I'm tired of spending all my time alone.
If I told you that I realized you're all I ever wanted
And it's killing me to be so far away.
Would you tell me that you loved me too and would we cry together?
Or would you simply laugh at me and say:
""I told you so, oh I told you so.
I told you someday you would come crawling back 
and asking me to take you in
I told you so, but you had to go,
Now I found somebody new and you will never break my heart in two again.""
""I told you so, oh I told you so.
I told you someday you would come crawling back
and asking me to take you in
I told you so, but you had to go,
Now I found somebody new and you will never break my heart in two again.""
","['G', 'Bm', 'C', 'D', 'G', 'C', 'G', 'Bm', 'Em', 'A', 'D', 'G', 'Bm', 'C', 'D', 'G', 'C', 'G', 'D/F#', 'Em', 'D/E', 'A', 'D', 'C/G', 'G', 'Bm', 'C', 'Bm', 'Am', 'C', 'D', 'G', 'D', 'C/G', 'G', 'Bm', 'C', 'Bm', 'Am', 'C', 'D', 'G', 'C/G', 'G', 'Bm', 'C', 'Bm', 'Am', 'C', 'D', 'G', 'D', 'C/G', 'G', 'Bm', 'C', 'Bm', 'Am', 'C', 'D', 'G']"
23,Fast Cars And Freedom (ver 3),Rascal Flatts,https://tabs.ultimate-guitar.com/tab/rascal-flatts/fast-cars-and-freedom-chords-1694870,"Starin' at you takin' off your makeup
Wondering why you even put it on
I know you think you do but baby you don't 
need it
Wish that you could see what I see it when 
it's gone
I see a dust trail following an old red Nova
Baby blue eyes, your head on my shoulder
Wait, baby don't moved, right here it is A
T-shirt hanging off Dogwood Bridge
That river was cold but we gave love a chance
Yeah, yeah for me
You don't look a day over Fast Cars and 
That sunset river back first time feeling
Yeah, smile and shake your head as if you 
don't believe me
I'll just sit right here and let you take me 
back
I'm on that gravel road, look at me
On my way to pick you up you're standing on 
the front porch
Looking just like that remember that
","['G', 'Em', 'D', 'Em', 'G', 'D', 'Em', 'G', 'D', 'Em', 'G', 'D', 'Em', 'G', 'D', 'Em', 'G', 'D', 'Em', 'G', 'D', 'Em', 'G', 'D', 'Em', 'G', 'D', 'Em', 'G', 'D', 'Em', 'G', 'D', 'Em', 'G', 'D', 'Em', 'G', 'D']"
24,If You Could Read My Mind,Johnny Cash,https://tabs.ultimate-guitar.com/tab/johnny-cash/if-you-could-read-my-mind-chords-405835,"If you could read my mind, love
What a tale my thoughts could tell
Just like an old time movie
'bout a ghost from a wishing-well
In a castle dark or a fortress strong
With chains upon my feet
You know that ghost is me
And I will never be set free
As long as I'm a ghost you can't see
If I could read your mind, love
What a tale your thoughts could tell
Just like a paperback novel
The kind that drugstores sell
When you reach the part where the heartaches come
The hero would be me
And heroes often fail
And you won't read that book again
Because the ending's just too hard to take
I'd walk away like a movie star
Who gets burned in a three way script
And enter number two
A movie queen to play the scene
Of bringing all the good things out in me
But for now, love, let's be real
I never thought I could act this way
And I've got to say that I just don't get it
I don't know where we went wrong 
But the feeling's gone
And I just can't get it back
If you could read my mind, love,
What a tale my thoughts could tell
Just like an old time movie
'bout a ghost from a wishing-well
In a castle dark or a fortress strong
With chains upon my feet
The story always ends
And if you read between the lines
You’ll know that I’m just trying to understand
The feeling that you lack
I never thought I could feel this way
And I've got to say that I just don't get it
I don't know where we went wrong 
But the feeling's gone
And I just can't get it back
","['A', 'G', 'A', 'G', 'A', 'D', 'E', 'F#m', 'D', 'A', 'D', 'F#m', 'Bm7', 'E', 'A', 'A', 'G', 'A', 'G', 'A', 'D', 'E', 'F#m', 'D', 'A', 'D', 'F#m', 'Bm7', 'E', 'A', 'A', 'D', 'E', 'F#m', 'D', 'A', 'D', 'F#m', 'Bm7', 'E', 'A', 'D', 'A', 'D', 'F#m', 'Bm7', 'E', 'D', 'F#m', 'Bm7', 'E', 'A', 'A', 'G', 'A', 'G', 'A', 'D', 'E', 'F#m', 'D', 'A', 'D', 'F#m', 'Bm7', 'E', 'A', 'D', 'A', 'D', 'F#m', 'Bm7', 'E', 'D', 'F#m', 'Bm7', 'E']"
25,If You Could Read My Mind (ver 2),Johnny Cash,https://tabs.ultimate-guitar.com/tab/johnny-cash/if-you-could-read-my-mind-chords-471444,"If you could read my mind, love
What a tale my thoughts could tell
Just like an old time movie
'bout a ghost from a wishing-well
In a castle dark or a fortress strong 
With chains upon my feet 
You know that ghost is me
And I will never be set free 
As long as I'm a ghost you can't see 
If I could read your mind, love
What a tale your thoughts could tell
Just like a paperback novel
The kind that drugstores sell
When you reach the part where the heartaches come
The hero would be me 
And heroes often fail
And you won't read that book again 
Because the ending's just too hard to take
I'd walk away like a movie star
Who gets burned in a three way script
And enter number two 
A movie queen to play the scene 
Of bringing all the good things out in me 
But for now, love, let's be real 
I never thought I could act this way 
And I've got to say that I just don't get it 
I don't know where we went wrong 
But the feeling's gone 
And I just can't get it back 
If you could read my mind, love, 
What a tale my thoughts could tell
Just like an old time movie
'bout a ghost from a wishing-well 
In a castle dark or a fortress strong
With chains upon my feet 
The story always ends 
And if you read between the lines 
You’ll know that I’m just trying to understand 
The feeling that you lack
I never thought I could feel this way 
And I've got to say that I just don't get it 
I don't know where we went wrong 
But the feeling's gone 
And I just can't get it back
","['E', 'Dadd9', 'E', 'Dadd9', 'E', 'A', 'B', 'C#m', 'A', 'E', 'A', 'C#m', 'Fm', 'A', 'E', 'E', 'Dadd9', 'E', 'Dadd9', 'E', 'A', 'B', 'C#m', 'A', 'E', 'A', 'C#m', 'Fm', 'B', 'E', 'E', 'A', 'B', 'C#m', 'A', 'E', 'A', 'C#m', 'Fm', 'B', 'A', 'E', 'A', 'C#m', 'Fm', 'B', 'A', 'C#m', 'Fm', 'B', 'E', 'E', 'Dadd9', 'E', 'Dadd9', 'E', 'A', 'B', 'C#m', 'A', 'E', 'A', 'C#m', 'Fm', 'B', 'C#m', 'A', 'E', 'A', 'C#m', 'Fm', 'B', 'A', 'C#m', 'Fm', 'B']"
26,Ill With Want,The Avett Brothers,https://tabs.ultimate-guitar.com/tab/the-avett-brothers/ill-with-want-chords-1510053,"I am sick with wanting and it's evil and it's daunting
How I let everything I cherish lay to waste
I am lost in greed, this time it's definitely me
I point fingers but there's no one there to blame
A need for something, now let me break it down again
A need for something but not more medicine
I am sick of wanting and it's evil how it's got me
And every day is worse than the one before
The more I have the more I think I'm almost where I need to be
If only I could get a little more
A need for something, now let me break it down again
A need for something but not more medicine
Something has me, oh something has me
Acting like someone I don't wanna be
Something has me, oh something has me
Acting like someone I know isn't me
Ill with want and poisoned by this ugly greed
Temporary is my time, ain't nothing on this world that's mine
Except the will I found to carry on
Free is not your right to chose
It's answering what's asked of you
To give the love you find until it's gone
A need for something, now let me break it down again
A need for something but not more medicine
Something has me, oh something has me
Acting like someone I don't wanna be
Something has me, oh something has me
Acting like someone I know isn't me
Ill with want and poisoned by this ugly greed
Ill with want and poisoned by this ugly greed
Ill with want and poisoned by this ugly greed
","['G', 'C', 'G', 'C', 'G', 'C', 'G', 'G', 'C', 'G', 'C', 'G', 'C', 'G', 'C', 'B7', 'Em', 'D', 'C', 'C', 'B7', 'Em', 'D', 'C', 'G', 'C', 'G', 'C', 'G', 'C', 'G', 'G', 'C', 'G', 'C', 'G', 'C', 'G', 'C', 'B7', 'Em', 'D', 'C', 'C', 'B7', 'Em', 'D', 'C', 'G', 'Em', 'C', 'D', 'G', 'G', 'Em', 'C', 'D', 'Em', 'C', 'D', 'G', 'G', 'C', 'G', 'C', 'G', 'C', 'G', 'G', 'C', 'G', 'C', 'G', 'C', 'G', 'C', 'G', 'C', 'G', 'C', 'B7', 'Em', 'D', 'C', 'C', 'B7', 'Em', 'D', 'C', 'G', 'Em', 'C', 'D', 'G', 'G', 'Em', 'C', 'D', 'Em', 'C', 'D', 'G', 'C', 'D', 'G', 'C', 'D', 'G']"
27,Stay Beautiful,Taylor Swift,https://tabs.ultimate-guitar.com/tab/taylor-swift/stay-beautiful-chords-430595,"Cory’s eyes are like a jungle
He smiles, it’s like the radio
He whispers songs into my window
In words nobody knows
There’s pretty girls on every corner
That watch him as he’s walking home
Saying, does he know
Will you ever know
You’re beautiful
Every little piece love, don’t you know
You’re really gonna be someone, ask anyone
When you find everything you looked for
I hope your life leads you back to my door
Oh but if it don’t
Stay beautiful
Cory finds another way to be
The highlight of my day
I’m taking pictures in my mind
So I can save them for a rainy day
It’s hard to make conversation
When he’s taking my breath away
I should say, hey by the way
You’re beautiful
Every little piece love, don’t you know
You’re really gonna be someone, ask anyone
When you find everything you looked for
I hope your life leads you back to my door
Oh but if it don’t
Stay beautiful
If you and I are a story
That never gets told
If what you are is a daydream
I’ll never get to hold, at least you’ll know
You’re beautiful
Every little piece love, don’t you know
You’re really gonna be someone, ask anyone
When you find everything you looked for
I hope your life leads you back to my front door
Oh but if it don’t
Will you stay beautiful, beautiful, beautiful
Beautiful, beautiful, beautiful, oh la la
Oh Oh    Oh but if it don’t
Stay beautiful, stay beautiful
Na na na na na
","['Cadd9', 'Dsus4', 'G', 'D/F#', 'Em', 'Cadd9', 'Dsus4', 'G', 'D/F#', 'Em', 'Cadd9', 'Dsus4', 'G', 'D/F#', 'Em', 'A', 'C', 'D', 'G', 'Em', 'C', 'Dsus4', 'D', 'Dsus2', 'D', 'G', 'Em', 'C', 'Dsus4', 'D', 'Dsus2', 'D', 'Cadd9', 'G', 'Cadd9', 'G', 'Cadd9', 'Dsus4', 'G', 'D/F#', 'Em', 'Cadd9', 'Dsus4', 'G', 'D/F#', 'Em', 'Cadd9', 'Dsus4', 'G', 'D/F#', 'Em', 'A', 'C', 'D', 'G', 'Em', 'C', 'Dsus4', 'D', 'Dsus2', 'D', 'G', 'Em', 'C', 'Dsus4', 'D', 'Dsus2', 'D', 'Cadd9', 'G', 'Cadd9', 'G', 'D', 'Em', 'C', 'G', 'D', 'Em', 'C', 'G', 'D', 'C', 'G', 'Em', 'C', 'Dsus4', 'D', 'Dsus2', 'D', 'G', 'Em', 'C', 'Dsus4', 'D', 'Dsus2', 'D', 'G', 'Em', 'C', 'Dsus4', 'D', 'Dsus2', 'D', 'D', 'G', 'Em', 'C', 'Dsus4', 'D', 'Dsus2', 'D', 'G']"
28,Almost Was Good Enough,Magnolia Electric Co.,https://tabs.ultimate-guitar.com/tab/magnolia-electric-co-/almost-was-good-enough-chords-1716546,"It's been hard doing anything
Winter's stuck around so long
I kept trying anyhow and I'm still trying now
Just to keep working, just to keep working.
I remember when it didn't use to be so hard
This used to be impossible
A new season has to begin
I can feel it leaning in whispering
""Nothing's lonely now”
Nothing anymore in pain.
A tall shadow dressed how secrets always dress
When they want everyone to know that they're around.
Leaning in whispering
""My friend over there don't know what he's talking about.”
Did you really believe, come on, did you really believe
That everyone makes it out?
Almost no one makes it out.
Almost no one makes it out.
Almost no one makes it out.
I'm going to  that street to hide
From that human doubt
To hide from what was shining and has finally burned us out.
Almost no one makes it out.
Almost no one makes it out.
If no one makes it out
How come you're talking to one right now
For once almost was good enough
","['Am', 'Em', 'D', 'Am', 'Em', 'D', 'Am', 'Em', 'D', 'Am', 'Em', 'D', 'Am', 'Em', 'D', 'Am', 'Em', 'D', 'Am', 'Em', 'D', 'Am', 'Em', 'D', 'Am', 'Em', 'D', 'Am', 'Em', 'D', 'Am', 'Em', 'D', 'Am', 'Em', 'D', 'Am', 'Em', 'D', 'Am', 'Em', 'D']"
29,Almost Was Good Enough (ver 2),Magnolia Electric Co.,https://tabs.ultimate-guitar.com/tab/magnolia-electric-co-/almost-was-good-enough-chords-3062487,"   It's been hard doing anything
   Winter stuck around so long
   I kept trying anyhow
   And I'm still trying now
   Just to keep working
   Just to keep working
   I remember when
   This didn't use to be so hard
   This used to be impossible
   New season    has got to begin
   I can feel it leaning in,    whispering:
   ""Nothing's lonely now
   Nothing anymore in pain
   Nothing's lonely now
   Nothing anymore in pain""
   Then a tall shadow dressed
   The way that secrets always dress
   When they want everyone to know
   That they're around
   Comes leaning in,    comes whispering:
   ""My friend over there
   Don't know what she's talking about.""
   Did you really believe?
   Come on, did you really believe
   That everyone makes it out?
   Almost no one makes it out
   Almost no one makes it out
   Think I'll pack it in
   Buy a pickup
   Head it down to L.A
   Maybe find a place
   That we can fix up
   Start a brand new day
   The woman I'm thinking of
   She loved me all up
   And I'm so down today
   She's so fine, she's in my mind
   I can hear her calling
   From my big brass bed
   See the lonely boys
   Out on the weekend
   Trying to make it pay
   See the lonely boys
   Out on the weekend
   Trying to make it pay
   I'm going to use them streets to hide
   From that human doubt
   Hide from what was shining
   And has finally burned me out
   For once, almost was good enough
   Almost was good enough
   Almost was good enough
   For once, almost was good enough
   Almost was good enough
   Almost was good enough
","['D', 'Am', 'Em', 'D', 'D', 'Am', 'Em', 'D', 'D', 'Am', 'Em', 'D', 'D', 'Am', 'Em', 'D', 'D', 'Am', 'Em', 'D', 'D', 'Am', 'Em', 'D', 'D', 'Am', 'Em', 'D', 'D', 'Am', 'Em', 'D', 'D', 'Am', 'Em', 'D', 'D', 'Am', 'Em', 'D', 'D', 'Am', 'Em', 'D', 'D', 'Am', 'Em', 'D', 'D', 'Am', 'Em', 'D', 'D', 'Am', 'Em', 'D', 'D', 'Am', 'Em', 'D', 'D', 'Am', 'Em', 'D', 'D', 'Am', 'Em', 'D', 'D', 'Am', 'Em', 'D', 'D', 'Am', 'Em', 'D']"
30,Mighty River,Railroad Earth,https://tabs.ultimate-guitar.com/tab/railroad-earth/mighty-river-chords-1751796,"sun risin’ on the shoulder
don’t take much to grow us older, no
just a little time
I was in the livin’ callin’
could it be that you were callin’ too
Oh my, my
blows out & bowls ya over
don’t take long to realize, you’re standin’
on shaky ground
ridin’ on a backroad dreamin’
hear a voice tellin’ you, you’re losin’
something dear
in the mighty river, rollin' along  ohh ohh   
in the mighty river, I'm over my head ohh ohh tearin free
in the mighty river, over my head
oh, washin' clean
write me down as one who knew
revenge means more revenge on you
what ya gonna do?
in a song that I once sang
I heard a bell & it just rang my blues
right away
in the mighty river, rollin' along  ohh ohh   
in the mighty river, I'm over my head ohh ohh tearin free
in the mighty river, over my head
oh, washin' clean
","['Em', 'G', 'D', 'A', 'Em', 'G', 'D', 'Em', 'G', 'D', 'A', 'Em', 'G', 'D', 'Em', 'G', 'D', 'A', 'Em', 'G', 'D', 'Em', 'G', 'D', 'A', 'Em', 'G', 'D', 'D', 'Em', 'G', 'A', 'Em', 'G', 'D', 'D', 'Em', 'G', 'A', 'Em', 'G', 'D', 'D', 'Em', 'G', 'A', 'Em', 'G', 'D', 'Em', 'G', 'D', 'A', 'Em', 'G', 'D', 'Em', 'G', 'D', 'A', 'Em', 'G', 'D', 'D', 'Em', 'G', 'A', 'Em', 'G', 'D', 'D', 'Em', 'G', 'A', 'Em', 'G', 'D', 'D', 'Em', 'G', 'A', 'Em', 'G', 'D']"
31,I Knew You Before (ver 4),Dustin Kensrue,https://tabs.ultimate-guitar.com/tab/dustin-kensrue/i-knew-you-before-chords-1098933,"You were once a sweet little girl, so innocent and pure,
Your eyes were open and sure, anyone could look right in.
As I followed closely your gaze, you looked up towards the sky,
And I watched your face drift away, other things had caught your eye.
Oh, the magazines and media supplied you with their plastic protocol,
Oh, and maybe music television really is the devil after all.
But all I can say is I knew you before you were beautiful back then,
Before you grew up,      Before you gave in.
You dream of sharing your heart, instead you share your bed,
And your heart beats empty and cold with all the tears you have shed.
And you dream of baring your soul, instead you bare more skin,
And you wear dark glasses to keep anyone from looking in.
Oh, the magazines and media supplied you with their plastic protocol,
Oh, and maybe music television really is the devil after all.
But all I can say is I knew you before you were beautiful back then,
Before you grew up,      Before you gave in.
And all you want is to hear the words ""Dear baby I love you""
So you hike your skirt higher still till their eyes are all on you.
You drive in fast foreign cars the color of your sin,
And you tint your windows to keep anyone from looking in.
But all I can say is I knew you before you were beautiful back then,
Before you grew up,      Before you gave in.
But all I can say is I knew you before you were beautiful back then,
You could be beautiful again.
","['Em', 'C', 'G', 'D', 'Em', 'C', 'Am', 'Em', 'Em', 'C', 'G', 'D', 'Em', 'C', 'Am', 'Em', 'Am', 'Em', 'Am', 'Em', 'G', 'G7', 'C', 'Em', 'Am', 'Em', 'B7', 'B7', 'Em', 'Em', 'C', 'G', 'D', 'Em', 'C', 'Am', 'Em', 'Em', 'C', 'G', 'D', 'Em', 'C', 'Am', 'Em', 'Am', 'Em', 'Am', 'Em', 'G', 'G7', 'C', 'Em', 'Am', 'Em', 'B7', 'B7', 'Em', 'Bm', 'C', 'D', 'Em', 'Bm', 'C', 'D', 'Em', 'Dm', 'Am', 'Dm', 'D', 'G', 'C', 'C7', 'F', 'Am', 'Dm', 'Am', 'E7', 'E7', 'Am', 'C', 'C7', 'F', 'Am', 'Dm', 'Am', 'E7', 'Am']"
