,name,author,link,lyrics,chords
0,You Think You Know Somebody (ver 2),Todd Snider,https://tabs.ultimate-guitar.com/tab/todd-snider/you-think-you-know-somebody-chords-1048701,"You think you know somebody.
You think they know you.
You think you know somebody.
But man you never do.
Jackie used to live three blocks away from me
We used to throw the baseball and we’d climb his old oak tree
And we would sneak his old man's cigarettes behind the picket fence
We swore that  we would always be the best of friends
We used to sit out on the curb and talk on summer nights,
Until Jackie's daddy’d call him, and then he took off like a light
","['Am', 'Fmaj9', 'Am', 'Fmaj9', 'Am', 'Fmaj9', 'G', 'C', 'C', 'F', 'C', 'G', 'Am', 'Em', 'F', 'G']"
1,Belleau Wood (ver 2),Garth Brooks,https://tabs.ultimate-guitar.com/tab/garth-brooks/belleau-wood-chords-2115901,"Oh  the  snowfakes fell in  silence 
Over Belleau Wood that night 
For a  Christmas truce had been declared 
    By     both sides of the fight 
As we     lay there in our trenches 
The        silence broke in  two 
By a  German soldier singing 
 A    song that we all   knew
Though I did not know the   language
The  song was ""Silent  Night"" 
Then I heard my buddy      whisper, 
  ""All is  calm, and all is bright"" 
Then the  fear and   doubt surrounded me 
'Cause I'd die if I was      wrong 
But I stood up in    trench 
And I began to sing  a - long
Then across the frozen battlefield 
A - nother's voice joined in 
until one by one each man became 
A singer of the hymn 
Then  I  thought that I was dreaming 
For right there in my sight 
       Stood the German    soldier 
'Neath the falling flakes of white 
And raised his hand and smiled at me 
As         if  he seemed to  say 
Here's hoping we both live 
 To   find a better      way
Then the devil's clock struck midnight 
And the skies lit up a - gain 
And the battlefield where heaven stood 
Was blown to hell a - gain 
But for just one fleeting moment 
The answer seemed so clear 
Heaven's not be - yond the clouds 
It's just beyond the fear 
No Heaven's not beyond the clouds 
It's for us to find it here 
","['Dsus', 'D', 'G', 'D', 'G', 'D', 'A', 'Dsus', 'D', 'G', 'Bm', 'G', 'D', 'A', 'D', 'Dsus', 'D', 'G', 'D', 'G', 'D', 'A', 'Dsus', 'D', 'G', 'Bm', 'G', 'D', 'A', 'D', 'A', 'G', 'D', 'A', 'G', 'Bm', 'G', 'A', 'Dsus', 'D', 'G', 'D', 'G', 'D', 'A', 'Dsus', 'D', 'G', 'Bm', 'G', 'D', 'A', 'D', 'A', 'G', 'D', 'A', 'G', 'Bm', 'G', 'A', 'Dsus', 'D', 'G', 'D', 'G', 'D', 'A', 'Bm', 'G', 'D', 'A', 'Dsus', 'D']"
2,If There Hadnt Been You,Billy Dean,https://tabs.ultimate-guitar.com/tab/billy-dean/if-there-hadnt-been-you-chords-1508989,"A man filled with doubt, down and out and so alone
A ship tossed and turning lost and yearning for a home
A survivor barely surviving, not really sure of his next move
All of this I would have been if there hadn't been you.
If there hadn't been you where would I be
If there hadn't been you here for me
I've made it through times I never would have made it through
If there hadn't been you
A man filled with hope, who finally knows where he belongs
A heart filled with love, more than enough to keep it strong
A life that's alive again, no longer afraid to face the truth
All of this I would have missed if there hadn't been you.
If there hadn't been you where would I be
If there hadn't been you here for me
I've made it through times I never would have made it through
If there hadn't been you on my side, you in my life
All my dreams would still be dreams if there hadn't been you
All my dreams would still be dreams if there hadn't been you. 
","['C', 'G', 'F', 'C', 'G', 'F', 'G', 'C', 'F', 'G', 'C', 'G', 'C', 'F', 'C', 'F', 'G', 'C', 'F', 'C', 'Am', 'G', 'F', 'G', 'G', 'C', 'F', 'C', 'C', 'G', 'F', 'C', 'G', 'F', 'G', 'C', 'F', 'G', 'C', 'G', 'C', 'F', 'C', 'F', 'G', 'C', 'F', 'C', 'Am', 'G', 'F', 'G', 'F', 'G', 'C', 'F', 'C', 'G', 'C', 'Am', 'F', 'C', 'G', 'C', 'Am', 'F']"
3,If There Hadnt Been You (ver 2),Billy Dean,https://tabs.ultimate-guitar.com/tab/billy-dean/if-there-hadnt-been-you-chords-1671682,"A man filled with doubt, down and out and so alone
A ship tossed and turned, lost and yearning for a home
A survivor barely surviving, not really sure of his next move
All of this, I would have been if there hadn't been you
If there hadn't been you where would I be
If there hadn't been you here for me
I made it through times
I never would've made it through
If there hadn't been you
If there hadn't been you on my side
You in my life
All my dreams would still be dreams
If there hadn't been you
All my dreams would still be dreams
If there hadn't been you
","['D', 'G', 'D', 'G', 'D', 'G', 'D', 'G', 'D', 'G', 'D', 'G', 'A', 'D', 'G', 'D', 'D', 'A', 'D', 'D/G', 'G', 'A', 'D', 'G', 'D', 'Bm', 'G', 'A', 'D', 'G', 'A', 'D', 'G', 'D', 'A', 'A', 'D', 'D', 'A', 'A', 'D', 'G', 'A', 'D']"
4,Nada,The Refreshments,https://tabs.ultimate-guitar.com/tab/the-refreshments/nada-chords-266732,"I see the lightning... storm down....
","['F', 'C', 'F', 'C']"
5,Nada (ver 2),The Refreshments,https://tabs.ultimate-guitar.com/tab/the-refreshments/nada-chords-1464319,"I see the lightning from the storm down in Mexico
I hear the thunder from the storm down in Mexico
There ain't no moral to this story at all
I feel the wind blow from the storm down in Mexico
There ain't no moral to this story at all
Come alive, yeah
Well, I feel the rain drops from the storm down in Mexico
There ain't no moral to this story at all
Come alive, come alive
","['F', 'C', 'F', 'C', 'F', 'C', 'F', 'C', 'Am', 'G', 'F', 'C', 'F', 'C', 'F', 'C', 'Am', 'G', 'F', 'C', 'F', 'C', 'F', 'C', 'F', 'C', 'F', 'C', 'Am', 'G', 'F', 'C', 'F', 'C', 'F', 'C']"
6,Nada (ver 3),The Refreshments,https://tabs.ultimate-guitar.com/tab/the-refreshments/nada-chords-1951605," I see the lightning from the storm down in Mexico
 I see my speedometer doesn't work
 I cross the desert and disappear into the tumbleweeds
 I tip the bottle and bite the lime
 I hear the thunder from the storm down in Mexico
 As I leave the border far behind
 I feel the dust coat my teeth and turn my sweat to mud
 I tip the bottle and bite the lime
 There ain't no moral to this story at all
 Anything I tell you very well could be a lie
 I've been away from the living, I don't need to be forgiven
 I'm just waiting for that cold black soul of mine 
 to come alive
 I feel the wind blow from the storm down in Mexico
 Gasoline for another hundred miles
 I cross the river and leave my shoes up on the other side
 I tip the bottle and bite the lime
 There ain't no moral to this story at all
 Anything I tell you very well could be a lie
 I've been away from the living, I don't need to be forgiven
 I'm just waiting for that cold black sun-cracked soul of mine 
            Come alive, yeah
 Well, I feel the rain drops from the storm down in Mexico
 Truck will go no further, out of gas
 I walk through the desert past the lizard and rattlesnake
 I tip the bottle and bite the lime
 There ain't no moral to this story at all
 Anything I tell you very well could be a lie
 There ain't no morals to these stories at all
 Everything I tell you, you can bet will be a lie
 I been away from the living, I don't need to be forgiven
 I'm just waiting for that cold black sun-cracked numb-inside soul of mine
 To come alive
Come alive, 
Come alive, 
Come alive.
","['F', 'C', 'F', 'C', 'F', 'C', 'F', 'C', 'F', 'C', 'F', 'C', 'F', 'C', 'F', 'C', 'Am', 'G', 'F', 'C', 'Am', 'G', 'F', 'C', 'Am', 'G', 'F', 'C', 'F', 'C', 'F', 'C', 'F', 'C', 'F', 'C', 'F', 'C', 'Am', 'G', 'F', 'C', 'Am', 'G', 'F', 'C', 'Am', 'G', 'F', 'C', 'F', 'C', 'F', 'C', 'F', 'C', 'F', 'C', 'F', 'C', 'F', 'C', 'F', 'C', 'Am', 'G', 'F', 'C', 'Am', 'G', 'F', 'C', 'Am', 'G', 'F', 'C', 'Am', 'G', 'F', 'C', 'Am', 'G', 'F', 'C', 'F', 'C', 'F', 'C', 'F', 'C', 'F', 'C']"
7,Youve Got A Way,Shania Twain,https://tabs.ultimate-guitar.com/tab/shania-twain/youve-got-a-way-chords-1344,"   You've got a way with me.
   Somehow you got me to believe
   in ev'rything that I could be
   I've gotta say, you really got a way
   You've got a way, it seems.
   You gave me faith to find my dreams.
   You'll never know just what that means.
   Can't you see you got a way with me?
   It's in the way you want me,
   It's in the way you hold me,
   The way you show me just what love's made of.
   Oh, how I adore you, like no one before you.
   I love you just the way you are.
   make love.
   It's just the way you are.
","['A', 'E/G#', 'D/F#', 'A', 'D', 'A', 'F#m', 'Bm', 'E7', 'A', 'E/G#', 'D/F#', 'A/C#', 'D', 'A', 'F#m', 'Bm', 'E7', 'E7', 'D', 'A', 'E/G#', 'F#m', 'D', 'A', 'F#m', 'E', 'D', 'F#m', 'E', 'D', 'D/F#', 'D', 'A']"
8,The Cape (ver 2),Guy Clark,https://tabs.ultimate-guitar.com/tab/guy-clark/the-cape-chords-1514994,"Eight years old with a flour sack cape
Tied all around his neck
He climbed up on the garage
Figurin' what the heck
He screwed his courage up so tight
The whole thing came unwound
He got a runnin' start and bless his heart
He headed for the ground
Well he's one of those who knows that life
Is just a leap of faith
Spread your arms and hold your breath
And always trust your cape
All grown up with a flour sack cape
Tied all around his dreams
He's full of piss and vinegar
He's bustin at the seams
He licked his finger and checked the wind
It's gonna be do or die
He wasn't scared of nothin', Boys
He was pretty sure he could fly
Well he's one of those who knows that life
Is just a leap of faith
Spread your arms and hold your breath
And always trust your cape
Old and grey with a flour sack cape
Tied all around his head
He's still jumpin' off the garage
And will be 'till he's dead
All these years the people said
He's actin like a kid
He did not know he could not fly
So he did
Well he's one of those who knows that life
Is just a leap of faith
Spread your arms and hold your breath
And always trust your cape
","['C', 'Em', 'A', 'G', 'F', 'G', 'C', 'C', 'Em', 'A', 'G', 'F', 'G', 'C', 'Em', 'A', 'G', 'F', 'G', 'C', 'C', 'Em', 'A', 'G', 'F', 'G', 'C', 'A', 'G', 'F', 'C', 'C', 'Em', 'A', 'G', 'F', 'G', 'C', 'C', 'Em', 'A', 'G', 'F', 'G', 'C', 'C', 'Em', 'A', 'G', 'F', 'G', 'C', 'Em', 'A', 'G', 'F', 'G', 'C', 'C', 'Em', 'A', 'G', 'F', 'G', 'C', 'A', 'G', 'F', 'C', 'C', 'Em', 'A', 'G', 'F', 'G', 'C', 'C', 'Em', 'A', 'G', 'F', 'G', 'C', 'C', 'Em', 'A', 'G', 'F', 'G', 'C', 'Em', 'A', 'G', 'F', 'G', 'C', 'C', 'Em', 'A', 'G', 'F', 'G', 'C', 'A', 'G', 'F', 'C', 'C', 'Em', 'A', 'G', 'F', 'G', 'C']"
9,The Cape (ver 3),Guy Clark,https://tabs.ultimate-guitar.com/tab/guy-clark/the-cape-chords-1540363,"-
-
-
-
Eight years old with a flour sack cape
Tied all around his neck
He climbed up on the garage
Figurin' what the heck
He screwed his courage up so tight
The whole thing came unwound
He got a runnin' start and bless his heart
He headed for the ground
Well he's one of those who knows that life
Is just a leap of faith
Spread your arms and hold your breath
And always trust your cape
#VERSE---------------------------------------
Now he's all grown up with a flour sack cape
Tied all around his dreams
He's full of piss and vinegar
He's bustin at the seams
He licked his finger and checked the wind
It's gonna be do or die
He wasn't scared of nothin', Boys
He was pretty sure he could fly
Well he's one of those who knows that life
Is just a leap of faith
Spread your arms and hold your breath
And always trust your cape
#VERSE-------------------------------------
Now he's old and grey with a flour sack cape
Tied all around his head
He's still jumpin' off the garage
And will be 'till he's dead
All these years the people said
He's actin like a kid
He did not know he could not fly
So he did
Well he's one of those who knows that life
Is just a leap of faith
Spread your arms and hold your breath
And always trust your cape
Spread your arms and hold your breath
And always trust your cape
","['C', 'C/B', 'Am', 'Am/G', 'F', 'G7', 'C', 'C', 'C/B', 'Am', 'Am/G', 'F', 'G7', 'C', 'C', 'C/B', 'Am', 'Am/G', 'F', 'G7', 'C', 'C', 'C/B', 'Am', 'Am/G', 'F', 'G7', 'C', 'C/B', 'Am', 'Am/G', 'F', 'G7', 'C', 'C', 'C/B', 'Am', 'Am/G', 'F', 'G7', 'C', 'Am', 'Am/G', 'F', 'C', 'C', 'C/B', 'Am', 'Am/G', 'F', 'G7', 'C', 'C', 'C/B', 'Am', 'Am/G', 'F', 'G7', 'C', 'C', 'C/B', 'Am', 'Am/G', 'F', 'G7', 'C', 'C', 'C/B', 'Am', 'Am/G', 'F', 'G7', 'C', 'C/B', 'Am', 'Am/G', 'F', 'G7', 'C', 'C', 'C/B', 'Am', 'Am/G', 'F', 'G7', 'C', 'Am', 'Am/G', 'F', 'C', 'C', 'C/B', 'Am', 'Am/G', 'F', 'G7', 'C', 'C', 'C/B', 'Am', 'Am/G', 'F', 'G7', 'C', 'C', 'C/B', 'Am', 'Am/G', 'F', 'G7', 'C', 'C', 'C/B', 'Am', 'Am/G', 'F', 'G7', 'C', 'C/B', 'Am', 'Am/G', 'F', 'G7', 'C', 'C', 'C/B', 'Am', 'Am/G', 'F', 'G7', 'C', 'Am', 'Am/G', 'F', 'C', 'C', 'C/B', 'Am', 'Am/G', 'F', 'G7', 'C', 'C', 'C/B', 'Am', 'Am/G', 'F', 'G7', 'C']"
10,The Cape (ver 4),Guy Clark,https://tabs.ultimate-guitar.com/tab/guy-clark/the-cape-chords-64761,"1  2   1  2  1  2  1  2
Eight years old with a flour sack cape
Tied all around his neck
He climbed up on the garage
Figurin' what the heck
He screwed his courage up so tight
The whole thing came unwound
He got a runnin' start and bless his heart
He headed for the ground
Well he's one of those who knows that life
Is just a leap of faith
Spread your arms and hold your breath
And always trust your cape
","['C', 'Em', 'A', 'G', 'F', 'G', 'C', 'C', 'Em', 'A', 'G', 'F', 'G', 'C', 'C', 'Em', 'A', 'G', 'F', 'G', 'C', 'Em', 'A', 'G', 'F', 'G', 'C', 'C', 'Em', 'A', 'G', 'F', 'G', 'C', 'A', 'G', 'F', 'C', 'C', 'Em', 'A', 'G', 'F', 'G', 'C']"
11,Achy Breaky Heart (ver 3),Billy Ray Cyrus,https://tabs.ultimate-guitar.com/tab/billy-ray-cyrus/achy-breaky-heart-chords-2971937,"Well you can tell the world you never was my girl.
You can burn my clothes when I am gone.
Or, you can tell your friends just what a fool I've been.
And laugh and joke about me on the phone.
You can tell my arms go back into the farm.
Or you can tell my feet to hit the floor.
Or you can tell my lips to tell my fingertips.
They won't be reaching out for you no more
But don't tell my heart, My achy breaky heart.
I just don't think he'd understand.
And if you tell my heart, My achy breaky heart,
He might blow up and kill this man. Ooohhh
You can tell your ma I moved to Arkansas.
Or you can tell your dog to bite my leg.
Or tell your brother Cliff who's fist can tell my lip.
He never really liked me anyway.
G Or tell your Aunt Louise. Tell anything you please.
Myself already knows I'm not ok.
Or you can tell my eye to watch out for my mind,
It might be walkin' out on me today
But don't tell my heart, My achy breaky heart.
I just don't think he'd understand.
And if you tell my heart, My achy breaky heart,
He might blow up and kill this man. Ooohhh
But don't tell my heart, My achy breaky heart.
I just don't think he'd understand.
And if you tell my heart, My achy breaky heart,
He might blow up and kill this man. Ooohhh
","['G', 'G', 'D', 'D', 'D', 'G', 'G', 'G', 'D', 'D', 'D', 'G', 'G', 'G', 'D', 'D', 'D', 'G', 'G', 'G', 'D', 'D', 'D', 'G', 'G', 'G', 'D', 'D', 'D', 'G', 'G', 'G', 'D', 'D', 'D', 'G', 'G', 'G', 'D', 'D', 'D', 'G']"
12,I Can Love You Like That (ver 2),John Michael Montgomery,https://tabs.ultimate-guitar.com/tab/john-michael-montgomery/i-can-love-you-like-that-chords-1970469,"They read you cinderella, You hoped it would come true 
That one day your prince charming would come rescue you
You like romantic movies, you never will forget
The way you felt when romeo kissed juliet
All this time that you've been waiting
You don't have to wait no more
I can love you like that, I would make you my world
Move heaven and earth if you were my girl
I will give you my heart, be all that you need
Show you you're everything that's precious to me
If you give me a chance, I can love you like that
I'd never make a promise I don't intend to keep
So when I say forever, forever's what I mean
I'm no casanova, but I swear this much is true
I'll be holding nothing back when it comes to you
You've dreamed of love that's everlasting
Well baby open up your eyes
I can love you like that, I would make you my world
Move heaven and earth if you were my girl
I will give you my heart, be all that you need
Show you you're everything that's precious to me
If you give me a chance, I can love you like that
You want tenderness, I've got tenderness
And I see through to the heart of you
If you want a man who understands
I can love you like that, I would make you my world
Move heaven and earth if you were my girl
I will give you my heart, be all that you need
Show you you're everything that's precious to me (X2)
If you give me a chance, I can love you like that
","['B', 'Ebm', 'E', 'F#', 'B', 'Ebm', 'E', 'F#', 'Ebm', 'E', 'Ebm', 'E', 'F#', 'B', 'Ebm', 'E', 'F#', 'B', 'Ebm', 'E', 'A', 'B', 'E', 'F#', 'B', 'Ebm', 'E', 'F#', 'B', 'Ebm', 'E', 'F#', 'Ebm', 'E', 'Ebm', 'E', 'F#', 'B', 'Ebm', 'E', 'F#', 'B', 'Ebm', 'E', 'A', 'F#', 'B', 'F#m', 'C#m', 'B', 'F#m', 'C#m', 'B', 'Ebm', 'E', 'F#', 'B', 'Ebm', 'E', 'A', 'F#', 'B']"
13,The Old Rugged Cross,Anne Murray,https://tabs.ultimate-guitar.com/tab/anne-murray/the-old-rugged-cross-chords-1776665,"On a hill far away stood an old rugged cross
The emblem of suffering and shame
And I love that old cross where the dearest and best
For a world of lost sinners was slain
So I’ll cherish the old rugged cross
Till my trophies at last I lay down
I will cling to the old rugged cross
And exchange it someday for a crown
O that old rugged cross so despised by the world
Has a wondrous attraction for me
For the dear lamb of God left His glory above
To bear it on dark Calvary
So I’ll cherish the old rugged cross
Till my trophies at last I lay down
I will cling to the old rugged cross
And exchange it someday for a crown
","['G', 'C', 'D7', 'G', 'C', 'D7', 'G', 'D7', 'G', 'C', 'G', 'C', 'G', 'D7', 'G', 'C', 'D7', 'G', 'C', 'G', 'D7', 'G', 'D7', 'G', 'C', 'G', 'C', 'G', 'D7', 'G']"
14,A Few Good Things Remain,Kathy Mattea,https://tabs.ultimate-guitar.com/tab/kathy-mattea/a-few-good-things-remain-chords-1791669,"I heard a siren late last night
You must have felt me shiver
Shaken by a wave of fright
That you calmed with a whisper
And fear gave way to better things
And sweeter dreams
Like a warm spring rain___    on the roof above
The way you call my name___    when we make love
While the world outside my window goes insane
You're here to remind me
A few good things remain
When living leaves my pride bruised up
I'm fragile as a feather
The storms of life just won't let up
You're like a change of weather
When dust settles on my dreams
You wash them clean
Like a warm spring rain___    on the roof above
The way you call my name___    when we make love
While the world outside my window goes insane
You're here to remind me
While the world outside my window goes insane
You're here to remind me
A few good things remain
You're here to remind me
A few good things remain
","['C', 'G', 'Em', 'C', 'G', 'C', 'G', 'Am', 'Bm7', 'D', 'G', 'D', 'Em', 'D', 'C', 'G', 'D', 'Em', 'D', 'C', 'D', 'C', 'D', 'Em', 'Em7', 'Em', 'G', 'C', 'D', 'G', 'Em', 'G', 'Em', 'G', 'C', 'G', 'Em', 'C', 'G', 'C', 'G', 'Am', 'Bm7', 'D', 'G', 'D', 'Em', 'D', 'C', 'G', 'D', 'Em', 'D', 'C', 'D', 'C', 'D', 'Em', 'Em7', 'Em', 'G', 'C', 'D', 'C', 'D', 'Em', 'Em7', 'Em', 'G', 'C', 'D', 'Em', 'C', 'Em', 'G', 'G']"
15,Me And You (ver 2),Kenny Chesney,https://tabs.ultimate-guitar.com/tab/kenny-chesney/me-and-you-chords-1679086,"Ordinary? No, Really don't think so
Not a love this true
Common Destiny, we were meant to be
Me and you
Like a perfect scene from a movie screen
We're a dream come true
Suited perfectly, for eternity
Me and you
Everyday I need you even more 
And the nighttime, too
There's no way I could ever let you go
Even if i wanted to
Everyday I live I try my best to give
All I have to you
Thank the stars above. that we share this love
Me and you
Everyday I need you even more 
And the nighttime, too
There's no way I could ever let you go
Even if i wanted to
Ordinary? No, Really don't think so
Just a precious few
Ever make it last, get as lucky as
Me and you
Me     and you
","['G', 'D/F#', 'Em7', 'Bm/D', 'C', 'G', 'D7sus4', 'D7', 'G', 'D/F#', 'Em7', 'Bm/D', 'C', 'D7sus4', 'G', 'G', 'D/F#', 'Em7', 'Bm/D', 'C', 'G', 'D7sus4', 'D7', 'G', 'D/F#', 'Em7', 'Bm/D', 'C', 'D7sus4', 'G', 'C', 'G/B', 'D', 'G', 'G/B', 'C', 'G/B', 'D7sus4', 'D7', 'C', 'G/B', 'D', 'Em7', 'A7sus4', 'A7', 'Am7', 'Am7/D', 'D7', 'G', 'D/F#', 'Em7', 'Bm/D', 'C', 'G', 'D7sus4', 'D7', 'G', 'D/F#', 'Em7', 'B7/D#', 'C', 'D7sus4', 'G', 'C', 'G/B', 'D', 'G', 'G/B', 'C', 'G/B', 'D7sus4', 'D7', 'C', 'G/B', 'D', 'Em7', 'A7sus4', 'A7', 'Am7', 'Am7/D', 'D7', 'G', 'D/F#', 'Em7', 'Bm/D', 'C', 'G', 'D7sus4', 'D7', 'G', 'D/F#', 'Em7', 'B7/D#', 'C', 'D7sus4', 'G', 'D7sus4', 'D', 'G']"
16,Shes Got It All,Kenny Chesney,https://tabs.ultimate-guitar.com/tab/kenny-chesney/shes-got-it-all-chords-1106206,"She’s got every quality
>From A all the way to Z
It’s easy to see she’s the perfect girl
Somtimes I still can’t quite believe she’s holding me cuz
She’s got it all my heart my soul my wishes
All of my love my hugs my kisses
Everything that means anything at all
All my life I been hopin’
I could give someone such devotion
Every sweet memory I can recall
She got it all
She’s got it all my heart my soul my wishes
All of my love my hugs my kisses
Everything that means anything at all
All my life I been hopin’
I could give someone such devotion
Every sweet memory I can recall
She got it all
She’s got it all my heart my soul my wishes
All of my love my hugs my kisses
Everything that means anything at all
All my life I been hopin’
I could give someone such devotion
Every sweet memory I can recall
She got it all
","['G', 'D', 'Em', 'C', 'G', 'D', 'C', 'G', 'C', 'G', 'C', 'G', 'G', 'D', 'C', 'G', 'D', 'Em', 'C', 'G', 'D', 'Em', 'C', 'G', 'D', 'Em', 'C', 'G', 'D', 'Em', 'C', 'G', 'G', 'D', 'Em', 'C', 'G', 'D', 'Em', 'C', 'G', 'D', 'Em', 'C', 'G', 'D', 'Em', 'C', 'G', 'G', 'D', 'Em', 'C', 'G', 'D', 'Em', 'C', 'G', 'D', 'Em', 'C', 'G', 'D', 'Em', 'C', 'G']"
17,Shes Got It All (ver 2),Kenny Chesney,https://tabs.ultimate-guitar.com/tab/kenny-chesney/shes-got-it-all-chords-1835071,"She’s got every quality
From A all the way to Z
It’s easy to see she’s the perfect girl
She’s got every single thing
That makes up my wildest dreams
Sometimes I still can’t quite 
believe she’s holding me cause
She’s got it all my heart my soul my wishes
All of my love my hugs my kisses
Everything that means anything at all
All my life I been hopin’
I could give someone such devotion
Every sweet memory I can recall
She got it all
You know that I admit
Someone to love like this
Only existed in my prayers
Until I saw her face
I knew I found the place
Where I could keep every faith eternally cause
She’s got it all my heart my soul my wishes
All of my love my hugs my kisses
Everything that means anything at all
All my life I been hopin’
I could give someone such devotion
Every sweet memory I can recall
She got it all
[Chorus]
All my life I been hopin’
I could give someone such devotion
Every sweet memory I can recall
All of my heart my soul my wishes
All of my love, my hugs, my kisses
Every sweet memory I can recall
She got it all
","['G', 'D', 'G', 'C', 'G', 'D', 'C', 'G', 'D', 'G', 'C', 'G', 'D', 'C', 'C/B', 'Am', 'D', 'D', 'G', 'D', 'Em', 'C', 'G', 'D', 'Em', 'C', 'D', 'G', 'D/F#', 'Em', 'C', 'G', 'D', 'Em', 'C', 'D', 'G', 'D', 'Em', 'C', 'G', 'D', 'G', 'C', 'G', 'D', 'C', 'G', 'D', 'G', 'C', 'G', 'D', 'C', 'C/B', 'Am', 'D', 'D', 'G', 'D', 'Em', 'C', 'G', 'D', 'Em', 'C', 'D', 'G', 'D/F#', 'Em', 'C', 'G', 'D', 'Em', 'C', 'D', 'G', 'G', 'C', 'G', 'C', 'Em', 'D/F#', 'G', 'C', 'G', 'D', 'Em', 'C', 'D', 'G', 'D', 'Em', 'C', 'G', 'D', 'C', 'G', 'D', 'Em', 'C']"
18,Party Crowd (ver 2),David Lee Murphy,https://tabs.ultimate-guitar.com/tab/david-lee-murphy/party-crowd-chords-624044,"	I knew Lord it was breakin' her heart, and she was breakin mine
	so for the sake of her feelings and the sake of my pride
	I told her not to worry 'bout me
	so I'm sittin here soakin' up the neon lights
	misery looking for some company
	Tonight I'm lookin for a party crowd
	slammin' 'em back and laughing out loud
	where the smoke's so thick the blues can't hang around
	With the jukebox a jumpin' like it just don't care
	if they're dancin' over here or fightin over there
	I'm makin' the rounds, looking for a party crowd
","['C', 'Am', 'G', 'G', 'Am', 'C', 'Am', 'C', 'D', 'G', 'Am', 'C', 'D', 'G', 'D', 'G', 'Am', 'C', 'D', 'G']"
